78944,http://linhcorner.com/shop/uncategorized/custom-warm-all-season-quilt-for-kids-adult-bed-cartoon-unicorn-rainbow-quilt-dropshipping-cartoon-animal-air-conditioner-quilt/,"Custom Warm All Season Quilt For Kids Adult Bed Cartoon Unicorn Rainbow Quilt Dropshipping Cartoon Animal Air Conditioner Quilt",2020/09/Custom-Warm-All-Season-Quilt-For-Kids-Adult-Bed-Cartoon-Unicorn-Rainbow-Quilt-Dropshipping-Cartoon-Animal.jpg
78966,http://linhcorner.com/shop/uncategorized/flower-lattice-quilted-quilt-throw-blankets-birthday-christmas-thanksgiving-gifts-bedding-cover-tapestry-wall/,"Flower lattice Quilted quilt Throw Blankets Birthday Christmas thanksgiving Gifts bedding cover Tapestry Wall",2020/09/Flower-lattice-Quilted-quilt-Throw-Blankets-Birthday-Christmas-thanksgiving-Gifts-bedding-cover-Tapestry-Wall.jpg
79055,http://linhcorner.com/shop/uncategorized/simple-bedding-sets-3d-flamingo-duvet-quilt-cover-set-comforter-bed-linen-pillowcase-king-queen-full-double-155x215cm-size/,"Simple Bedding Sets 3D Flamingo Duvet Quilt Cover Set Comforter Bed Linen Pillowcase King Queen Full Double 155x215cm Size",2020/09/Simple-Bedding-Sets-3D-Flamingo-Duvet-Quilt-Cover-Set-Comforter-Bed-Linen-Pillowcase-King-Queen-Full.jpg
79164,http://linhcorner.com/shop/uncategorized/new-my-hero-academia-3d-bedding-set-bakugou-katsuki-todoroki-shouto-duvet-cover-pillowcase-children-anime-bed-linen-bedclothes/,"New My Hero Academia 3d Bedding Set Bakugou Katsuki Todoroki Shouto Duvet Cover Pillowcase Children Anime Bed Linen Bedclothes",2020/09/New-My-Hero-Academia-3d-Bedding-Set-Bakugou-Katsuki-Todoroki-Shouto-Duvet-Cover-Pillowcase-Children-Anime.jpg
79206,http://linhcorner.com/shop/uncategorized/bedding-sets-simple-color-green-bed-sheet-duver-quilt-cover-pillowcase-soft-and-comfortable-king-queen-full-twin/,"Bedding Sets Simple Color Green  Bed Sheet Duver Quilt Cover Pillowcase Soft and Comfortable King Queen Full Twin",2020/09/Bedding-Sets-Simple-Color-Green-Bed-Sheet-Duver-Quilt-Cover-Pillowcase-Soft-and-Comfortable-King-Queen.jpg
79218,http://linhcorner.com/shop/uncategorized/new-owl-fish-flamingo-summer-quilt-blankets-cartoon-comforter-bed-cover-quilting-for-adults-kids-home-textile-free-shipping/,"New Owl Fish Flamingo Summer Quilt Blankets Cartoon Comforter Bed Cover Quilting for Adults Kids Home Textile Free shipping",2020/09/New-Owl-Fish-Flamingo-Summer-Quilt-Blankets-Cartoon-Comforter-Bed-Cover-Quilting-for-Adults-Kids-Home.jpg
79406,http://linhcorner.com/shop/uncategorized/3d-bedding-sets-white-duvet-quilt-cover-set-comforter-bed-linen-pillowcase-king-queen-200220cm-size-pet-dog-golden-retriever/,"3D Bedding Sets White Duvet Quilt Cover Set Comforter Bed Linen Pillowcase King Queen 200*220cm Size Pet Dog Golden Retriever",2020/09/3D-Bedding-Sets-White-Duvet-Quilt-Cover-Set-Comforter-Bed-Linen-Pillowcase-King-Queen-200-220cm.jpg
79421,http://linhcorner.com/shop/uncategorized/american-style-patchwork-quilts-full-cotton-handmade-quilted-quilt-pillowcase-3pcs-sets-summer-air-condition-bed-cover-blanket/,"American Style Patchwork Quilts Full Cotton Handmade Quilted Quilt pillowcase 3pcs Sets  Summer Air Condition Bed Cover Blanket",2020/09/American-Style-Patchwork-Quilts-Full-Cotton-Handmade-Quilted-Quilt-pillowcase-3pcs-Sets-Summer-Air-Condition-Bed.jpg
79565,http://linhcorner.com/shop/uncategorized/comfortable-bedding-4pcs-plaid-duvet-cover-geometric-stripe-quilt-set-simple-nordic-style-bed-set-queen-size-bedding-set-luxury/,"Comfortable bedding 4pcs plaid duvet cover geometric stripe quilt set simple Nordic style bed set queen size bedding set luxury",2020/09/Comfortable-bedding-4pcs-plaid-duvet-cover-geometric-stripe-quilt-set-simple-Nordic-style-bed-set-queen.jpg
79658,http://linhcorner.com/shop/uncategorized/3d-duvet-cover-set-bedding-sets-double-king-blanket-quilt-cover-elk-bedclothes-bed-linings-dream-animal-eur-uk-size-2-3pcs-set/,"3D Duvet Cover Set Bedding Sets Double King Blanket Quilt Cover elk Bedclothes Bed Linings Dream Animal EUR UK Size 2-3pcs/set",2020/09/3D-Duvet-Cover-Set-Bedding-Sets-Double-King-Blanket-Quilt-Cover-elk-Bedclothes-Bed-Linings-Dream.jpg
79812,http://linhcorner.com/shop/uncategorized/oloey-geometric-plaid-bedding-set-duvet-cover-flower-sheet-bed-king-queen-size-bed-set-gray-cute-bedding-quilt-cover-simply/,"OLOEY geometric Plaid bedding Set Duvet Cover flower sheet bed king queen size bed set  gray cute bedding quilt cover simply",2020/09/OLOEY-geometric-Plaid-bedding-Set-Duvet-Cover-flower-sheet-bed-king-queen-size-bed-set-gray.jpg
79821,http://linhcorner.com/shop/uncategorized/luxury-quilted-padding-bed-skirt-sanding-soft-thicken-bedspread-1pc-lace-edge-bedspread-not-including-pillowcase/,"Luxury Quilted Padding Bed Skirt Sanding Soft Thicken Bedspread 1pc Lace Edge Bedspread Not Including Pillowcase",2020/09/Luxury-Quilted-Padding-Bed-Skirt-Sanding-Soft-Thicken-Bedspread-1pc-Lace-Edge-Bedspread-Not-Including-Pillowcase.jpg
79838,http://linhcorner.com/shop/uncategorized/50-bed-dust-cover-mattress-protective-case-fitted-sheet-cover-single-double-queen-size-bedclothes-protect-cover-pillowcase/,"50 Bed Dust Cover Mattress Protective Case Fitted Sheet Cover Single Double Queen Size Bedclothes Protect Cover Pillowcase",2020/09/50-Bed-Dust-Cover-Mattress-Protective-Case-Fitted-Sheet-Cover-Single-Double-Queen-Size-Bedclothes-Protect.jpg
79990,http://linhcorner.com/shop/uncategorized/home-textiles-solid-color-bed-linens-luxury-bedding-sets-simple-bedclothes-family-duvet-cover-set-quilt-cover-queen-king-size/,"Home Textiles Solid color bed linens luxury Bedding Sets Simple bedclothes family Duvet Cover set Quilt cover Queen king size",2020/09/Home-Textiles-Solid-color-bed-linens-luxury-Bedding-Sets-Simple-bedclothes-family-Duvet-Cover-set-Quilt.jpg
80053,http://linhcorner.com/shop/uncategorized/sea-turtle-quilt-marine-life-high-end-lifelike-cartoon-kids-school-adults-bed-summer-quilt-fashion-dropshipping/,"Sea Turtle Quilt Marine Life High End Lifelike Cartoon Kids School Adults Bed Summer Quilt Fashion Dropshipping",2020/09/Sea-Turtle-Quilt-Marine-Life-High-End-Lifelike-Cartoon-Kids-School-Adults-Bed-Summer-Quilt-Fashion-6.jpg
80213,http://linhcorner.com/shop/uncategorized/bed-head-board-cover-thicken-elastic-all-inclusive-bed-head-back-protection-dust-cover-headboard-cover-plain-soft-solid-color/,"Bed Head Board Cover Thicken Elastic All-inclusive Bed Head Back Protection Dust Cover Headboard Cover Plain Soft Solid Color",2020/09/Bed-Head-Board-Cover-Thicken-Elastic-All-inclusive-Bed-Head-Back-Protection-Dust-Cover-Headboard-Cover.jpg
80280,http://linhcorner.com/shop/uncategorized/lovely-christmas-snowflake-gift-printed-bed-quilt-cover-pillow-case-bedding-set-checkerboard-blanket/,"Lovely Christmas Snowflake Gift Printed Bed Quilt Cover Pillow Case Bedding Set Checkerboard blanket",2020/09/Lovely-Christmas-Snowflake-Gift-Printed-Bed-Quilt-Cover-Pillow-Case-Bedding-Set-Checkerboard-blanket.jpg
80293,http://linhcorner.com/shop/uncategorized/3-4pcs-pink-color-heart-printed-bed-linen-set-single-double-queen-king-size-bedding-set-couple-bed-set-quilt-cover-bed-sheets/,"3/4pcs Pink Color Heart Printed Bed Linen Set Single Double Queen King Size Bedding Set Couple Bed Set Quilt Cover Bed Sheets",2020/09/3-4pcs-Pink-Color-Heart-Printed-Bed-Linen-Set-Single-Double-Queen-King-Size-Bedding-Set.jpg
80353,http://linhcorner.com/shop/uncategorized/3d-luxury-bedding-set-custom-king-europe-usaduvet-cover-setquilt-blanket-cover-setbed-set-animal-pet-lazy-catdrop-ship/,"3D luxury Bedding Set Custom/King/Europe/USA,Duvet Cover Set,Quilt/Blanket Cover Set,Bed set Animal pet Lazy cat,drop ship",2020/09/3D-luxury-Bedding-Set-Custom-King-Europe-USA-Duvet-Cover-Set-Quilt-Blanket-Cover-Set-Bed-12.jpg
80400,http://linhcorner.com/shop/uncategorized/luxury-3d-dragon-ball-z-duvet-cover-set-children-cartoon-son-goku-son-gohan-character-bedding-set-europe-usa-australia-bed-linen/,"Luxury 3d Dragon Ball Z Duvet Cover Set Children Cartoon Son Goku Son Gohan Character Bedding Set Europe Usa Australia Bed Linen",2020/09/Luxury-3d-Dragon-Ball-Z-Duvet-Cover-Set-Children-Cartoon-Son-Goku-Son-Gohan-Character-Bedding.jpg
80719,http://linhcorner.com/shop/uncategorized/drying-quilt-artifact-spiral-drying-rack-multifunctional-balcony-round-rotating-bed-sheet-quilt-storage-household-bay-window/,"Drying quilt artifact spiral drying rack multifunctional balcony round rotating bed sheet quilt storage household Bay window",2020/09/Drying-quilt-artifact-spiral-drying-rack-multifunctional-balcony-round-rotating-bed-sheet-quilt-storage-household-Bay.jpg
80759,http://linhcorner.com/shop/uncategorized/dream-ns-3d-animal-tiger-bedding-set-super-king-california-king-quilt-set-bedclothes-kussensloop-bed-room-home-textiles-pn001/,"Dream NS 3D Animal Tiger Bedding set Super King / California King Quilt Set Bedclothes kussensloop Bed room Home textiles PN001",2020/09/Dream-NS-3D-Animal-Tiger-Bedding-set-Super-King-California-King-Quilt-Set-Bedclothes-kussensloop-Bed.jpg
80789,http://linhcorner.com/shop/uncategorized/flowers-print-3d-bed-quilt-duvet-cover-set-2-3pc-bedding-set-duvet-coverpillowcase-queen-high-quality-luxury-soft-comefortable/,"Flowers Print 3D Bed Quilt Duvet Cover Set 2/3pc Bedding Set duvet Cover+pillowcase Queen High quality luxury soft comefortable",2020/09/Flowers-Print-3D-Bed-Quilt-Duvet-Cover-Set-2-3pc-Bedding-Set-duvet-Cover-pillowcase-Queen.jpg
80868,http://linhcorner.com/shop/uncategorized/meteor-shower-usa-twin-queen-king-uk-double-bed-cover-sets-microfiber-bedding-set-blue-and-white-star-quilt-cover-set/,"Meteor Shower USA Twin Queen King UK double bed cover sets microfiber bedding set blue and white star quilt cover set",2020/09/Meteor-Shower-USA-Twin-Queen-King-UK-double-bed-cover-sets-microfiber-bedding-set-blue-and.jpg
81160,http://linhcorner.com/shop/uncategorized/lofuka-women-100-cotton-pink-bedding-set-premium-long-staple-cotton-queen-king-quilt-cover-set-bed-sheet-pillowcase-for-bed/,"Lofuka Women 100% Cotton Pink Bedding Set Premium Long-staple Cotton Queen King Quilt Cover Set Bed Sheet Pillowcase For Bed",2020/09/Lofuka-Women-100-Cotton-Pink-Bedding-Set-Premium-Long-staple-Cotton-Queen-King-Quilt-Cover-Set.jpg
81176,http://linhcorner.com/shop/uncategorized/hot-satin-silk-fitted-sheet-pillowcase-bed-mattress-protector-cover-white-black-grey-blue-purple-twin-queen-king-size-bedspread/,"HOT Satin silk Fitted Sheet Pillowcase Bed Mattress Protector Cover White Black Grey Blue Purple Twin Queen King size Bedspread",2020/09/HOT-Satin-silk-Fitted-Sheet-Pillowcase-Bed-Mattress-Protector-Cover-White-Black-Grey-Blue-Purple-Twin.jpg
81206,http://linhcorner.com/shop/uncategorized/home-textiles-quilt-cover-1pcs-pillow-case-2pcs-winter-bedding-sets-soft-warm-lamb-cashmere-duvet-cover-solid-fleece-bed-cover/,"Home Textiles Quilt Cover 1pcs Pillow Case 2pcs Winter bedding sets soft warm lamb cashmere duvet cover solid fleece bed cover",2020/09/Home-Textiles-Quilt-Cover-1pcs-Pillow-Case-2pcs-Winter-bedding-sets-soft-warm-lamb-cashmere-duvet.jpg
81212,http://linhcorner.com/shop/uncategorized/3d-bedding-sets-white-duvet-quilt-cover-set-comforter-bed-linen-pillowcase-king-queen-140210cm-size-dogs-pets-dog/,"3D Bedding Sets White Duvet Quilt Cover Set Comforter Bed Linen Pillowcase King Queen 140*210cm Size Dogs Pets Dog",2020/09/3D-Bedding-Sets-White-Duvet-Quilt-Cover-Set-Comforter-Bed-Linen-Pillowcase-King-Queen-140-210cm.jpg
81257,http://linhcorner.com/shop/uncategorized/christmas-bedclothes-bedding-set-with-pillowcase-bed-quilt-cover-santa-claus-pattern-pillow-cover-for-family-hotel-xmas-supplies/,"Christmas Bedclothes Bedding Set With Pillowcase Bed Quilt Cover Santa Claus Pattern Pillow Cover for Family Hotel Xmas Supplies",2020/09/Christmas-Bedclothes-Bedding-Set-With-Pillowcase-Bed-Quilt-Cover-Santa-Claus-Pattern-Pillow-Cover-for-Family.jpg
81428,http://linhcorner.com/shop/uncategorized/london-tower-bridge-lifelike-design-3d-comforter-sets-bed-linen-set-quilt-cover-beddind-duvet-cover-king-size/,"London Tower Bridge Lifelike Design 3d Comforter Sets Bed Linen Set Quilt Cover beddind Duvet Cover King Size",2020/09/London-Tower-Bridge-Lifelike-Design-3d-Comforter-Sets-Bed-Linen-Set-Quilt-Cover-beddind-Duvet-Cover.jpg
81585,http://linhcorner.com/shop/uncategorized/modern-elastic-all-inclusive-headboard-bed-head-cover-solid-color-bed-head-back-protection-dust-cover-plain-soft-home-decor/,"Modern Elastic All-inclusive Headboard Bed Head Cover Solid Color Bed Head Back Protection Dust Cover Plain Soft Home Decor",2020/09/Modern-Elastic-All-inclusive-Headboard-Bed-Head-Cover-Solid-Color-Bed-Head-Back-Protection-Dust-Cover.jpg
81620,http://linhcorner.com/shop/uncategorized/3-piece-bedding-set-penguin-cover-set-animal-duvet-cover-comfortable-bed-quilt-pillowcase-3d-printing-bedding-full-size-bed-set/,"3 Piece Bedding Set Penguin Cover Set Animal Duvet Cover Comfortable Bed Quilt Pillowcase 3D Printing Bedding Full Size Bed Set",2020/09/3-Piece-Bedding-Set-Penguin-Cover-Set-Animal-Duvet-Cover-Comfortable-Bed-Quilt-Pillowcase-3D-Printing.jpg
81796,http://linhcorner.com/shop/uncategorized/3d-bedding-sets-duvet-quilt-cover-set-comforter-bed-linens-king-queen-full-twin-double-size-modern-animal-horse-white-design/,"3D Bedding Sets Duvet Quilt Cover Set Comforter Bed Linens King Queen Full Twin Double Size Modern Animal Horse White Design",2020/09/3D-Bedding-Sets-Duvet-Quilt-Cover-Set-Comforter-Bed-Linens-King-Queen-Full-Twin-Double-Size.jpg
81993,http://linhcorner.com/shop/uncategorized/printing-home-comforter-bedding-set-fresh-queen-king-size-bed-set-duvet-covers-bedclothes-1pcs-quilt-cover-2pcs-pillow-cases/,"printing Home comforter bedding set fresh Queen King Size bed set duvet covers Bedclothes 1pcs Quilt Cover +2pcs Pillow cases",2020/09/printing-Home-comforter-bedding-set-fresh-Queen-King-Size-bed-set-duvet-covers-Bedclothes-1pcs-Quilt.jpg
82135,http://linhcorner.com/shop/uncategorized/free-shipping-100cotton-3pcs-elegant-european-embroidered-quilted-bed-cover-patchwork-quilt-bedspread-full-queen-king-size/,"Free shipping 100%cotton 3pcs elegant European embroidered quilted bed cover patchwork quilt bedspread full queen king size",2020/09/Free-shipping-100-cotton-3pcs-elegant-European-embroidered-quilted-bed-cover-patchwork-quilt-bedspread-full-queen.jpg
82148,http://linhcorner.com/shop/uncategorized/disney-mickey-mouse-bedding-sets-queen-king-size-cartoon-duvet-cover-quilt-cover-pillowcase-bed-sheet-bed-linen-set/,"Disney Mickey Mouse Bedding Sets Queen King Size Cartoon Duvet Cover Quilt Cover Pillowcase Bed Sheet Bed Linen Set",2020/09/Disney-Mickey-Mouse-Bedding-Sets-Queen-King-Size-Cartoon-Duvet-Cover-Quilt-Cover-Pillowcase-Bed-Sheet.jpg
82229,http://linhcorner.com/shop/uncategorized/jddton-new-arrival-classical-double-sided-bed-linings-concise-style-bedding-set-quilt-cover-pillowcase-cover-bed-3pcs-set-be031/,"JDDTON New Arrival Classical Double sided Bed Linings Concise Style Bedding Set Quilt Cover Pillowcase Cover Bed 3pcs/set BE031",2020/09/JDDTON-New-Arrival-Classical-Double-sided-Bed-Linings-Concise-Style-Bedding-Set-Quilt-Cover-Pillowcase-Cover.jpg
82280,http://linhcorner.com/shop/uncategorized/3d-printed-merry-christmas-bedding-set-festival-gifts-kid-duvet-cover-single-queen-king-size-quilt-covers-elk-bed-linens-sets/,"3D Printed Merry Christmas Bedding Set Festival Gifts Kid Duvet Cover Single Queen King Size Quilt Covers Elk Bed Linens Sets",2020/09/3D-Printed-Merry-Christmas-Bedding-Set-Festival-Gifts-Kid-Duvet-Cover-Single-Queen-King-Size-Quilt.jpg
82406,http://linhcorner.com/shop/uncategorized/2020-black-bedding-set-pure-cotton-a-b-double-sided-pattern-simplicity-bed-sheet-quilt-cover-pillowcase-4pcs/,"2020 Black bedding set Pure cotton A/B double-sided pattern Simplicity Bed sheet, quilt cover pillowcase 4pcs",2020/09/2020-Black-bedding-set-Pure-cotton-A-B-double-sided-pattern-Simplicity-Bed-sheet-quilt-cover.jpg
82446,http://linhcorner.com/shop/uncategorized/3d-bedding-sets-sea-dolphin-blue-duvet-quilt-cover-set-comforter-bed-linen-pillowcase-king-queen-full-size-140x200-home-texitle/,"3D Bedding Sets Sea Dolphin Blue Duvet Quilt Cover Set Comforter Bed Linen Pillowcase King Queen Full Size 140x200 Home Texitle",2020/09/3D-Bedding-Sets-Sea-Dolphin-Blue-Duvet-Quilt-Cover-Set-Comforter-Bed-Linen-Pillowcase-King-Queen.jpg
82477,http://linhcorner.com/shop/uncategorized/washable-summer-air-condition-quilts-with-ball-breathable-lightweight-throw-blankets-for-bed-sofa-travel-camping/,"Washable Summer Air Condition Quilts with Ball Breathable Lightweight Throw blankets for Bed Sofa Travel Camping",2020/09/Washable-Summer-Air-Condition-Quilts-with-Ball-Breathable-Lightweight-Throw-blankets-for-Bed-Sofa-Travel-Camping.jpg
82505,http://linhcorner.com/shop/uncategorized/bonenjoy-white-color-bedding-set-king-size-flower-printed-quilt-cover-bed-linen-set-with-pillowcase-floral-double-bedding/,"Bonenjoy White Color Bedding Set King Size Flower Printed Quilt Cover Bed Linen Set with Pillowcase Floral Double Bedding",2020/09/Bonenjoy-White-Color-Bedding-Set-King-Size-Flower-Printed-Quilt-Cover-Bed-Linen-Set-with-Pillowcase.jpg
82517,http://linhcorner.com/shop/uncategorized/softbatfy-to-my-mom-quilt-blanket-for-bed-soft-dropshipping/,"SOFTBATFY  To My MOM Quilt Blanket for Bed Soft Dropshipping",2020/09/SOFTBATFY-To-My-MOM-Quilt-Blanket-for-Bed-Soft-Dropshipping.jpg
82790,http://linhcorner.com/shop/uncategorized/high-quality-printed-comforter-bedding-sets-couple-modern-bed-set-cotton-duvet-cover-pillowcase-marble-beding-set-beddingoutlet/,"High Quality Printed Comforter Bedding Sets Couple Modern Bed Set Cotton Duvet Cover Pillowcase Marble Beding Set Beddingoutlet",2020/09/High-Quality-Printed-Comforter-Bedding-Sets-Couple-Modern-Bed-Set-Cotton-Duvet-Cover-Pillowcase-Marble-Beding.jpg
82886,http://linhcorner.com/shop/uncategorized/thicken-bed-skirt-double-lace-bed-skirt-bedspread-polyester-bed-sheet-for-wedding-housewarming-gift-bed-cover-with-elastic-band/,"Thicken Bed Skirt Double Lace Bed Skirt Bedspread Polyester Bed Sheet for Wedding Housewarming Gift Bed Cover with Elastic Band",2020/09/Thicken-Bed-Skirt-Double-Lace-Bed-Skirt-Bedspread-Polyester-Bed-Sheet-for-Wedding-Housewarming-Gift-Bed.jpg
83016,http://linhcorner.com/shop/uncategorized/drying-quilt-artifact-spiral-drying-rack-multifunctional-balcony-round-rotating-bed-sheet-quilt-storage-household-bay-window-2/,"Drying quilt artifact spiral drying rack multifunctional balcony round rotating bed sheet quilt storage household Bay window",2020/09/Drying-quilt-artifact-spiral-drying-rack-multifunctional-balcony-round-rotating-bed-sheet-quilt-storage-household-Bay-6.jpg
83060,http://linhcorner.com/shop/uncategorized/japan-towel-quilt-summer-cotton-blanket-for-bed-5-layer-gauze-thin-comforter-floral-geometric-bedspread-bedding-bed-cover-queen/,"Japan Towel Quilt Summer Cotton Blanket for Bed 5 Layer Gauze Thin Comforter Floral Geometric Bedspread Bedding Bed Cover Queen",2020/09/Japan-Towel-Quilt-Summer-Cotton-Blanket-for-Bed-5-Layer-Gauze-Thin-Comforter-Floral-Geometric-Bedspread.jpg
83115,http://linhcorner.com/shop/uncategorized/solid-washing-cotton-summer-quilt-twin-full-queen-king-blankets-bed-cover-quilting-suitable-for-children-adults-gray-comforters/,"Solid Washing cotton Summer Quilt twin full queen king Blankets Bed Cover Quilting Suitable for Children Adults gray Comforters",2020/09/Solid-Washing-cotton-Summer-Quilt-twin-full-queen-king-Blankets-Bed-Cover-Quilting-Suitable-for-Children.jpg
83126,http://linhcorner.com/shop/uncategorized/home-textile-3d-basketball-club-bedding-set-quilt-duvet-cover-pillowcases-sport-bed-linens-twin-full-queen-king-size-2-3pcs/,"Home Textile 3D Basketball Club Bedding Set Quilt Duvet Cover Pillowcases Sport Bed Linens Twin Full Queen King Size 2-3PCS",2020/09/Home-Textile-3D-Basketball-Club-Bedding-Set-Quilt-Duvet-Cover-Pillowcases-Sport-Bed-Linens-Twin-Full.jpg
83227,http://linhcorner.com/shop/uncategorized/comforter-bedding-set-3pcs-bed-linen-set-queen-king-nordic-duvet-cover-set-quilt-cover-bedclothes-pillow-case-home-decor-textile/,"comforter bedding set 3pcs bed linen set Queen King nordic duvet cover set Quilt Cover Bedclothes Pillow case Home decor Textile",2020/09/comforter-bedding-set-3pcs-bed-linen-set-Queen-King-nordic-duvet-cover-set-Quilt-Cover-Bedclothes.jpg
83241,http://linhcorner.com/shop/uncategorized/students-silk-quilt-quilt-for-summer-and-winter-king-queen-twin-size-bedding-handmade-white-pink-gray-green-orange-pure-color/,"Students Silk quilt / quilt for summer and winter king queen twin size bedding handmade white/pink/gray/green/orange Pure color",2020/09/Students-Silk-quilt-quilt-for-summer-and-winter-king-queen-twin-size-bedding-handmade-white-pink.jpg
83368,http://linhcorner.com/shop/uncategorized/bed-linen-bag-the-single-double-bed-cover-piece-quilt-15-18-20-mt-bed-mattress-quilt-cover/,"Bed linen bag The single double bed cover piece quilt 1,5 /1,8 /2,0 mt bed mattress quilt cover",2020/09/Bed-linen-bag-The-single-double-bed-cover-piece-quilt-1-5-1-8-2-0.jpg
83477,http://linhcorner.com/shop/uncategorized/bohemia-2-3pcs-bedding-sets-geometric-duvet-cover-set-bed-linens-quilt-covers-single-double-queen-king-bedclothes-no-bed-sheet/,"Bohemia 2/3Pcs Bedding Sets Geometric Duvet Cover Set Bed Linens Quilt Covers Single Double Queen King BedClothes (No Bed Sheet)",2020/09/Bohemia-2-3Pcs-Bedding-Sets-Geometric-Duvet-Cover-Set-Bed-Linens-Quilt-Covers-Single-Double-Queen.jpg
83478,http://linhcorner.com/shop/uncategorized/disney-the-lion-king-bedding-set-home-textile-quilt-cover-and-pillowcase-comforter-bedding-sets-luxury-full-size-bed-set/,"Disney The Lion King Bedding Set Home Textile Quilt Cover and Pillowcase Comforter Bedding Sets Luxury Full Size Bed Set",2020/09/Disney-The-Lion-King-Bedding-Set-Home-Textile-Quilt-Cover-and-Pillowcase-Comforter-Bedding-Sets-Luxury.jpg
83797,http://linhcorner.com/shop/uncategorized/plant-floral-printed-quilts-summer-used-thin-air-conditioned-comforter-queen-size-colcha-duvets-single-bedspread-for-single-bed/,"Plant Floral Printed Quilts Summer Used Thin Air-conditioned Comforter Queen Size Colcha Duvets Single Bedspread for Single Bed",2020/09/Plant-Floral-Printed-Quilts-Summer-Used-Thin-Air-conditioned-Comforter-Queen-Size-Colcha-Duvets-Single-Bedspread.jpg
83842,http://linhcorner.com/shop/uncategorized/polar-fleece-fabric-all-inclusive-headboard-covers-pink-bedspread-soft-dust-back-protective-elastic-cloth-all-wrapped-headboard/,"Polar Fleece Fabric All-inclusive Headboard Covers Pink Bedspread Soft Dust Back Protective Elastic Cloth All Wrapped Headboard",2020/09/Polar-Fleece-Fabric-All-inclusive-Headboard-Covers-Pink-Bedspread-Soft-Dust-Back-Protective-Elastic-Cloth-All.jpg
