71433,http://linhcorner.com/shop/uncategorized/duvet-cover-set-american-flag-printed-2-3-pcs-bedding-sets-twin-full-queen-king-quilt-bed/,"Duvet Cover Set American Flag Printed 2/3 Pcs Bedding Sets Twin Full Queen King Quilt  Bed",2020/09/Duvet-Cover-Set-American-Flag-Printed-2-3-Pcs-Bedding-Sets-Twin-Full-Queen-King-Quilt-6.jpg
71440,http://linhcorner.com/shop/uncategorized/goang-luxury-new-bedding-set-quilt-cover-pillowcases-king-size-bedding-set-home-textiles-parrot-printing-bed-duvet-cover-220-240/,"GOANG luxury new bedding set quilt cover pillowcases king size bedding set home textiles parrot printing bed duvet cover 220 240",2020/09/GOANG-luxury-new-bedding-set-quilt-cover-pillowcases-king-size-bedding-set-home-textiles-parrot-printing-6.jpg
71448,http://linhcorner.com/shop/uncategorized/1pcs-winter-warm-soft-double-side-plush-bed-blanket-magic-thick-duvet-cover-comforter-quilt-blanket-case-full-queen-king-size/,"1pcs Winter Warm Soft Double Side Plush Bed Blanket Magic Thick Duvet cover Comforter/Quilt/Blanket case Full Queen King Size",2020/09/1pcs-Winter-Warm-Soft-Double-Side-Plush-Bed-Blanket-Magic-Thick-Duvet-cover-Comforter-Quilt-Blanket-6.jpg
71450,http://linhcorner.com/shop/uncategorized/hot-movie-stranger-things-bedding-set-3d-horror-printed-duvet-cover-set-pillowcase-twin-full-queen-king-size-bed-sets-drop-ship/,"Hot Movie Stranger-Things Bedding Set 3d Horror Printed Duvet Cover Set Pillowcase Twin Full Queen King Size Bed Sets Drop Ship",2020/09/Hot-Movie-Stranger-Things-Bedding-Set-3d-Horror-Printed-Duvet-Cover-Set-Pillowcase-Twin-Full-Queen-6.jpg
71452,http://linhcorner.com/shop/uncategorized/2020-dragon-ball-z-3d-bedding-set-son-goku-vegeta-duvet-cover-set-pillowcase-bed-set-comforter-bedclothes-queen-king-bed-linen/,"2020 DRAGON BALL Z 3D Bedding Set Son Goku Vegeta Duvet Cover Set Pillowcase Bed Set Comforter Bedclothes Queen King Bed Linen",2020/09/2020-DRAGON-BALL-Z-3D-Bedding-Set-Son-Goku-Vegeta-Duvet-Cover-Set-Pillowcase-Bed-Set-6.jpg
71459,http://linhcorner.com/shop/uncategorized/movie-suicide-squad-3d-harley-quinn-bedding-set-duvet-covers-pillowcases-x-task-force-joker-bedding-sets-bedclothes-bed-linen/,"Movie Suicide Squad 3d Harley Quinn Bedding Set Duvet Covers Pillowcases X Task Force Joker Bedding Sets Bedclothes Bed Linen",2020/09/Movie-Suicide-Squad-3d-Harley-Quinn-Bedding-Set-Duvet-Covers-Pillowcases-X-Task-Force-Joker-Bedding-6.jpg
72053,http://linhcorner.com/shop/uncategorized/summer-throw-quilts-fresh-pink-patchwork-quilt-stitching-small-balls-duvet-1pc-soft-bedspread-solid-bed-cover-pastoral-bed-linen/,"Summer throw Quilts fresh pink patchwork quilt stitching small balls duvet 1pc soft bedspread solid bed cover pastoral bed linen",2020/09/Summer-throw-Quilts-fresh-pink-patchwork-quilt-stitching-small-balls-duvet-1pc-soft-bedspread-solid-bed-6.jpg
72085,http://linhcorner.com/shop/uncategorized/50-new-bedding-flamingo-summer-quilt-blankets-cartoon-comforter-bed-cover-quilting-home-textiles-suitable-for-adults-kids/,"50 New Bedding Flamingo Summer Quilt Blankets Cartoon Comforter Bed Cover Quilting Home Textiles Suitable for Adults Kids",2020/09/50-New-Bedding-Flamingo-Summer-Quilt-Blankets-Cartoon-Comforter-Bed-Cover-Quilting-Home-Textiles-Suitable-for-6.jpg
72195,http://linhcorner.com/shop/uncategorized/mushroom-printing-duvet-cover-sets-king-bedding-sets-ru-usa-au-eu-size-child-quilt-cover-sheet-set-bedroom-bedding-bed-linen/,"Mushroom Printing Duvet Cover Sets King Bedding sets RU USA AU EU Size, Child Quilt cover Sheet Set Bedroom Bedding Bed Linen",2020/09/Mushroom-Printing-Duvet-Cover-Sets-King-Bedding-sets-RU-USA-AU-EU-Size-Child-Quilt-cover-6.jpg
72295,http://linhcorner.com/shop/uncategorized/crystal-pile-grinding-hair-embossing-quilted-warm-single-double-sided-amphibious-bed-cover-four-seasons-general/,"Crystal pile + grinding hair embossing quilted warm single double-sided amphibious bed cover four seasons general",2020/09/Crystal-pile-grinding-hair-embossing-quilted-warm-single-double-sided-amphibious-bed-cover-four-seasons-general-6.jpg
72532,http://linhcorner.com/shop/uncategorized/60black-and-white-color-stripe-bed-cover-sets-twin-full-queen-king-super-king-size-quilt-cover-bed-sheet-pillowcase-bedding-set/,"60Black and White Color Stripe Bed Cover Sets Twin/Full/Queen/King/Super King size Quilt Cover Bed Sheet Pillowcase Bedding Set",2020/09/60Black-and-White-Color-Stripe-Bed-Cover-Sets-Twin-Full-Queen-King-Super-King-size-Quilt-5.jpg
72533,http://linhcorner.com/shop/uncategorized/wostar-3d-print-animal-wolf-kisses-bedding-set-king-size-home-textiles-summer-quilt-cover-pillowcase-luxury-bedding-bed-linen/,"WOSTAR 3d print animal wolf kisses bedding set king size home textiles summer quilt cover pillowcase luxury bedding bed linen",2020/09/WOSTAR-3d-print-animal-wolf-kisses-bedding-set-king-size-home-textiles-summer-quilt-cover-pillowcase-6.jpg
72564,http://linhcorner.com/shop/uncategorized/halloween-funny-skeleton-skull-quilt-duvet-cover-room-decor-bedding-set-bedspread-3pcs-large-size-bed-sets-home-textile/,"Halloween Funny Skeleton Skull Quilt Duvet Cover Room Decor Bedding Set Bedspread 3pcs Large Size Bed Sets Home Textile",2020/09/Halloween-Funny-Skeleton-Skull-Quilt-Duvet-Cover-Room-Decor-Bedding-Set-Bedspread-3pcs-Large-Size-Bed-2.jpg
72582,http://linhcorner.com/shop/uncategorized/brushed-bedding-set-duvet-cover-fitted-sheet-pillowcases-mattress-protector-twin-queen-pink-blue-grey-bed-cover-for-women-girls/,"Brushed Bedding Set Duvet Cover Fitted Sheet Pillowcases Mattress Protector Twin Queen Pink Blue Grey Bed Cover for Women Girls",2020/09/Brushed-Bedding-Set-Duvet-Cover-Fitted-Sheet-Pillowcases-Mattress-Protector-Twin-Queen-Pink-Blue-Grey-Bed-6.jpg
72838,http://linhcorner.com/shop/uncategorized/1pcs-winter-warm-soft-double-side-plush-bed-blanket-flannel-thick-duvet-cover-comforter-quilt-blanket-case-full-queen-king-size/,"1pcs Winter Warm Soft Double Side Plush Bed Blanket Flannel Thick Duvet cover Comforter/Quilt/Blanket case Full Queen King Size",2020/09/1pcs-Winter-Warm-Soft-Double-Side-Plush-Bed-Blanket-Flannel-Thick-Duvet-cover-Comforter-Quilt-Blanket-6.jpg
72866,http://linhcorner.com/shop/uncategorized/designer-bedding-set-cotton-single-duvet-cover-set-of-bed-linen-adult-mattress-protector-printed-flat-bed-sheets-and-pillowcases/,"Designer Bedding Set Cotton Single Duvet Cover Set of Bed Linen Adult Mattress Protector Printed Flat Bed Sheets and Pillowcases",2020/09/Designer-Bedding-Set-Cotton-Single-Duvet-Cover-Set-of-Bed-Linen-Adult-Mattress-Protector-Printed-Flat-6.jpg
73022,http://linhcorner.com/shop/uncategorized/ab-side-bedding-set-pure-cotton-noctilucent-plaid-striped-red-heart-patterns-bed-sheet-quilt-cover-pillowcase-3-4pcs/,"AB side bedding set Pure cotton Noctilucent plaid striped red heart Patterns Bed sheet quilt cover pillowcase 3/4pcs",2020/09/AB-side-bedding-set-Pure-cotton-Noctilucent-plaid-striped-red-heart-Patterns-Bed-sheet-quilt-cover-6.jpg
73388,http://linhcorner.com/shop/uncategorized/55-free-shipping-new-fish-summer-quilt-blankets-cartoon-comforter-bed-cover-quilting-for-adults-kids-home-textile29/,"55 Free shipping  New Fish  Summer Quilt Blankets Cartoon Comforter Bed Cover Quilting for Adults Kids Home Textile29",2020/09/55-Free-shipping-New-Fish-Summer-Quilt-Blankets-Cartoon-Comforter-Bed-Cover-Quilting-for-Adults-Kids-4.jpg
73411,http://linhcorner.com/shop/uncategorized/satin-silk-bedding-set-luxury-queen-king-size-bed-set-quilt-duvet-cover-linens-and-pillowcase-for-single-double-bedclothes/,"Satin Silk Bedding Set Luxury Queen King Size Bed Set Quilt Duvet Cover Linens And Pillowcase For Single Double Bedclothes",2020/09/Satin-Silk-Bedding-Set-Luxury-Queen-King-Size-Bed-Set-Quilt-Duvet-Cover-Linens-And-Pillowcase-6.jpg
73453,http://linhcorner.com/shop/uncategorized/crystal-velvet-plus-printed-cotton-embroidered-bed-cover-both-sides-with-four-seasons-general/,"Crystal velvet plus printed cotton embroidered bed cover both sides with Four Seasons General",2020/09/Crystal-velvet-plus-printed-cotton-embroidered-bed-cover-both-sides-with-Four-Seasons-General-6.jpg
73618,http://linhcorner.com/shop/uncategorized/egyptian-cotton-white-comforter-bedding-sets-satin-strip-luxury-soft-home-textile-beddings-and-bed-sets-duvet-cover-pillowcases/,"Egyptian Cotton White Comforter Bedding Sets Satin Strip Luxury Soft Home Textile Beddings and Bed Sets Duvet Cover Pillowcases",2020/09/Egyptian-Cotton-White-Comforter-Bedding-Sets-Satin-Strip-Luxury-Soft-Home-Textile-Beddings-and-Bed-Sets-6.jpg
73649,http://linhcorner.com/shop/uncategorized/vescovo-mulberry-silk-quilts-warm-winter-duvet-insert-quilted-bed-comforter-king-queen-full-twin-size-kid-bed-patchwork-blanket/,"VESCOVO mulberry silk quilts warm winter duvet insert quilted bed comforter king queen full twin size kid bed patchwork blanket",2020/09/VESCOVO-mulberry-silk-quilts-warm-winter-duvet-insert-quilted-bed-comforter-king-queen-full-twin-size-4.jpg
73739,http://linhcorner.com/shop/uncategorized/lovinsunshine-comforter-bedding-sets-cover-duvet-queen-home-textile-love-pattern-4pcs-bed-quilt-ab42/,"LOVINSUNSHINE Comforter Bedding Sets Cover Duvet Queen Home Textile Love Pattern 4pcs Bed Quilt AB#42",2020/09/LOVINSUNSHINE-Comforter-Bedding-Sets-Cover-Duvet-Queen-Home-Textile-Love-Pattern-4pcs-Bed-Quilt-AB-42-6.jpg
73770,http://linhcorner.com/shop/uncategorized/justchic-4pcs-set-winter-flannel-berber-fleece-duvet-cover-bed-sheets-pillowcase-kit-bedding-set-quilt-cover-ab-version-double/,"JUSTCHIC 4pcs/set Winter Flannel Berber Fleece Duvet Cover Bed Sheets Pillowcase Kit Bedding Set Quilt Cover AB Version Double",2020/09/JUSTCHIC-4pcs-set-Winter-Flannel-Berber-Fleece-Duvet-Cover-Bed-Sheets-Pillowcase-Kit-Bedding-Set-Quilt-6.jpg
73900,http://linhcorner.com/shop/uncategorized/simple-printing-bedding-cotton-polyester-bedspread-pillowcase-quilt-coverlet-bed-covers-blanket-quilting-double-single-size-l/,"Simple Printing Bedding Cotton Polyester Bedspread Pillowcase Quilt Coverlet Bed Covers Blanket Quilting Double/Single Size #/L",2020/09/Simple-Printing-Bedding-Cotton-Polyester-Bedspread-Pillowcase-Quilt-Coverlet-Bed-Covers-Blanket-Quilting-Double-Single-Size-6.jpg
74200,http://linhcorner.com/shop/uncategorized/bed-linen-bedding-set-black-cow-curve-duvet-cover-flat-sheet-pillowcase-quilt-cover-full-queen-king-size-3-4pcs-bedclothes/,"Bed linen Bedding Set Black Cow Curve Duvet Cover Flat Sheet Pillowcase Quilt Cover Full Queen King Size 3/4pcs Bedclothes",2020/09/Bed-linen-Bedding-Set-Black-Cow-Curve-Duvet-Cover-Flat-Sheet-Pillowcase-Quilt-Cover-Full-Queen-6.jpg
74224,http://linhcorner.com/shop/uncategorized/2020-hot-bohemian-style-comforter-bedding-set-printing-bed-set-duvet-cover-sets-queen-king-quilt-cover-pillow-cases-home-textile/,"2020 Hot Bohemian style comforter bedding set printing bed set duvet cover sets Queen King Quilt Cover Pillow cases Home Textile",2020/09/2020-Hot-Bohemian-style-comforter-bedding-set-printing-bed-set-duvet-cover-sets-Queen-King-Quilt-5.jpg
74350,http://linhcorner.com/shop/uncategorized/softbatfy-3d-printed-quilt-blanket-for-bed-soft-dropshipping/,"SOFTBATFY  3D Printed Quilt Blanket for Bed Soft Dropshipping",2020/09/SOFTBATFY-3D-Printed-Quilt-Blanket-for-Bed-Soft-Dropshipping-6.jpg
74380,http://linhcorner.com/shop/uncategorized/nordic-solid-color-bedding-set-bedcloths-pillowcases-gray-bed-linens-set-adults-soft-bed-duvet-cover-set-us-twin-queen-king/,"Nordic Solid Color Bedding Set Bedcloths Pillowcases Gray Bed Linens Set Adults Soft Bed Duvet Cover Set US Twin Queen King",2020/09/Nordic-Solid-Color-Bedding-Set-Bedcloths-Pillowcases-Gray-Bed-Linens-Set-Adults-Soft-Bed-Duvet-Cover-6.jpg
74687,http://linhcorner.com/shop/uncategorized/summer-washed-cotton-air-conditioning-quilt-soft-breathable-blanket-thin-stripe-plaid-comforter-bed-cover/,"Summer Washed Cotton Air-conditioning Quilt Soft Breathable Blanket Thin Stripe Plaid Comforter Bed Cover",2020/09/Summer-Washed-Cotton-Air-conditioning-Quilt-Soft-Breathable-Blanket-Thin-Stripe-Plaid-Comforter-Bed-Cover-6.jpg
74709,http://linhcorner.com/shop/uncategorized/3d-luxury-bedding-set-custom-king-europe-usaduvet-cover-setquilt-blanket-cover-setbed-set-animal-black-cat-eyesdrop-ship/,"3D luxury Bedding Set Custom/King/Europe/USA,Duvet Cover Set,Quilt/Blanket Cover Set,Bed set Animal Black cat eyes,drop ship",2020/09/3D-luxury-Bedding-Set-Custom-King-Europe-USA-Duvet-Cover-Set-Quilt-Blanket-Cover-Set-Bed-6.jpg
75186,http://linhcorner.com/shop/uncategorized/bedding-sets-dark-purple-simple-color-lake-blue-striped-bed-sheet-duver-quilt-cover-pillowcase-soft-king-queen-full-twin/,"Bedding sets Dark purple Simple color Lake Blue striped bed sheet duver quilt cover pillowcase soft King Queen Full Twin",2020/09/Bedding-sets-Dark-purple-Simple-color-Lake-Blue-striped-bed-sheet-duver-quilt-cover-pillowcase-soft-4.jpg
75375,http://linhcorner.com/shop/uncategorized/pink-disney-princess-bedding-set-for-kids-bedroom-decor-twin-quilt-duvet-cover-set-single-bed-sheet-girls-home-children-2-4-pcs/,"Pink Disney Princess Bedding Set for Kids Bedroom Decor Twin Quilt Duvet Cover Set Single Bed Sheet Girls Home Children 2-4 pcs",2020/09/Pink-Disney-Princess-Bedding-Set-for-Kids-Bedroom-Decor-Twin-Quilt-Duvet-Cover-Set-Single-Bed-6.jpg
75496,http://linhcorner.com/shop/uncategorized/chausub-bedspreads-for-bed-quilt-set-3pcs-cotton-quilts-handmade-patchwork-coverlet-quilted-bed-cover-king-queen-summer-blanket/,"CHAUSUB Bedspreads For Bed Quilt Set 3pcs Cotton Quilts Handmade Patchwork Coverlet Quilted Bed Cover King Queen Summer Blanket",2020/09/CHAUSUB-Bedspreads-For-Bed-Quilt-Set-3pcs-Cotton-Quilts-Handmade-Patchwork-Coverlet-Quilted-Bed-Cover-King-6.jpg
75583,http://linhcorner.com/shop/uncategorized/japan-summer-quilt-blanket-for-bed-grey-thin-solid-color-comforter-quilted-bedspread-for-double-king-bed-cover-bedding/,"Japan Summer Quilt Blanket For Bed Grey Thin Solid Color Comforter Quilted Bedspread For Double King Bed Cover Bedding",2020/09/Japan-Summer-Quilt-Blanket-For-Bed-Grey-Thin-Solid-Color-Comforter-Quilted-Bedspread-For-Double-King-1.jpeg
75618,http://linhcorner.com/shop/uncategorized/minnie-mouse-bedding-set-cover-pillowcase-quilt-mickey-mouse-cartoon-children-bedclothes-bed-set-disney-home-textile/,"Minnie mouse Bedding Set Cover pillowcase quilt mickey mouse cartoon Children bedclothes  bed set Disney  Home textile",2020/09/Minnie-mouse-Bedding-Set-Cover-pillowcase-quilt-mickey-mouse-cartoon-Children-bedclothes-bed-set-Disney-Home-6.jpg
75628,http://linhcorner.com/shop/uncategorized/claroom-pink-strawberry-bed-linens-cute-bedding-set-girls-duvet-cover-sets-quilt-cover-bed-sheet-king-queen-size-ti51/,"claroom Pink Strawberry Bed Linens cute bedding set girls duvet cover sets Quilt cover Bed Sheet king queen size TI51#",2020/09/claroom-Pink-Strawberry-Bed-Linens-cute-bedding-set-girls-duvet-cover-sets-Quilt-cover-Bed-Sheet-6.jpg
75810,http://linhcorner.com/shop/uncategorized/christmas-bed-cover-kids-bed-decor-santa-claus-duvet-cover-quilt-cover-pillowcase-red-twin-full-queen-bed-linen-bedding-sets/,"Christmas Bed Cover Kids Bed Decor Santa Claus Duvet Cover Quilt Cover Pillowcase Red Twin Full Queen Bed Linen Bedding Sets",2020/09/Christmas-Bed-Cover-Kids-Bed-Decor-Santa-Claus-Duvet-Cover-Quilt-Cover-Pillowcase-Red-Twin-Full-6.jpg
76006,http://linhcorner.com/shop/uncategorized/denisroom-quilts-and-set-bedding-twins-queen-duvet-cover-double-bed-comforters-children-3d-animal-cat-dog-bed-set-xy84/,"Denisroom Quilts and Set Bedding Twins Queen Duvet Cover Double Bed Comforters Children 3D Animal Cat Dog Bed set  XY84#",2020/09/Denisroom-Quilts-and-Set-Bedding-Twins-Queen-Duvet-Cover-Double-Bed-Comforters-Children-3D-Animal-Cat-6.jpg
76009,http://linhcorner.com/shop/uncategorized/j-home-textiles-quilt-cover-1pcs-pillow-case-2pcs-winter-bedding-set-soft-warm-lamb-cashmere-duvet-cover-solid-fleece-bed-cover/,"J  Home Textiles Quilt Cover 1pcs Pillow Case 2pcs Winter bedding set soft warm lamb cashmere duvet cover solid fleece bed cover",2020/09/J-Home-Textiles-Quilt-Cover-1pcs-Pillow-Case-2pcs-Winter-bedding-set-soft-warm-lamb-cashmere-6.jpg
76065,http://linhcorner.com/shop/uncategorized/bonenjoy-duvet-cover-set-stars-printed-quilt-cover-and-pillow-sham-single-queen-king-comforter-cover-housse-de-couette-bed-cover/,"Bonenjoy Duvet Cover Set Stars Printed Quilt Cover and Pillow Sham Single/Queen/King Comforter Cover housse de couette Bed Cover",2020/09/Bonenjoy-Duvet-Cover-Set-Stars-Printed-Quilt-Cover-and-Pillow-Sham-Single-Queen-King-Comforter-Cover-6.jpg
76099,http://linhcorner.com/shop/uncategorized/macaron-solid-color-bedspread-soft-summer-comforter-quilts-washable-bed-quilt-air-conditioned-quilt-duvet-adults-summer-quilt/,"Macaron Solid Color Bedspread Soft Summer Comforter Quilts Washable Bed Quilt Air Conditioned Quilt Duvet Adults Summer Quilt",2020/09/Macaron-Solid-Color-Bedspread-Soft-Summer-Comforter-Quilts-Washable-Bed-Quilt-Air-Conditioned-Quilt-Duvet-Adults-6.jpg
76661,http://linhcorner.com/shop/uncategorized/bonenjoy-yellow-king-bed-quilt-cover-queen-size-bedding-covers-cartoon-kids-bed-linen-single-for-children-double-bedding-sets/,"Bonenjoy Yellow King Bed Quilt Cover Queen Size Bedding Covers Cartoon Kids Bed Linen Single For Children Double Bedding Sets",2020/09/Bonenjoy-Yellow-King-Bed-Quilt-Cover-Queen-Size-Bedding-Covers-Cartoon-Kids-Bed-Linen-Single-For-6.jpg
76725,http://linhcorner.com/shop/uncategorized/disney-cartoon-toy-story-bedding-set-king-size-quilt-duvet-cover-for-kids-bedroom-decora-boy-bed-cover-comforter-bedding-sets/,"Disney Cartoon Toy Story Bedding Set King Size Quilt Duvet Cover for Kids Bedroom Decora Boy Bed Cover  Comforter Bedding Sets",2020/09/Disney-Cartoon-Toy-Story-Bedding-Set-King-Size-Quilt-Duvet-Cover-for-Kids-Bedroom-Decora-Boy-6.jpg
76768,http://linhcorner.com/shop/uncategorized/quilt-winter-autumn-warm-bed-cover-for-double-bed-soft-blanket-solid-color-bedspread-for-children-adults-king-full-twin-size/,"Quilt Winter Autumn Warm Bed Cover for Double Bed Soft Blanket Solid Color Bedspread for Children Adults King Full Twin Size",2020/09/Quilt-Winter-Autumn-Warm-Bed-Cover-for-Double-Bed-Soft-Blanket-Solid-Color-Bedspread-for-Children-6.jpg
76782,http://linhcorner.com/shop/uncategorized/baby-blanket-knitted-newborn-swaddle-wrap-blankets-super-soft-toddler-infant-bedding-quilt-for-bed-sofa-basket-stroller-blankets/,"Baby Blanket Knitted Newborn Swaddle Wrap Blankets Super Soft Toddler Infant Bedding Quilt For Bed Sofa Basket Stroller Blankets",2020/09/Baby-Blanket-Knitted-Newborn-Swaddle-Wrap-Blankets-Super-Soft-Toddler-Infant-Bedding-Quilt-For-Bed-Sofa-6.jpg
77077,http://linhcorner.com/shop/uncategorized/air-condition-thin-stripe-summer-cool-quilt-single-double-breathable-sofa-office-bed-travel-quilts-throw-blanket/,"Air Condition Thin Stripe Summer Cool Quilt Single Double Breathable Sofa Office Bed Travel Quilts Throw Blanket",2020/09/Air-Condition-Thin-Stripe-Summer-Cool-Quilt-Single-Double-Breathable-Sofa-Office-Bed-Travel-Quilts-Throw-6.jpg
77220,http://linhcorner.com/shop/uncategorized/luxury-jacquard-bedding-set-king-size-duvet-cover-bed-linen-queen-comforter-bed-gold-quilt-cover-high-quality-for-adults/,"Luxury Jacquard Bedding Set King Size Duvet Cover Bed Linen Queen Comforter Bed Gold Quilt Cover High Quality For Adults",2020/09/Luxury-Jacquard-Bedding-Set-King-Size-Duvet-Cover-Bed-Linen-Queen-Comforter-Bed-Gold-Quilt-Cover.jpg
77353,http://linhcorner.com/shop/uncategorized/zeimon-cartoon-mermaid-bedding-set-100-polyester-adult-kids-girl-duvet-cover-quilt-cover-pillowcase-students-bed-linen-set/,"ZEIMON Cartoon Mermaid Bedding Set 100% Polyester Adult/kids Girl Duvet Cover Quilt Cover Pillowcase Students Bed Linen Set",2020/09/ZEIMON-Cartoon-Mermaid-Bedding-Set-100-Polyester-Adult-kids-Girl-Duvet-Cover-Quilt-Cover-Pillowcase-Students-6.jpg
77403,http://linhcorner.com/shop/uncategorized/6-pcs-set-quilt-blankets-fastener-clip-quilt-holder-bed-sheet-holders-non-slip-duvet-cover-clamp-safe-coverlet-holder-device/,"6 Pcs/Set Quilt Blankets Fastener Clip Quilt Holder Bed Sheet Holders Non-Slip Duvet Cover Clamp Safe Coverlet Holder Device",2020/09/6-Pcs-Set-Quilt-Blankets-Fastener-Clip-Quilt-Holder-Bed-Sheet-Holders-Non-Slip-Duvet-Cover.jpg
77706,http://linhcorner.com/shop/uncategorized/2-3pcs-home-duvet-cover-queen-bedding-set-3d-solid-color-quilt-covers-winter-simple-comfortable-bed-line-set-with-pillowcase/,"2/3Pcs Home Duvet Cover Queen Bedding Set 3d Solid Color Quilt Covers Winter Simple Comfortable Bed Line Set With Pillowcase",2020/09/2-3Pcs-Home-Duvet-Cover-Queen-Bedding-Set-3d-Solid-Color-Quilt-Covers-Winter-Simple-Comfortable-6.jpg
77886,http://linhcorner.com/shop/uncategorized/carved-velvet-quilts-bedding-soft-fur-comforters-throw-on-sofa-bed-plane-travel-blanket-printed-bedspread-cotton-duvet-cover/,"Carved velvet Quilts Bedding Soft Fur Comforters Throw on Sofa/Bed/Plane Travel Blanket Printed Bedspread Cotton Duvet Cover",2020/09/Carved-velvet-Quilts-Bedding-Soft-Fur-Comforters-Throw-on-Sofa-Bed-Plane-Travel-Blanket-Printed-Bedspread.jpg
77959,http://linhcorner.com/shop/uncategorized/lofuka-women-100-mulberry-silk-quilt-healthy-beauty-handwork-silk-comforters-duvet-silk-filled-double-queen-king-quilt-1pcs/,"Lofuka Women 100% Mulberry  Silk Quilt Healthy Beauty Handwork Silk Comforters Duvet Silk Filled Double Queen King Quilt 1PCS",2020/09/Lofuka-Women-100-Mulberry-Silk-Quilt-Healthy-Beauty-Handwork-Silk-Comforters-Duvet-Silk-Filled-Double-Queen.jpg
78025,http://linhcorner.com/shop/uncategorized/3d-rose-flowers-printing-bedding-set-2-3-4pcs-quilt-duvet-cover-pillowcases-bed-linen-bedroom-decorations-bedclothes/,"3D Rose Flowers Printing Bedding Set 2/3/4pcs Quilt Duvet Cover Pillowcases Bed Linen Bedroom Decorations Bedclothes",2020/09/3D-Rose-Flowers-Printing-Bedding-Set-2-3-4pcs-Quilt-Duvet-Cover-Pillowcases-Bed-Linen-Bedroom.jpg
78092,http://linhcorner.com/shop/uncategorized/31-summer-quilt-solid-bedspread-blanket-comforter-bed-cover-quilting-home-suitable-thin-coverlet-bed-sheet-duvet-cover-bk05/,"31 Summer Quilt Solid Bedspread Blanket Comforter Bed Cover Quilting Home Suitable Thin Coverlet Bed Sheet Duvet Cover BK05",2020/09/31-Summer-Quilt-Solid-Bedspread-Blanket-Comforter-Bed-Cover-Quilting-Home-Suitable-Thin-Coverlet-Bed-Sheet-6.jpg
78285,http://linhcorner.com/shop/uncategorized/2-3-pcs-gamer-duvet-cover-set-cartoon-bedding-kids-boys-girls-bed-set-game-quilt-cover-comforter-cover-gamer-bedding-set/,"2/3 Pcs Gamer Duvet Cover Set Cartoon Bedding Kids Boys Girls Bed Set Game Quilt Cover Comforter Cover Gamer Bedding Set",2020/09/2-3-Pcs-Gamer-Duvet-Cover-Set-Cartoon-Bedding-Kids-Boys-Girls-Bed-Set-Game-Quilt.jpg
78342,http://linhcorner.com/shop/uncategorized/new-solid-pink-white-bedspread-summer-quilt-blanket-comforter-bed-cover-quilting-home-textiles-suitable-for-children-adult-29/,"New Solid pink white Bedspread  Summer Quilt Blanket Comforter Bed Cover Quilting Home Textiles Suitable for Children adult 29",2020/09/New-Solid-pink-white-Bedspread-Summer-Quilt-Blanket-Comforter-Bed-Cover-Quilting-Home-Textiles-Suitable-for.jpg
78405,http://linhcorner.com/shop/uncategorized/3pcs-luxury-bedding-set-twin-queen-king-size-bedding-sets-king-double-size-satin-silk-summer-used-single-bed-linen-bedding-kit/,"3pcs Luxury Bedding set Twin Queen King Size Bedding Sets King Double Size Satin Silk Summer Used Single Bed Linen Bedding Kit",2020/09/3pcs-Luxury-Bedding-set-Twin-Queen-King-Size-Bedding-Sets-King-Double-Size-Satin-Silk-Summer-6.jpg
78415,http://linhcorner.com/shop/uncategorized/simple-luxury-king-size-bedding-set-floral-printed-duvet-cover-sets-bed-linen-quilt-covers-single-queen-bedclothesno-bed-sheet/,"Simple Luxury King Size Bedding Set Floral Printed Duvet Cover Sets Bed Linen Quilt Covers Single Queen BedClothes(No Bed Sheet)",2020/09/Simple-Luxury-King-Size-Bedding-Set-Floral-Printed-Duvet-Cover-Sets-Bed-Linen-Quilt-Covers-Single.jpg
78521,http://linhcorner.com/shop/uncategorized/mulberry-silk-comforter-100-real-silk-summer-quilt-single-double-bed-adult-twin-full-queen-king-size-jacquard-blanket-comforter/,"Mulberry Silk Comforter 100% Real Silk Summer Quilt Single Double Bed Adult Twin Full Queen King Size Jacquard Blanket Comforter",2020/09/Mulberry-Silk-Comforter-100-Real-Silk-Summer-Quilt-Single-Double-Bed-Adult-Twin-Full-Queen-King.jpg
78931,http://linhcorner.com/shop/uncategorized/bedding-set-one-piece-japan-cartoon-anime-luffy-chopper-duvet-cover-for-kids-bed-cover-3d-quilt-children-home-textiles-3pcs/,"Bedding Set ONE PIECE Japan Cartoon Anime Luffy Chopper Duvet Cover for kids Bed Cover 3d Quilt children Home Textiles 3PCS",2020/09/Bedding-Set-ONE-PIECE-Japan-Cartoon-Anime-Luffy-Chopper-Duvet-Cover-for-kids-Bed-Cover-3d.jpg
78937,http://linhcorner.com/shop/uncategorized/simple-luxury-king-size-bedding-sets-floral-jacquard-printed-bed-linen-duvet-cover-set-quilt-covers-bedclothes-no-bed-sheet/,"Simple Luxury King Size Bedding Sets Floral Jacquard Printed Bed Linen Duvet Cover Set Quilt Covers Bedclothes (No Bed Sheet)",2020/09/Simple-Luxury-King-Size-Bedding-Sets-Floral-Jacquard-Printed-Bed-Linen-Duvet-Cover-Set-Quilt-Covers.jpg
78940,http://linhcorner.com/shop/uncategorized/marble-pattern-bedding-set-duvet-cover-set-2-3pcs-bed-set-twin-double-queen-quilt-cover-bed-linen-no-sheet-no-filling/,"Marble Pattern Bedding Set Duvet Cover Set 2/3pcs Bed Set Twin Double Queen Quilt Cover Bed linen (No Sheet No Filling)",2020/09/Marble-Pattern-Bedding-Set-Duvet-Cover-Set-2-3pcs-Bed-Set-Twin-Double-Queen-Quilt-Cover.jpg
78941,http://linhcorner.com/shop/uncategorized/2020-newest-bedding-summer-quilt-blankets-cartoon-comforter-bed-cover-quilting-home-textiles-suitable-for-adults-kids/,"2020 Newest Bedding Summer Quilt Blankets Cartoon Comforter Bed Cover Quilting Home Textiles Suitable for Adults Kids",2020/09/2020-Newest-Bedding-Summer-Quilt-Blankets-Cartoon-Comforter-Bed-Cover-Quilting-Home-Textiles-Suitable-for-Adults.jpg
