247785,https://linhcorner.com/shop/uncategorized/haircube-fast-hair-growth-essence-oil-anti-hair-loss-treatment-help-for-hair-growth-hair-care-products-for-men-women-hair-tonic/,"HAIRCUBE Fast Hair Growth Essence Oil Anti Hair Loss Treatment Help for hair Growth Hair Care Products for Men Women Hair Tonic",2020/09/HAIRCUBE-Fast-Hair-Growth-Essence-Oil-Anti-Hair-Loss-Treatment-Help-for-hair-Growth-Hair-Care.jpg
247786,https://linhcorner.com/shop/uncategorized/ginger-hair-growth-essence-7-days-germinal-hair-growth-serum-essence-oil-hair-loss-treatment-growth-hair-for-men-women/,"Ginger Hair Growth Essence 7 Days Germinal Hair Growth Serum Essence Oil Hair Loss Treatment Growth Hair for Men Women",2020/09/Ginger-Hair-Growth-Essence-7-Days-Germinal-Hair-Growth-Serum-Essence-Oil-Hair-Loss-Treatment-Growth.jpg
247788,https://linhcorner.com/shop/uncategorized/hair-regrowth-micro-needling-roller-anti-hair-loss-tool/,"Hair Regrowth Micro needling Roller Anti Hair Loss Tool",2020/09/Hair-Regrowth-Micro-needling-Roller-Anti-Hair-Loss-Tool.jpg
247790,https://linhcorner.com/shop/uncategorized/hair-growth-essence-oil-anti-hair-loss-treatment-spray-help-hair-growth-organic-nourishing-hair-root-hair-care-products/,"Hair Growth Essence Oil Anti Hair Loss Treatment Spray Help Hair Growth Organic Nourishing Hair Root Hair Care Products",2020/09/Hair-Growth-Essence-Oil-Anti-Hair-Loss-Treatment-Spray-Help-Hair-Growth-Organic-Nourishing-Hair-Root.jpg
247793,https://linhcorner.com/shop/uncategorized/fast-hair-growth-serum-spray-60ml-anti-hair-loss-treatment-dense-thicken-hair-nourish-hair-roots-hair-care-products-women/,"Fast Hair Growth Serum Spray 60ml Anti Hair Loss Treatment Dense Thicken Hair Nourish Hair Roots Hair Care Products Women",2020/09/Fast-Hair-Growth-Serum-Spray-60ml-Anti-Hair-Loss-Treatment-Dense-Thicken-Hair-Nourish-Hair-Roots.jpg
247801,https://linhcorner.com/shop/uncategorized/hair-growth-essence-triple-roller-massager-anti-hair-loss-treatment-promote-hair-growth-tools-hair-care-products-30mlx2/,"Hair Growth Essence Triple Roller Massager Anti hair loss Treatment Promote hair growth tools Hair Care Products 30ml×2",2020/09/Hair-Growth-Essence-Triple-Roller-Massager-Anti-hair-loss-Treatment-Promote-hair-growth-tools-Hair-Care.jpg
247833,https://linhcorner.com/shop/uncategorized/haircube-hair-growth-spray-anti-hair-loss-products-for-fast-hair-growth-oil-natural-organic-hair-tonic-hair-care-products/,"HAIRCUBE Hair Growth Spray Anti Hair Loss Products for Fast Hair Growth Oil Natural Organic Hair Tonic Hair Care Products",2020/09/HAIRCUBE-Hair-Growth-Spray-Anti-Hair-Loss-Products-for-Fast-Hair-Growth-Oil-Natural-Organic-Hair.jpg
247841,https://linhcorner.com/shop/uncategorized/haircube-hair-growth-spray-anti-hair-loss-serum-for-fast-hair-growth-treatment-oil-hair-tonic-hair-care-hair-loss-products/,"HAIRCUBE Hair Growth Spray Anti Hair Loss Serum for Fast Hair Growth Treatment Oil Hair Tonic Hair Care Hair Loss Products",2020/09/HAIRCUBE-Hair-Growth-Spray-Anti-Hair-Loss-Serum-for-Fast-Hair-Growth-Treatment-Oil-Hair-Tonic.jpg
247858,https://linhcorner.com/shop/uncategorized/omy-lady-anti-hair-loss-hair-growth-spray-essential-oil-liquid-for-men-women-dry-hair-regeneration-repair/,"OMY LADY Anti Hair Loss Hair Growth Spray Essential Oil Liquid For Men Women Dry Hair Regeneration Repair",2020/09/OMY-LADY-Anti-Hair-Loss-Hair-Growth-Spray-Essential-Oil-Liquid-For-Men-Women-Dry-Hair.jpg
247864,https://linhcorner.com/shop/uncategorized/omy-lady-hair-growth-spray-essential-serum-hair-regrowth-oil-anti-hair-loss-liquid-for-men-women-dry-hair-regeneration-repair/,"OMY LADY Hair Growth Spray Essential Serum Hair Regrowth Oil Anti Hair Loss Liquid For Men Women Dry Hair Regeneration Repair",2020/09/OMY-LADY-Hair-Growth-Spray-Essential-Serum-Hair-Regrowth-Oil-Anti-Hair-Loss-Liquid-For-Men.jpg
247870,https://linhcorner.com/shop/uncategorized/haircube-hair-growth-oil-fast-hair-growth-agent-anti-hair-loss-remedy-treatment-hair-care-spray-thickener-hair-growth-essence/,"HAIRCUBE Hair Growth Oil Fast Hair Growth Agent Anti Hair Loss Remedy Treatment Hair Care Spray Thickener Hair Growth Essence",2020/09/HAIRCUBE-Hair-Growth-Oil-Fast-Hair-Growth-Agent-Anti-Hair-Loss-Remedy-Treatment-Hair-Care-Spray.jpg
247877,https://linhcorner.com/shop/uncategorized/hair-growth-essence-oil-anti-hair-loss-treatment-hair-thickener-beard-growth-for-hair-growth-serum-hair-tonic-hair-care-products/,"Hair Growth Essence Oil Anti Hair Loss Treatment Hair Thickener Beard Growth for Hair Growth Serum Hair Tonic Hair Care Products",2020/09/Hair-Growth-Essence-Oil-Anti-Hair-Loss-Treatment-Hair-Thickener-Beard-Growth-for-Hair-Growth-Serum.jpg
247896,https://linhcorner.com/shop/uncategorized/hair-shadow-powder-hair-line-modified-repair-hair-shadow-trimming-powder-makeup-hair-concealer-natural-cover-beauty-edge-control/,"Hair Shadow Powder Hair line Modified Repair Hair Shadow Trimming Powder Makeup Hair Concealer Natural Cover Beauty Edge Control",2020/09/Hair-Shadow-Powder-Hair-line-Modified-Repair-Hair-Shadow-Trimming-Powder-Makeup-Hair-Concealer-Natural-Cover.jpg
247912,https://linhcorner.com/shop/uncategorized/electric-laser-hair-growth-comb-anti-hair-loss-treatment-infrared-rf-nano-red-light-ems-vibration-massage-hair-brush-hair-care46/,"Electric Laser Hair Growth Comb Anti Hair Loss Treatment Infrared RF Nano Red Light EMS Vibration Massage Hair Brush Hair Care46",2020/09/Electric-Laser-Hair-Growth-Comb-Anti-Hair-Loss-Treatment-Infrared-RF-Nano-Red-Light-EMS-Vibration.jpg
247914,https://linhcorner.com/shop/uncategorized/hair-care-set-morocco-herbal-supple-anti-dandruff-shampoo-hair-loss-fast-powerful-hair-growth-serum-repair-hair-smooth-soft/,"Hair Care Set Morocco Herbal Supple Anti Dandruff Shampoo Hair Loss Fast Powerful Hair Growth Serum Repair Hair Smooth Soft",2020/09/Hair-Care-Set-Morocco-Herbal-Supple-Anti-Dandruff-Shampoo-Hair-Loss-Fast-Powerful-Hair-Growth-Serum.jpg
247943,https://linhcorner.com/shop/uncategorized/omy-lady-ginger-anti-hair-loss-shampoo-promote-hair-growth-shampoo-hair-thick-fast-growth-serum-herbal-liquid-for-women-men/,"OMY LADY Ginger Anti Hair Loss Shampoo promote hair growth Shampoo Hair Thick Fast Growth Serum Herbal Liquid For Women Men",2020/09/OMY-LADY-Ginger-Anti-Hair-Loss-Shampoo-promote-hair-growth-Shampoo-Hair-Thick-Fast-Growth-Serum.jpg
247964,https://linhcorner.com/shop/uncategorized/vibrant-glamour-hair-growth-essence-hair-loss-products-moroccan-essential-oil-liquid-treatment-preventing-hair-loss-hair-care/,"VIBRANT GLAMOUR Hair Growth Essence Hair Loss Products Moroccan Essential Oil Liquid Treatment Preventing Hair Loss Hair Care",2020/09/VIBRANT-GLAMOUR-Hair-Growth-Essence-Hair-Loss-Products-Moroccan-Essential-Oil-Liquid-Treatment-Preventing-Hair-Loss.jpg
247972,https://linhcorner.com/shop/uncategorized/natural-hair-shadow-powder-hair-line-modified-repair-hair-shadow-trimming-powder-makeup-hair-concealer-cover-beauty-edge-control/,"Natural Hair Shadow Powder Hair line Modified Repair Hair Shadow Trimming Powder Makeup Hair Concealer Cover Beauty Edge Control",2020/09/Natural-Hair-Shadow-Powder-Hair-line-Modified-Repair-Hair-Shadow-Trimming-Powder-Makeup-Hair-Concealer-Cover.jpg
247979,https://linhcorner.com/shop/uncategorized/anti-hair-loss-hair-growth-spray-essential-oil-liquid-hair-care-damaged-hair-repair-treatment-men-women-dry-hair-care-product/,"Anti Hair Loss Hair Growth Spray Essential Oil Liquid Hair Care Damaged Hair Repair Treatment Men Women Dry Hair Care Product",2020/09/Anti-Hair-Loss-Hair-Growth-Spray-Essential-Oil-Liquid-Hair-Care-Damaged-Hair-Repair-Treatment-Men.jpg
248001,https://linhcorner.com/shop/uncategorized/anti-hair-loss-hair-growth-spray-essential-oil-liquid-for-men-women-dry-hair-regeneration-repairhair-loss-products/,"Anti Hair Loss Hair Growth Spray Essential Oil Liquid For Men Women Dry Hair Regeneration Repair,Hair Loss Products",2020/09/Anti-Hair-Loss-Hair-Growth-Spray-Essential-Oil-Liquid-For-Men-Women-Dry-Hair-Regeneration-Repair.jpg
248007,https://linhcorner.com/shop/uncategorized/dimollaure-men-beard-balm-organic-mustache-wax-beard-conditioner-moisturizing-smoothing-gentlemen-beard-care-beard-growth/,"Dimollaure Men Beard Balm Organic Mustache Wax Beard Conditioner Moisturizing Smoothing Gentlemen Beard Care Beard Growth",2020/09/Dimollaure-Men-Beard-Balm-Organic-Mustache-Wax-Beard-Conditioner-Moisturizing-Smoothing-Gentlemen-Beard-Care-Beard-Growth.jpg
248022,https://linhcorner.com/shop/uncategorized/blue-zoo-natural-beard-oil-balm-moustache-styling-beeswax-moisturizing-smoothing-gentlemen-beard-balm-organic-men-grooming-kit/,"Blue ZOO Natural Beard Oil Balm Moustache Styling Beeswax Moisturizing Smoothing Gentlemen Beard Balm Organic Men Grooming Kit",2020/09/Blue-ZOO-Natural-Beard-Oil-Balm-Moustache-Styling-Beeswax-Moisturizing-Smoothing-Gentlemen-Beard-Balm-Organic-Men.jpg
248040,https://linhcorner.com/shop/uncategorized/new-makeup-hair-line-shadow-powder-eyebrow-powder-extract-easy-to-wear-makeup-neat-hairline-with-mirror-puff-fibers/,"New Makeup Hair Line Shadow Powder Eyebrow Powder Extract Easy to Wear Makeup Neat  Hairline with Mirror Puff Fibers",2020/09/New-Makeup-Hair-Line-Shadow-Powder-Eyebrow-Powder-Extract-Easy-to-Wear-Makeup-Neat-Hairline-with.jpg
248047,https://linhcorner.com/shop/uncategorized/efero-hair-growth-essence-oil-hair-beard-growth-serum-anti-hair-loss-products-hairs-care-treatment-essential-for-women-men-20ml/,"EFERO Hair Growth Essence Oil Hair Beard Growth Serum Anti-hair Loss Products Hairs Care Treatment Essential for Women Men 20ML",2020/09/EFERO-Hair-Growth-Essence-Oil-Hair-Beard-Growth-Serum-Anti-hair-Loss-Products-Hairs-Care-Treatment.jpg
248053,https://linhcorner.com/shop/uncategorized/lanbena-fast-powerful-hair-growth-essence-products-essential-oil-liquid-treatment-preventing-hair-loss-hair-care-andrea-20ml/,"LANBENA Fast Powerful Hair Growth Essence Products Essential Oil Liquid Treatment Preventing Hair Loss Hair Care Andrea 20ml",2020/09/LANBENA-Fast-Powerful-Hair-Growth-Essence-Products-Essential-Oil-Liquid-Treatment-Preventing-Hair-Loss-Hair-Care.jpg
248066,https://linhcorner.com/shop/uncategorized/laikou-pure-moroccan-argan-oil-hair-oil-keratin-straightening-curly-treatment-growth-mask-for-damaged-hair-dry-split-ends-40ml/,"LAIKOU Pure Moroccan Argan Oil Hair Oil Keratin Straightening Curly Treatment Growth Mask for Damaged Hair Dry Split ends 40ml",2020/09/LAIKOU-Pure-Moroccan-Argan-Oil-Hair-Oil-Keratin-Straightening-Curly-Treatment-Growth-Mask-for-Damaged-Hair.jpg
248100,https://linhcorner.com/shop/uncategorized/vibrant-glamour-hair-growth-spray-serum-essential-oil-nourish-scalp-hair-roots-prevent-hair-loss-clean-scalp-grease-hair-care/,"VIBRANT GLAMOUR Hair Growth Spray Serum Essential Oil Nourish Scalp Hair Roots Prevent Hair Loss Clean Scalp Grease Hair Care",2020/09/VIBRANT-GLAMOUR-Hair-Growth-Spray-Serum-Essential-Oil-Nourish-Scalp-Hair-Roots-Prevent-Hair-Loss-Clean.jpg
248101,https://linhcorner.com/shop/uncategorized/micro-needle-roller-derma-roller-titanium-beard-roller-for-hair-regrowth-beard-growth-anti-hair-loss-skin-care-treatment/,"Micro Needle Roller Derma Roller Titanium Beard Roller for Hair Regrowth Beard Growth Anti-Hair Loss Skin Care Treatment",2020/09/Micro-Needle-Roller-Derma-Roller-Titanium-Beard-Roller-for-Hair-Regrowth-Beard-Growth-Anti-Hair-Loss.jpg
248105,https://linhcorner.com/shop/uncategorized/beard-styling-shaping-cream-beard-oil-kit-with-shears-scissors-mustache-hair-care-tool-beard-styling-comb-brush-bag-grooming-set/,"Beard Styling Shaping Cream Beard Oil Kit with Shears Scissors Mustache Hair Care Tool Beard Styling Comb Brush Bag Grooming Set",2020/09/Beard-Styling-Shaping-Cream-Beard-Oil-Kit-with-Shears-Scissors-Mustache-Hair-Care-Tool-Beard-Styling.jpg
248111,https://linhcorner.com/shop/uncategorized/breylee-hair-growth-essential-oil-20ml-fast-powerful-hair-products-hair-care-prevent-baldness-anti-hair-loss-serum-nourishing/,"BREYLEE Hair Growth Essential Oil 20ml Fast Powerful Hair Products Hair Care Prevent Baldness Anti-Hair Loss Serum Nourishing",2020/09/BREYLEE-Hair-Growth-Essential-Oil-20ml-Fast-Powerful-Hair-Products-Hair-Care-Prevent-Baldness-Anti-Hair.jpg
248116,https://linhcorner.com/shop/uncategorized/lanbena-fast-ginger-hair-growth-essence-anti-hair-loss-essential-oil-liquid-treatment-repair-hair-serum-hair-loss-product-20ml/,"LANBENA Fast Ginger Hair Growth Essence Anti-Hair-Loss Essential Oil Liquid Treatment Repair Hair Serum Hair Loss Product 20ml",2020/09/LANBENA-Fast-Ginger-Hair-Growth-Essence-Anti-Hair-Loss-Essential-Oil-Liquid-Treatment-Repair-Hair-Serum.jpg
248131,https://linhcorner.com/shop/uncategorized/vibrantglamour-hair-growth-essence-essential-oil-liquid-spray-nourish-roots-thick-shiny-prevent-hair-loss-anti-hair-for-menwomen/,"VIBRANTGLAMOUR Hair Growth Essence Essential Oil Liquid Spray Nourish Roots Thick Shiny Prevent Hair Loss Anti-hair For Menwomen",2020/09/VIBRANTGLAMOUR-Hair-Growth-Essence-Essential-Oil-Liquid-Spray-Nourish-Roots-Thick-Shiny-Prevent-Hair-Loss-Anti.jpg
248155,https://linhcorner.com/shop/uncategorized/electric-led-laser-hair-growth-comb-hair-massage-brush-laser-hair-loss-stop-regrow-therapy-comb-infrared-scalp-massager-treatmen/,"Electric LED Laser Hair Growth Comb Hair Massage Brush Laser Hair Loss Stop Regrow Therapy Comb Infrared Scalp Massager Treatmen",2020/09/Electric-LED-Laser-Hair-Growth-Comb-Hair-Massage-Brush-Laser-Hair-Loss-Stop-Regrow-Therapy-Comb.jpg
248156,https://linhcorner.com/shop/uncategorized/hair-growth-care-treatment-infrared-massage-laser-comb-anti-loss-therapy-regrowth-restoration-grow-vibrator-brush/,"Hair Growth Care Treatment Infrared Massage Laser Comb Anti  Loss Therapy Regrowth Restoration Grow Vibrator Brush",2020/09/Hair-Growth-Care-Treatment-Infrared-Massage-Laser-Comb-Anti-Loss-Therapy-Regrowth-Restoration-Grow-Vibrator-Brush.jpg
248157,https://linhcorner.com/shop/uncategorized/omy-lady-anti-hair-loss-hair-growth-spray-essential-oil-liquid-for-men-women-dry-hair-regeneration-repair-care/,"OMY LADY Anti Hair Loss Hair Growth Spray Essential Oil Liquid For Men Women Dry Hair Regeneration Repair, Care",2020/09/OMY-LADY-Anti-Hair-Loss-Hair-Growth-Spray-Essential-Oil-Liquid-For-Men-Women-Dry-Hair-6.jpg
248165,https://linhcorner.com/shop/uncategorized/natural-organic-30ml-beard-wax-balm-mustache-care-grooming-hair-wax-balm-men-beard-conditioner-styling-moisturizing-smoothing/,"Natural Organic 30ml Beard Wax Balm Mustache Care Grooming Hair Wax Balm Men Beard Conditioner Styling Moisturizing Smoothing",2020/09/Natural-Organic-30ml-Beard-Wax-Balm-Mustache-Care-Grooming-Hair-Wax-Balm-Men-Beard-Conditioner-Styling.jpg
248166,https://linhcorner.com/shop/uncategorized/1pcs-men-beard-growth-pen-facial-hair-sideburn-mustache-repair-shape-regrowth-pen-beard-enhancer-nourish-shaping-anti-hair-loss/,"1pcs Men Beard Growth Pen Facial Hair Sideburn Mustache Repair Shape Regrowth Pen Beard Enhancer Nourish Shaping Anti Hair Loss",2020/09/1pcs-Men-Beard-Growth-Pen-Facial-Hair-Sideburn-Mustache-Repair-Shape-Regrowth-Pen-Beard-Enhancer-Nourish.jpg
248194,https://linhcorner.com/shop/uncategorized/2pcs-chemical-free-natural-conditioning-softener-beard-balm-and-wax-for-men-beard-growth-30g-1fl-oz-best-factory-price/,"2pcs Chemical Free Natural Conditioning Softener Beard Balm and Wax for Men Beard Growth 30G/1FL OZ Best Factory Price",2020/09/2pcs-Chemical-Free-Natural-Conditioning-Softener-Beard-Balm-and-Wax-for-Men-Beard-Growth-30G-1FL.jpg
248204,https://linhcorner.com/shop/uncategorized/6pcs-set-men-beard-kit-styling-tool-beard-oil-comb-beard-brushes-moisturizing-wax-cream-styling-scissors-beard-care-set/,"6pcs/set Men Beard Kit Styling Tool Beard Oil Comb Beard Brushes Moisturizing Wax Cream Styling Scissors Beard Care Set",2020/09/6pcs-set-Men-Beard-Kit-Styling-Tool-Beard-Oil-Comb-Beard-Brushes-Moisturizing-Wax-Cream-Styling.jpg
248206,https://linhcorner.com/shop/uncategorized/efero-hair-growth-serum-prevent-hair-loss-fast-growth-essence-natural-hair-growing-serum-restoration-essence-thicken-hair-care/,"EFERO Hair Growth Serum Prevent Hair Loss Fast Growth Essence Natural Hair Growing Serum Restoration Essence Thicken Hair Care",2020/09/EFERO-Hair-Growth-Serum-Prevent-Hair-Loss-Fast-Growth-Essence-Natural-Hair-Growing-Serum-Restoration-Essence.jpg
248211,https://linhcorner.com/shop/uncategorized/hair-care-hair-growth-essential-oils-essence-anti-preventing-hair-loss-products-beauty-dense-fast-original-hair-growth-serum/,"Hair Care Hair Growth Essential Oils Essence Anti Preventing Hair Loss Products Beauty Dense Fast Original Hair Growth Serum",2020/09/Hair-Care-Hair-Growth-Essential-Oils-Essence-Anti-Preventing-Hair-Loss-Products-Beauty-Dense-Fast-Original.jpg
248213,https://linhcorner.com/shop/uncategorized/breylee-hair-growth-essential-oil-2pcs-fast-powerful-hair-products-hair-care-prevent-baldness-anti-hair-loss-serum-increase-hair/,"BREYLEE Hair Growth Essential Oil 2PCS Fast Powerful Hair Products Hair Care Prevent Baldness Anti-Hair Loss Serum Increase Hair",2020/09/BREYLEE-Hair-Growth-Essential-Oil-2PCS-Fast-Powerful-Hair-Products-Hair-Care-Prevent-Baldness-Anti-Hair.jpg
248215,https://linhcorner.com/shop/uncategorized/lanbena-hair-growth-essence-spray-preventing-baldness-consolidating-labena-anti-hair-loss-lambena-against-stop-hair-loss-product/,"LANBENA Hair Growth Essence Spray Preventing Baldness Consolidating LABENA Anti Hair Loss LAMBENA Against Stop Hair-loss Product",2020/09/LANBENA-Hair-Growth-Essence-Spray-Preventing-Baldness-Consolidating-LABENA-Anti-Hair-Loss-LAMBENA-Against-Stop-Hair.jpg
248256,https://linhcorner.com/shop/uncategorized/5-10-20pcs-hair-building-fiber-powder-10-3g-25g-27-5g-toppik-spray-applicator-extension-nozzle-pump-for-hair-loss/,"5/10/20pcs Hair Building Fiber Powder 10.3g 25g 27.5g Toppik Spray Applicator Extension Nozzle Pump for Hair Loss",2020/09/5-10-20pcs-Hair-Building-Fiber-Powder-10-3g-25g-27-5g-Toppik-Spray-Applicator-Extension.jpg
248258,https://linhcorner.com/shop/uncategorized/omy-lady-anti-hair-loss-hair-growth-spray-essential-oil-liquid-for-men-women-dry-hair-regeneration-repair-hair-care-products/,"OMY LADY Anti Hair Loss Hair Growth Spray Essential Oil Liquid  For Men Women Dry Hair  Regeneration Repair  Hair Care Products",2020/09/OMY-LADY-Anti-Hair-Loss-Hair-Growth-Spray-Essential-Oil-Liquid-For-Men-Women-Dry-Hair-12.jpg
248269,https://linhcorner.com/shop/uncategorized/1pc-yiganerjing-ginger-extract-dense-hair-fast-sunburst-hair-growth-essence-restoration-hair-loss-liquid-serum-hair-care-oil/,"1pc YIGANERJING Ginger Extract Dense Hair Fast Sunburst Hair Growth Essence Restoration Hair Loss Liquid Serum Hair Care Oil",2020/09/1pc-YIGANERJING-Ginger-Extract-Dense-Hair-Fast-Sunburst-Hair-Growth-Essence-Restoration-Hair-Loss-Liquid-Serum.jpg
248272,https://linhcorner.com/shop/uncategorized/1pcs-fast-hair-growth-essence-anti-hair-loss-treatment-for-hair-growth-natural-thick-hair-care-products-for-men-women-20ml/,"1pcs Fast Hair Growth Essence Anti Hair Loss Treatment for Hair Growth Natural Thick Hair Care Products for Men Women 20ml",2020/09/1pcs-Fast-Hair-Growth-Essence-Anti-Hair-Loss-Treatment-for-Hair-Growth-Natural-Thick-Hair-Care.jpg
248275,https://linhcorner.com/shop/uncategorized/blue-zoo-organic-natural-beard-care-wax-balm-men-styling-moisturizing-smoothing-gentlemen-natural-beard-oil-balm-drape-smooth/,"Blue ZOO Organic Natural Beard Care Wax Balm Men Styling Moisturizing Smoothing Gentlemen Natural Beard Oil Balm Drape Smooth",2020/09/Blue-ZOO-Organic-Natural-Beard-Care-Wax-Balm-Men-Styling-Moisturizing-Smoothing-Gentlemen-Natural-Beard-Oil.jpg
248276,https://linhcorner.com/shop/uncategorized/lanbena-fast-powerful-hair-growth-essence-products-essential-oil-liquid-treatment-preventing-hair-loss-hair-growth-oil-hair-care/,"LANBENA Fast Powerful Hair Growth Essence Products Essential Oil Liquid Treatment Preventing Hair Loss Hair Growth Oil Hair Care",2020/09/LANBENA-Fast-Powerful-Hair-Growth-Essence-Products-Essential-Oil-Liquid-Treatment-Preventing-Hair-Loss-Hair-Growth.jpg
248298,https://linhcorner.com/shop/uncategorized/hair-growth-oil-ginger-ginseng-essence-anti-hair-loss-liquid-natural-plant-formula-hair-grow-care-beauty-styling-20ml-pc/,"Hair Growth Oil Ginger Ginseng Essence Anti Hair Loss Liquid Natural Plant Formula Hair Grow Care Beauty Styling 20ml/pc",2020/09/Hair-Growth-Oil-Ginger-Ginseng-Essence-Anti-Hair-Loss-Liquid-Natural-Plant-Formula-Hair-Grow-Care.jpg
248311,https://linhcorner.com/shop/uncategorized/20ml-fast-hair-growth-essence-oil-liquid-sprayer-natural-ginger-ginseng-essence-nourish-scalp-hair-loss-treatment-men-woman/,"20ml Fast Hair Growth Essence Oil Liquid Sprayer Natural Ginger Ginseng Essence Nourish Scalp Hair Loss Treatment Men Woman",2020/09/20ml-Fast-Hair-Growth-Essence-Oil-Liquid-Sprayer-Natural-Ginger-Ginseng-Essence-Nourish-Scalp-Hair-Loss.jpg
248316,https://linhcorner.com/shop/uncategorized/toppik-hair-fiber-powder-building-fibers-hair-spray-powder-full-hair-instantly-capilares-fiber-hold-powder-hair-growth-27-5g/,"Toppik hair fiber powder building fibers hair spray powder full hair instantly Capilares fiber hold powder hair growth 27.5g",2020/09/Toppik-hair-fiber-powder-building-fibers-hair-spray-powder-full-hair-instantly-Capilares-fiber-hold-powder.jpg
248322,https://linhcorner.com/shop/uncategorized/lanbena-20ml-fast-hair-growth-essence-spray-anti-baldness-nourish-root-hair-care-hair-loss-treatment-help-for-hair-growth/,"LANBENA 20mL Fast Hair Growth Essence Spray Anti Baldness Nourish Root Hair Care Hair Loss Treatment Help for hair Growth",2020/09/LANBENA-20mL-Fast-Hair-Growth-Essence-Spray-Anti-Baldness-Nourish-Root-Hair-Care-Hair-Loss-Treatment.jpg
248327,https://linhcorner.com/shop/uncategorized/laser-therapy-hair-growth-helmet-anti-hair-loss-device-machine-anti-hair-loss-promote-hair-regrowth-cap-fast-treatment-hat/,"Laser Therapy Hair Growth Helmet Anti Hair Loss Device Machine Anti Hair Loss Promote Hair Regrowth Cap Fast Treatment Hat",2020/09/Laser-Therapy-Hair-Growth-Helmet-Anti-Hair-Loss-Device-Machine-Anti-Hair-Loss-Promote-Hair-Regrowth.jpg
248335,https://linhcorner.com/shop/uncategorized/infrared-massage-comb-hair-comb-massage-equipment-comb-hair-growth-care-treatment-hair-brush-grow-laser-hair-loss-therapy/,"Infrared Massage Comb Hair Comb Massage Equipment Comb Hair Growth Care Treatment Hair Brush Grow Laser Hair Loss Therapy",2020/09/Infrared-Massage-Comb-Hair-Comb-Massage-Equipment-Comb-Hair-Growth-Care-Treatment-Hair-Brush-Grow-Laser.jpg
248345,https://linhcorner.com/shop/uncategorized/zhangguang-101-apply-medicine-liquid-apparatus-comb-10ml-apply-medicine-apparatus-easy-operate-zhanguang-101-tonic-applicators/,"ZHANGGUANG 101 Apply medicine liquid apparatus/comb 10ml/apply medicine apparatus easy operate zhanguang 101  tonic applicators",2020/09/ZHANGGUANG-101-Apply-medicine-liquid-apparatus-comb-10ml-apply-medicine-apparatus-easy-operate-zhanguang-101-tonic.jpg
248361,https://linhcorner.com/shop/uncategorized/lanbena-hair-growth-essence-hair-growth-products-essential-oil-liquid-treatment-preventing-hair-loss-hair-care-andrea-20ml-3pcs/,"LANBENA Hair Growth Essence Hair Growth Products Essential Oil Liquid Treatment Preventing Hair Loss Hair Care Andrea 20ml 3PCS",2020/09/LANBENA-Hair-Growth-Essence-Hair-Growth-Products-Essential-Oil-Liquid-Treatment-Preventing-Hair-Loss-Hair-Care.jpg
248366,https://linhcorner.com/shop/uncategorized/hair-growth-massage-comb-anti-hair-loss-product-scalp-massager-hair-brush-for-dropshipping-new-arrival/,"Hair Growth Massage Comb Anti Hair Loss Product Scalp Massager Hair Brush for Dropshipping New Arrival",2020/09/Hair-Growth-Massage-Comb-Anti-Hair-Loss-Product-Scalp-Massager-Hair-Brush-for-Dropshipping-New-Arrival.jpg
248395,https://linhcorner.com/shop/uncategorized/60ml-hair-loss-beard-growth-oil-spray-beard-grow-stimulator-100-natural-accelerate-beard-growth-oil-facial-hair-grower/,"60ml Hair Loss Beard Growth Oil Spray Beard Grow Stimulator 100% Natural Accelerate Beard Growth Oil Facial Hair Grower",2020/09/60ml-Hair-Loss-Beard-Growth-Oil-Spray-Beard-Grow-Stimulator-100-Natural-Accelerate-Beard-Growth-Oil.jpg
248397,https://linhcorner.com/shop/uncategorized/vibrant-glamour-hair-growth-essence-spray-preventing-baldness-consolidating-anti-hair-loss-nourish-roots-easy-to-carry-hair-care/,"Vibrant Glamour Hair Growth Essence Spray Preventing Baldness Consolidating Anti Hair Loss Nourish Roots Easy To Carry Hair Care",2020/09/Vibrant-Glamour-Hair-Growth-Essence-Spray-Preventing-Baldness-Consolidating-Anti-Hair-Loss-Nourish-Roots-Easy-To.jpg
248428,https://linhcorner.com/shop/uncategorized/fast-hair-growth-essence-natural-herbal-health-treatment-hair-loss-makes-hair-growth-longer-and-thicker-hair-care-products-60ml/,"Fast Hair Growth Essence Natural Herbal Health Treatment Hair Loss Makes Hair Growth Longer and Thicker Hair Care Products 60ml",2020/09/Fast-Hair-Growth-Essence-Natural-Herbal-Health-Treatment-Hair-Loss-Makes-Hair-Growth-Longer-and-Thicker.jpg
248433,https://linhcorner.com/shop/uncategorized/anti-hair-loss-shampoo-hair-loss-treatment-hair-thickner-fast-hair-growth-serum-hair-care-products-hair-growth-essence-serum-oil/,"Anti Hair Loss Shampoo Hair Loss Treatment Hair Thickner Fast Hair Growth Serum Hair Care Products Hair Growth Essence Serum Oil",2020/09/Anti-Hair-Loss-Shampoo-Hair-Loss-Treatment-Hair-Thickner-Fast-Hair-Growth-Serum-Hair-Care-Products.jpg
248434,https://linhcorner.com/shop/uncategorized/beard-growth-oil-hair-growth-agent-thickener-hair-beard-care-product-anti-hair-loss-tonic-grow-beard-treatment-hair-serum/,"Beard Growth Oil Hair Growth Agent Thickener Hair Beard Care Product Anti Hair Loss Tonic Grow Beard Treatment Hair Serum",2020/09/Beard-Growth-Oil-Hair-Growth-Agent-Thickener-Hair-Beard-Care-Product-Anti-Hair-Loss-Tonic-Grow.jpg
