249055,https://linhcorner.com/shop/uncategorized/putimi-powerful-hair-growth-essence-hair-loss-products-ginger-hair-treatment-prevent-hair-loss-product-growing-hair-serum-20ml/,"PUTIMI Powerful Hair Growth Essence Hair Loss Products Ginger Hair Treatment Prevent Hair Loss Product Growing Hair Serum 20ml",2020/09/PUTIMI-Powerful-Hair-Growth-Essence-Hair-Loss-Products-Ginger-Hair-Treatment-Prevent-Hair-Loss-Product-Growing.jpg
249058,https://linhcorner.com/shop/uncategorized/hair-growth-oil-for-fast-hair-growth-agent-against-hair-loss-remedy-treatment-hair-care-thickener-hair-growth-essential-serum/,"Hair Growth Oil for Fast Hair Growth Agent Against Hair Loss Remedy Treatment Hair Care Thickener Hair Growth Essential Serum",2020/09/Hair-Growth-Oil-for-Fast-Hair-Growth-Agent-Against-Hair-Loss-Remedy-Treatment-Hair-Care-Thickener.jpg
249061,https://linhcorner.com/shop/uncategorized/morocco-hair-growth-argan-oil-hair-care-essence-hair-loss-treatment-for-men-and-women-dry-and-damaged-hairs-nutrition-40ml/,"Morocco Hair Growth Argan Oil Hair Care Essence Hair Loss Treatment For Men And Women Dry and Damaged Hairs Nutrition 40ml",2020/09/Morocco-Hair-Growth-Argan-Oil-Hair-Care-Essence-Hair-Loss-Treatment-For-Men-And-Women-Dry.jpg
249072,https://linhcorner.com/shop/uncategorized/natural-ginger-hair-growth-essence-prevent-hair-loss-powerful-hair-care-serum-fast-growth-prevent-baldness-product/,"Natural Ginger Hair Growth Essence Prevent Hair Loss Powerful Hair Care Serum Fast Growth Prevent Baldness Product",2020/09/Natural-Ginger-Hair-Growth-Essence-Prevent-Hair-Loss-Powerful-Hair-Care-Serum-Fast-Growth-Prevent-Baldness.jpg
249079,https://linhcorner.com/shop/uncategorized/60ml-hair-growth-essence-nourishing-scalp-hair-loss-treatment-liquid-pilatory-n/,"60ml Hair Growth Essence Nourishing Scalp Hair Loss Treatment Liquid Pilatory n",2020/09/60ml-Hair-Growth-Essence-Nourishing-Scalp-Hair-Loss-Treatment-Liquid-Pilatory-n.jpg
249082,https://linhcorner.com/shop/uncategorized/hair-growth-essence-fast-hair-grow-restoration-pilatory-professional-keratin-hair-care-styling-anti-hair-loss-dense-sunburst/,"Hair Growth Essence Fast Hair Grow Restoration Pilatory Professional Keratin Hair Care Styling Anti Hair Loss Dense Sunburst",2020/09/Hair-Growth-Essence-Fast-Hair-Grow-Restoration-Pilatory-Professional-Keratin-Hair-Care-Styling-Anti-Hair-Loss.jpg
249087,https://linhcorner.com/shop/uncategorized/drs-540-derma-roller-hair-regrowth-beard-growth-roller-anti-hair-loss-products-random-color/,"DRS 540 Derma Roller Hair Regrowth Beard Growth Roller Anti Hair Loss Products Random color",2020/09/DRS-540-Derma-Roller-Hair-Regrowth-Beard-Growth-Roller-Anti-Hair-Loss-Products-Random-color.jpg
249118,https://linhcorner.com/shop/uncategorized/omy-lady-anti-hair-loss-hair-growth-spray-essential-oil-liquid-for-men-women-dry-hair-regeneration-repairhair-loss-products/,"OMY LADY Anti Hair Loss Hair Growth Spray Essential Oil Liquid  For Men Women Dry Hair  Regeneration Repair,Hair Loss Products",2020/09/OMY-LADY-Anti-Hair-Loss-Hair-Growth-Spray-Essential-Oil-Liquid-For-Men-Women-Dry-Hair-18.jpg
249122,https://linhcorner.com/shop/uncategorized/efero-fast-powerful-ginger-hair-growth-essence-hair-loss-products-for-hair-growth-serum-beard-growth-essence-health-care-20ml/,"EFERO Fast Powerful Ginger Hair Growth Essence Hair Loss Products For Hair Growth Serum Beard Growth Essence Health Care 20ml",2020/09/EFERO-Fast-Powerful-Ginger-Hair-Growth-Essence-Hair-Loss-Products-For-Hair-Growth-Serum-Beard-Growth.jpg
249123,https://linhcorner.com/shop/uncategorized/hair-growth-ginger-germinal-oil-fast-hair-growth-essential-oil-anti-hair-loss-product-alopecia-treatment-for-men-women-30ml/,"Hair Growth Ginger Germinal Oil Fast Hair Growth Essential Oil Anti-Hair Loss Product Alopecia Treatment for Men Women 30ml",2020/09/Hair-Growth-Ginger-Germinal-Oil-Fast-Hair-Growth-Essential-Oil-Anti-Hair-Loss-Product-Alopecia-Treatment.jpg
249126,https://linhcorner.com/shop/uncategorized/1pcs-men-hair-sideburn-beard-mustache-repair-shape-growth-pen-beard-growth-pen-shaping-styling-spray-tools/,"1pcs Men Hair Sideburn Beard Mustache Repair Shape Growth Pen Beard Growth Pen Shaping Styling Spray Tools",2020/09/1pcs-Men-Hair-Sideburn-Beard-Mustache-Repair-Shape-Growth-Pen-Beard-Growth-Pen-Shaping-Styling-Spray.jpg
249128,https://linhcorner.com/shop/uncategorized/fast-powerful-hair-growth-essence-essential-oils-essence-hair-loss-products-health-care-beauty-dense-hair-growth-serum-hair-care/,"Fast Powerful Hair Growth Essence Essential Oils Essence Hair Loss Products Health Care Beauty Dense Hair Growth Serum Hair Care",2020/09/Fast-Powerful-Hair-Growth-Essence-Essential-Oils-Essence-Hair-Loss-Products-Health-Care-Beauty-Dense-Hair.jpg
249134,https://linhcorner.com/shop/uncategorized/2pcs-fast-hair-growth-oil-anti-hair-loss-products-treatment-tonic-beard-oil-natural-liquid-body-hair-care-treatment-solutions/,"2pcs Fast Hair Growth Oil Anti Hair Loss Products Treatment Tonic Beard Oil Natural Liquid Body Hair Care Treatment Solutions",2020/09/2pcs-Fast-Hair-Growth-Oil-Anti-Hair-Loss-Products-Treatment-Tonic-Beard-Oil-Natural-Liquid-Body.jpg
249166,https://linhcorner.com/shop/uncategorized/haircube-hair-growth-spray-anti-hair-loss-for-fast-hair-growth-treatment-oil-hair-tonic-hair-care-serum-hair-loss-products/,"HAIRCUBE Hair Growth Spray Anti Hair Loss for Fast Hair Growth Treatment Oil Hair Tonic Hair Care Serum Hair Loss Products",2020/09/HAIRCUBE-Hair-Growth-Spray-Anti-Hair-Loss-for-Fast-Hair-Growth-Treatment-Oil-Hair-Tonic-Hair.jpg
249177,https://linhcorner.com/shop/uncategorized/hair-growth-essence-oil-spray-fast-hair-growth-natural-anti-hair-loss-treatment-hair-solution-hair-care-products-hair-tonic/,"Hair Growth Essence Oil Spray Fast Hair Growth Natural Anti Hair Loss Treatment Hair Solution Hair Care Products Hair Tonic",2020/09/Hair-Growth-Essence-Oil-Spray-Fast-Hair-Growth-Natural-Anti-Hair-Loss-Treatment-Hair-Solution-Hair.jpg
249180,https://linhcorner.com/shop/uncategorized/fast-hair-growth-spray-anti-hair-loss-products-dense-body-and-chest-hair-eyebrows-and-beard-oil-treatment-help-for-men-20-ml/,"Fast Hair Growth Spray Anti Hair Loss Products Dense Body and Chest Hair Eyebrows and Beard Oil Treatment Help for Men 20 ml",2020/09/Fast-Hair-Growth-Spray-Anti-Hair-Loss-Products-Dense-Body-and-Chest-Hair-Eyebrows-and-Beard.jpg
249187,https://linhcorner.com/shop/uncategorized/hair-growth-treatment-spray-anti-hair-loss-essence-serum-for-fast-thick-hair-tonic-eyebrows-natural-healthy-hair-loss-treatment/,"Hair Growth Treatment Spray Anti Hair Loss Essence Serum for Fast Thick Hair Tonic Eyebrows Natural Healthy Hair Loss Treatment",2020/09/Hair-Growth-Treatment-Spray-Anti-Hair-Loss-Essence-Serum-for-Fast-Thick-Hair-Tonic-Eyebrows-Natural.jpg
249194,https://linhcorner.com/shop/uncategorized/3pcs-anti-hair-loss-products-hair-growth-spray-essential-serum-for-men-women-hair-growth-oil-natural-hair-care-essential-oil/,"3Pcs Anti Hair Loss Products Hair Growth Spray Essential Serum for Men Women Hair Growth Oil Natural Hair Care Essential Oil",2020/09/3Pcs-Anti-Hair-Loss-Products-Hair-Growth-Spray-Essential-Serum-for-Men-Women-Hair-Growth-Oil.jpg
249200,https://linhcorner.com/shop/uncategorized/haircube-hair-rapid-growth-essence-oil-anti-hair-loss-dense-hair-repair-damage-hair-serum-natural-organic-hair-care-spray/,"HAIRCUBE Hair Rapid Growth Essence Oil Anti Hair Loss Dense Hair Repair Damage Hair Serum Natural Organic Hair Care Spray",2020/09/HAIRCUBE-Hair-Rapid-Growth-Essence-Oil-Anti-Hair-Loss-Dense-Hair-Repair-Damage-Hair-Serum-Natural.jpg
249241,https://linhcorner.com/shop/uncategorized/haircube-beard-growth-essential-oil-natural-organic-beard-oil-hair-loss-product-for-men-beard-grow-nourishing-beard-care/,"HAIRCUBE Beard Growth Essential Oil Natural Organic Beard Oil Hair loss Product For Men Beard Grow Nourishing Beard Care",2020/09/HAIRCUBE-Beard-Growth-Essential-Oil-Natural-Organic-Beard-Oil-Hair-loss-Product-For-Men-Beard-Grow.jpg
249243,https://linhcorner.com/shop/uncategorized/efero-fast-powerful-ginger-hair-growth-essence-hair-loss-products-for-hair-growth-beard-growth-oil-essential-health-care-20ml/,"EFERO Fast Powerful Ginger Hair Growth Essence Hair Loss Products For Hair Growth Beard Growth Oil Essential Health Care 20ml",2020/09/EFERO-Fast-Powerful-Ginger-Hair-Growth-Essence-Hair-Loss-Products-For-Hair-Growth-Beard-Growth-Oil.jpg
249248,https://linhcorner.com/shop/uncategorized/hair-rapid-growth-spray-for-mens-body-and-chest-and-eyebrows-and-beard-thick-hair-treatment-loss-product-60ml-and-20ml/,"Hair Rapid Growth Spray  for Men's Body and Chest and Eyebrows and Beard Thick Hair Treatment Loss Product 60ml and 20ml",2020/09/Hair-Rapid-Growth-Spray-for-Men-s-Body-and-Chest-and-Eyebrows-and-Beard-Thick-Hair.jpg
249259,https://linhcorner.com/shop/uncategorized/20ml-powerful-ginger-hair-growth-essence-against-hair-loss-product-thicker-preventing-baldness-repair-demaged-hair-serum/,"20ml Powerful Ginger Hair Growth Essence Against Hair Loss Product Thicker Preventing Baldness Repair Demaged Hair Serum",2020/09/20ml-Powerful-Ginger-Hair-Growth-Essence-Against-Hair-Loss-Product-Thicker-Preventing-Baldness-Repair-Demaged-Hair.jpg
249269,https://linhcorner.com/shop/uncategorized/fast-hair-growth-essential-oil-anti-prevent-hair-lose-liquid-damaged-hair-repair-growing-for-women-men-hair-care-products/,"Fast Hair Growth Essential Oil Anti Prevent Hair Lose Liquid Damaged Hair Repair Growing For Women Men Hair Care Products",2020/09/Fast-Hair-Growth-Essential-Oil-Anti-Prevent-Hair-Lose-Liquid-Damaged-Hair-Repair-Growing-For-Women.jpg
249285,https://linhcorner.com/shop/uncategorized/2pcs-anti-hair-loss-essence-oil-hair-growth-treatment-fast-thick-hair-eyebrows-support-natural-healthy-hair-treatment-hair-care/,"2pcs Anti Hair Loss Essence Oil Hair Growth Treatment  Fast Thick Hair Eyebrows Support Natural Healthy Hair Treatment Hair Care",2020/09/2pcs-Anti-Hair-Loss-Essence-Oil-Hair-Growth-Treatment-Fast-Thick-Hair-Eyebrows-Support-Natural-Healthy.jpg
249296,https://linhcorner.com/shop/uncategorized/hair-growth-serum-essential-oil-anti-hair-loss-treament-damage-hair-repair-treatment-dense-fast-hair-growth-hair-tonic/,"Hair Growth Serum Essential Oil Anti Hair Loss Treament Damage Hair Repair Treatment Dense Fast Hair Growth Hair Tonic",2020/09/Hair-Growth-Serum-Essential-Oil-Anti-Hair-Loss-Treament-Damage-Hair-Repair-Treatment-Dense-Fast-Hair.jpg
249304,https://linhcorner.com/shop/uncategorized/organic-beard-oil-hair-loss-product-beard-growth-oil-for-growth-men-beard-grow-nourishing-enhancer-moustache-beard-care/,"Organic Beard Oil Hair loss Product Beard Growth Oil For Growth Men Beard Grow Nourishing Enhancer Moustache Beard Care",2020/09/Organic-Beard-Oil-Hair-loss-Product-Beard-Growth-Oil-For-Growth-Men-Beard-Grow-Nourishing-Enhancer.jpg
249324,https://linhcorner.com/shop/uncategorized/2pcs-hair-growth-oil-essence-for-hair-growth-serum-thickener-hair-loss-product-100-natural-extract-liquid-oil-fast-hair-growth/,"2Pcs Hair Growth Oil Essence for Hair Growth Serum Thickener Hair Loss Product 100% Natural Extract Liquid Oil Fast Hair Growth",2020/09/2Pcs-Hair-Growth-Oil-Essence-for-Hair-Growth-Serum-Thickener-Hair-Loss-Product-100-Natural-Extract.jpg
249334,https://linhcorner.com/shop/uncategorized/hair-growth-essence-oil-hair-growth-serum-anti-hair-loss-treatment-solution-hair-care-hair-loss-produrts-hair-tonic/,"Hair Growth Essence Oil Hair Growth Serum Anti Hair Loss Treatment Solution Hair Care Hair Loss Produrts Hair Tonic",2020/09/Hair-Growth-Essence-Oil-Hair-Growth-Serum-Anti-Hair-Loss-Treatment-Solution-Hair-Care-Hair-Loss.jpg
249338,https://linhcorner.com/shop/uncategorized/hair-loss-products-for-hair-regrowth-serum-liquid-hair-care-essential-oil-herb-natural-care-treatment-hair-salon/,"Hair Loss Products for Hair Regrowth Serum Liquid Hair Care Essential Oil Herb Natural Care Treatment Hair Salon",2020/09/Hair-Loss-Products-for-Hair-Regrowth-Serum-Liquid-Hair-Care-Essential-Oil-Herb-Natural-Care-Treatment.jpg
249349,https://linhcorner.com/shop/uncategorized/fast-hair-growth-essence-oil-hair-treatment-anti-hair-loss-help-for-men-women-hair-growth-hair-care-product-liquid-30ml/,"Fast Hair Growth Essence Oil Hair Treatment Anti Hair Loss Help for Men Women Hair Growth Hair Care Product Liquid 30ml",2020/09/Fast-Hair-Growth-Essence-Oil-Hair-Treatment-Anti-Hair-Loss-Help-for-Men-Women-Hair-Growth.jpg
249359,https://linhcorner.com/shop/uncategorized/hair-growth-serum-essence-oil-for-fast-hair-growth-anti-hair-loss-treatment-ginger-hair-loss-products-for-women-men-hair-tonic/,"Hair Growth Serum Essence Oil for Fast Hair Growth Anti Hair Loss Treatment Ginger Hair Loss Products for Women Men Hair Tonic",2020/09/Hair-Growth-Serum-Essence-Oil-for-Fast-Hair-Growth-Anti-Hair-Loss-Treatment-Ginger-Hair-Loss.jpg
249363,https://linhcorner.com/shop/uncategorized/3pcs-anti-hair-loss-essence-hair-growth-treatment-oil-fast-thick-hair-eyebrows-support-natural-healthy-hair-treatment-for-women/,"3Pcs Anti Hair Loss Essence Hair Growth Treatment Oil Fast Thick Hair Eyebrows Support Natural Healthy Hair Treatment for Women",2020/09/3Pcs-Anti-Hair-Loss-Essence-Hair-Growth-Treatment-Oil-Fast-Thick-Hair-Eyebrows-Support-Natural-Healthy.jpg
249373,https://linhcorner.com/shop/uncategorized/hair-care-hair-growth-essential-oils-essence-grow-hair-fluid-prevent-hair-loss-health-care-beauty-dense-hair-growth-serum/,"Hair Care Hair Growth Essential Oils Essence Grow Hair Fluid Prevent Hair Loss Health Care Beauty Dense Hair Growth Serum",2020/09/Hair-Care-Hair-Growth-Essential-Oils-Essence-Grow-Hair-Fluid-Prevent-Hair-Loss-Health-Care-Beauty.jpg
249380,https://linhcorner.com/shop/uncategorized/haircube-hair-growth-spray-anti-hair-loss-products-for-fast-hair-growth-treatment-oil-hair-tonic-hair-care-serum-anti-hair-loss/,"HAIRCUBE Hair Growth Spray Anti Hair Loss Products for Fast Hair Growth Treatment Oil Hair Tonic Hair Care Serum Anti Hair Loss",2020/09/HAIRCUBE-Hair-Growth-Spray-Anti-Hair-Loss-Products-for-Fast-Hair-Growth-Treatment-Oil-Hair-Tonic.jpg
249402,https://linhcorner.com/shop/uncategorized/anti-hair-loss-nourishing-essence-spray-natural-extract-relieve-hair-loss-and-strongen-roots-nourish-scalp-thicken-hair-60ml/,"Anti Hair Loss Nourishing Essence Spray Natural Extract Relieve Hair Loss and Strongen Roots Nourish Scalp Thicken Hair 60ml",2020/09/Anti-Hair-Loss-Nourishing-Essence-Spray-Natural-Extract-Relieve-Hair-Loss-and-Strongen-Roots-Nourish-Scalp.jpg
249407,https://linhcorner.com/shop/uncategorized/hair-growth-serum-essence-oil-anti-hair-loss-treatment-for-hair-growth-beard-triple-ball-massager-hair-care-hair-regroth-tonic/,"Hair Growth Serum Essence Oil Anti Hair Loss Treatment for Hair Growth Beard Triple Ball Massager Hair Care Hair Regroth Tonic",2020/09/Hair-Growth-Serum-Essence-Oil-Anti-Hair-Loss-Treatment-for-Hair-Growth-Beard-Triple-Ball-Massager.jpg
249410,https://linhcorner.com/shop/uncategorized/3-pcs-haircub-hair-growth-spray-for-fast-hair-growth-anti-hair-loss-treatment-hair-care-tonic-thickener-hair-growth-essence-oil/,"3 Pcs HAIRCUB Hair Growth Spray for Fast Hair Growth Anti Hair Loss Treatment Hair Care Tonic Thickener Hair Growth Essence Oil",2020/09/3-Pcs-HAIRCUB-Hair-Growth-Spray-for-Fast-Hair-Growth-Anti-Hair-Loss-Treatment-Hair-Care.jpg
249412,https://linhcorner.com/shop/uncategorized/hair-growth-essence-essential-oil-natural-herbal-for-hair-growth-treatment-prevent-anti-hair-loss-hair-care-products-hair-tonic/,"Hair Growth Essence Essential Oil Natural Herbal for Hair Growth Treatment Prevent Anti Hair Loss Hair Care Products Hair Tonic",2020/09/Hair-Growth-Essence-Essential-Oil-Natural-Herbal-for-Hair-Growth-Treatment-Prevent-Anti-Hair-Loss-Hair.jpg
249416,https://linhcorner.com/shop/uncategorized/7-days-ginger-hair-growth-serum-germinal-hair-growth-essence-oil-hair-loss-treatement-growth-hair-for-thin-hair-men-women-30ml/,"7 Days Ginger Hair Growth Serum Germinal Hair Growth Essence Oil Hair Loss Treatement Growth Hair for Thin hair Men Women 30ML",2020/09/7-Days-Ginger-Hair-Growth-Serum-Germinal-Hair-Growth-Essence-Oil-Hair-Loss-Treatement-Growth-Hair.jpg
249454,https://linhcorner.com/shop/uncategorized/hair-essence-oil-anti-hair-loss-products-for-fast-hair-growth-treatment-hair-care-products-for-women-men-hair-tonic-hair-care/,"Hair Essence Oil Anti Hair Loss Products for Fast Hair Growth Treatment Hair Care Products for Women Men Hair Tonic Hair Care",2020/09/Hair-Essence-Oil-Anti-Hair-Loss-Products-for-Fast-Hair-Growth-Treatment-Hair-Care-Products-for.jpg
249462,https://linhcorner.com/shop/uncategorized/beard-growth-enhancer-thickener-beard-essential-oil-for-men-beard-growth-anti-hair-loss-products-for-moustache-fast-grow-beard/,"Beard Growth Enhancer Thickener Beard Essential Oil for Men Beard Growth Anti Hair Loss Products for Moustache Fast Grow Beard",2020/09/Beard-Growth-Enhancer-Thickener-Beard-Essential-Oil-for-Men-Beard-Growth-Anti-Hair-Loss-Products-for.jpg
249472,https://linhcorner.com/shop/uncategorized/3-pieces-hair-essence-anti-hair-loss-treatment-hair-growth-essential-oil-hair-care-fast-powerful-hair-scalp-repair-30ml/,"3 Pieces Hair Essence Anti-Hair Loss Treatment Hair Growth Essential Oil Hair Care Fast Powerful Hair Scalp Repair 30ml",2020/09/3-Pieces-Hair-Essence-Anti-Hair-Loss-Treatment-Hair-Growth-Essential-Oil-Hair-Care-Fast-Powerful.jpg
249473,https://linhcorner.com/shop/uncategorized/2pcs-hair-loss-treatment-for-help-hair-growth-essence-to-smooth-coarse-repair-hair-root-and-scalp-hair-care-solution-products/,"2pcs Hair Loss Treatment for Help Hair Growth Essence to Smooth Coarse Repair Hair Root and Scalp Hair Care Solution Products",2020/09/2pcs-Hair-Loss-Treatment-for-Help-Hair-Growth-Essence-to-Smooth-Coarse-Repair-Hair-Root-and.jpg
249479,https://linhcorner.com/shop/uncategorized/putimi-powerful-hair-growth-serum-essence-prevent-hair-loss-products-longer-thicker-hair-anti-baldness-hair-growth-essence/,"Putimi Powerful Hair Growth Serum Essence Prevent Hair Loss Products Longer Thicker Hair Anti Baldness Hair Growth Essence",2020/09/Putimi-Powerful-Hair-Growth-Serum-Essence-Prevent-Hair-Loss-Products-Longer-Thicker-Hair-Anti-Baldness-Hair.jpg
249483,https://linhcorner.com/shop/uncategorized/hair-growth-products-ginger-oil-hair-growth-faster-grow-hair-ginger-shampoo-stop-hair-loss-plant-treatment/,"Hair Growth Products Ginger Oil Hair Growth Faster Grow Hair Ginger Shampoo Stop Hair Loss Plant Treatment",2020/09/Hair-Growth-Products-Ginger-Oil-Hair-Growth-Faster-Grow-Hair-Ginger-Shampoo-Stop-Hair-Loss-Plant.jpg
249499,https://linhcorner.com/shop/uncategorized/2pcs-hair-growth-oil-treatment-anti-hair-loss-men-beard-growth-oil-topical-solutions-repair-damage-hair-roots-hair-care-products/,"2pcs Hair Growth Oil Treatment Anti Hair Loss Men Beard Growth Oil Topical Solutions Repair Damage Hair Roots Hair Care Products",2020/09/2pcs-Hair-Growth-Oil-Treatment-Anti-Hair-Loss-Men-Beard-Growth-Oil-Topical-Solutions-Repair-Damage.jpg
