248436,https://linhcorner.com/shop/uncategorized/2pcs-haircube-anti-hair-loss-products-hair-growth-essential-oil-liquid-spray-dense-nourish-hair-roots-hair-care-repair-growing/,"2Pcs HAIRCUBE Anti Hair Loss Products Hair Growth Essential Oil Liquid Spray Dense Nourish Hair Roots Hair Care Repair Growing",2020/09/2Pcs-HAIRCUBE-Anti-Hair-Loss-Products-Hair-Growth-Essential-Oil-Liquid-Spray-Dense-Nourish-Hair-Roots.jpg
248438,https://linhcorner.com/shop/uncategorized/haircube-hair-growth-serum-spray-treatment-hair-care-products-for-hair-growth-oil-natural-organic-hair-tonic-beauty-products/,"HAIRCUBE Hair Growth Serum Spray Treatment Hair Care Products for Hair Growth Oil Natural Organic Hair Tonic Beauty Products",2020/09/HAIRCUBE-Hair-Growth-Serum-Spray-Treatment-Hair-Care-Products-for-Hair-Growth-Oil-Natural-Organic-Hair.jpg
248440,https://linhcorner.com/shop/uncategorized/haircube-3pcs-fast-hair-growth-essence-anti-hair-loss-treatment-hair-care-products-dense-thick-nourish-hair-roots-regrowth-spray/,"HAIRCUBE 3Pcs Fast Hair Growth Essence Anti Hair Loss Treatment hair care products Dense Thick Nourish Hair Roots Regrowth spray",2020/09/HAIRCUBE-3Pcs-Fast-Hair-Growth-Essence-Anti-Hair-Loss-Treatment-hair-care-products-Dense-Thick-Nourish.jpg
248491,https://linhcorner.com/shop/uncategorized/hair-growth-essence-control-oil-nourishing-hair-help-growth-hair-treatment-for-anti-hair-loss-sets-natural-herbal-oil-hair-care/,"Hair Growth Essence Control Oil Nourishing Hair Help Growth Hair Treatment for Anti hair Loss Sets Natural Herbal Oil Hair Care",2020/09/Hair-Growth-Essence-Control-Oil-Nourishing-Hair-Help-Growth-Hair-Treatment-for-Anti-hair-Loss-Sets.jpg
248495,https://linhcorner.com/shop/uncategorized/putimi-natural-hair-growth-essence-anti-hair-loss-serum-health-care-dense-beard-hair-growth-serum-haircare-regrowth-treatment/,"Putimi Natural Hair Growth Essence Anti Hair Loss Serum Health Care Dense Beard Hair Growth Serum HairCare Regrowth Treatment",2020/09/Putimi-Natural-Hair-Growth-Essence-Anti-Hair-Loss-Serum-Health-Care-Dense-Beard-Hair-Growth-Serum.jpg
248500,https://linhcorner.com/shop/uncategorized/omy-lady-natural-beard-oil-balm-moustache-styling-beeswax-moisturizing-smoothing-gentlemen-beard-balm-organic-men-grooming/,"OMY LADY Natural Beard Oil Balm Moustache Styling Beeswax Moisturizing Smoothing Gentlemen Beard Balm Organic Men Grooming",2020/09/OMY-LADY-Natural-Beard-Oil-Balm-Moustache-Styling-Beeswax-Moisturizing-Smoothing-Gentlemen-Beard-Balm-Organic-Men.jpg
248505,https://linhcorner.com/shop/uncategorized/hair-building-fiber-spray-applicator-sprayer-nozzle-pump-hair-loss-products-hair-sprays-for-hair-extensions-hair-fiber-sprays/,"Hair Building Fiber Spray Applicator Sprayer Nozzle Pump Hair Loss Products Hair Sprays for Hair Extensions Hair Fiber Sprays",2020/09/Hair-Building-Fiber-Spray-Applicator-Sprayer-Nozzle-Pump-Hair-Loss-Products-Hair-Sprays-for-Hair-Extensions.jpg
248510,https://linhcorner.com/shop/uncategorized/2-boxes-macadamia-powerful-hair-growth-oil-essence-treatment-hair-loss-herbal-for-dry-hair-care-liquid-natural-pure-nut-oils/,"2 Boxes Macadamia Powerful Hair Growth Oil Essence Treatment Hair Loss Herbal For Dry Hair Care Liquid Natural Pure Nut Oils",2020/09/2-Boxes-Macadamia-Powerful-Hair-Growth-Oil-Essence-Treatment-Hair-Loss-Herbal-For-Dry-Hair-Care.jpg
248519,https://linhcorner.com/shop/uncategorized/3pcs-lot-purple-hair-growth-essential-oils-essence-anti-hair-loss-treatment-fast-hair-growth-liquid-dense-beauty-hair-care/,"3pcs/lot PURPLE Hair Growth Essential Oils Essence Anti Hair Loss Treatment Fast Hair Growth Liquid Dense Beauty Hair Care",2020/09/3pcs-lot-PURPLE-Hair-Growth-Essential-Oils-Essence-Anti-Hair-Loss-Treatment-Fast-Hair-Growth-Liquid.jpg
248545,https://linhcorner.com/shop/uncategorized/dexe-hair-shampoo-anti-hair-loss-hair-growth-chinese-herbal-product-thick-hair-care-treatment-men-women-us-do-dropshipping/,"Dexe Hair Shampoo Anti-hair Loss Hair Growth Chinese Herbal Product Thick Hair Care Treatment Men Women US Do Dropshipping",2020/09/Dexe-Hair-Shampoo-Anti-hair-Loss-Hair-Growth-Chinese-Herbal-Product-Thick-Hair-Care-Treatment-Men.jpg
248561,https://linhcorner.com/shop/uncategorized/76-118pcs-lamp-beads-therapy-hair-loss-treatment-instrument-oil-control-adjustable-hair-growth-hat-cap-hair-care-products/,"76/118pcs Lamp Beads Therapy Hair Loss Treatment Instrument Oil Control Adjustable Hair Growth Hat Cap Hair Care Products",2020/09/76-118pcs-Lamp-Beads-Therapy-Hair-Loss-Treatment-Instrument-Oil-Control-Adjustable-Hair-Growth-Hat-Cap.jpg
248566,https://linhcorner.com/shop/uncategorized/hair-care-hair-growth-products-essential-oils-natural-effects-grow-hair-loss-essence-health-care-liquid-original-authentic-100/,"Hair Care Hair Growth Products Essential Oils Natural Effects Grow Hair Loss Essence Health Care Liquid Original Authentic 100%",2020/09/Hair-Care-Hair-Growth-Products-Essential-Oils-Natural-Effects-Grow-Hair-Loss-Essence-Health-Care-Liquid.jpg
248571,https://linhcorner.com/shop/uncategorized/hair-building-fiber-spray-nozzle-pump-hair-loss-products-hair-sprays-for-hair-extensions-hair-fiber-sprays-applicator-sprayer/,"Hair Building Fiber Spray Nozzle Pump Hair Loss Products Hair Sprays for Hair Extensions Hair Fiber Sprays Applicator Sprayer",2020/09/Hair-Building-Fiber-Spray-Nozzle-Pump-Hair-Loss-Products-Hair-Sprays-for-Hair-Extensions-Hair-Fiber.jpg
248577,https://linhcorner.com/shop/uncategorized/efero-hair-growth-essence-hair-loss-serum-essential-oils-dense-hair-growth-serum-haircare-prevent-baldness-anti-hair-loss-serum/,"EFERO Hair Growth Essence Hair Loss Serum Essential Oils Dense Hair Growth Serum HairCare Prevent Baldness Anti-Hair Loss Serum",2020/09/EFERO-Hair-Growth-Essence-Hair-Loss-Serum-Essential-Oils-Dense-Hair-Growth-Serum-HairCare-Prevent-Baldness.jpg
248583,https://linhcorner.com/shop/uncategorized/2pcs-factory-price-hot-new-30g-beard-balm-and-moustache-beard-brush-for-men-daily-beard-styling/,"2pcs Factory Price Hot New 30g Beard Balm and Moustache Beard Brush For Men Daily Beard Styling",2020/09/2pcs-Factory-Price-Hot-New-30g-Beard-Balm-and-Moustache-Beard-Brush-For-Men-Daily-Beard.jpg
248601,https://linhcorner.com/shop/uncategorized/dimollaure-hair-growth-anti-hair-loss-liquid-10ml-dense-hair-fast-sunburst-hair-growth-grow-alopecia-treatment-oil-essence/,"Dimollaure Hair Growth anti Hair Loss Liquid 10ml dense hair fast sunburst hair growth grow alopecia Treatment oil essence",2020/09/Dimollaure-Hair-Growth-anti-Hair-Loss-Liquid-10ml-dense-hair-fast-sunburst-hair-growth-grow-alopecia.jpg
248607,https://linhcorner.com/shop/uncategorized/2pcs-fast-hair-growth-essence-oil-grape-keratin-hair-loss-treatment-liquid-help-for-dry-and-damaged-hairs-nutrition-care/,"2pcs Fast Hair Growth Essence Oil Grape Keratin Hair Loss Treatment Liquid Help for Dry and Damaged Hairs Nutrition Care",2020/09/2pcs-Fast-Hair-Growth-Essence-Oil-Grape-Keratin-Hair-Loss-Treatment-Liquid-Help-for-Dry-and.jpg
248620,https://linhcorner.com/shop/uncategorized/1-2pcs-high-quality-20ml-bottle-hair-growth-essence-effective-hair-care-serum-natural-extract-beauty-dense-hair-growth-serum/,"1/2pcs High Quality 20ml/bottle Hair Growth Essence Effective Hair Care Serum Natural Extract Beauty Dense Hair Growth Serum",2020/09/1-2pcs-High-Quality-20ml-bottle-Hair-Growth-Essence-Effective-Hair-Care-Serum-Natural-Extract-Beauty.jpg
248623,https://linhcorner.com/shop/uncategorized/omy-lady-anti-hair-loss-hair-growth-spray-ginger-anti-hair-loss-shampoo-60ml-natural-hair-essential-oilshampoo-brush/,"OMY LADY Anti Hair Loss Hair Growth Spray +Ginger Anti Hair Loss Shampoo +60ML Natural Hair Essential Oil+shampoo brush",2020/09/OMY-LADY-Anti-Hair-Loss-Hair-Growth-Spray-Ginger-Anti-Hair-Loss-Shampoo-60ML-Natural-Hair.jpg
248626,https://linhcorner.com/shop/uncategorized/efero-20ml-hair-growth-essence-prevent-hair-loss-treatment-ginger-grow-hair-serum-dense-gentle-hair-growth-serum-health-care/,"EFERO 20ml Hair Growth Essence Prevent Hair Loss Treatment Ginger Grow Hair Serum Dense Gentle Hair Growth Serum Health Care",2020/09/EFERO-20ml-Hair-Growth-Essence-Prevent-Hair-Loss-Treatment-Ginger-Grow-Hair-Serum-Dense-Gentle-Hair.jpg
248645,https://linhcorner.com/shop/uncategorized/laser-comb-hair-growth-product-tonic-care-hair-fiber-loss-keratin-hair-scalp-treatment-massage-brush-stop-hair-loss-dropshipping/,"Laser Comb Hair Growth Product Tonic Care Hair Fiber Loss Keratin Hair Scalp Treatment Massage Brush Stop Hair Loss Dropshipping",2020/09/Laser-Comb-Hair-Growth-Product-Tonic-Care-Hair-Fiber-Loss-Keratin-Hair-Scalp-Treatment-Massage-Brush.jpg
248649,https://linhcorner.com/shop/uncategorized/desktop-freeze-hair-care-instrument-hair-waxing-perm-dye-repair-hairdressing-blue-light-calming-hair-care-splint-machine-au-plug/,"Desktop Freeze Hair Care Instrument Hair Waxing Perm Dye Repair Hairdressing Blue Light Calming Hair Care Splint Machine AU Plug",2020/09/Desktop-Freeze-Hair-Care-Instrument-Hair-Waxing-Perm-Dye-Repair-Hairdressing-Blue-Light-Calming-Hair-Care.jpg
248662,https://linhcorner.com/shop/uncategorized/set-of-hair-building-fibers-9-colors-hair-full-hair-instantly-fibras-capilares-fiber-hold-spray-powder-hair-regrowth-serum-kit/,"Set of Hair Building Fibers 9 Colors Hair Full Hair Instantly Fibras Capilares fiber hold spray powder hair regrowth serum Kit",2020/09/Set-of-Hair-Building-Fibers-9-Colors-Hair-Full-Hair-Instantly-Fibras-Capilares-fiber-hold-spray.jpg
248673,https://linhcorner.com/shop/uncategorized/76-152-276pcs-lamp-bead-hair-growth-hat-cap-oil-control-adjustable-hair-growth-therapy-decive-cap-for-men-women-hair-care/,"76/152/276pcs Lamp Bead Hair Growth Hat Cap Oil-control Adjustable Hair Growth Therapy Decive Cap for Men Women Hair Care",2020/09/76-152-276pcs-Lamp-Bead-Hair-Growth-Hat-Cap-Oil-control-Adjustable-Hair-Growth-Therapy-Decive.jpg
248682,https://linhcorner.com/shop/uncategorized/omy-lady-hair-care-hair-growth-essential-oil-essence-original-authentic-100-hair-loss-liquid-body-care-beauty-dense-hair-growth/,"OMY LADY Hair Care Hair Growth Essential Oil Essence Original Authentic 100% Hair Loss Liquid BODY Care Beauty Dense Hair Growth",2020/09/OMY-LADY-Hair-Care-Hair-Growth-Essential-Oil-Essence-Original-Authentic-100-Hair-Loss-Liquid-BODY.jpg
248690,https://linhcorner.com/shop/uncategorized/haircube-hair-growth-spray-essential-oil-liquid-anti-hair-loss-essence-serum-for-hair-growth-oil-natural-hair-care-products/,"HAIRCUBE Hair Growth Spray Essential Oil Liquid Anti Hair Loss Essence Serum for Hair Growth Oil Natural Hair Care Products",2020/09/HAIRCUBE-Hair-Growth-Spray-Essential-Oil-Liquid-Anti-Hair-Loss-Essence-Serum-for-Hair-Growth-Oil.jpg
248696,https://linhcorner.com/shop/uncategorized/ginger-fast-hair-growth-essence-oils-anti-hair-loss-treatment-hair-growth-serum-growing-hair-care-serum-restoration-products/,"Ginger Fast Hair Growth Essence Oils Anti Hair Loss Treatment Hair Growth Serum Growing Hair Care Serum Restoration Products",2020/09/Ginger-Fast-Hair-Growth-Essence-Oils-Anti-Hair-Loss-Treatment-Hair-Growth-Serum-Growing-Hair-Care.jpg
248725,https://linhcorner.com/shop/uncategorized/micro-needle-540-derma-roller-0-25mm-titanium-beard-roller-for-hair-regrowth-beard-growth-anti-hair-loss-skin-care-treatment/,"Micro Needle 540 Derma Roller 0.25mm Titanium Beard Roller for Hair Regrowth Beard Growth Anti-Hair Loss Skin Care Treatment",2020/09/Micro-Needle-540-Derma-Roller-0-25mm-Titanium-Beard-Roller-for-Hair-Regrowth-Beard-Growth-Anti.jpg
248738,https://linhcorner.com/shop/uncategorized/portable-hair-building-fiber-powder-10-3g-25g-27-5g-toppik-spray-applicator-extension-nozzle-pump-for-hair-loss/,"Portable Hair Building Fiber Powder 10.3g 25g 27.5g Toppik Spray Applicator Extension Nozzle Pump for Hair Loss",2020/09/Portable-Hair-Building-Fiber-Powder-10-3g-25g-27-5g-Toppik-Spray-Applicator-Extension-Nozzle-Pump.jpg
248742,https://linhcorner.com/shop/uncategorized/lanbena-hair-growth-essence-spray-product-preventing-baldness-consolidating-anti-hair-loss-nourish-roots-easy-to-carry-hair-care/,"LANBENA Hair Growth Essence Spray Product Preventing Baldness Consolidating Anti Hair Loss Nourish Roots Easy To Carry Hair Care",2020/09/LANBENA-Hair-Growth-Essence-Spray-Product-Preventing-Baldness-Consolidating-Anti-Hair-Loss-Nourish-Roots-Easy-To.jpg
248751,https://linhcorner.com/shop/uncategorized/efero-3pcs-lot-hair-growth-hair-faster-regrowth-anti-hair-loss-building-beauty-dense-repair-restoration-treatment-serum/,"EFERO 3pcs/lot Hair Growth Hair Faster Regrowth Anti Hair Loss Building Beauty Dense Repair Restoration Treatment Serum",2020/09/EFERO-3pcs-lot-Hair-Growth-Hair-Faster-Regrowth-Anti-Hair-Loss-Building-Beauty-Dense-Repair-Restoration.jpg
248761,https://linhcorner.com/shop/uncategorized/double-gentlemen-beard-comb-wooden-shaping-template-beard-shaping-comb-for-men-men-shaving-comb-tools/,"Double Gentlemen Beard Comb Wooden Shaping Template Beard Shaping Comb for Men Men Shaving Comb Tools",2020/09/Double-Gentlemen-Beard-Comb-Wooden-Shaping-Template-Beard-Shaping-Comb-for-Men-Men-Shaving-Comb-Tools.jpg
248765,https://linhcorner.com/shop/uncategorized/lanbena-faster-powerful-hair-growth-hairloss-preventing-essence-products-essential-oil-liquid-treatment-hair-care-dropshipping/,"LANBENA Faster Powerful Hair Growth Hairloss Preventing Essence Products Essential Oil Liquid Treatment  Hair Care Dropshipping",2020/09/LANBENA-Faster-Powerful-Hair-Growth-Hairloss-Preventing-Essence-Products-Essential-Oil-Liquid-Treatment-Hair-Care-Dropshipping.jpg
248770,https://linhcorner.com/shop/uncategorized/putimi-nourishing-hair-growth-serum-fast-growing-dense-hair-products-prevent-baldness-anti-hair-loss-serum-essence-care-20ml/,"PUTIMI Nourishing Hair Growth Serum Fast Growing Dense Hair Products Prevent Baldness Anti-Hair Loss Serum Essence Care 20ml",2020/09/PUTIMI-Nourishing-Hair-Growth-Serum-Fast-Growing-Dense-Hair-Products-Prevent-Baldness-Anti-Hair-Loss-Serum.jpg
248781,https://linhcorner.com/shop/uncategorized/hair-building-fiber-applicator-spray-nozzle-pump-hair-loss-products-hair-sprays-for-hair-extensions-hair-fiber-sprays/,"Hair Building Fiber Applicator Spray Nozzle Pump Hair Loss Products Hair Sprays for Hair Extensions Hair Fiber Sprays",2020/09/Hair-Building-Fiber-Applicator-Spray-Nozzle-Pump-Hair-Loss-Products-Hair-Sprays-for-Hair-Extensions-Hair.jpg
248788,https://linhcorner.com/shop/uncategorized/hair-growth-laser-comb-therapy-electric-massage-equipment-stop-hair-loss-treatment-promote-grow-brush-product-men-birthday-gift/,"Hair Growth Laser Comb Therapy Electric Massage Equipment Stop Hair Loss Treatment Promote Grow Brush Product Men Birthday Gift",2020/09/Hair-Growth-Laser-Comb-Therapy-Electric-Massage-Equipment-Stop-Hair-Loss-Treatment-Promote-Grow-Brush-Product.jpg
248799,https://linhcorner.com/shop/uncategorized/electric-laser-hair-growth-comb-anti-hair-loss-massager-hair-regrowth-comb-brush-treatment-infrared-detangling-hair-regrowthcomb/,"Electric Laser Hair Growth Comb Anti Hair Loss Massager Hair Regrowth Comb Brush Treatment Infrared Detangling Hair RegrowthComb",2020/09/Electric-Laser-Hair-Growth-Comb-Anti-Hair-Loss-Massager-Hair-Regrowth-Comb-Brush-Treatment-Infrared-Detangling.jpg
248809,https://linhcorner.com/shop/uncategorized/breylee-3pcs-hair-growth-essential-oil-fast-powerful-hair-products-hair-care-prevent-baldness-anti-hair-loss-serum-increase-hair/,"BREYLEE 3PCS Hair Growth Essential Oil Fast Powerful Hair Products Hair Care Prevent Baldness Anti-Hair Loss Serum Increase Hair",2020/09/BREYLEE-3PCS-Hair-Growth-Essential-Oil-Fast-Powerful-Hair-Products-Hair-Care-Prevent-Baldness-Anti-Hair.jpg
248813,https://linhcorner.com/shop/uncategorized/hair-care-hair-growth-essential-oils-essence-original-authentic-100-hair-loss-liquid-health-care-beauty-dense-hair-growth-serum/,"Hair Care Hair Growth Essential Oils Essence Original Authentic 100% Hair Loss Liquid Health Care Beauty Dense Hair Growth Serum",2020/09/Hair-Care-Hair-Growth-Essential-Oils-Essence-Original-Authentic-100-Hair-Loss-Liquid-Health-Care-Beauty.jpg
248814,https://linhcorner.com/shop/uncategorized/yiber-natural-beard-growth-oil-20ml-beard-oil-hair-loss-products-leave-in-conditioner-for-groomed-beard-care/,"Yiber Natural Beard Growth Oil 20ml Beard Oil Hair loss Products Leave-In Conditioner for Groomed Beard Care",2020/09/Yiber-Natural-Beard-Growth-Oil-20ml-Beard-Oil-Hair-loss-Products-Leave-In-Conditioner-for-Groomed.jpg
248820,https://linhcorner.com/shop/uncategorized/omy-lady-hair-growth-spray-face-creamshampoo-brushface-cleaner/,"OMY LADY Hair growth Spray+ face cream+shampoo+ brush+face cleaner",2020/09/OMY-LADY-Hair-growth-Spray-face-cream-shampoo-brush-face-cleaner.jpg
248837,https://linhcorner.com/shop/uncategorized/efero-hair-growth-essence-preventing-hair-loss-product-hair-care-dense-hair-fast-restoration-growth-serum-beard-essential-oil/,"EFERO Hair Growth Essence Preventing Hair Loss Product Hair Care Dense Hair Fast Restoration Growth Serum Beard Essential Oil",2020/09/EFERO-Hair-Growth-Essence-Preventing-Hair-Loss-Product-Hair-Care-Dense-Hair-Fast-Restoration-Growth-Serum.jpg
248847,https://linhcorner.com/shop/uncategorized/hair-growth-essence-liquid-fast-hair-growth-natural-extract-ginger-hair-growth-faster-oil-anti-hair-loss-nourishing-20ml/,"Hair Growth Essence Liquid Fast Hair Growth Natural Extract Ginger Hair Growth Faster Oil Anti Hair-loss Nourishing 20ml",2020/09/Hair-Growth-Essence-Liquid-Fast-Hair-Growth-Natural-Extract-Ginger-Hair-Growth-Faster-Oil-Anti-Hair.jpg
248854,https://linhcorner.com/shop/uncategorized/7ml-100-natural-eyebrows-enhancer-eyelash-growth-nourishing-serum-lashes-longer-thicker-hair-regrowth-mascara-cosmetics/,"7ml 100% Natural Eyebrows Enhancer Eyelash Growth Nourishing Serum Lashes Longer Thicker Hair Regrowth Mascara Cosmetics",2020/09/7ml-100-Natural-Eyebrows-Enhancer-Eyelash-Growth-Nourishing-Serum-Lashes-Longer-Thicker-Hair-Regrowth-Mascara-Cosmetics.jpg
248867,https://linhcorner.com/shop/uncategorized/breylee-hair-growth-essential-oil-anti-hair-loss-serum-hair-products-prevent-baldness-nourishing-re-growth-hair-care-oil-20ml/,"BREYLEE Hair Growth Essential Oil Anti-Hair Loss Serum Hair Products Prevent Baldness Nourishing Re-growth Hair Care Oil 20ml",2020/09/BREYLEE-Hair-Growth-Essential-Oil-Anti-Hair-Loss-Serum-Hair-Products-Prevent-Baldness-Nourishing-Re-growth.jpg
248869,https://linhcorner.com/shop/uncategorized/6pcs-set-beard-kit-styling-tool-men-beard-oil-comb-beard-brushes-moisturizing-wax-cream-styling-scissors-beard-care-set/,"6pcs/set Beard Kit Styling Tool Men Beard Oil Comb Beard Brushes Moisturizing Wax Cream Styling Scissors Beard Care Set",2020/09/6pcs-set-Beard-Kit-Styling-Tool-Men-Beard-Oil-Comb-Beard-Brushes-Moisturizing-Wax-Cream-Styling.jpg
248872,https://linhcorner.com/shop/uncategorized/efero-hair-growth-essence-treatment-for-men-women-prevent-hair-loss-fast-powerful-hair-growth-serum-longer-thicker-hairs-care/,"EFERO Hair Growth Essence Treatment for Men Women Prevent Hair Loss Fast Powerful Hair Growth Serum Longer Thicker Hairs Care",2020/09/EFERO-Hair-Growth-Essence-Treatment-for-Men-Women-Prevent-Hair-Loss-Fast-Powerful-Hair-Growth-Serum.jpg
248898,https://linhcorner.com/shop/uncategorized/anti-hair-loss-set-repair-damage-hair-organic-ginger-300ml-shampoo15ml-oil-hair-growth-product-natural-chinese-herb-formula/,"Anti-Hair Loss Set Repair Damage Hair Organic Ginger 300ml shampoo+15ml Oil Hair Growth Product Natural Chinese Herb Formula",2020/09/Anti-Hair-Loss-Set-Repair-Damage-Hair-Organic-Ginger-300ml-shampoo-15ml-Oil-Hair-Growth-Product.jpg
248905,https://linhcorner.com/shop/uncategorized/omy-lady-100-natural-organic-men-beard-growth-oil-beard-wax-balm-hair-loss-product-plant-based-for-groomed-beard-growth-essence/,"OMY LADY 100% Natural Organic Men Beard Growth Oil Beard Wax balm Hair Loss Product Plant-based for Groomed Beard Growth Essence",2020/09/OMY-LADY-100-Natural-Organic-Men-Beard-Growth-Oil-Beard-Wax-balm-Hair-Loss-Product-Plant.jpg
248910,https://linhcorner.com/shop/uncategorized/efero-hair-growth-serum-anti-hair-loss-beard-growth-serum-fast-dense-thicken-hair-growth-serum-beauty-care-hair-loss-product/,"EFERO Hair Growth Serum Anti Hair Loss Beard Growth Serum Fast Dense Thicken Hair Growth Serum Beauty Care Hair Loss Product",2020/09/EFERO-Hair-Growth-Serum-Anti-Hair-Loss-Beard-Growth-Serum-Fast-Dense-Thicken-Hair-Growth-Serum.jpg
248914,https://linhcorner.com/shop/uncategorized/efero-fast-powerful-hair-growth-serum-dense-anti-hair-loss-treatment-preventing-baldness-growth-products-hair-care-products-20ml/,"efero Fast Powerful Hair Growth Serum Dense Anti Hair Loss Treatment Preventing Baldness Growth Products Hair Care Products 20ml",2020/09/efero-Fast-Powerful-Hair-Growth-Serum-Dense-Anti-Hair-Loss-Treatment-Preventing-Baldness-Growth-Products-Hair.jpg
248926,https://linhcorner.com/shop/uncategorized/ginger-hair-growth-products-fast-grow-hair-loss-treatment-preventing-hair-loss-serum-oil-hairs-growth-faster-grow-shampoo-20ml/,"Ginger Hair Growth Products Fast Grow Hair Loss Treatment Preventing Hair Loss Serum Oil Hairs Growth Faster Grow Shampoo 20ml",2020/09/Ginger-Hair-Growth-Products-Fast-Grow-Hair-Loss-Treatment-Preventing-Hair-Loss-Serum-Oil-Hairs-Growth.jpg
248934,https://linhcorner.com/shop/uncategorized/electric-laser-hair-growth-comb-anti-hair-loss-massager-hair-regrowth-comb-brush-infrared-nano-ems-vibration-massage-hair-brush/,"Electric Laser Hair Growth Comb Anti Hair Loss Massager Hair Regrowth Comb Brush Infrared Nano EMS Vibration Massage Hair Brush",2020/09/Electric-Laser-Hair-Growth-Comb-Anti-Hair-Loss-Massager-Hair-Regrowth-Comb-Brush-Infrared-Nano-EMS.jpg
248944,https://linhcorner.com/shop/uncategorized/10-pcs-yiganerjing-hair-growth-product-natural-pure-essential-hair-oil-for-fast-hair-growth-ginger-healthy-dense-serum/,"10 PCS YIGANERJING  Hair Growth Product Natural Pure Essential Hair Oil for Fast Hair Growth Ginger Healthy Dense Serum",2020/09/10-PCS-YIGANERJING-Hair-Growth-Product-Natural-Pure-Essential-Hair-Oil-for-Fast-Hair-Growth-Ginger.jpg
248951,https://linhcorner.com/shop/uncategorized/15ml-anti-hair-loss-ginger-oil-hair-growth-product-natural-extraction-material-for-man-and-woman-free-shipping/,"15ml Anti-hair Loss Ginger Oil Hair Growth Product Natural extraction material For Man and Woman Free Shipping",2020/09/15ml-Anti-hair-Loss-Ginger-Oil-Hair-Growth-Product-Natural-extraction-material-For-Man-and-Woman.jpg
248957,https://linhcorner.com/shop/uncategorized/men-beard-oil-kit-stainless-steel-beard-brush-comb-shaving-set-grooming-and-trimming-kit-male-beard-care-set-with-cloth-bag/,"Men Beard Oil Kit Stainless Steel Beard Brush Comb Shaving Set Grooming and Trimming Kit Male Beard Care Set with Cloth Bag",2020/09/Men-Beard-Oil-Kit-Stainless-Steel-Beard-Brush-Comb-Shaving-Set-Grooming-and-Trimming-Kit-Male.jpg
248960,https://linhcorner.com/shop/uncategorized/hair-fibers-keratin-toppik-thickening-spray-hair-building-fibers-27-5g-loss-products-instant-wig-regrowth-powders/,"Hair Fibers Keratin Toppik Thickening Spray Hair Building Fibers 27.5g Loss Products Instant Wig Regrowth Powders",2020/09/Hair-Fibers-Keratin-Toppik-Thickening-Spray-Hair-Building-Fibers-27-5g-Loss-Products-Instant-Wig-Regrowth.jpg
248995,https://linhcorner.com/shop/uncategorized/pure-beard-growth-oil-men-anti-hair-loss-grow-mustache-essence-oil-thicker-fuller-mens-natural-ingredients-beard-oil-60ml/,"Pure Beard Growth Oil Men Anti Hair Loss Grow Mustache Essence Oil Thicker Fuller Men's Natural Ingredients Beard Oil 60ml",2020/09/Pure-Beard-Growth-Oil-Men-Anti-Hair-Loss-Grow-Mustache-Essence-Oil-Thicker-Fuller-Men-s.jpg
248997,https://linhcorner.com/shop/uncategorized/beard-growth-oil-natural-organic-for-men-beard-growthenhancer-anti-hair-loss-products-facial-nutrition-moustache-grow-beard/,"Beard Growth Oil Natural Organic for Men Beard GrowthEnhancer Anti Hair Loss Products Facial Nutrition Moustache Grow Beard",2020/09/Beard-Growth-Oil-Natural-Organic-for-Men-Beard-GrowthEnhancer-Anti-Hair-Loss-Products-Facial-Nutrition-Moustache.jpg
249000,https://linhcorner.com/shop/uncategorized/beard-growth-oil-enhancer-natural-organic-for-men-beard-growth-anti-hair-loss-products-facial-nutrition-moustache-grow-beard/,"Beard Growth Oil Enhancer Natural Organic for Men Beard Growth Anti Hair Loss Products Facial Nutrition Moustache Grow Beard",2020/09/Beard-Growth-Oil-Enhancer-Natural-Organic-for-Men-Beard-Growth-Anti-Hair-Loss-Products-Facial-Nutrition.jpg
249003,https://linhcorner.com/shop/uncategorized/natural-organic-beard-oil-beard-growth-conditioner-nourish-nursing-moisturizing-beard-fast-growth-beard-care-liquid-30ml/,"Natural Organic Beard Oil Beard Growth Conditioner Nourish Nursing Moisturizing Beard Fast Growth Beard Care Liquid 30ml",2020/09/Natural-Organic-Beard-Oil-Beard-Growth-Conditioner-Nourish-Nursing-Moisturizing-Beard-Fast-Growth-Beard-Care-Liquid.jpg
249004,https://linhcorner.com/shop/uncategorized/hair-growth-essence-oil-anti-hair-loss-products-for-hair-growth-treatment-genger-natural-serum-hair-thickener-care-solutions/,"Hair Growth Essence Oil Anti Hair Loss Products for Hair Growth Treatment Genger Natural Serum Hair Thickener Care Solutions",2020/09/Hair-Growth-Essence-Oil-Anti-Hair-Loss-Products-for-Hair-Growth-Treatment-Genger-Natural-Serum-Hair.jpg
249007,https://linhcorner.com/shop/uncategorized/hair-care-essential-oil-100-natural-extract-for-helps-hair-grow-fast-thick-hair-anti-hair-loss-hair-growth-fluid/,"Hair Care Essential Oil 100% Natural Extract for Helps Hair Grow Fast Thick Hair Anti Hair Loss Hair Growth Fluid",2020/09/Hair-Care-Essential-Oil-100-Natural-Extract-for-Helps-Hair-Grow-Fast-Thick-Hair-Anti-Hair.jpg
