94739,http://dummy.xtemos.com/woodmart/?post_type=product&amp;p=47,"Panton tunior chair",2017/06/wood-product-paceholder.jpg
94739,http://dummy.xtemos.com/woodmart/?post_type=product&amp;p=47,"Panton tunior chair",2017/06/wood-product-paceholder.jpg
119926,https://nanacorner.com/product/mirror-alarm-clock-desktop-digital-led-display-battery-operated-portable-multi-function-timer-adjustable-luminance/,"Mirror Alarm Clock Desktop Digital LED Display Battery Operated Portable Multi-Function Timer Adjustable Luminance",2020/02/Mirror-Alarm-Clock-Desktop-Digital-LED-Display-Battery-Operated-Portable-Multi-Function-Timer-Adjustable-Luminance.jpg
119933,https://nanacorner.com/product/electronic-digital-lcd-temperature-humidity-monitor-clock-thermometer-hygrometer-electronic-indoor-home-weather-forecast-clock-2/,"Electronic Digital LCD Temperature Humidity Monitor Clock Thermometer Hygrometer Electronic Indoor Home Weather Forecast Clock",2020/02/Electronic-Digital-LCD-Temperature-Humidity-Monitor-Clock-Thermometer-Hygrometer-Electronic-Indoor-Home-Weather-Forecast-Clock-6.jpg
119934,https://nanacorner.com/product/wooden-wall-clock-luminous-number-hanging-clocks-quiet-dark-glowing-wall-clocks-modern-watches-decoration-for-living-room/,"Wooden Wall Clock Luminous Number Hanging Clocks Quiet Dark Glowing Wall Clocks Modern Watches Decoration For Living Room",2020/02/Wooden-Wall-Clock-Luminous-Number-Hanging-Clocks-Quiet-Dark-Glowing-Wall-Clocks-Modern-Watches-Decoration-For.jpg
119935,https://nanacorner.com/product/1-set-mirror-stickers-3d-diy-mirror-wall-clock-home-decor-acrylic-glass-silver-watch-sticker-love-letter-shape-bedroom-clocks/,"1 Set Mirror Stickers 3D DIY Mirror Wall Clock Home Decor Acrylic Glass Silver Watch Sticker LOVE Letter Shape Bedroom Clocks",2020/02/1-Set-Mirror-Stickers-3D-DIY-Mirror-Wall-Clock-Home-Decor-Acrylic-Glass-Silver-Watch-Sticker.jpeg
119936,https://nanacorner.com/product/non-ticking-long-spindle-quartz-pendulum-clock-movement-motor-mechanism-wall-hanger-hook-metal-hands-pointer-diy-repair-fitting/,"Non-ticking Long Spindle Quartz Pendulum Clock Movement Motor Mechanism Wall Hanger Hook Metal Hands Pointer DIY Repair Fitting",2020/02/Non-ticking-Long-Spindle-Quartz-Pendulum-Clock-Movement-Motor-Mechanism-Wall-Hanger-Hook-Metal-Hands-Pointer.jpg
119937,https://nanacorner.com/product/portable-2-in-1-car-digital-lcd-clock-temperature-display-auto-dashboard-clocks-backlight-electronic-screen-clock-with-battery/,"Portable 2 in 1 Car Digital LCD Clock &amp; Temperature Display Auto Dashboard Clocks Backlight Electronic Screen Clock with Battery",2020/02/Portable-2-in-1-Car-Digital-LCD-Clock-Temperature-Display-Auto-Dashboard-Clocks-Backlight-Electronic-Screen.jpg
119963,https://nanacorner.com/product/gh-water-droplets-swing-wall-clock-modern-design-nordic-style-living-room-wall-clocks-fashion-creative-bedroom-silent-quartz/,"GH Water Droplets Swing Wall Clock Modern Design Nordic Style Living Room Wall Clocks Fashion Creative Bedroom Silent Quartz",2020/02/GH-Water-Droplets-Swing-Wall-Clock-Modern-Design-Nordic-Style-Living-Room-Wall-Clocks-Fashion-Creative.jpg
119994,https://nanacorner.com/product/new-useful-wooden-pointers-diy-creative-wall-clock-hands-clock-walnut-wood-needle-quartz-clock-replace-part-accessories/,"NEW Useful Wooden Pointers DIY Creative wall Clock Hands clock Walnut wood needle Quartz Clock replace part Accessories",2020/02/NEW-Useful-Wooden-Pointers-DIY-Creative-wall-Clock-Hands-clock-Walnut-wood-needle-Quartz-Clock-replace.jpg
120001,https://nanacorner.com/product/set-sail-2020-new-wall-clock-acrylic-metal-mirror-big-personalized-decoration-wall-watches-3d-large-wall-clocks-free-shipping/,"Set sail 2020 New Wall Clock Acrylic Metal Mirror Big Personalized decoration Wall Watches 3D large wall Clocks Free shipping",2020/02/Set-sail-2020-New-Wall-Clock-Acrylic-Metal-Mirror-Big-Personalized-decoration-Wall-Watches-3D-large.jpg
120005,https://nanacorner.com/product/ford-mustang-handmade-vinyl-record-wall-clock-fun-gift-vintage-unique-home-decor-car-clocks/,"Ford Mustang Handmade Vinyl Record Wall Clock Fun gift Vintage Unique Home decor  Car clocks",2020/02/Ford-Mustang-Handmade-Vinyl-Record-Wall-Clock-Fun-gift-Vintage-Unique-Home-decor-Car-clocks.jpg
120038,https://nanacorner.com/product/adjustable-modern-digital-stereo-clock-usb-led-light-3d-numbers-display-date-desktop-wall-clock-alarm-voice-control-home-decor/,"Adjustable Modern Digital Stereo Clock USB LED Light 3D Numbers Display Date Desktop Wall Clock Alarm Voice Control Home Decor",2020/02/Adjustable-Modern-Digital-Stereo-Clock-USB-LED-Light-3D-Numbers-Display-Date-Desktop-Wall-Clock-Alarm.jpg
120097,https://nanacorner.com/product/frying-pan-clock-with-fried-egg-kitchen-cafe-wall-clock-red/,"Frying Pan Clock with Fried Egg - Kitchen Cafe Wall Clock - Red",2020/02/Frying-Pan-Clock-with-Fried-Egg-Kitchen-Cafe-Wall-Clock-Red.jpg
120117,https://nanacorner.com/product/projection-alarm-clock-snooze-weather-temperature-humidity-projection-wall-clock-home-decoration-clocks-led-digital-table-clocks/,"Projection Alarm Clock Snooze Weather Temperature Humidity Projection Wall Clock Home Decoration Clocks LED Digital Table Clocks",2020/02/Projection-Alarm-Clock-Snooze-Weather-Temperature-Humidity-Projection-Wall-Clock-Home-Decoration-Clocks-LED-Digital-Table.jpg
120132,https://nanacorner.com/product/modern-wood-vintage-design-wall-clock-fashion-style-home-living-room-coffee-shop-chic-bar-personality-quiet-clock-square-shape/,"Modern Wood Vintage Design Wall Clock Fashion Style Home Living Room Coffee Shop Chic Bar Personality Quiet Clock Square Shape",2020/02/Modern-Wood-Vintage-Design-Wall-Clock-Fashion-Style-Home-Living-Room-Coffee-Shop-Chic-Bar-Personality.jpg
120142,https://nanacorner.com/product/3d-led-digital-wall-clock-snooze-bedroom-desk-alarm-clocks-hanging-wall-clock-calendar-thermometer-home-decor/,"3D LED Digital Wall Clock Snooze Bedroom Desk Alarm Clocks Hanging Wall Clock Calendar Thermometer Home Decor",2020/02/3D-LED-Digital-Wall-Clock-Snooze-Bedroom-Desk-Alarm-Clocks-Hanging-Wall-Clock-Calendar-Thermometer-Home.jpg
120143,https://nanacorner.com/product/led-clock-alarm-watch-usb-charge-electronic-digital-clocks-wall-horloge-3d-dijital-saat-home-decoration-office-table-desk-clock/,"LED Clock Alarm Watch USB Charge Electronic Digital Clocks Wall Horloge 3D Dijital Saat Home Decoration Office Table Desk Clock",2020/02/LED-Clock-Alarm-Watch-USB-Charge-Electronic-Digital-Clocks-Wall-Horloge-3D-Dijital-Saat-Home-Decoration.jpg
120175,https://nanacorner.com/product/luminous-auto-gauge-clock-mini-car-air-vent-quartz-clock-with-clip-auto-air-outlet-watch-car-styling-for-audi-100-200-80-quattro/,"Luminous Auto Gauge Clock Mini Car Air Vent Quartz Clock with clip Auto air outlet Watch Car styling for Audi 100 200 80 Quattro",2020/02/Luminous-Auto-Gauge-Clock-Mini-Car-Air-Vent-Quartz-Clock-with-clip-Auto-air-outlet-Watch.jpg
120184,https://nanacorner.com/product/home-3d-mirror-wall-clock-self-adhesive-modern-mute-acrylic-art-analog-kitchen-diy-coffee-cups-decor-waterproof/,"Home 3D Mirror Wall Clock Self Adhesive Modern Mute Acrylic Art Analog Kitchen DIY Coffee Cups Decor Waterproof",2020/02/Home-3D-Mirror-Wall-Clock-Self-Adhesive-Modern-Mute-Acrylic-Art-Analog-Kitchen-DIY-Coffee-Cups.jpg
120250,https://nanacorner.com/product/2019-new-wall-clock-quartz-watch-reloj-de-pared-modern-design-large-decorative-clocks-europe-acrylic-stickers-living-room-klok/,"2019 new wall clock quartz watch reloj de pared modern design large decorative clocks Europe acrylic stickers living room klok",2020/02/2019-new-wall-clock-quartz-watch-reloj-de-pared-modern-design-large-decorative-clocks-Europe-acrylic.jpg
120262,https://nanacorner.com/product/mrosaa-plastic-circular-30cm-nordic-simple-silent-quartz-wall-clock-quiet-sweeping-movement-no-ticking-home-art-decor/,"Mrosaa Plastic Circular 30cm Nordic Simple Silent Quartz Wall Clock Quiet Sweeping Movement No-ticking Home Art Decor",2020/02/Mrosaa-Plastic-Circular-30cm-Nordic-Simple-Silent-Quartz-Wall-Clock-Quiet-Sweeping-Movement-No-ticking-Home.jpg
120289,https://nanacorner.com/product/car-electronic-clock-liquid-crystal-display-lcd-car-timer-digital-clock-with-suction-cup-hot-selling-home-decorations-hot-sale/,"Car Electronic Clock Liquid Crystal Display LCD Car Timer Digital Clock with suction cup hot selling Home Decorations Hot Sale",2020/02/Car-Electronic-Clock-Liquid-Crystal-Display-LCD-Car-Timer-Digital-Clock-with-suction-cup-hot-selling.jpg
120303,https://nanacorner.com/product/multi-use-8-shaped-led-display-desktop-digital-table-clocks-3-levers-of-light-bright-snooze-interval-setting-usb-charge/,"Multi-use 8 Shaped LED Display Desktop Digital Table Clocks 3 levers of light: bright Snooze interval setting USB charge",2020/02/Multi-use-8-Shaped-LED-Display-Desktop-Digital-Table-Clocks-3-levers-of-light-bright-Snooze.jpg
120331,https://nanacorner.com/product/new-hot-clock-watch-wall-clocks-horloge-3d-diy-acrylic-mirror-stickers-home-decoration-living-room-quartz-needle-reloj-de-pared/,"New Hot Clock Watch Wall Clocks Horloge 3d Diy Acrylic Mirror Stickers Home Decoration Living Room Quartz Needle reloj de pared",2020/02/New-Hot-Clock-Watch-Wall-Clocks-Horloge-3d-Diy-Acrylic-Mirror-Stickers-Home-Decoration-Living-Room.jpg
120364,https://nanacorner.com/product/practical-diy-luxury-3d-roman-numerals-wall-clock-large-size-home-decoration-art-clock-hot-colorgold/,"Practical DIY Luxury 3D Roman numerals Wall Clock Large Size Home Decoration Art Clock HOT (color:gold)",2020/02/Practical-DIY-Luxury-3D-Roman-numerals-Wall-Clock-Large-Size-Home-Decoration-Art-Clock-HOT-color.jpg
120382,https://nanacorner.com/product/new-coffee-cup-shape-time-clock-3d-diy-mirror-acrylic-wall-clock-modern-kitchen-home-decor-digital-wall-stickers-for-living-room/,"NEW Coffee Cup Shape Time Clock 3D DIY Mirror Acrylic Wall Clock Modern Kitchen Home Decor Digital Wall Stickers For Living Room",2020/02/NEW-Coffee-Cup-Shape-Time-Clock-3D-DIY-Mirror-Acrylic-Wall-Clock-Modern-Kitchen-Home-Decor.jpg
120387,https://nanacorner.com/product/2020-free-shipping-new-clock-watch-wall-clocks-3d-diy-acrylic-mirror-stickers-home-decoration-living-room-quartz-needle/,"2020 Free Shipping New Clock Watch Wall Clocks  3d Diy Acrylic Mirror Stickers Home Decoration Living Room Quartz Needle",2020/02/2020-Free-Shipping-New-Clock-Watch-Wall-Clocks-3d-Diy-Acrylic-Mirror-Stickers-Home-Decoration-Living.jpg
120396,https://nanacorner.com/product/24-12-hour-display-watch-alarm-led-digital-clock-wall-hanging-3d-table-clock-calendar-temperature-display-brightness-adjustable/,"24/12 Hour Display Watch Alarm LED Digital Clock Wall Hanging 3D Table Clock Calendar Temperature Display Brightness Adjustable",2020/02/24-12-Hour-Display-Watch-Alarm-LED-Digital-Clock-Wall-Hanging-3D-Table-Clock-Calendar-Temperature.jpg
120402,https://nanacorner.com/product/3d-clock-lotus-diy-art-acrylic-mirror-wall-sticker-tv-backdrop-home-decoration/,"3D Clock Lotus DIY Art Acrylic Mirror Wall Sticker TV Backdrop Home Decoration",2020/02/3D-Clock-Lotus-DIY-Art-Acrylic-Mirror-Wall-Sticker-TV-Backdrop-Home-Decoration.jpg
120440,https://nanacorner.com/product/1pc-modern-large-3d-mirror-surface-wall-clock-sticker-home-office-room-diy-decor/,"1pc Modern Large 3D Mirror Surface Wall Clock Sticker Home Office Room DIY Decor",2020/02/1pc-Modern-Large-3D-Mirror-Surface-Wall-Clock-Sticker-Home-Office-Room-DIY-Decor.jpg
120460,https://nanacorner.com/product/large-wall-quartz-clock-movement-precision-sweep-quartz-clock-movement-kit-repair-tool-parts-kitfor-diy-replacement-2-22-20-63/,"large wall Quartz Clock Movement Precision Sweep Quartz Clock Movement Kit Repair Tool Parts KitFor DIY Replacement 2.2*2.2*0.63",2020/02/large-wall-Quartz-Clock-Movement-Precision-Sweep-Quartz-Clock-Movement-Kit-Repair-Tool-Parts-KitFor-DIY.jpeg
120475,https://nanacorner.com/product/2019-new-luminous-wall-clocks-large-clock-watch-horloge-3d-diy-acrylic-mirror-stickers-quartz-duvar-saat-klock-modern-mute/,"2019 New Luminous Wall Clocks Large Clock watch Horloge 3D DIY Acrylic Mirror Stickers  Quartz Duvar Saat Klock Modern mute",2020/02/2019-New-Luminous-Wall-Clocks-Large-Clock-watch-Horloge-3D-DIY-Acrylic-Mirror-Stickers-Quartz-Duvar.jpg
120483,https://nanacorner.com/product/circular-photoreceptive-led-digital-wall-clock-modern-design-dual-use-dimming-digital-clocks-for-home-decoration-us-eu-plug/,"Circular Photoreceptive LED Digital Wall Clock Modern Design Dual-Use Dimming Digital Clocks For Home Decoration US EU PLUG",2020/02/Circular-Photoreceptive-LED-Digital-Wall-Clock-Modern-Design-Dual-Use-Dimming-Digital-Clocks-For-Home-Decoration.jpg
120503,https://nanacorner.com/product/high-quality-modern-diy-interior-roman-wall-clock-wall-clock-3d-sticker-home-mirror-effect-4-style-3d-wall-stickers-q1/,"high quality Modern DIY Interior Roman Wall Clock Wall Clock 3D Sticker Home Mirror Effect 4 Style 3D Wall Stickers Q1",2020/02/high-quality-Modern-DIY-Interior-Roman-Wall-Clock-Wall-Clock-3D-Sticker-Home-Mirror-Effect-4.jpg
120507,https://nanacorner.com/product/led-mirror-mini-digital-alarm-clock-table-electronic-time-temperature-date-display-clock-home-decoration-digital-clock/,"LED Mirror Mini Digital Alarm Clock Table Electronic Time Temperature Date Display Clock Home Decoration Digital Clock",2020/02/LED-Mirror-Mini-Digital-Alarm-Clock-Table-Electronic-Time-Temperature-Date-Display-Clock-Home-Decoration-Digital.jpg
120508,https://nanacorner.com/product/modern-style-butterfly-fairy-diy-mirror-wall-clock-wall-sticker-home-decor-home-decoration-bedroom-living-room-parlor-decoration/,"Modern Style Butterfly Fairy DIY Mirror Wall Clock Wall Sticker Home Decor Home Decoration Bedroom Living Room Parlor Decoration",2020/02/Modern-Style-Butterfly-Fairy-DIY-Mirror-Wall-Clock-Wall-Sticker-Home-Decor-Home-Decoration-Bedroom-Living.jpg
120573,https://nanacorner.com/product/8-shaped-usb-digital-table-clocks-wall-clock-led-time-display-creative-watches-2412-hour-display-alarm-snooze-home-decoration/,"8 Shaped USB Digital Table Clocks Wall Clock LED Time Display Creative Watches 24&amp;12-Hour Display Alarm Snooze Home Decoration",2020/02/8-Shaped-USB-Digital-Table-Clocks-Wall-Clock-LED-Time-Display-Creative-Watches-24-12-Hour.jpg
120580,https://nanacorner.com/product/cafe-diy-large-wall-clock-frameless-giant-wall-clock-modern-design-cafe-coffee-mug-coffee-bean-wall-decor-kitchen-wall-watch-new/,"Cafe DIY Large Wall Clock Frameless Giant Wall Clock Modern Design Cafe Coffee Mug Coffee Bean Wall Decor Kitchen Wall Watch New",2020/02/Cafe-DIY-Large-Wall-Clock-Frameless-Giant-Wall-Clock-Modern-Design-Cafe-Coffee-Mug-Coffee-Bean.jpg
120590,https://nanacorner.com/product/2-in-1-car-digital-clock-automobile-watch-automotive-auto-thermometer-hygrometer-decoration-ornament-mini-clock-in-car-styling/,"2 In 1 Car Digital Clock Automobile Watch Automotive Auto Thermometer Hygrometer Decoration Ornament Mini Clock In Car-Styling",2020/02/2-In-1-Car-Digital-Clock-Automobile-Watch-Automotive-Auto-Thermometer-Hygrometer-Decoration-Ornament-Mini-Clock.jpg
120591,https://nanacorner.com/product/car-decoration-clock-watch-modified-car-interior-electronic-quartz-watch-for-alfa-romeo-159-147-156-giulietta-147-159-emblems/,"Car decoration clock watch modified car interior electronic quartz watch For alfa romeo 159 147 156 giulietta 147 159 Emblems",2020/02/Car-decoration-clock-watch-modified-car-interior-electronic-quartz-watch-For-alfa-romeo-159-147-156.jpg
120627,https://nanacorner.com/product/hot-luminous-wall-clock-12-inch-wooden-silent-non-ticking-kitchen-wall-clocks-with-night-lights-for-indoor-outdoor-living-room-2/,"Hot Luminous Wall Clock 12 Inch Wooden Silent Non-Ticking Kitchen Wall Clocks With Night Lights For Indoor/Outdoor Living Room",2020/02/Hot-Luminous-Wall-Clock-12-Inch-Wooden-Silent-Non-Ticking-Kitchen-Wall-Clocks-With-Night-Lights-6.jpg
120663,https://nanacorner.com/product/car-led-backlight-digital-thermometer-clock-indoor-outdoor-temperature-voltage-meter-with-car-cigarette-socket-hot-sale/,"Car LED Backlight Digital Thermometer Clock Indoor Outdoor Temperature Voltage Meter with Car Cigarette Socket Hot Sale",2020/02/Car-LED-Backlight-Digital-Thermometer-Clock-Indoor-Outdoor-Temperature-Voltage-Meter-with-Car-Cigarette-Socket-Hot.jpg
120671,https://nanacorner.com/product/nordic-style-hedgehog-wall-clocks-black-and-white-creative-wall-clock-bedroom-home-decor-silent-wooden-clock-for-living-room-co1/,"Nordic Style Hedgehog Wall Clocks black and white creative wall clock Bedroom home decor Silent Wooden Clock for Living Room CO1",2020/02/Nordic-Style-Hedgehog-Wall-Clocks-black-and-white-creative-wall-clock-Bedroom-home-decor-Silent-Wooden.jpg
120680,https://nanacorner.com/product/2-in-1-hidden-secret-house-storage-wall-clock-home-decroation-office-security-safe-money-stash-jewellery-stuff-container-clock/,"2 In 1 Hidden Secret House Storage Wall Clock Home Decroation Office Security Safe Money Stash Jewellery Stuff Container Clock",2020/02/2-In-1-Hidden-Secret-House-Storage-Wall-Clock-Home-Decroation-Office-Security-Safe-Money-Stash.jpg
120725,https://nanacorner.com/product/3d-led-digital-wall-clocks-24-12-hours-display-3-brightness-levels-dimmable-nightlight-snooze-function-for-home-kitchen-office/,"3D LED Digital Wall Clocks 24 / 12 Hours Display 3 Brightness Levels Dimmable Nightlight Snooze Function for Home Kitchen Office",2020/02/3D-LED-Digital-Wall-Clocks-24-12-Hours-Display-3-Brightness-Levels-Dimmable-Nightlight-Snooze-Function.jpg
120726,https://nanacorner.com/product/2019-new-hot-sale-led-display-digital-clock-12v-24v-dashboard-car-motorcycle-accessory-1pc-drop-shipping-new/,"2019 New Hot Sale LED Display Digital Clock 12V/24V Dashboard Car Motorcycle Accessory 1PC Drop shipping new",2020/02/2019-New-Hot-Sale-LED-Display-Digital-Clock-12V-24V-Dashboard-Car-Motorcycle-Accessory-1PC-Drop.jpg
120742,https://nanacorner.com/product/industrial-gear-wall-clock-decorative-retro-metal-wall-clock-industrial-age-style-room-decoration-wall-art-decor/,"Industrial Gear Wall Clock Decorative Retro Metal Wall Clock Industrial Age Style Room Decoration Wall Art Decor",2020/02/Industrial-Gear-Wall-Clock-Decorative-Retro-Metal-Wall-Clock-Industrial-Age-Style-Room-Decoration-Wall-Art.jpg
120752,https://nanacorner.com/product/original-lcd-digital-weather-forecast-snooze-temperature-alarm-clock-watch-household-wall-desk-alarm-watch-multi-functional/,"Original Lcd Digital Weather Forecast Snooze Temperature Alarm Clock Watch Household Wall Desk Alarm Watch Multi Functional",2020/02/Original-Lcd-Digital-Weather-Forecast-Snooze-Temperature-Alarm-Clock-Watch-Household-Wall-Desk-Alarm-Watch-Multi.jpg
120785,https://nanacorner.com/product/0-56-inch-4-bits-led-digital-display-module-tube-for-arduino-7-segments-clock-double-dots-module-clock-tm1637-electric-clock/,"0.56 Inch 4 Bits LED Digital Display Module Tube For Arduino 7 Segments Clock Double Dots Module Clock TM1637 Electric Clock",2020/02/0-56-Inch-4-Bits-LED-Digital-Display-Module-Tube-For-Arduino-7-Segments-Clock-Double.jpg
120828,https://nanacorner.com/product/baogela-top-luxury-brand-mens-quartz-watch-leather-strap-simple-watches-men-ultra-thin-fashion-business-analogue-fashion-clock/,"BAOGELA Top Luxury Brand Men's Quartz Watch Leather Strap Simple Watches Men Ultra-thin Fashion Business Analogue Fashion Clock",2020/02/BAOGELA-Top-Luxury-Brand-Men-s-Quartz-Watch-Leather-Strap-Simple-Watches-Men-Ultra-thin-Fashion.jpg
120829,https://nanacorner.com/product/new-naviforce-men-watch-digital-sport-top-brand-luxury-coffee-man-wristwatch-military-genuine-leather-led-quartz-male-clock-9153/,"New NAVIFORCE Men Watch Digital Sport Top Brand Luxury Coffee Man WristWatch Military Genuine Leather LED Quartz Male Clock 9153",2020/02/New-NAVIFORCE-Men-Watch-Digital-Sport-Top-Brand-Luxury-Coffee-Man-WristWatch-Military-Genuine-Leather-LED.jpg
120831,https://nanacorner.com/product/mens-watch-top-luxury-brand-lige-men-waterproof-quartz-watches-dress-business-fashion-full-steel-black-moon-phase-male-clock/,"Men's Watch Top Luxury Brand LIGE Men Waterproof Quartz Watches Dress Business Fashion Full Steel Black Moon Phase Male Clock",2020/02/Men-s-Watch-Top-Luxury-Brand-LIGE-Men-Waterproof-Quartz-Watches-Dress-Business-Fashion-Full-Steel.jpg
120835,https://nanacorner.com/product/olmeca-hot-selling-fashion-relogio-masculino-chronograph-watches-wrist-watch-steel-clock-mens-waterproof-military-black/,"OLMECA Hot Selling Fashion Relogio Masculino Chronograph Watches Wrist Watch Steel Clock Men's Waterproof Military Black",2020/02/OLMECA-Hot-Selling-Fashion-Relogio-Masculino-Chronograph-Watches-Wrist-Watch-Steel-Clock-Men-s-Waterproof-Military.jpg
120841,https://nanacorner.com/product/dom-watch-men-luxury-business-steel-man-watch-waterproof-calendar-unique-fashion-casual-quartz-male-dress-clock-m-435/,"DOM Watch Men Luxury Business Steel Man Watch Waterproof Calendar Unique Fashion Casual Quartz Male Dress Clock M-435",2020/02/DOM-Watch-Men-Luxury-Business-Steel-Man-Watch-Waterproof-Calendar-Unique-Fashion-Casual-Quartz-Male-Dress.jpg
120848,https://nanacorner.com/product/dom-fashion-mens-watches-top-brand-luxury-waterproof-watches-ultra-thin-date-simple-casual-quartz-watch-men-sports-clock-m-1219/,"DOM Fashion Mens Watches Top Brand Luxury Waterproof Watches Ultra Thin Date Simple Casual Quartz Watch Men Sports Clock M-1219",2020/02/DOM-Fashion-Mens-Watches-Top-Brand-Luxury-Waterproof-Watches-Ultra-Thin-Date-Simple-Casual-Quartz-Watch.jpg
120869,https://nanacorner.com/product/relogio-masculino-naviforce-watch-men-fashion-casual-waterproof-quartz-military-stainless-steel-sports-watches-man-clock-9085/,"Relogio Masculino NAVIFORCE Watch Men Fashion Casual Waterproof Quartz Military Stainless Steel Sports Watches Man Clock 9085",2020/02/Relogio-Masculino-NAVIFORCE-Watch-Men-Fashion-Casual-Waterproof-Quartz-Military-Stainless-Steel-Sports-Watches-Man-Clock.jpg
120905,https://nanacorner.com/product/6-numbers-total-art-modern-luxury-diy-removable3d-acrylic-crystal-mirror-wall-clock-watch-wall-sticker-living-room-bedroom-decor/,"6 Numbers Total Art Modern Luxury DIY Removable3D Acrylic Crystal Mirror Wall Clock Watch Wall Sticker Living Room Bedroom Decor",2020/02/6-Numbers-Total-Art-Modern-Luxury-DIY-Removable3D-Acrylic-Crystal-Mirror-Wall-Clock-Watch-Wall-Sticker.jpg
120933,https://nanacorner.com/product/quartz-round-retro-wall-clock-art-design-kitchen-living-room-home-decoration-vinyl-record-clock-blue-black-plastic/,"Quartz Round Retro Wall Clock Art Design Kitchen Living Room Home Decoration Vinyl Record Clock Blue + Black Plastic",2020/02/Quartz-Round-Retro-Wall-Clock-Art-Design-Kitchen-Living-Room-Home-Decoration-Vinyl-Record-Clock-Blue.jpg
120941,https://nanacorner.com/product/portable-night-led-digital-display-office-clock-bedroom-wake-up-light-led-digital-clock-table-watch-desk-clock-reloj-sobremesa/,"Portable Night LED Digital Display Office Clock Bedroom Wake Up Light LED Digital Clock Table Watch Desk Clock Reloj Sobremesa",2020/02/Portable-Night-LED-Digital-Display-Office-Clock-Bedroom-Wake-Up-Light-LED-Digital-Clock-Table-Watch.jpg
120945,https://nanacorner.com/product/houkiper-universal-motorcycle-clock-accessories-watch-waterproof-stick-on-motorbike-mount-digital-clock-moto-clocks-forbmw-watch/,"Houkiper Universal Motorcycle Clock Accessories Watch Waterproof Stick-On Motorbike Mount Digital Clock Moto Clocks ForBMW Watch",2020/02/Houkiper-Universal-Motorcycle-Clock-Accessories-Watch-Waterproof-Stick-On-Motorbike-Mount-Digital-Clock-Moto-Clocks-ForBMW.jpg
120954,https://nanacorner.com/product/3-in-1-led-mirror-alarm-clock-with-wireless-bluetooth-speaker-and-fm-radio-clock-table-digital-electronic-desktop-alarm-clocks/,"3-in-1 LED Mirror Alarm Clock With Wireless Bluetooth Speaker And FM Radio Clock Table Digital Electronic Desktop Alarm Clocks",2020/02/3-in-1-LED-Mirror-Alarm-Clock-With-Wireless-Bluetooth-Speaker-And-FM-Radio-Clock-Table.jpg
120961,https://nanacorner.com/product/3d-circular-retro-roman-wrought-hollow-iron-vintage-large-mute-decorative-wall-clock-on-the-wall-decoration-for-home-crafts-gift/,"3D Circular Retro Roman Wrought Hollow Iron Vintage Large Mute Decorative Wall Clock On The Wall Decoration For Home Crafts Gift",2020/02/3D-Circular-Retro-Roman-Wrought-Hollow-Iron-Vintage-Large-Mute-Decorative-Wall-Clock-On-The-Wall.jpg
120973,https://nanacorner.com/product/diy-3d-mirror-surface-large-number-wall-clock-sticker-home-decor-mirror-living-room-large-art-design-wall-clock/,"DIY 3D Mirror Surface Large Number Wall Clock Sticker Home Decor Mirror Living Room Large Art Design Wall Clock",2020/02/DIY-3D-Mirror-Surface-Large-Number-Wall-Clock-Sticker-Home-Decor-Mirror-Living-Room-Large-Art.jpg
121000,https://nanacorner.com/product/tm1637-0-56-0-56-inch-4-digit-digital-clock-led-display-tube-7-segments-led-clock-double-dots-module-for-arduino/,"TM1637 0.56"" 0.56 Inch 4-Digit Digital Clock LED Display Tube 7 Segments LED Clock Double Dots Module For Arduino",2020/02/TM1637-0-56-0-56-Inch-4-Digit-Digital-Clock-LED-Display-Tube-7-Segments-LED.jpg
121002,https://nanacorner.com/product/thermometer-hygrometer-wall-clock-office-electronic-temperature-and-humidity-monitor-digital-clock/,"Thermometer Hygrometer Wall Clock Office Electronic Temperature And Humidity Monitor Digital Clock",2020/02/Thermometer-Hygrometer-Wall-Clock-Office-Electronic-Temperature-And-Humidity-Monitor-Digital-Clock.jpg
121022,https://nanacorner.com/product/car-luminova-gauge-mini-clock-auto-interior-waterproof-air-vent-quartz-clock-decoration-stick-on-clock-car-styling-accessories/,"Car Luminova Gauge Mini Clock Auto Interior Waterproof Air Vent Quartz Clock Decoration Stick-On Clock Car Styling Accessories",2020/02/Car-Luminova-Gauge-Mini-Clock-Auto-Interior-Waterproof-Air-Vent-Quartz-Clock-Decoration-Stick-On-Clock.jpg
