322566,https://nanacorner.com/product/nordic-3d-wooden-large-wall-clock-modern-design-home-decor-bedroom-silent-oclock-nixie-watch-wall-kids-clock-for-children-room/,"Nordic 3D Wooden Large Wall Clock Modern Design Home Decor Bedroom Silent oclock Nixie Watch Wall Kids Clock For Children Room",2020/03/Nordic-3D-Wooden-Large-Wall-Clock-Modern-Design-Home-Decor-Bedroom-Silent-oclock-Nixie-Watch-Wall.jpg
322567,https://nanacorner.com/product/cartoon-smile-wall-clock-on-the-wall-watch-decorative-quartz-living-room-bathroom-clocks-modern-design-home-decor-kids-bedroom/,"Cartoon Smile Wall Clock on The Wall Watch Decorative Quartz Living Room Bathroom Clocks Modern Design Home Decor Kids Bedroom",2020/03/Cartoon-Smile-Wall-Clock-on-The-Wall-Watch-Decorative-Quartz-Living-Room-Bathroom-Clocks-Modern-Design.jpg
322568,https://nanacorner.com/product/fanju-digital-wall-clock-lcd-big-large-number-time-temperature-calendar-alarm-table-desk-clocks-modern-design-office-home-decor/,"FanJu Digital Wall Clock LCD Big Large Number Time Temperature Calendar Alarm Table Desk Clocks Modern Design Office Home Decor",2020/03/FanJu-Digital-Wall-Clock-LCD-Big-Large-Number-Time-Temperature-Calendar-Alarm-Table-Desk-Clocks-Modern.jpg
322607,https://nanacorner.com/product/understated-luxury-circular-home-decoration-corridor-wall-stickers-mirror-effect-modern-style-diy-quartz-wall-clock-still-life/,"Understated luxury  Circular home decoration Corridor wall stickers mirror effect Modern style  diy quartz wall clock still life",2020/03/Understated-luxury-Circular-home-decoration-Corridor-wall-stickers-mirror-effect-Modern-style-diy-quartz-wall-clock.jpg
322617,https://nanacorner.com/product/wonzom-beer-wine-glass-silent-wall-art-large-wall-clock-wall-watch-for-home-decor-study-no-ticking-sound-creative-decoration/,"WONZOM Beer Wine Glass Silent Wall Art Large Wall Clock, Wall Watch For Home Decor Study, No Ticking Sound, Creative Decoration",2020/03/WONZOM-Beer-Wine-Glass-Silent-Wall-Art-Large-Wall-Clock-Wall-Watch-For-Home-Decor-Study.jpg
322672,https://nanacorner.com/product/a-bottle-of-whiskey-beer-wall-clock-modern-design-vintage-vinyl-record-clocks-led-lighting-wall-watch-home-decor-for-beer/,"A Bottle of Whiskey Beer Wall Clock Modern Design Vintage Vinyl Record Clocks LED Lighting Wall Watch Home Decor for Beer",2020/03/A-Bottle-of-Whiskey-Beer-Wall-Clock-Modern-Design-Vintage-Vinyl-Record-Clocks-LED-Lighting-Wall.jpg
322686,https://nanacorner.com/product/new-arrival-quartz-clocks-diy-watch-mute-scan-seconds-movement-3d-watches-home-photo-wall-clock-accessories-living-room-decor/,"New Arrival Quartz Clocks DIY Watch Mute Scan Seconds Movement 3D Watches Home Photo Wall Clock Accessories Living Room Decor",2020/03/New-Arrival-Quartz-Clocks-DIY-Watch-Mute-Scan-Seconds-Movement-3D-Watches-Home-Photo-Wall-Clock.jpg
322689,https://nanacorner.com/product/new-3d-wall-clock-design-large-acrylic-mirror-clocks-stickers-living-room-accessories-decorative-house-clock-on-the-wall/,"New 3d Wall Clock Design Large Acrylic Mirror Clocks Stickers Living Room Accessories Decorative House Clock On The Wall",2020/03/New-3d-Wall-Clock-Design-Large-Acrylic-Mirror-Clocks-Stickers-Living-Room-Accessories-Decorative-House-Clock.jpg
322719,https://nanacorner.com/product/40cm-large-metal-nordic-style-wall-clock-household-bedroom-iron-art-clocks-wall-watch-home-decor/,"40cm Large Metal Nordic Style Wall Clock Household Bedroom Iron Art Clocks Wall Watch Home Decor",2020/03/40cm-Large-Metal-Nordic-Style-Wall-Clock-Household-Bedroom-Iron-Art-Clocks-Wall-Watch-Home-Decor.jpg
322807,https://nanacorner.com/product/creative-digital-wall-clock-sticker-watch-modern-design-clock-diy-clocks-on-wall-kitchen-clock-living-room-home-decor-horloge/,"Creative Digital Wall Clock Sticker Watch Modern Design Clock DIY Clocks On Wall Kitchen Clock Living Room Home Decor horloge",2020/03/Creative-Digital-Wall-Clock-Sticker-Watch-Modern-Design-Clock-DIY-Clocks-On-Wall-Kitchen-Clock-Living-2.jpg
322812,https://nanacorner.com/product/handmade-small-dreamcatcher-braided-wind-chimes-car-pendant-home-decor-wall-hanging-dream-catcher-wedding-gift/,"Handmade Small Dreamcatcher Braided Wind Chimes Car Pendant &amp; Home Decor &amp; Wall Hanging Dream Catcher Wedding Gift",2020/03/Handmade-Small-Dreamcatcher-Braided-Wind-Chimes-Car-Pendant-Home-Decor-Wall-Hanging-Dream-Catcher-Wedding-Gift.jpg
322813,https://nanacorner.com/product/creative-digital-wall-clock-sticker-watch-modern-design-clock-diy-clocks-on-wall-kitchen-clock-living-room-home-decor/,"Creative Digital Wall Clock Sticker Watch Modern Design Clock DIY Clocks On Wall Kitchen Clock Living Room Home Decor",2020/03/Creative-Digital-Wall-Clock-Sticker-Watch-Modern-Design-Clock-DIY-Clocks-On-Wall-Kitchen-Clock-Living-2.jpg
322818,https://nanacorner.com/product/2019-new-home-decoration-big-mirror-wall-clock-modern-design-3d-diy-large-decorative-wall-clocks-watch-wall-unique-gift/,"2019 New Home decoration big mirror wall clock modern design 3D DIY large decorative wall clocks watch wall unique gift",2020/03/2019-New-Home-decoration-big-mirror-wall-clock-modern-design-3D-DIY-large-decorative-wall-clocks.jpg
322852,https://nanacorner.com/product/high-quality-3d-wall-stickers-creative-fashion-living-room-clocks-large-wall-clock-diy-home-decoration-acrylic-eva-wall-watch/,"High Quality 3D Wall Stickers Creative Fashion Living Room Clocks Large Wall Clock DIY Home Decoration Acrylic + EVA Wall Watch",2020/03/High-Quality-3D-Wall-Stickers-Creative-Fashion-Living-Room-Clocks-Large-Wall-Clock-DIY-Home-Decoration.jpg
322877,https://nanacorner.com/product/new-creative-large-acrylic-mirror-wall-clock-diy-quartz-watch-single-face-clocks-modern-home-decoration-living-room-stickers/,"New creative large acrylic mirror wall clock diy quartz watch Single Face clocks modern home decoration living room stickers",2020/03/New-creative-large-acrylic-mirror-wall-clock-diy-quartz-watch-Single-Face-clocks-modern-home-decoration.jpg
322881,https://nanacorner.com/product/bob-marley-wall-clock-modern-design-music-theme-classic-vintage-vinyl-record-clocks-wall-watch-home-decor-silent-12-inch/,"Bob Marley Wall Clock Modern Design Music Theme Classic Vintage Vinyl Record Clocks Wall Watch Home Decor Silent 12 inch",2020/03/Bob-Marley-Wall-Clock-Modern-Design-Music-Theme-Classic-Vintage-Vinyl-Record-Clocks-Wall-Watch-Home.png
322934,https://nanacorner.com/product/large-wall-clock-modern-design-3d-wall-sticker-clock-watch-silent-home-decor-living-room-acrylic-mirror-silver-wall-clocks/,"Large Wall Clock Modern Design 3D Wall Sticker Clock Watch Silent Home Decor Living Room Acrylic Mirror Silver Wall Clocks",2020/03/Large-Wall-Clock-Modern-Design-3D-Wall-Sticker-Clock-Watch-Silent-Home-Decor-Living-Room-Acrylic-2.jpg
322957,https://nanacorner.com/product/yoja-21-521-3cm-watercolor-flowers-wall-sticker-decals-home-toilet-seat-stickers-decor-t1-0353/,"YOJA 21.5*21.3CM Watercolor Flowers Wall Sticker Decals Home Toilet Seat Stickers Decor T1-0353",2020/03/YOJA-21-5-21-3CM-Watercolor-Flowers-Wall-Sticker-Decals-Home-Toilet-Seat-Stickers-Decor-T1.jpg
322982,https://nanacorner.com/product/mountain-bike-vinyl-wall-clock-modern-design-cycling-biking-sport-vinyl-record-clock-wall-watch-home-decor-gifts-for-biker-12/,"Mountain Bike Vinyl Wall Clock Modern Design Cycling Biking Sport Vinyl Record Clock Wall Watch Home Decor Gifts for Biker 12""",2020/03/Mountain-Bike-Vinyl-Wall-Clock-Modern-Design-Cycling-Biking-Sport-Vinyl-Record-Clock-Wall-Watch-Home.jpg
322987,https://nanacorner.com/product/modern-large-wall-clock-3d-mirror-sticker-unique-big-number-watch-diy-decor-wall-clock-art-sticker-decal-home-modern-decoration-4/,"Modern Large Wall Clock 3d Mirror Sticker Unique Big Number Watch Diy Decor Wall Clock Art Sticker Decal Home Modern Decoration",2020/03/Modern-Large-Wall-Clock-3d-Mirror-Sticker-Unique-Big-Number-Watch-Diy-Decor-Wall-Clock-Art-12.jpg
323019,https://nanacorner.com/product/2020-creative-wall-clock-modern-design-for-home-office-decorative-hanging-living-room-classic-brief-metal-wall-watch/,"2020 Creative Wall Clock Modern Design For Home Office Decorative Hanging Living Room Classic Brief Metal Wall Watch",2020/03/2020-Creative-Wall-Clock-Modern-Design-For-Home-Office-Decorative-Hanging-Living-Room-Classic-Brief-Metal.jpg
323046,https://nanacorner.com/product/wall-clock-diy-self-adhesive-home-modern-analog-acrylic-mirror-mute-waterproof-kitchen-coffee-cups-decor-art-3d/,"Wall Clock DIY Self Adhesive Home Modern Analog Acrylic Mirror Mute Waterproof Kitchen Coffee Cups Decor Art 3D",2020/03/Wall-Clock-DIY-Self-Adhesive-Home-Modern-Analog-Acrylic-Mirror-Mute-Waterproof-Kitchen-Coffee-Cups-Decor.jpg
323086,https://nanacorner.com/product/digital-number-diy-wall-clock-quartz-mute-decorative-clock-kitchen-home-decor-self-adhesive-acrylic-wall-sticker-birds/,"Digital Number DIY Wall Clock Quartz Mute Decorative Clock Kitchen Home Decor Self-adhesive Acrylic Wall Sticker Birds",2020/03/Digital-Number-DIY-Wall-Clock-Quartz-Mute-Decorative-Clock-Kitchen-Home-Decor-Self-adhesive-Acrylic-Wall.jpg
323097,https://nanacorner.com/product/quartz-round-vintage-wall-clock-modern-design-cd-black-vinyl-record-clock-duvar-saati-horloge-mural-kitchen-watch-for-home-decor/,"Quartz Round Vintage wall clock modern design CD Black Vinyl Record Clock Duvar Saati Horloge Mural kitchen watch for Home Decor",2020/03/Quartz-Round-Vintage-wall-clock-modern-design-CD-Black-Vinyl-Record-Clock-Duvar-Saati-Horloge-Mural.jpg
323100,https://nanacorner.com/product/new-arrival-roman-numerals-frameless-large-acrylic-mirror-surface-diy-3d-wall-clock-home-office-school-wall-decor-clock-stickers/,"New Arrival Roman Numerals Frameless Large Acrylic Mirror Surface DIY 3D Wall Clock Home Office School Wall Decor Clock Stickers",2020/03/New-Arrival-Roman-Numerals-Frameless-Large-Acrylic-Mirror-Surface-DIY-3D-Wall-Clock-Home-Office-School.jpg
323161,https://nanacorner.com/product/3d-creative-dragon-ball-led-record-wall-clock-hollow-vinyl-cd-wall-clock-home-decor-black-clock-vintage-home-decoration/,"3D Creative Dragon Ball LED Record Wall Clock Hollow Vinyl CD Wall Clock Home Decor Black Clock Vintage Home Decoration",2020/03/3D-Creative-Dragon-Ball-LED-Record-Wall-Clock-Hollow-Vinyl-CD-Wall-Clock-Home-Decor-Black.jpg
323165,https://nanacorner.com/product/creative-mirror-stickers-3d-diy-moment-quartz-needle-clock-watch-wall-clocks-acrylic-home-diy-bedroom-modern-home-decoration-new-2/,"Creative Mirror Stickers 3D DIY Moment Quartz Needle Clock Watch Wall Clocks Acrylic Home DIY Bedroom Modern Home Decoration New",2020/03/Creative-Mirror-Stickers-3D-DIY-Moment-Quartz-Needle-Clock-Watch-Wall-Clocks-Acrylic-Home-DIY-Bedroom-6.jpg
323166,https://nanacorner.com/product/3-colors-cuckoo-quartz-wall-clock-modern-bird-home-living-room-hanging-watch-horologe-clocks-timer-office-home-decoration-gifts/,"3 Colors Cuckoo Quartz Wall Clock Modern Bird Home Living Room Hanging Watch Horologe Clocks Timer Office Home Decoration Gifts",2020/03/3-Colors-Cuckoo-Quartz-Wall-Clock-Modern-Bird-Home-Living-Room-Hanging-Watch-Horologe-Clocks-Timer.jpg
323168,https://nanacorner.com/product/creative-yoga-postures-wall-clock-gym-fitness-flexible-girl-silent-modern-clock-watch-home-decor-meditation-decor/,"Creative Yoga Postures Wall Clock GYM Fitness Flexible Girl Silent Modern Clock Watch Home Decor Meditation Decor",2020/03/Creative-Yoga-Postures-Wall-Clock-GYM-Fitness-Flexible-Girl-Silent-Modern-Clock-Watch-Home-Decor-Meditation.jpg
323198,https://nanacorner.com/product/modern-wall-clock-sacred-geometry-handmade-masterpiece-rustic-wooden-tree-of-life-wall-clock-infinity-tree-home-decor-zen/,"Modern Wall Clock Sacred Geometry Handmade Masterpiece Rustic Wooden Tree Of Life Wall Clock Infinity Tree Home Decor Zen",2020/03/Modern-Wall-Clock-Sacred-Geometry-Handmade-Masterpiece-Rustic-Wooden-Tree-Of-Life-Wall-Clock-Infinity-Tree.jpg
323201,https://nanacorner.com/product/diy-wall-clock-3d-mirror-surface-sticker-home-office-decor-clock/,"DIY Wall Clock 3D Mirror Surface Sticker Home Office Decor Clock",2020/03/DIY-Wall-Clock-3D-Mirror-Surface-Sticker-Home-Office-Decor-Clock.jpg
323208,https://nanacorner.com/product/office-8-inch-time-living-room-home-quartz-silent-wall-clock-plastic-accurate-modern-round-decorative-fashion-battery-operated/,"Office 8 Inch Time Living Room Home Quartz Silent Wall Clock Plastic Accurate Modern Round Decorative Fashion Battery Operated",2020/03/Office-8-Inch-Time-Living-Room-Home-Quartz-Silent-Wall-Clock-Plastic-Accurate-Modern-Round-Decorative-1.jpg
323227,https://nanacorner.com/product/ceramic-luxury-wall-clock-silent-modern-design-creative-large-wall-clock-living-room-reloj-pared-grande-home-decor-clocks-oo50wc/,"Ceramic Luxury Wall Clock Silent Modern Design Creative Large Wall Clock Living Room Reloj Pared Grande Home Decor Clocks OO50WC",2020/03/Ceramic-Luxury-Wall-Clock-Silent-Modern-Design-Creative-Large-Wall-Clock-Living-Room-Reloj-Pared-Grande.png
323276,https://nanacorner.com/product/large-wall-clock-creative-motorcycle-wall-watch-living-room-household-home-decor-retro-iron-bicycle-digital-clocks/,"Large Wall Clock Creative Motorcycle Wall Watch Living Room Household Home Decor Retro Iron Bicycle Digital Clocks",2020/03/Large-Wall-Clock-Creative-Motorcycle-Wall-Watch-Living-Room-Household-Home-Decor-Retro-Iron-Bicycle-Digital.jpg
323295,https://nanacorner.com/product/nordic-roman-numeral-metal-wall-clocks-retro-hollow-iron-round-art-black-gold-large-outdoor-garden-clock-home-decoration-40-47cm/,"Nordic Roman Numeral Metal Wall Clocks Retro Hollow Iron Round Art Black Gold Large Outdoor Garden Clock Home Decoration 40/47CM",2020/03/Nordic-Roman-Numeral-Metal-Wall-Clocks-Retro-Hollow-Iron-Round-Art-Black-Gold-Large-Outdoor-Garden.jpg
323339,https://nanacorner.com/product/luxury-wall-clock-modern-design-large-metal-living-room-creative-nordic-clocks-wall-home-decor-horloge-mural-gift-ideas-fz095/,"Luxury Wall Clock Modern Design Large Metal Living Room Creative Nordic Clocks Wall Home Decor Horloge Mural Gift Ideas FZ095",2020/03/Luxury-Wall-Clock-Modern-Design-Large-Metal-Living-Room-Creative-Nordic-Clocks-Wall-Home-Decor-Horloge.png
323347,https://nanacorner.com/product/large-wall-watches-modern-art-creative-quartz-silent-diy-acrylic-mirror-cylinder-wall-clock-for-home-decoration-50x60cm/,"Large Wall Watches Modern Art Creative Quartz Silent DIY Acrylic Mirror Cylinder Wall Clock for Home Decoration 50x60cm",2020/03/Large-Wall-Watches-Modern-Art-Creative-Quartz-Silent-DIY-Acrylic-Mirror-Cylinder-Wall-Clock-for-Home.jpg
323348,https://nanacorner.com/product/diy-5d-diamond-painting-clockuryke-wall-clock-full-drill-paint-by-number-kits-cross-stitch-embroidery-for-art-craft-home-decor/,"DIY 5D Diamond Painting Clock,URYKE Wall Clock Full Drill Paint By Number Kits Cross Stitch Embroidery for Art Craft Home Decor",2020/03/DIY-5D-Diamond-Painting-Clock-URYKE-Wall-Clock-Full-Drill-Paint-By-Number-Kits-Cross-Stitch.jpg
323366,https://nanacorner.com/product/pet-shop-cute-cat-decoration-pocket-watch-mute-bedroom-childrens-room-kindergarten-clock-classroom-creative-wall-clock/,"Pet Shop Cute Cat Decoration Pocket Watch Mute Bedroom CHILDREN'S Room Kindergarten Clock Classroom Creative Wall Clock",2020/03/Pet-Shop-Cute-Cat-Decoration-Pocket-Watch-Mute-Bedroom-CHILDREN-S-Room-Kindergarten-Clock-Classroom-Creative.jpg
323378,https://nanacorner.com/product/wall-clock-home-kitchen-mute-scan-3d-cat-mirror-black-wall-clock-modern-design-home-decoration-watch-wall-sticker-l522/,"Wall clock home kitchen mute scan 3D cat mirror black wall clock modern design home decoration watch wall sticker L522",2020/03/Wall-clock-home-kitchen-mute-scan-3D-cat-mirror-black-wall-clock-modern-design-home-decoration.jpg
323419,https://nanacorner.com/product/new-hot-quartz-sale-quiet-wall-clock-interesting-3d-diy-home-decor-clocks-roman-numeral-art-stickers-single-wall-watches/,"new hot quartz sale quiet wall clock interesting 3d diy home decor clocks roman numeral art stickers single wall watches",2020/03/new-hot-quartz-sale-quiet-wall-clock-interesting-3d-diy-home-decor-clocks-roman-numeral-art.jpg
323421,https://nanacorner.com/product/minimalist-clock-wall-clock-watch-clocks-3d-diy-acrylic-mirror-stickers-living-room-wall-home-decor-house-clock-on-the-wall/,"Minimalist Clock Wall Clock Watch Clocks 3d Diy Acrylic Mirror Stickers Living Room Wall Home Decor House Clock on The Wall",2020/03/Minimalist-Clock-Wall-Clock-Watch-Clocks-3d-Diy-Acrylic-Mirror-Stickers-Living-Room-Wall-Home-Decor.jpg
323426,https://nanacorner.com/product/fashion-wall-clock-modern-design-acrylic-decor-3d-mirror-diy-decor-decal-stickers-home-wall-clock/,"Fashion Wall Clock Modern Design Acrylic Decor 3D Mirror DIY Decor Decal Stickers Home Wall Clock",2020/03/Fashion-Wall-Clock-Modern-Design-Acrylic-Decor-3D-Mirror-DIY-Decor-Decal-Stickers-Home-Wall-Clock.jpg
323428,https://nanacorner.com/product/wall-sticker-clock-3d-diy-roman-numbers-acrylic-mirror-home-decor-mural-decals-living-room-mechanism-for-pendulum-modern19jul23/,"Wall Sticker Clock 3D DIY Roman Numbers Acrylic Mirror Home Decor Mural Decals living room mechanism for pendulum modern19JUL23",2020/03/Wall-Sticker-Clock-3D-DIY-Roman-Numbers-Acrylic-Mirror-Home-Decor-Mural-Decals-living-room-mechanism.jpg
323436,https://nanacorner.com/product/queen-vinyl-record-clock-home-decor-wall-art-duvar-saati/,"QUEEN  Vinyl Record Clock Home Decor Wall Art  duvar saati",2020/03/QUEEN-Vinyl-Record-Clock-Home-Decor-Wall-Art-duvar-saati.jpg
323507,https://nanacorner.com/product/diy-3d-roman-numbers-wall-clock-mirror-sticker-home-room-modern-office-decor-art-design-home-decoration-dropshipping-325w/,"DIY 3D Roman Numbers Wall Clock Mirror Sticker Home Room modern Office Decor Art Design Home decoration dropshipping 325W",2020/03/DIY-3D-Roman-Numbers-Wall-Clock-Mirror-Sticker-Home-Room-modern-Office-Decor-Art-Design-Home.jpg
323512,https://nanacorner.com/product/luxury-wall-clock-metal-nordic-modern-silent-clocks-wall-home-decor-creative-gold-home-watch-wall-relogio-de-parede-gift-fz755/,"Luxury Wall Clock Metal Nordic Modern Silent Clocks Wall Home Decor Creative Gold Home Watch Wall Relogio De Parede Gift FZ755",2020/03/Luxury-Wall-Clock-Metal-Nordic-Modern-Silent-Clocks-Wall-Home-Decor-Creative-Gold-Home-Watch-Wall.jpg
323523,https://nanacorner.com/product/diy-wall-clock-coffee-shape-acrylic-modern-design-wall-watch-removable-3d-mirror-wall-clock-for-living-room-home-decoration/,"DIY Wall Clock Coffee Shape Acrylic Modern Design Wall Watch Removable 3D Mirror Wall Clock For Living Room Home Decoration",2020/03/DIY-Wall-Clock-Coffee-Shape-Acrylic-Modern-Design-Wall-Watch-Removable-3D-Mirror-Wall-Clock-For.jpg
323525,https://nanacorner.com/product/hoomin-creative-melting-clock-home-decoration-gift-surrealist-salvador-dali-style-clocks-surreal-distorted-wall-clock/,"HOOMIN Creative Melting Clock Home Decoration Gift Surrealist Salvador Dali Style Clocks Surreal Distorted Wall Clock",2020/03/HOOMIN-Creative-Melting-Clock-Home-Decoration-Gift-Surrealist-Salvador-Dali-Style-Clocks-Surreal-Distorted-Wall-Clock.jpg
323591,https://nanacorner.com/product/novelty-home-funny-decoration-wooden-wall-color-sex-clock-circular-alarm-12-kinds-sexy-gestures-positions-living-room-2019/,"Novelty Home Funny Decoration Wooden Wall Color Sex Clock Circular Alarm 12 Kinds Sexy Gestures Positions Living Room 2019",2020/03/Novelty-Home-Funny-Decoration-Wooden-Wall-Color-Sex-Clock-Circular-Alarm-12-Kinds-Sexy-Gestures-Positions.jpg
323614,https://nanacorner.com/product/3d-wall-clock-acrylic-silent-chemistry-periodic-table-frameless-vintage-wall-clock-battery-operated-home-wall-decor-sticker-gift/,"3D Wall Clock Acrylic Silent Chemistry Periodic Table Frameless Vintage Wall Clock Battery Operated Home Wall Decor Sticker Gift",2020/03/3D-Wall-Clock-Acrylic-Silent-Chemistry-Periodic-Table-Frameless-Vintage-Wall-Clock-Battery-Operated-Home-Wall.jpg
323617,https://nanacorner.com/product/5-patterns-vintage-wall-clocks-roman-number-design-silent-room-decoration-home-decor-watches-large-wall-clocks-no-ticking-sound/,"5 Patterns Vintage Wall Clocks Roman Number Design Silent Room Decoration Home Decor Watches Large Wall Clocks No Ticking Sound",2020/03/5-Patterns-Vintage-Wall-Clocks-Roman-Number-Design-Silent-Room-Decoration-Home-Decor-Watches-Large-Wall.jpg
323627,https://nanacorner.com/product/acrylic-mirror-3d-wall-clock-big-quartz-watch-still-life-modern-hot-fashion-diy-clocks-living-room-home-decoration-stickers/,"Acrylic mirror 3d wall clock big quartz watch still life modern hot fashion diy clocks living room home decoration stickers",2020/03/Acrylic-mirror-3d-wall-clock-big-quartz-watch-still-life-modern-hot-fashion-diy-clocks-living.jpg
323710,https://nanacorner.com/product/american-pit-bull-decorative-3d-diy-wall-clock-american-staffordshire-terrier-fashion-home-clock-with-mirror-numbers-stickers/,"American Pit Bull Decorative 3D DIY Wall Clock American Staffordshire Terrier Fashion Home Clock With Mirror Numbers Stickers",2020/03/American-Pit-Bull-Decorative-3D-DIY-Wall-Clock-American-Staffordshire-Terrier-Fashion-Home-Clock-With-Mirror.jpeg
323753,https://nanacorner.com/product/2019-new-3d-acrylic-wall-clock-large-size-diy-mirror-sticker-quartz-living-room-home-decor-duvar-saati-reloj-27-37-47-inch/,"2019 New 3D Acrylic Wall Clock Large Size DIY Mirror Sticker Quartz Living Room Home Decor Duvar Saati Reloj 27/37/47 inch",2020/03/2019-New-3D-Acrylic-Wall-Clock-Large-Size-DIY-Mirror-Sticker-Quartz-Living-Room-Home-Decor.jpg
323759,https://nanacorner.com/product/diy-wall-clock-3d-mirror-surface-sticker-home-office-decor-clock-sw5/,"DIY Wall Clock 3D Mirror Surface Sticker Home Office Decor Clock sw5",2020/03/DIY-Wall-Clock-3D-Mirror-Surface-Sticker-Home-Office-Decor-Clock-sw5.jpg
323764,https://nanacorner.com/product/night-lights-non-ticking-easy-to-read-battery-operated-practical-office-luminous-wall-clock-home-decor-arabic-number-bedroom/,"Night Lights Non Ticking Easy To Read Battery Operated Practical Office Luminous Wall Clock Home Decor Arabic Number Bedroom",2020/03/Night-Lights-Non-Ticking-Easy-To-Read-Battery-Operated-Practical-Office-Luminous-Wall-Clock-Home-Decor.jpg
323792,https://nanacorner.com/product/retro-wood-wall-clock-modern-silent-wall-watch-home-japanese-style-wooden-needle-clocks-wall-home-decor-reloj-cocina-gift-fz750/,"Retro Wood Wall Clock Modern Silent Wall Watch Home Japanese Style Wooden Needle Clocks Wall Home Decor Reloj Cocina Gift FZ750",2020/03/Retro-Wood-Wall-Clock-Modern-Silent-Wall-Watch-Home-Japanese-Style-Wooden-Needle-Clocks-Wall-Home.jpg
323849,https://nanacorner.com/product/creative-modern-wall-clock-wood-kitchen-living-room-silent-bedroom-relogio-de-parede-gift-ideas-wall-watches-home-decor-b50/,"Creative Modern  Wall Clock Wood Kitchen   Living Room Silent Bedroom Relogio De Parede Gift Ideas  Wall Watches Home Decor B50",2020/03/Creative-Modern-Wall-Clock-Wood-Kitchen-Living-Room-Silent-Bedroom-Relogio-De-Parede-Gift-Ideas-Wall.jpg
323866,https://nanacorner.com/product/nordic-style-wall-clock-silent-transparent-acrylic-clock-home-living-room-retro-iron-round-face-black-large-outdoor-decor/,"Nordic  Style Wall Clock Silent Transparent Acrylic Clock  Home  Living Room Retro Iron Round Face Black Large Outdoor Decor",2020/03/Nordic-Style-Wall-Clock-Silent-Transparent-Acrylic-Clock-Home-Living-Room-Retro-Iron-Round-Face-Black.jpg
323889,https://nanacorner.com/product/saat-aerosmith-band-art-vinyl-record-wall-clock-decor-home-design-reloj/,"saat Aerosmith Band Art Vinyl Record  Wall Clock Decor Home Design reloj",2020/03/saat-Aerosmith-Band-Art-Vinyl-Record-Wall-Clock-Decor-Home-Design-reloj.jpg
323898,https://nanacorner.com/product/vintage-wooden-wall-clock-shabby-chic-rustic-kitchen-home-antique-watches-decor/,"Vintage Wooden Wall Clock Shabby Chic Rustic Kitchen Home Antique Watches Decor",2020/03/Vintage-Wooden-Wall-Clock-Shabby-Chic-Rustic-Kitchen-Home-Antique-Watches-Decor.jpg
323925,https://nanacorner.com/product/camelcade-wall-clock-desert-animals-camels-vinyl-record-clock-african-animals-camels-lined-up-wall-art-home-decor-wall-clock/,"Camelcade Wall Clock Desert Animals Camels Vinyl Record Clock African Animals Camels Lined Up Wall Art Home Decor Wall Clock",2020/03/Camelcade-Wall-Clock-Desert-Animals-Camels-Vinyl-Record-Clock-African-Animals-Camels-Lined-Up-Wall-Art.jpg
323956,https://nanacorner.com/product/nordic-wood-creative-pendulum-wall-clock-silent-wall-clock-modern-design-living-room-watch-horloge-mural-gift-home-decor/,"Nordic Wood Creative  Pendulum Wall  Clock  Silent Wall Clock Modern Design Living Room Watch Horloge Mural Gift Home Decor",2020/03/Nordic-Wood-Creative-Pendulum-Wall-Clock-Silent-Wall-Clock-Modern-Design-Living-Room-Watch-Horloge-Mural-2.jpg
323991,https://nanacorner.com/product/nordic-style-rabbit-wall-clock-silent-wooden-clock-for-home-living-room-suitable-for-room-decoration-black/,"Nordic Style Rabbit Wall Clock Silent Wooden Clock For Home Living Room Suitable For Room Decoration Black",2020/03/Nordic-Style-Rabbit-Wall-Clock-Silent-Wooden-Clock-For-Home-Living-Room-Suitable-For-Room-Decoration.jpg
324025,https://nanacorner.com/product/modern-design-mini-diy-large-wall-clock-sticker-gift-wall-big-clock-living-room-home-office-decor-christmas-gift-made-in-turkey/,"Modern Design Mini DIY Large Wall Clock Sticker gift Wall Big Clock Living Room Home Office Decor Christmas gift made in turkey",2020/03/Modern-Design-Mini-DIY-Large-Wall-Clock-Sticker-gift-Wall-Big-Clock-Living-Room-Home-Office.jpg
