121055,https://nanacorner.com/product/mini-cute-bathroom-kitchen-suction-wall-clock-shower-waterproof-timer-wall-window-mirror-shower-clock-decoration/,"Mini Cute Bathroom Kitchen Suction Wall Clock Shower Waterproof Timer Wall Window Mirror Shower Clock Decoration",2020/02/Mini-Cute-Bathroom-Kitchen-Suction-Wall-Clock-Shower-Waterproof-Timer-Wall-Window-Mirror-Shower-Clock-Decoration.jpg
121058,https://nanacorner.com/product/automotive-digital-clock-with-backlight-solar-luminous-display-24-hour-solar-electronic-clock-high-temperature-resistant-durable/,"Automotive Digital Clock With Backlight Solar Luminous Display 24-Hour Solar Electronic Clock High Temperature Resistant Durable",2020/02/Automotive-Digital-Clock-With-Backlight-Solar-Luminous-Display-24-Hour-Solar-Electronic-Clock-High-Temperature-Resistant.jpg
121061,https://nanacorner.com/product/3d-diy-large-wall-clock-modern-design-wall-sticker-clock-silent-home-decor-living-room-acrylic-mirror-nordic-wall-clock/,"3D DIY Large Wall Clock Modern Design Wall Sticker Clock Silent Home Decor Living Room Acrylic Mirror Nordic Wall Clock",2020/02/3D-DIY-Large-Wall-Clock-Modern-Design-Wall-Sticker-Clock-Silent-Home-Decor-Living-Room-Acrylic.jpg
121077,https://nanacorner.com/product/new-fashion-3d-wall-clock-modern-design-art-decorative-dome-round-watch-bell-clocks-home-decor-birthday-gifts/,"New fashion 3D wall clock modern design Art Decorative Dome Round Watch Bell clocks home decor birthday gifts",2020/02/New-fashion-3D-wall-clock-modern-design-Art-Decorative-Dome-Round-Watch-Bell-clocks-home-decor.jpg
121093,https://nanacorner.com/product/new-mini-precision-motorcycle-clocks-watch-waterproof-stick-on-motorbike-mount-watch-moto-digital-clock-with-stopwatch-2019/,"New Mini Precision Motorcycle Clocks Watch Waterproof Stick-On Motorbike Mount Watch Moto Digital Clock With Stopwatch 2019",2020/02/New-Mini-Precision-Motorcycle-Clocks-Watch-Waterproof-Stick-On-Motorbike-Mount-Watch-Moto-Digital-Clock-With.jpg
121117,https://nanacorner.com/product/accessories-luminous-air-vent-round-auto-car-clock-interior-outlet-universal-quartz-portable-needle-gauge-mini-with-clip/,"Accessories Luminous Air Vent Round Auto Car Clock Interior Outlet Universal Quartz Portable Needle Gauge Mini With Clip",2020/02/Accessories-Luminous-Air-Vent-Round-Auto-Car-Clock-Interior-Outlet-Universal-Quartz-Portable-Needle-Gauge-Mini.jpg
121124,https://nanacorner.com/product/modern-diy-large-wall-clock-3d-mirror-surface-sticker-home-decor-art-giant-wall-clock-watch-with-roman-numerals-big-clock/,"Modern DIY Large Wall Clock 3D Mirror Surface Sticker Home Decor Art Giant Wall Clock Watch With Roman Numerals Big Clock",2020/02/Modern-DIY-Large-Wall-Clock-3D-Mirror-Surface-Sticker-Home-Decor-Art-Giant-Wall-Clock-Watch.jpg
121157,https://nanacorner.com/product/hlzs-3-in-1-silent-quartz-wall-clock-quiet-sweep-movement-thermometer-hygrometer-no-ticking-home-art-decor-wall-clock/,"HLZS-3 in 1 Silent Quartz Wall Clock Quiet Sweep Movement Thermometer Hygrometer No-Ticking Home Art Decor Wall Clock",2020/02/HLZS-3-in-1-Silent-Quartz-Wall-Clock-Quiet-Sweep-Movement-Thermometer-Hygrometer-No-Ticking-Home.jpg
121180,https://nanacorner.com/product/alarm-clock-with-alarm-quartz-stainless-metal-alarm-battery-operated-creative-cute-mini-metal-small-electronic-small-19may13/,"Alarm Clock With Alarm Quartz Stainless Metal Alarm Battery Operated Creative Cute Mini Metal Small Electronic Small 19MAY13",2020/02/Alarm-Clock-With-Alarm-Quartz-Stainless-Metal-Alarm-Battery-Operated-Creative-Cute-Mini-Metal-Small-Electronic.jpg
121184,https://nanacorner.com/product/luminous-wall-clock-wood-silent-light-in-dark-night-nordic-fashion-wall-clock-non-ticking-clock-with-night-light-12-inch/,"Luminous Wall Clock Wood Silent light in dark night Nordic Fashion Wall Clock Non Ticking Clock With Night Light 12 Inch",2020/02/Luminous-Wall-Clock-Wood-Silent-light-in-dark-night-Nordic-Fashion-Wall-Clock-Non-Ticking-Clock.jpg
121185,https://nanacorner.com/product/silent-wall-clock-living-room-creative-fashion-clock-modern-minimalist-art-luxury-nordic-novelty-wall-watch-modern-design-w6/,"Silent Wall Clock Living Room Creative Fashion Clock Modern Minimalist Art Luxury Nordic Novelty Wall Watch Modern Design W6",2020/02/Silent-Wall-Clock-Living-Room-Creative-Fashion-Clock-Modern-Minimalist-Art-Luxury-Nordic-Novelty-Wall-Watch.jpg
121222,https://nanacorner.com/product/12-inch-cartoon-my-melody-swing-kids-girls-wall-quartz-clock-home-decro-for-bedroom-liveroom/,"12 Inch Cartoon My Melody Swing Kids Girls Wall Quartz Clock Home Decro for Bedroom Liveroom",2020/02/12-Inch-Cartoon-My-Melody-Swing-Kids-Girls-Wall-Quartz-Clock-Home-Decro-for-Bedroom-Liveroom.jpg
121224,https://nanacorner.com/product/digital-calendar-temperature-led-digital-alarm-clock-with-blue-backlight-electronic-calendar-thermometer-led-clock-with-time/,"Digital Calendar Temperature LED Digital Alarm Clock with Blue Backlight  Electronic Calendar Thermometer Led Clock With Time",2020/02/Digital-Calendar-Temperature-LED-Digital-Alarm-Clock-with-Blue-Backlight-Electronic-Calendar-Thermometer-Led-Clock-With.jpg
121278,https://nanacorner.com/product/diy-clock-mechanism-parts-classic-hanging-black-quartz-watch-wall-clock-movement-quartz-wall-clock-movement/,"DIY Clock Mechanism Parts Classic Hanging Black Quartz Watch Wall Clock Movement Quartz Wall Clock Movement",2020/02/DIY-Clock-Mechanism-Parts-Classic-Hanging-Black-Quartz-Watch-Wall-Clock-Movement-Quartz-Wall-Clock-Movement.jpg
121311,https://nanacorner.com/product/surreal-melting-distorted-wall-clocks-surrealist-salvador-dali-style-wall-watch-decoration/,"Surreal Melting Distorted Wall Clocks Surrealist Salvador Dali Style Wall Watch Decoration",2020/02/Surreal-Melting-Distorted-Wall-Clocks-Surrealist-Salvador-Dali-Style-Wall-Watch-Decoration.jpg
121331,https://nanacorner.com/product/clock-core-high-quality-quartz-clock-movement-mechanism-with-hook-diy-repair-parts/,"Clock Core High Quality Quartz Clock Movement Mechanism with Hook DIY Repair Parts",2020/02/Clock-Core-High-Quality-Quartz-Clock-Movement-Mechanism-with-Hook-DIY-Repair-Parts.jpg
121348,https://nanacorner.com/product/new-3d-mirror-effect-wall-clock-fairy-butterfly-home-decoration-clock-for-living-room-kids-bedroom-modern-design-silent-watch/,"new 3D mirror effect wall clock fairy butterfly home decoration clock for living room kids bedroom modern design silent watch",2020/02/new-3D-mirror-effect-wall-clock-fairy-butterfly-home-decoration-clock-for-living-room-kids-bedroom.jpg
121395,https://nanacorner.com/product/diy-3d-mirror-surface-large-number-wall-clock-sticker-home-decor-mirror-living-room-large-art-design-wall-clock-2/,"DIY 3D Mirror Surface Large Number Wall Clock Sticker Home Decor Mirror Living Room Large Art Design Wall Clock",2020/02/DIY-3D-Mirror-Surface-Large-Number-Wall-Clock-Sticker-Home-Decor-Mirror-Living-Room-Large-Art-6.jpg
121404,https://nanacorner.com/product/creative-cartoon-cute-cat-wall-clock-home-decor-watch-way-tail-move-silence-wall-clock-home-decoration-art-decal-for-living-room/,"Creative Cartoon Cute Cat Wall Clock Home Decor Watch Way Tail Move Silence Wall Clock Home Decoration Art Decal for Living Room",2020/02/Creative-Cartoon-Cute-Cat-Wall-Clock-Home-Decor-Watch-Way-Tail-Move-Silence-Wall-Clock-Home.jpg
121414,https://nanacorner.com/product/bz844-car-clock-timepiece-sticker-watch-interior-ornament-decoration-accessories-double-sided-adhesive-with-strong-viscous-force/,"BZ844 Car Clock Timepiece Sticker Watch Interior Ornament Decoration Accessories Double-Sided Adhesive With Strong Viscous Force",2020/02/BZ844-Car-Clock-Timepiece-Sticker-Watch-Interior-Ornament-Decoration-Accessories-Double-Sided-Adhesive-With-Strong-Viscous.jpg
121429,https://nanacorner.com/product/3d-led-digital-clock-snooze-bedroom-clocks-desk-alarm-hanging-wall-clock-12-24-hours-calendar-thermometer-home-furnishing-gift/,"3D LED Digital Clock Snooze Bedroom Clocks Desk Alarm Hanging Wall Clock 12/24 Hours Calendar Thermometer  Home Furnishing Gift",2020/02/3D-LED-Digital-Clock-Snooze-Bedroom-Clocks-Desk-Alarm-Hanging-Wall-Clock-12-24-Hours-Calendar.jpg
121476,https://nanacorner.com/product/creative-diy-3d-wall-clock-acrylic-coffee-cup-teapot-decorative-kitchen-wall-clocks-living-room-dining-room-home-decor-clock/,"Creative DIY 3D Wall Clock Acrylic Coffee Cup Teapot Decorative Kitchen Wall Clocks Living Room Dining Room Home Decor Clock",2020/02/Creative-DIY-3D-Wall-Clock-Acrylic-Coffee-Cup-Teapot-Decorative-Kitchen-Wall-Clocks-Living-Room-Dining.jpg
121479,https://nanacorner.com/product/multifunctional-3-in-1-digital-clock-thermometer-calendar-led-large-screen-electronic-table-clock-mute-mirror-alarm-clock/,"Multifunctional 3 In 1 Digital Clock Thermometer Calendar LED Large Screen Electronic Table Clock Mute Mirror Alarm Clock",2020/02/Multifunctional-3-In-1-Digital-Clock-Thermometer-Calendar-LED-Large-Screen-Electronic-Table-Clock-Mute-Mirror.jpg
121490,https://nanacorner.com/product/roman-numerals-frameless-large-acrylic-mirror-surface-3d-diy-wall-clock-home-office-school-wall-decor-clock-stickers/,"Roman Numerals Frameless Large Acrylic Mirror Surface 3D DIY Wall Clock Home Office School Wall Decor Clock Stickers",2020/02/Roman-Numerals-Frameless-Large-Acrylic-Mirror-Surface-3D-DIY-Wall-Clock-Home-Office-School-Wall-Decor.jpg
121517,https://nanacorner.com/product/new-2-in-1-car-digital-lcd-temperature-thermometer-clock-auto-accessories-car-digital-time-clock-air-vent-outlet-clip-on/,"New 2 in 1 Car Digital LCD Temperature Thermometer Clock Auto Accessories Car Digital Time Clock Air Vent Outlet Clip On",2020/02/New-2-in-1-Car-Digital-LCD-Temperature-Thermometer-Clock-Auto-Accessories-Car-Digital-Time-Clock.jpg
121573,https://nanacorner.com/product/1pc-unique-acrylic-wall-clock-creative-world-map-wall-hanging-clock-for-office-home-living-room-wall-art-home-decorations/,"1PC Unique Acrylic Wall Clock Creative World Map Wall Hanging Clock For Office Home Living Room Wall Art Home Decorations",2020/02/1PC-Unique-Acrylic-Wall-Clock-Creative-World-Map-Wall-Hanging-Clock-For-Office-Home-Living-Room.jpg
121576,https://nanacorner.com/product/sale-new-wall-clock-clocks-watch-stickers-diy-3d-acrylic-mirror-home-decoration-quartz-balcony-courtyard-needle-modern-hot/,"Sale New Wall Clock Clocks Watch Stickers Diy 3d Acrylic Mirror Home Decoration Quartz Balcony/courtyard Needle Modern hot",2020/02/Sale-New-Wall-Clock-Clocks-Watch-Stickers-Diy-3d-Acrylic-Mirror-Home-Decoration-Quartz-Balcony-courtyard.jpg
121588,https://nanacorner.com/product/wall-clock-29pcs-set-3d-angel-diy-mirror-effect-wall-sticker-backdrop-decor-removable-home-decoration-tools-stick-clocks/,"Wall Clock 29Pcs/Set 3D Angel DIY Mirror Effect Wall Sticker Backdrop Decor Removable Home Decoration Tools Stick Clocks",2020/02/Wall-Clock-29Pcs-Set-3D-Angel-DIY-Mirror-Effect-Wall-Sticker-Backdrop-Decor-Removable-Home-Decoration.jpg
121591,https://nanacorner.com/product/acrylic-large-wall-clock-sticker-mute-3d-diy-self-adhesive-wall-clock-modern-design-mirror-angel-wall-stickers-home-decor/,"Acrylic Large Wall Clock Sticker Mute 3D DIY Self adhesive Wall Clock Modern Design Mirror Angel Wall Stickers Home Decor",2020/02/Acrylic-Large-Wall-Clock-Sticker-Mute-3D-DIY-Self-adhesive-Wall-Clock-Modern-Design-Mirror-Angel.jpg
121604,https://nanacorner.com/product/car-digital-thermometer-with-2-probes-in-out-temperature-temp-gauge-meter-fahrenheit-celsius-thermograph-clock-auto-accessories/,"Car Digital Thermometer with 2 Probes In/Out Temperature Temp Gauge Meter Fahrenheit Celsius Thermograph Clock Auto Accessories",2020/02/Car-Digital-Thermometer-with-2-Probes-In-Out-Temperature-Temp-Gauge-Meter-Fahrenheit-Celsius-Thermograph-Clock.jpg
121675,https://nanacorner.com/product/dom-fashion-mens-sport-watch-men-analog-quartz-watches-waterproof-date-military-multifunction-wrist-watches-men-clock-m-612bl/,"DOM Fashion Men's Sport Watch Men Analog Quartz Watches Waterproof Date Military Multifunction Wrist Watches Men Clock M-612BL",2020/02/DOM-Fashion-Men-s-Sport-Watch-Men-Analog-Quartz-Watches-Waterproof-Date-Military-Multifunction-Wrist-Watches.jpg
121679,https://nanacorner.com/product/dom-2019-fashion-mens-sport-watch-men-analog-quartz-watches-waterproof-military-multifunction-wrist-watches-men-clock-m-635/,"DOM 2019 Fashion Men's Sport Watch Men Analog Quartz Watches Waterproof Military Multifunction Wrist Watches Men Clock M-635",2020/02/DOM-2019-Fashion-Men-s-Sport-Watch-Men-Analog-Quartz-Watches-Waterproof-Military-Multifunction-Wrist-Watches.jpg
121687,https://nanacorner.com/product/dom-watch-men-sport-casual-blue-face-simple-man-watch-waterproof-calendar-unique-fashion-casual-quartz-male-dress-clock-m-302/,"DOM Watch Men Sport Casual Blue Face Simple Man Watch Waterproof Calendar Unique Fashion Casual Quartz Male Dress Clock M-302",2020/02/DOM-Watch-Men-Sport-Casual-Blue-Face-Simple-Man-Watch-Waterproof-Calendar-Unique-Fashion-Casual-Quartz.jpg
121688,https://nanacorner.com/product/2020-reef-tiger-rt-top-brand-luxury-military-sport-watch-men-waterproof-fashion-quartz-watches-leather-band-male-clock-rga3363/,"2020 Reef Tiger/RT Top Brand Luxury Military Sport Watch Men Waterproof Fashion Quartz Watches Leather Band Male Clock RGA3363",2020/02/2020-Reef-Tiger-RT-Top-Brand-Luxury-Military-Sport-Watch-Men-Waterproof-Fashion-Quartz-Watches-Leather.jpg
121693,https://nanacorner.com/product/olmeca-hot-selling-fashion-relogio-masculino-chronograph-watches-wrist-watch-steel-clock-mens-waterproof-military-black-2/,"OLMECA Hot Selling Fashion Relogio Masculino Chronograph Watches Wrist Watch Steel Clock Men's Waterproof Military Black",2020/02/OLMECA-Hot-Selling-Fashion-Relogio-Masculino-Chronograph-Watches-Wrist-Watch-Steel-Clock-Men-s-Waterproof-Military-6.jpg
121694,https://nanacorner.com/product/dom-watch-men-luxury-business-gold-melt-steel-man-watch-waterproof-calendar-unique-fashion-casual-quartz-male-dress-clock-m-302/,"DOM Watch Men Luxury Business Gold Melt Steel Man Watch Waterproof Calendar Unique Fashion Casual Quartz Male Dress Clock M-302",2020/02/DOM-Watch-Men-Luxury-Business-Gold-Melt-Steel-Man-Watch-Waterproof-Calendar-Unique-Fashion-Casual-Quartz.jpg
121742,https://nanacorner.com/product/dom-watch-men-luxury-business-gold-melt-steel-man-watch-waterproof-calendar-unique-fashion-casual-quartz-male-dress-clock-m-302-2/,"DOM Watch Men Luxury Business Gold Melt Steel Man Watch Waterproof Calendar Unique Fashion Casual Quartz Male Dress Clock M-302",2020/02/DOM-Watch-Men-Luxury-Business-Gold-Melt-Steel-Man-Watch-Waterproof-Calendar-Unique-Fashion-Casual-Quartz-6.jpg
121753,https://nanacorner.com/product/modern-large-wall-clock-3d-mirror-sticker-unique-big-number-watch-diy-decor-wall-clock-art-sticker-decal-home-modern-decoration/,"Modern Large Wall Clock 3d Mirror Sticker Unique Big Number Watch Diy Decor Wall Clock Art Sticker Decal Home Modern Decoration",2020/02/Modern-Large-Wall-Clock-3d-Mirror-Sticker-Unique-Big-Number-Watch-Diy-Decor-Wall-Clock-Art.jpg
121765,https://nanacorner.com/product/2019-50m-waterproof-fashion-chronograph-brand-quartz-watch-men-military-stainless-steel-sports-watches-man-clock/,"2019 50M Waterproof Fashion Chronograph Brand Quartz Watch Men Military Stainless Steel Sports Watches Man Clock",2020/02/2019-50M-Waterproof-Fashion-Chronograph-Brand-Quartz-Watch-Men-Military-Stainless-Steel-Sports-Watches-Man-Clock.jpg
121768,https://nanacorner.com/product/high-quality-walnut-wall-clock-pointer-accessories-diy-hour-hand-minute-hand-second-hand-parts-10-12-inch/,"High-quality Walnut Wall Clock Pointer Accessories DIY Hour Hand Minute Hand Second Hand Parts 10/12 Inch",2020/02/High-quality-Walnut-Wall-Clock-Pointer-Accessories-DIY-Hour-Hand-Minute-Hand-Second-Hand-Parts-10.jpg
121775,https://nanacorner.com/product/motorcycle-handlebar-watch-waterproof-hand-grip-bar-mount-dial-top-mount-clock-for-scooter-bicycle-motor-bike-ornaments-2019/,"Motorcycle Handlebar Watch Waterproof Hand Grip Bar Mount Dial Top Mount Clock For Scooter Bicycle Motor Bike Ornaments 2019",2020/02/Motorcycle-Handlebar-Watch-Waterproof-Hand-Grip-Bar-Mount-Dial-Top-Mount-Clock-For-Scooter-Bicycle-Motor.jpg
121787,https://nanacorner.com/product/love-stereo-clock-watch-wall-clocks-clock-3d-diy-acrylic-mirror-stickers-home-decoration-living-room-quartz-needle-dropshipping/,"LOVE Stereo Clock Watch Wall Clocks Clock 3d Diy Acrylic Mirror Stickers Home Decoration Living Room Quartz Needle Dropshipping",2020/02/LOVE-Stereo-Clock-Watch-Wall-Clocks-Clock-3d-Diy-Acrylic-Mirror-Stickers-Home-Decoration-Living-Room.jpg
121832,https://nanacorner.com/product/creative-acrylic-large-wall-clock-modern-design-3d-living-room-wall-quartz-clock-quiet-clock-wall-home-decoration-free-shipping/,"Creative Acrylic Large Wall Clock Modern Design 3D Living Room Wall Quartz Clock Quiet Clock Wall Home Decoration Free Shipping",2020/02/Creative-Acrylic-Large-Wall-Clock-Modern-Design-3D-Living-Room-Wall-Quartz-Clock-Quiet-Clock-Wall.jpg
121842,https://nanacorner.com/product/diy-4-bit-rgb-led-glow-digital-clock-board-nixie-tube-clock-kit-diy-electronic-retro-desk-clock-rgb-tube-not-incl/,"DIY 4 Bit RGB LED Glow Digital Clock Board Nixie Tube Clock Kit DIY Electronic Retro Desk Clock  RGB Tube Not Incl",2020/02/DIY-4-Bit-RGB-LED-Glow-Digital-Clock-Board-Nixie-Tube-Clock-Kit-DIY-Electronic-Retro.jpg
121846,https://nanacorner.com/product/retro-european-wall-clocks-round-bedroom-living-room-digital-dial-mute-metal-wall-clock-home-decoration-dropshipping-325z/,"Retro European Wall Clocks Round Bedroom Living Room Digital Dial Mute Metal Wall Clock Home Decoration dropshipping 325Z",2020/02/Retro-European-Wall-Clocks-Round-Bedroom-Living-Room-Digital-Dial-Mute-Metal-Wall-Clock-Home-Decoration.jpg
121847,https://nanacorner.com/product/digital-time-projection-clock-mini-led-watch-projector-flashlight-hanging-rope-small-portable-clock-high-intensity-led-light/,"Digital Time Projection Clock Mini LED Watch Projector Flashlight Hanging Rope Small Portable Clock High-intensity LED Light",2020/02/Digital-Time-Projection-Clock-Mini-LED-Watch-Projector-Flashlight-Hanging-Rope-Small-Portable-Clock-High-intensity.jpg
121909,https://nanacorner.com/product/3d-led-alarm-clock-modern-digital-wall-clock-table-desktop-nightlight-saat-wall-for-home-living-room-office-decoration-19may13/,"3D LED Alarm Clock Modern Digital Wall Clock Table Desktop Nightlight Saat Wall For Home Living Room Office Decoration 19MAY13",2020/02/3D-LED-Alarm-Clock-Modern-Digital-Wall-Clock-Table-Desktop-Nightlight-Saat-Wall-For-Home-Living.jpg
121912,https://nanacorner.com/product/creative-3d-wall-clocks-quartz-acrylic-wall-clock-mirror-fairy-sticker-kids-decor-watch-home-living-room-decoration/,"Creative 3D Wall Clocks Quartz Acrylic Wall Clock Mirror Fairy Sticker Kids Decor Watch Home Living Room Decoration",2020/02/Creative-3D-Wall-Clocks-Quartz-Acrylic-Wall-Clock-Mirror-Fairy-Sticker-Kids-Decor-Watch-Home-Living.jpeg
121920,https://nanacorner.com/product/car-electronic-meter-car-round-clock-timepiece-auto-interior-ornament-sticker-watch-car-accessories/,"Car Electronic Meter Car Round Clock Timepiece Auto Interior Ornament Sticker Watch Car Accessories",2020/02/Car-Electronic-Meter-Car-Round-Clock-Timepiece-Auto-Interior-Ornament-Sticker-Watch-Car-Accessories.jpg
121942,https://nanacorner.com/product/hot-luminous-wall-clock12-inch-wooden-silent-non-ticking-kitchen-wall-clocks-with-night-lights-for-indoor-outdoor-living-room/,"Hot-Luminous Wall Clock,12 Inch Wooden Silent Non-Ticking Kitchen Wall Clocks With Night Lights For Indoor/Outdoor Living Room",2020/02/Hot-Luminous-Wall-Clock-12-Inch-Wooden-Silent-Non-Ticking-Kitchen-Wall-Clocks-With-Night-Lights-12.jpg
121983,https://nanacorner.com/product/osculum-type-lcd-vehicle-mounted-digital-window-thermometer-on-the-window-celsius-fahrenheit-car-digital-clock-new/,"Osculum Type LCD Vehicle-mounted Digital Window Thermometer On The Window Celsius Fahrenheit Car Digital Clock New",2020/02/Osculum-Type-LCD-Vehicle-mounted-Digital-Window-Thermometer-On-The-Window-Celsius-Fahrenheit-Car-Digital-Clock.jpg
121999,https://nanacorner.com/product/modern-design-mini-diy-large-wall-clock-sticker-mute-digital-3d-wall-big-clock-living-room-home-office-decor-christmas-gift-2/,"Modern Design Mini DIY Large Wall-Clock Sticker Mute Digital 3D Wall Big Clock Living Room Home Office Decor Christmas Gift",2020/02/Modern-Design-Mini-DIY-Large-Wall-Clock-Sticker-Mute-Digital-3D-Wall-Big-Clock-Living-Room-6.jpg
122014,https://nanacorner.com/product/3d-large-wall-clock-frameless-mirror-number-sticker-modern-art-decal-decor-3d-wall-sticker-clock-silent-home-decor-quartz/,"3D* Large Wall Clock Frameless Mirror Number Sticker Modern Art Decal Decor 3D Wall Sticker Clock Silent Home Decor Quartz",2020/02/3D-Large-Wall-Clock-Frameless-Mirror-Number-Sticker-Modern-Art-Decal-Decor-3D-Wall-Sticker-Clock.jpg
122027,https://nanacorner.com/product/faroot-modern-large-wall-clock-3d-mirror-sticker-unique-big-number-watch-diy-decor-acylic-mirror-fashion-clocks/,"FAROOT Modern Large Wall Clock 3D Mirror Sticker Unique Big Number Watch DIY Decor Acylic Mirror Fashion Clocks",2020/02/FAROOT-Modern-Large-Wall-Clock-3D-Mirror-Sticker-Unique-Big-Number-Watch-DIY-Decor-Acylic-Mirror.jpg
122030,https://nanacorner.com/product/creative-suck-clock-for-car-chuck-type-electronic-clock-automotive-digital-table-transparent-lcd-clock-drop-shipping/,"Creative Suck Clock for Car chuck type electronic clock automotive digital table transparent LCD clock Drop shipping",2020/02/Creative-Suck-Clock-for-Car-chuck-type-electronic-clock-automotive-digital-table-transparent-LCD-clock-Drop.jpg
122032,https://nanacorner.com/product/top-quality-12888-style-luxury-quartz-clock-movement-mechanism-parts-clock-repair-diy-clock-tools-thick-back-panel-clock/,"Top Quality 12888 Style Luxury Quartz Clock Movement Mechanism Parts Clock Repair DIY Clock Tools thick back panel clock",2020/02/Top-Quality-12888-Style-Luxury-Quartz-Clock-Movement-Mechanism-Parts-Clock-Repair-DIY-Clock-Tools-thick.jpg
122055,https://nanacorner.com/product/2in1-car-digital-lcd-clock-temperature-display-electronic-clock-auto-thermometer-car-automotive-blue-backlight-car-accessories/,"2In1 Car Digital LCD Clock Temperature Display Electronic Clock Auto Thermometer Car Automotive Blue Backlight Car Accessories",2020/02/2In1-Car-Digital-LCD-Clock-Temperature-Display-Electronic-Clock-Auto-Thermometer-Car-Automotive-Blue-Backlight-Car.jpg
122067,https://nanacorner.com/product/motor-bike-cycle-chopper-quartz-alarm-clock-watch-time-desk-room-kids-xmas-gift/,"Motor Bike Cycle Chopper Quartz Alarm Clock Watch Time Desk Room Kids Xmas Gift",2020/02/Motor-Bike-Cycle-Chopper-Quartz-Alarm-Clock-Watch-Time-Desk-Room-Kids-Xmas-Gift.jpg
122075,https://nanacorner.com/product/3d-wall-clock-mirror-wall-stickers-creative-diy-wall-clocks-removable-art-decal-sticker-home-decor-living-room-quartz-needle-hot/,"3D Wall Clock Mirror Wall Stickers Creative DIY Wall Clocks Removable Art Decal Sticker Home Decor Living Room Quartz Needle Hot",2020/02/3D-Wall-Clock-Mirror-Wall-Stickers-Creative-DIY-Wall-Clocks-Removable-Art-Decal-Sticker-Home-Decor.jpg
122079,https://nanacorner.com/product/modern-diy-2019-new-real-living-room-clocks-3d-mirror-sticke-big-wall-clock-home-decoration-acrylic-diy-watch-stickers/,"Modern DIY 2019 new real living room clocks 3d mirror sticke Big wall clock home decoration acrylic diy watch stickers",2020/02/Modern-DIY-2019-new-real-living-room-clocks-3d-mirror-sticke-Big-wall-clock-home-decoration.jpg
122085,https://nanacorner.com/product/1pcs-diy-clock-mechanism-sun-12888-clock-accessory-kits-silent-smooth-quartz-movement-8-11-13-16-19-22-mm-precision-shaft/,"1Pcs DIY Clock mechanism SUN 12888 Clock Accessory kits Silent Smooth Quartz Movement 8 /11 /13 /16 /19 /22 mm Precision shaft",2020/02/1Pcs-DIY-Clock-mechanism-SUN-12888-Clock-Accessory-kits-Silent-Smooth-Quartz-Movement-8-11-13.jpg
122107,https://nanacorner.com/product/3d-diy-acrylic-watch-wall-clocks-coffee-timeclock-cup-shape-wall-sticker-hollow-numeral-clock-for-kitchen-home-decoration/,"3D DIY Acrylic Watch Wall Clocks Coffee Timeclock Cup Shape Wall Sticker Hollow Numeral Clock For Kitchen Home Decoration",2020/02/3D-DIY-Acrylic-Watch-Wall-Clocks-Coffee-Timeclock-Cup-Shape-Wall-Sticker-Hollow-Numeral-Clock-For.jpg
122115,https://nanacorner.com/product/mini-digital-car-electronic-clock-electronic-watch-lcd-display-digital-with-self-adhesive-bracket/,"Mini Digital Car Electronic Clock Electronic Watch LCD Display Digital With Self-Adhesive Bracket",2020/02/Mini-Digital-Car-Electronic-Clock-Electronic-Watch-LCD-Display-Digital-With-Self-Adhesive-Bracket.jpg
122136,https://nanacorner.com/product/elegant-piano-key-clock-music-notes-wave-round-modern-wall-clock-without-battery-black-white-acrylic/,"Elegant Piano Key Clock Music Notes Wave Round Modern Wall Clock Without Battery Black + White Acrylic",2020/02/Elegant-Piano-Key-Clock-Music-Notes-Wave-Round-Modern-Wall-Clock-Without-Battery-Black-White-Acrylic.jpg
122145,https://nanacorner.com/product/12-inch-night-light-function-wooden-wall-clock-vintage-rustic-country-tuscan-style-for-kitchen-office-home-silent-non-tickin/,"12 Inch Night Light Function Wooden Wall Clock Vintage Rustic Country Tuscan Style For Kitchen Office Home Silent &amp; Non-Tickin",2020/02/12-Inch-Night-Light-Function-Wooden-Wall-Clock-Vintage-Rustic-Country-Tuscan-Style-For-Kitchen-Office.jpg
122150,https://nanacorner.com/product/vintage-wooden-round-square-wall-clock-large-shabby-chic-rustic-kitchen-home-antique-living-room-decorations/,"Vintage Wooden Round Square Wall Clock Large Shabby Chic Rustic Kitchen Home Antique Living Room Decorations",2020/02/Vintage-Wooden-Round-Square-Wall-Clock-Large-Shabby-Chic-Rustic-Kitchen-Home-Antique-Living-Room-Decorations.jpg
