378157,https://wallcorners.com/product/american-style-shell-chair-light-luxury-fabric-single-sofa-living-room-balcony-bedroom-small-flat-simple-modern-leisure-chair/,"American Style Shell Chair Light Luxury Fabric Single Sofa Living Room Balcony Bedroom Small Flat Simple Modern Leisure Chair",2020/04/American-Style-Shell-Chair-Light-Luxury-Fabric-Single-Sofa-Living-Room-Balcony-Bedroom-Small-Flat-Simple.jpg
378279,https://wallcorners.com/product/adult-home-camping-one-seat-inflatable-sofa-round-lazy-sofa-flocked-pvc-comfortable-portable-air-chairs/,"Adult Home Camping One Seat Inflatable Sofa Round Lazy Sofa Flocked PVC Comfortable Portable  Air Chairs",2020/04/Adult-Home-Camping-One-Seat-Inflatable-Sofa-Round-Lazy-Sofa-Flocked-PVC-Comfortable-Portable-Air-Chairs.jpg
378288,https://wallcorners.com/product/modern-armchair-single-sofa-seat-home-living-room-or-bedroom-furniture-leisure-sofa-chair-modern-accent-chair-relax-design-chair/,"Modern Armchair Single Sofa Seat Home Living Room or Bedroom Furniture Leisure Sofa Chair Modern Accent Chair Relax Design Chair",2020/04/Modern-Armchair-Single-Sofa-Seat-Home-Living-Room-or-Bedroom-Furniture-Leisure-Sofa-Chair-Modern-Accent.jpg
378295,https://wallcorners.com/product/light-luxury-nordic-single-leisure-small-sofa-net-red-section-ins-wind-bedroom-living-room-simple-balcony-american-leisure-chair/,"Light luxury Nordic single leisure small sofa net red section ins wind bedroom living room simple balcony American leisure chair",2020/04/Light-luxury-Nordic-single-leisure-small-sofa-net-red-section-ins-wind-bedroom-living-room-simple.jpg
378302,https://wallcorners.com/product/home-furniture-softeating-modern-design-accordin-folding-paper-stool-sofa-chair-kraft-paper-relaxing-foot-living-dining-room/,"Home Furniture Softeating Modern Design Accordin Folding Paper Stool Sofa Chair Kraft Paper Relaxing Foot  Living  Dining Room",2020/04/Home-Furniture-Softeating-Modern-Design-Accordin-Folding-Paper-Stool-Sofa-Chair-Kraft-Paper-Relaxing-Foot-Living.jpg
378308,https://wallcorners.com/product/360-degree-swivel-folded-video-game-chair-floor-lazy-man-sofa-chair-for-living-room-bedroom-furniture-ergonomic-leisure-chair/,"360 Degree Swivel Folded Video Game Chair Floor Lazy Man Sofa Chair For Living Room Bedroom Furniture Ergonomic Leisure Chair",2020/04/360-Degree-Swivel-Folded-Video-Game-Chair-Floor-Lazy-Man-Sofa-Chair-For-Living-Room-Bedroom.jpg
378320,https://wallcorners.com/product/modern-living-room-lazy-sofa-couch-floor-gaming-sofa-chair-folding-adjustab-sleeping-sofa-bed-lazy-living-room-furniture/,"Modern Living Room Lazy Sofa Couch Floor Gaming Sofa Chair Folding Adjustab Sleeping Sofa Bed Lazy Living Room Furniture",2020/04/Modern-Living-Room-Lazy-Sofa-Couch-Floor-Gaming-Sofa-Chair-Folding-Adjustab-Sleeping-Sofa-Bed-Lazy.jpg
378345,https://wallcorners.com/product/adjustable-comfort-floor-folding-sofa-chair-for-home-living-room-furniture-modern-foldable-japanese-floor-chair-lazy-couch-sofa/,"Adjustable Comfort Floor Folding Sofa Chair For Home Living Room Furniture Modern Foldable Japanese Floor Chair Lazy Couch Sofa",2020/04/Adjustable-Comfort-Floor-Folding-Sofa-Chair-For-Home-Living-Room-Furniture-Modern-Foldable-Japanese-Floor-Chair.jpg
378351,https://wallcorners.com/product/new-living-room-sofa-chair-modern-simple-lazy-people-use-nordic-wooden-stool-dining-room-back-chair-learning-simple-desk-chair/,"NEW Living Room Sofa Chair Modern Simple Lazy People Use Nordic Wooden Stool Dining Room Back Chair Learning Simple Desk Chair",2020/04/NEW-Living-Room-Sofa-Chair-Modern-Simple-Lazy-People-Use-Nordic-Wooden-Stool-Dining-Room-Back.jpg
378362,https://wallcorners.com/product/folding-floor-chair-for-living-room-janpanese-lazy-sofa-soft-futon-with-armrest-adjustable-back-multi-function-furniture-2/,"Folding Floor Chair for Living Room Janpanese Lazy Sofa Soft Futon with Armrest &amp; Adjustable Back Multi Function Furniture",2020/04/Folding-Floor-Chair-for-Living-Room-Janpanese-Lazy-Sofa-Soft-Futon-with-Armrest-Adjustable-Back-Multi-6.jpg
378367,https://wallcorners.com/product/leather-round-stool-low-stool-clothing-shop-coffee-table-sofa-stool-living-room-dressing-table-change-shoe-bench-custom-stool-gi/,"Leather Round Stool Low Stool Clothing Shop Coffee Table Sofa Stool Living Room Dressing Table Change Shoe Bench Custom Stool Gi",2020/04/Leather-Round-Stool-Low-Stool-Clothing-Shop-Coffee-Table-Sofa-Stool-Living-Room-Dressing-Table-Change.jpg
378384,https://wallcorners.com/product/lounge-chair-armchair-mid-century-modern-accent-chair-wood-frame-leisure-single-sofa-chair-for-living-room-bedroom-furniture/,"Lounge Chair Armchair Mid Century Modern Accent Chair Wood Frame Leisure Single Sofa Chair for Living Room, Bedroom Furniture",2020/04/Lounge-Chair-Armchair-Mid-Century-Modern-Accent-Chair-Wood-Frame-Leisure-Single-Sofa-Chair-for-Living.jpg
378395,https://wallcorners.com/product/lazy-sofa-tatami-single-and-double-furniture-bed-floor-floating-window-balcony-bedroom-living-room-leisure-chair/,"Lazy Sofa, Tatami, Single And Double Furniture Bed, Floor, Floating Window, Balcony, Bedroom, Living Room, Leisure Chair",2020/04/Lazy-Sofa-Tatami-Single-And-Double-Furniture-Bed-Floor-Floating-Window-Balcony-Bedroom-Living-Room-Leisure.jpg
378409,https://wallcorners.com/product/floor-folding-single-sofa-chair-with-ottoman-japanese-style-lounge-recliner-occasional-accent-chair-for-living-room-furniture/,"Floor Folding Single Sofa Chair  With Ottoman Japanese Style Lounge Recliner Occasional Accent Chair For Living Room Furniture",2020/04/Floor-Folding-Single-Sofa-Chair-With-Ottoman-Japanese-Style-Lounge-Recliner-Occasional-Accent-Chair-For-Living.jpg
378418,https://wallcorners.com/product/nordic-leather-single-sofa-light-luxury-designer-living-room-rotating-leisure-chair-lazy-lounge-chair-tiger-chair-snail-chair/,"Nordic leather single sofa light luxury designer living room rotating leisure chair lazy lounge chair tiger chair snail chair",2020/04/Nordic-leather-single-sofa-light-luxury-designer-living-room-rotating-leisure-chair-lazy-lounge-chair-tiger.jpg
378449,https://wallcorners.com/product/30-nordic-single-living-room-sofa-balcony-apartment-mini-chair-modern-minimalist-sofa-personality-leisure-bedroom-room-chair/,"30%  Nordic single living room sofa balcony apartment mini chair modern minimalist sofa personality leisure bedroom room chair",2020/04/30-Nordic-single-living-room-sofa-balcony-apartment-mini-chair-modern-minimalist-sofa-personality-leisure-bedroom.jpg
378456,https://wallcorners.com/product/japanese-floor-chair-folding-adjustable-lazy-sofa-chair-furniture-bedroom-living-room-playroom-balcony-adjustable-gaming-chair/,"Japanese Floor Chair Folding Adjustable Lazy Sofa Chair Furniture Bedroom Living Room Playroom Balcony Adjustable Gaming Chair",2020/04/Japanese-Floor-Chair-Folding-Adjustable-Lazy-Sofa-Chair-Furniture-Bedroom-Living-Room-Playroom-Balcony-Adjustable-Gaming.jpg
378468,https://wallcorners.com/product/light-luxury-single-sofa-chair-back-nordic-simple-tiger-chair-living-room-fabric-lounge-chair-lazy-chair/,"Light luxury single sofa chair back Nordic simple tiger chair living room fabric lounge chair lazy chair",2020/04/Light-luxury-single-sofa-chair-back-Nordic-simple-tiger-chair-living-room-fabric-lounge-chair-lazy.jpg
378475,https://wallcorners.com/product/light-luxury-fabric-single-sofa-living-room-balcony-bedroom-small-apartment-simple-modern-lounge-chair-2/,"Light luxury fabric single sofa living room balcony bedroom small apartment simple modern lounge chair",2020/04/Light-luxury-fabric-single-sofa-living-room-balcony-bedroom-small-apartment-simple-modern-lounge-chair-5.jpg
378483,https://wallcorners.com/product/wooden-legs-solid-color-stools-imitation-leather-stools-change-shoes-stool-fashion-creative-sofa-stool-wear-shoes-sitting-pier-d/,"Wooden Legs Solid Color Stools Imitation Leather Stools Change Shoes Stool Fashion Creative Sofa Stool Wear Shoes Sitting Pier D",2020/04/Wooden-Legs-Solid-Color-Stools-Imitation-Leather-Stools-Change-Shoes-Stool-Fashion-Creative-Sofa-Stool-Wear.jpg
378533,https://wallcorners.com/product/multifunctional-fabric-bed-lazy-sofa-single-bay-window-tatami-internet-cafe-computer-legless-adjustable-folding-chair/,"Multifunctional Fabric Bed Lazy Sofa Single Bay Window Tatami Internet Cafe Computer Legless Adjustable Folding Chair",2020/04/Multifunctional-Fabric-Bed-Lazy-Sofa-Single-Bay-Window-Tatami-Internet-Cafe-Computer-Legless-Adjustable-Folding-Chair.jpg
378540,https://wallcorners.com/product/floor-chair-foldable-single-small-sofa-bed-computer-back-chair-floor-sofa/,"Floor chair foldable single small sofa bed computer back chair floor sofa",2020/04/Floor-chair-foldable-single-small-sofa-bed-computer-back-chair-floor-sofa.jpg
378549,https://wallcorners.com/product/nordic-style-single-sofa-chair-leisure-chair-living-room-small-chair-net-red-nail-shop-stool-light-luxury-lounge-chair-bar-chair/,"Nordic Style Single Sofa Chair Leisure Chair Living Room Small Chair Net Red Nail Shop Stool Light Luxury Lounge Chair Bar Chair",2020/04/Nordic-Style-Single-Sofa-Chair-Leisure-Chair-Living-Room-Small-Chair-Net-Red-Nail-Shop-Stool.jpg
378554,https://wallcorners.com/product/casual-accent-chair-with-button-tufts-upholstered-living-room-bedroom-side-chair-furniture-modern-mid-century-chair-without-arms/,"Casual Accent Chair with Button Tufts-Upholstered Living Room Bedroom Side Chair Furniture Modern Mid Century Chair Without Arms",2020/04/Casual-Accent-Chair-with-Button-Tufts-Upholstered-Living-Room-Bedroom-Side-Chair-Furniture-Modern-Mid-Century.jpg
378574,https://wallcorners.com/product/customizable-nordic-single-sofa-chair-light-luxury-simple-modern-ins-living-room-chair-office-business-reception-lazy-sofa-chair/,"Customizable Nordic Single Sofa Chair Light Luxury Simple Modern Ins Living Room Chair Office Business Reception Lazy Sofa Chair",2020/04/Customizable-Nordic-Single-Sofa-Chair-Light-Luxury-Simple-Modern-Ins-Living-Room-Chair-Office-Business-Reception.jpg
378645,https://wallcorners.com/product/nordic-modren-peacock-shape-living-room-chair-sofa-chair-wrought-iron-ins-chair-leisure-customized-creative-simple-minimalist/,"nordic modren peacock shape  living room chair sofa chair wrought iron ins chair Leisure customized creative simple minimalist",2020/04/nordic-modren-peacock-shape-living-room-chair-sofa-chair-wrought-iron-ins-chair-Leisure-customized-creative.jpg
378659,https://wallcorners.com/product/home-furniture-softeating-modern-design-accordin-folding-paper-stool-sofa-chair-kraft-paper-relaxing-foot-living-dining-room-2/,"Home Furniture Softeating Modern Design Accordin Folding Paper Stool Sofa Chair Kraft Paper Relaxing Foot  living &amp; Dining Room",2020/04/Home-Furniture-Softeating-Modern-Design-Accordin-Folding-Paper-Stool-Sofa-Chair-Kraft-Paper-Relaxing-Foot-living.jpg
378664,https://wallcorners.com/product/nordic-light-luxury-leather-single-sofa-chair-living-room-fabric-sofa-single-chair-high-back-chair-tiger-chair/,"Nordic light luxury leather single sofa chair living room fabric sofa single chair high back chair tiger chair",2020/04/Nordic-light-luxury-leather-single-sofa-chair-living-room-fabric-sofa-single-chair-high-back-chair.jpg
378671,https://wallcorners.com/product/louis-fashion-living-room-chairs-single-sofa-nordic-creative-leisure-fabric-balcony-bedroom/,"Louis Fashion Living Room Chairs Single Sofa Nordic Creative Leisure Fabric Balcony Bedroom",2020/04/Louis-Fashion-Living-Room-Chairs-Single-Sofa-Nordic-Creative-Leisure-Fabric-Balcony-Bedroom.jpg
378678,https://wallcorners.com/product/lazy-sofa-single-folding-bedroom-sofa-creative-tatami-minimalist-modern-lounge-chair-living-room/,"Lazy sofa single folding bedroom sofa creative tatami minimalist modern lounge chair living room",2020/04/Lazy-sofa-single-folding-bedroom-sofa-creative-tatami-minimalist-modern-lounge-chair-living-room.jpg
378684,https://wallcorners.com/product/reclining-chair-folding-lunch-break-balcony-leisure-backrest-nap-chair-office-home-bed-lazy-sofa-portable-chair/,"Reclining chair folding lunch break balcony leisure backrest nap chair office home bed lazy sofa portable chair",2020/04/Reclining-chair-folding-lunch-break-balcony-leisure-backrest-nap-chair-office-home-bed-lazy-sofa-portable.jpg
378701,https://wallcorners.com/product/modern-fashion-single-sofa-chair-armrest-nordic-minimalist-sofa-living-room-chair-flannelette-soft-seat-cushion-metal-iron-frame/,"Modern Fashion Single Sofa Chair Armrest Nordic Minimalist Sofa Living Room Chair Flannelette Soft Seat Cushion Metal Iron Frame",2020/04/Modern-Fashion-Single-Sofa-Chair-Armrest-Nordic-Minimalist-Sofa-Living-Room-Chair-Flannelette-Soft-Seat-Cushion.jpg
378708,https://wallcorners.com/product/manufacturer-supply-chair-frp-sofa-nordic-leisure-lounge-chair-hotel-creative-furniture/,"Manufacturer supply chair FRP sofa Nordic leisure lounge chair hotel creative furniture",2020/04/Manufacturer-supply-chair-FRP-sofa-Nordic-leisure-lounge-chair-hotel-creative-furniture.jpg
378718,https://wallcorners.com/product/nordic-ins-light-luxury-cloth-wrought-iron-net-red-single-small-sofa-simple-living-room-bedroom-balcony-leisure-high-chair-pink/,"Nordic Ins Light Luxury Cloth Wrought Iron Net Red Single Small Sofa Simple Living Room Bedroom Balcony Leisure High Chair pink",2020/04/Nordic-Ins-Light-Luxury-Cloth-Wrought-Iron-Net-Red-Single-Small-Sofa-Simple-Living-Room-Bedroom.jpg
378732,https://wallcorners.com/product/new-nordic-iron-art-dining-chair-household-modern-simple-ins-industrial-sofa-chair-leisure-backrest-chair-living-room-furniture/,"New Nordic Iron Art Dining Chair Household Modern Simple Ins Industrial Sofa Chair Leisure Backrest Chair Living Room Furniture",2020/04/New-Nordic-Iron-Art-Dining-Chair-Household-Modern-Simple-Ins-Industrial-Sofa-Chair-Leisure-Backrest-Chair.jpg
378734,https://wallcorners.com/product/country-style-lounge-sofa-chair-floor-couch-for-living-room-furniture-bedroom-reclining-two-seat-sofa-chair-foldable-loveseat/,"Country style Lounge Sofa Chair Floor Couch For Living Room Furniture Bedroom Reclining Two Seat Sofa Chair Foldable Loveseat",2020/04/Country-style-Lounge-Sofa-Chair-Floor-Couch-For-Living-Room-Furniture-Bedroom-Reclining-Two-Seat-Sofa.jpg
378759,https://wallcorners.com/product/nordic-single-sofa-chair-modern-minimalist-designer-light-luxury-leisure-lazy-chair-tiger-chair-snail-chair/,"Nordic single sofa chair modern minimalist designer light luxury leisure lazy chair tiger chair snail chair",2020/04/Nordic-single-sofa-chair-modern-minimalist-designer-light-luxury-leisure-lazy-chair-tiger-chair-snail-chair.jpg
378834,https://wallcorners.com/product/floor-chair-folding-adjustable-gaming-couch-w-backrest-lazy-lounge-sofa-bed-home-furniture-floor-leisure-chair-for-living-room/,"Floor Chair Folding Adjustable Gaming Couch W/ Backrest Lazy Lounge Sofa Bed Home Furniture Floor Leisure Chair For Living Room",2020/04/Floor-Chair-Folding-Adjustable-Gaming-Couch-W-Backrest-Lazy-Lounge-Sofa-Bed-Home-Furniture-Floor-Leisure.jpg
378854,https://wallcorners.com/product/nordic-single-sofa-chair-simple-modern-lazy-sofa-balcony-leisure-armchair-american-cloth-tiger-chair/,"Nordic Single Sofa Chair Simple Modern Lazy Sofa Balcony Leisure Armchair American Cloth Tiger Chair",2020/04/Nordic-Single-Sofa-Chair-Simple-Modern-Lazy-Sofa-Balcony-Leisure-Armchair-American-Cloth-Tiger-Chair.jpg
378860,https://wallcorners.com/product/ins-fabric-art-sofa-chair-modern-simplicity-living-room-furniture-light-extravagant-nordic-restaurant-chairs-for-sale/,"Ins Fabric Art Sofa Chair Modern Simplicity Living Room Furniture Light Extravagant Nordic Restaurant Chairs for Sale",2020/04/Ins-Fabric-Art-Sofa-Chair-Modern-Simplicity-Living-Room-Furniture-Light-Extravagant-Nordic-Restaurant-Chairs-for.jpg
378867,https://wallcorners.com/product/15-adjustable-floor-chair-gaming-sofas-special-design-for-indoor-game-lover-hangout-living-room-funiture-with-breathable-cover/,"15% Adjustable Floor Chair Gaming Sofas Special Design for Indoor Game Lover Hangout Living Room Funiture with Breathable Cover",2020/04/15-Adjustable-Floor-Chair-Gaming-Sofas-Special-Design-for-Indoor-Game-Lover-Hangout-Living-Room-Funiture.jpg
378874,https://wallcorners.com/product/new-retro-modern-living-room-chair-home-dining-chair-for-bedroom-fabric-upholstered-wood-lounge-chair-single-gray-wooden-sofa/,"New Retro Modern Living Room Chair Home Dining Chair For Bedroom Fabric Upholstered Wood Lounge Chair Single Gray Wooden Sofa",2020/04/New-Retro-Modern-Living-Room-Chair-Home-Dining-Chair-For-Bedroom-Fabric-Upholstered-Wood-Lounge-Chair.jpg
378884,https://wallcorners.com/product/2-sizes-leather-comfortable-simple-six-button-linen-sofa-chair-with-elm-legs-modern-furniture-chairs-living-room-furniture-hwc/,"2 Sizes Leather Comfortable Simple Six-button Linen Sofa Chair with Elm Legs Modern Furniture Chairs Living Room Furniture HWC",2020/04/2-Sizes-Leather-Comfortable-Simple-Six-button-Linen-Sofa-Chair-with-Elm-Legs-Modern-Furniture-Chairs.jpg
378899,https://wallcorners.com/product/floor-chair-adjustable-backrest-foldable-lazy-lounge-sofa-soft-cushion-meditation-for-home-living-room-furniture-leisure-chair/,"Floor Chair Adjustable Backrest Foldable Lazy Lounge Sofa Soft Cushion Meditation For Home Living Room Furniture Leisure Chair",2020/04/Floor-Chair-Adjustable-Backrest-Foldable-Lazy-Lounge-Sofa-Soft-Cushion-Meditation-For-Home-Living-Room-Furniture.jpg
378919,https://wallcorners.com/product/help-walk-living-room-chairs-foldable-sofa-walking-stick-aluminum-alloy-light-and-strong-crutch-chair-for-old-disabled/,"Help Walk Living Room Chairs Foldable Sofa Walking Stick Aluminum Alloy Light And Strong Crutch Chair For Old Disabled",2020/04/Help-Walk-Living-Room-Chairs-Foldable-Sofa-Walking-Stick-Aluminum-Alloy-Light-And-Strong-Crutch-Chair.jpg
378922,https://wallcorners.com/product/nordic-fashion-balcony-wooden-chair-bedroom-living-room-furniture-sofa/,"Nordic fashion balcony wooden chair bedroom living room furniture sofa",2020/04/Nordic-fashion-balcony-wooden-chair-bedroom-living-room-furniture-sofa.png
378926,https://wallcorners.com/product/living-room-furniture-purple-single-sofa-chair-wa560/,"Living room furniture purple single sofa chair WA560",2020/04/Living-room-furniture-purple-single-sofa-chair-WA560.jpg
