361455,https://wallcorners.com/product/topfinel-stretch-sofa-cover-single-two-three-four-seat-luxury-nordic-couch-cover-for-living-room-multi-patterns-sofa-protector/,"Topfinel Stretch Sofa Cover Single/Two/Three/Four Seat Luxury Nordic Couch Cover For Living Room Multi Patterns Sofa Protector",2020/04/Topfinel-Stretch-Sofa-Cover-Single-Two-Three-Four-Seat-Luxury-Nordic-Couch-Cover-For-Living-Room.jpg
361460,https://wallcorners.com/product/meijuner-sofa-cover-solid-color-elastic-universal-slipcover-all-inclusive-anti-slip-sofa-covers-towel-for-dining-room-y402/,"Meijuner Sofa Cover Solid Color Elastic Universal Slipcover All-inclusive Anti-slip Sofa Covers Towel For Dining Room Y402",2020/04/Meijuner-Sofa-Cover-Solid-Color-Elastic-Universal-Slipcover-All-inclusive-Anti-slip-Sofa-Covers-Towel-For.jpg
361462,https://wallcorners.com/product/high-grade-velvet-stretch-sofa-cover-for-living-room-couch-slipcover-furniture-protector-case-sofa-cover-elastic-1-2-3-4-seater/,"High Grade Velvet Stretch Sofa Cover for Living Room Couch Slipcover Furniture Protector Case Sofa Cover Elastic 1/2/3/4 Seater",2020/04/High-Grade-Velvet-Stretch-Sofa-Cover-for-Living-Room-Couch-Slipcover-Furniture-Protector-Case-Sofa-Cover.jpg
361464,https://wallcorners.com/product/thick-plush-sofa-cover-for-living-room-elastic-non-slip-slipcover-couch-cover-with-pillowcase-for-l-shape-chaise-longue-sofa/,"Thick Plush Sofa Cover for Living Room Elastic Non-slip Slipcover Couch Cover with Pillowcase for L Shape Chaise Longue Sofa",2020/04/Thick-Plush-Sofa-Cover-for-Living-Room-Elastic-Non-slip-Slipcover-Couch-Cover-with-Pillowcase-for.jpg
361465,https://wallcorners.com/product/meijuner-sofa-cover-waterproof-solid-color-high-stretch-slipcover-all-inclusive-elastic-couch-cover-sofa-covers-for-dining-room/,"Meijuner Sofa Cover Waterproof Solid Color High Stretch Slipcover All-inclusive Elastic Couch Cover Sofa Covers For Dining Room",2020/04/Meijuner-Sofa-Cover-Waterproof-Solid-Color-High-Stretch-Slipcover-All-inclusive-Elastic-Couch-Cover-Sofa-Covers.jpg
361466,https://wallcorners.com/product/l-shaped-corner-sofa-cover-for-living-room-corner-sofa-cover-elastic-stretch-tight-wrap-all-inclusive-furniture-couch-cover-l/,"L Shaped Corner Sofa Cover for Living Room Corner Sofa Cover Elastic Stretch Tight Wrap All-inclusive Furniture Couch Cover L",2020/04/L-Shaped-Corner-Sofa-Cover-for-Living-Room-Corner-Sofa-Cover-Elastic-Stretch-Tight-Wrap-All.jpg
361760,https://wallcorners.com/product/wholesale-furniture-2016-germany-modern-leather-corner-sofa-set-for-living-room/,"Wholesale Furniture 2016 Germany modern leather corner sofa set for living room",2020/04/Wholesale-Furniture-2016-Germany-modern-leather-corner-sofa-set-for-living-room.jpg
361776,https://wallcorners.com/product/claroom-solid-color-thick-velvet-sofa-cover-for-living-room-sofa-towel-slip-resistant-sofa-cover-strech-sofa-slipcover-co85/,"Claroom solid color Thick velvet sofa cover for living room sofa towel Slip-resistant sofa cover strech sofa Slipcover CO85#",2020/04/Claroom-solid-color-Thick-velvet-sofa-cover-for-living-room-sofa-towel-Slip-resistant-sofa-cover.jpg
361781,https://wallcorners.com/product/rama-dymasty-genuine-leather-recliner-sofa-relax-massage-sofa-modern-design-for-office-or-living-room/,"RAMA DYMASTY genuine leather recliner sofa relax massage sofa modern design for office or living room",2020/04/RAMA-DYMASTY-genuine-leather-recliner-sofa-relax-massage-sofa-modern-design-for-office-or-living-room.jpg
361784,https://wallcorners.com/product/double-people-floor-couch-home-inflatable-sofa-bed-for-living-room-furniture-folding-lazy-sofa-soft-velvet-comfort-beds-chair/,"Double People Floor Couch Home Inflatable Sofa Bed For Living Room Furniture Folding Lazy Sofa Soft Velvet Comfort Beds Chair",2020/04/Double-People-Floor-Couch-Home-Inflatable-Sofa-Bed-For-Living-Room-Furniture-Folding-Lazy-Sofa-Soft.jpg
361788,https://wallcorners.com/product/multifunction-rotating-sofa-bed-home-furniture-for-live-room-fold-sofas-computer-chair-soft-rise-down-armchair-muebles/,"Multifunction Rotating Sofa Bed Home Furniture For Live Room Fold Sofas Computer Chair Soft Rise Down Armchair muebles",2020/04/Multifunction-Rotating-Sofa-Bed-Home-Furniture-For-Live-Room-Fold-Sofas-Computer-Chair-Soft-Rise-Down.jpg
361790,https://wallcorners.com/product/nordic-adjustable-sofa-fabric-sofa-bed-strong-bearing-portable-leisure-chair-zitzak-sofas-for-living-room-beanbag-cheap/,"Nordic Adjustable Sofa Fabric Sofa Bed Strong Bearing Portable Leisure Chair Zitzak Sofas For Living Room Beanbag Cheap",2020/04/Nordic-Adjustable-Sofa-Fabric-Sofa-Bed-Strong-Bearing-Portable-Leisure-Chair-Zitzak-Sofas-For-Living-Room.jpg
361803,https://wallcorners.com/product/wholesale-2019-new-design-leather-modern-sofa-for-living-room/,"Wholesale 2019 new design leather modern sofa for living room",2020/04/Wholesale-2019-new-design-leather-modern-sofa-for-living-room.jpg
361850,https://wallcorners.com/product/modern-linen-sleeper-futon-sofa-love-seat-couches-for-home-living-room-furniture-japanese-lazy-recliner-sofa-foldable-backarm/,"Modern Linen Sleeper Futon Sofa Love Seat Couches For Home Living Room Furniture Japanese Lazy Recliner Sofa Foldable Back&amp;Arm",2020/04/Modern-Linen-Sleeper-Futon-Sofa-Love-Seat-Couches-For-Home-Living-Room-Furniture-Japanese-Lazy-Recliner.jpg
361863,https://wallcorners.com/product/l-shape-colorful-fabric-sofa-couch-for-living-room-furniture-a-002-single-seat-lounge-3-seat/,"L shape colorful fabric sofa couch for living room furniture A-002  single seat lounge 3 seat",2020/04/L-shape-colorful-fabric-sofa-couch-for-living-room-furniture-A-002-single-seat-lounge-3.jpg
361875,https://wallcorners.com/product/adjustable-sofa-and-loveseat-in-colorful-line-fabric-home-furniture-fold-down-sofa-couch-ideal-for-living-room-bedroom-dorm/,"Adjustable Sofa and Loveseat in Colorful Line Fabric Home Furniture Fold Down Sofa Couch Ideal for Living Room, Bedroom, Dorm",2020/04/Adjustable-Sofa-and-Loveseat-in-Colorful-Line-Fabric-Home-Furniture-Fold-Down-Sofa-Couch-Ideal-for.jpg
361880,https://wallcorners.com/product/modern-sofa-design-genuine-leather-sofa-set-for-living-room-furniture-%d0%b4%d0%b8%d0%b2%d0%b0%d0%bd/,"Modern sofa design genuine leather sofa set for living room furniture диван",2020/04/Modern-sofa-design-genuine-leather-sofa-set-for-living-room-furniture.jpg
361893,https://wallcorners.com/product/rotating-sofa-bed-home-furniture-for-living-room-fold-soft-sofas-computer-chair-multifunction-armchair-high-quality/,"Rotating Sofa Bed Home Furniture For Living Room Fold Soft Sofas Computer Chair Multifunction Armchair High Quality",2020/04/Rotating-Sofa-Bed-Home-Furniture-For-Living-Room-Fold-Soft-Sofas-Computer-Chair-Multifunction-Armchair-High.jpg
361918,https://wallcorners.com/product/antique-style-leather-sofa-sets-1-2-3-for-living-room-luxury-series-with-very-competative-price-from-real-factory-wa536/,"Antique style leather sofa sets 1 2 3 for living room luxury  series with very competative price from real factory WA536",2020/04/Antique-style-leather-sofa-sets-1-2-3-for-living-room-luxury-series-with-very-competative.jpg
361947,https://wallcorners.com/product/japanese-tatami-floor-sofa-foldable-modern-leisure-sofa-bed-video-gaming-sofa-for-living-room-furniture-home-couch-love-seat/,"Japanese Tatami Floor Sofa Foldable Modern Leisure Sofa Bed Video Gaming Sofa For Living Room Furniture Home Couch Love Seat",2020/04/Japanese-Tatami-Floor-Sofa-Foldable-Modern-Leisure-Sofa-Bed-Video-Gaming-Sofa-For-Living-Room-Furniture.jpg
361954,https://wallcorners.com/product/u-best-vintage-luxury-chesterfield-velvet-button-tufted-sofa-3-seat-for-living-room-furnitureluxury-velvet-sofa/,"U-BEST Vintage Luxury Chesterfield Velvet Button Tufted Sofa 3 Seat For Living Room furniture,Luxury Velvet Sofa",2020/04/U-BEST-Vintage-Luxury-Chesterfield-Velvet-Button-Tufted-Sofa-3-Seat-For-Living-Room-furniture-Luxury.jpg
361963,https://wallcorners.com/product/modern-fabric-sofa-relax-fashion-sofa-bed-for-living-room-with-high-density-sponge-inside/,"Modern fabric sofa/relax fashion sofa bed for living room with high density sponge inside",2020/04/Modern-fabric-sofa-relax-fashion-sofa-bed-for-living-room-with-high-density-sponge-inside.jpg
361968,https://wallcorners.com/product/fabric-recliner-sofa-relax-massage-sofa-modern-design-for-office-or-living-room-furniture/,"Fabric recliner sofa relax massage sofa modern design for office or living room furniture",2020/04/Fabric-recliner-sofa-relax-massage-sofa-modern-design-for-office-or-living-room-furniture.jpg
361976,https://wallcorners.com/product/rama-dymasty-functional-sofa-bed-fashion-bunk-bed-for-living-room-furniture/,"RAMA DYMASTY functional sofa bed, fashion bunk bed for living room furniture",2020/04/RAMA-DYMASTY-functional-sofa-bed-fashion-bunk-bed-for-living-room-furniture.jpg
361983,https://wallcorners.com/product/adjustable-floor-couch-and-sofa-for-living-room-and-bedroom-japanese-foldable-reclining-chaise-lounge-convertible-flip-chair/,"Adjustable Floor Couch and Sofa for Living Room and Bedroom Japanese Foldable Reclining Chaise Lounge Convertible Flip Chair",2020/04/Adjustable-Floor-Couch-and-Sofa-for-Living-Room-and-Bedroom-Japanese-Foldable-Reclining-Chaise-Lounge-Convertible.jpg
362018,https://wallcorners.com/product/sectional-sofa-for-living-room/,"sectional sofa for living room",2020/04/sectional-sofa-for-living-room.jpg
362027,https://wallcorners.com/product/high-quality-leather-sofa-for-living-room/,"High quality leather sofa for living room",2020/04/High-quality-leather-sofa-for-living-room.jpg
362031,https://wallcorners.com/product/hotsale-genuine-leather-sofa-for-living-room-l-shaped/,"Hotsale genuine leather sofa for living room L shaped",2020/04/Hotsale-genuine-leather-sofa-for-living-room-L-shaped.jpg
362042,https://wallcorners.com/product/luxury-modern-led-corner-sofa-for-living-room/,"Luxury modern LED corner sofa for living room",2020/04/Luxury-modern-LED-corner-sofa-for-living-room.jpg
362048,https://wallcorners.com/product/modern-design-sofa-set-genuine-leather-sofa-for-living-room/,"Modern design sofa set genuine leather sofa for living room",2020/04/Modern-design-sofa-set-genuine-leather-sofa-for-living-room.jpg
362061,https://wallcorners.com/product/american-cotton-linen-fabric-single-armrest-sofa-nordic-comfortable-mini-chair-for-balcony-bedroom-living-room-furniture/,"American Cotton Linen Fabric Single Armrest Sofa Nordic Comfortable Mini Chair for Balcony Bedroom Living Room Furniture",2020/04/American-Cotton-Linen-Fabric-Single-Armrest-Sofa-Nordic-Comfortable-Mini-Chair-for-Balcony-Bedroom-Living-Room.jpg
362077,https://wallcorners.com/product/modern-design-rocking-lounge-chair-sofa-bed-fabric-wood-for-home-furniture-sofas-living-room-adult-luxury-rocking-chair-chaise/,"Modern Design Rocking Lounge Chair Sofa Bed Fabric Wood For Home Furniture Sofas Living Room Adult Luxury Rocking Chair Chaise",2020/04/Modern-Design-Rocking-Lounge-Chair-Sofa-Bed-Fabric-Wood-For-Home-Furniture-Sofas-Living-Room-Adult.jpg
362080,https://wallcorners.com/product/1-piece-high-stretch-sofa-cover-for-living-room-jacquard-knitted-with-lycra-sofa-slipcover-soft-thick-spandex-furniture-cover/,"1 Piece High Stretch Sofa Cover for Living Room Jacquard Knitted with Lycra Sofa Slipcover Soft Thick Spandex Furniture Cover",2020/04/1-Piece-High-Stretch-Sofa-Cover-for-Living-Room-Jacquard-Knitted-with-Lycra-Sofa-Slipcover-Soft.jpg
362082,https://wallcorners.com/product/nordic-furniture-reclining-japanese-futon-sofa-bed-modern-furniture-decor-sleeper-chaise-lounge-recliner-for-living-room-sofa/,"Nordic Furniture Reclining Japanese Futon Sofa Bed Modern Furniture Decor Sleeper Chaise Lounge Recliner for Living Room Sofa",2020/04/Nordic-Furniture-Reclining-Japanese-Futon-Sofa-Bed-Modern-Furniture-Decor-Sleeper-Chaise-Lounge-Recliner-for-Living.jpg
362090,https://wallcorners.com/product/futon-koltuk-takimi-asiento-meubel-couche-for-sectional-puff-leather-mobilya-mueble-de-sala-set-living-room-furniture-sofa/,"Futon Koltuk Takimi Asiento Meubel Couche For Sectional Puff Leather Mobilya Mueble De Sala Set Living Room Furniture Sofa",2020/04/Futon-Koltuk-Takimi-Asiento-Meubel-Couche-For-Sectional-Puff-Leather-Mobilya-Mueble-De-Sala-Set-Living.jpg
362102,https://wallcorners.com/product/floor-furniture-reclining-japanese-futon-sofa-bed-modern-folding-adjustable-sleeper-chaise-lounge-recliner-for-living-room-sofa/,"Floor Furniture Reclining Japanese Futon Sofa Bed Modern Folding Adjustable Sleeper Chaise Lounge Recliner For Living Room Sofa",2020/04/Floor-Furniture-Reclining-Japanese-Futon-Sofa-Bed-Modern-Folding-Adjustable-Sleeper-Chaise-Lounge-Recliner-For-Living.jpg
362131,https://wallcorners.com/product/puff-recliner-divano-letto-couch-couche-for-zitzak-futon-moderno-para-mueble-de-sala-set-living-room-furniture-mobilya-sofa-bed/,"Puff Recliner Divano Letto Couch Couche For Zitzak Futon Moderno Para Mueble De Sala Set Living Room Furniture Mobilya Sofa Bed",2020/04/Puff-Recliner-Divano-Letto-Couch-Couche-For-Zitzak-Futon-Moderno-Para-Mueble-De-Sala-Set-Living.jpg
362203,https://wallcorners.com/product/living-room-sofa-modern-sofa-set-recliner-sofa-with-fabric-for-home-movie-theatre-lounge-chair/,"Living room sofa modern sofa set recliner sofa with fabric for home movie theatre lounge chair",2020/04/Living-room-sofa-modern-sofa-set-recliner-sofa-with-fabric-for-home-movie-theatre-lounge-chair.jpg
362213,https://wallcorners.com/product/hot-children-baby-seat-sofa-high-quality-cartoon-pu-chairs-living-room-sofas-couch-for-double-4-colors-83x37x50cm-pink/,"Hot Children Baby Seat Sofa High Quality Cartoon PU Chairs Living Room Sofas Couch For Double 4 Colors 83X37X50cm pink",2020/04/Hot-Children-Baby-Seat-Sofa-High-Quality-Cartoon-PU-Chairs-Living-Room-Sofas-Couch-For-Double.jpg
362214,https://wallcorners.com/product/divano-letto-futon-fotel-wypoczynkowy-sectional-kanepe-couche-for-mueble-de-sala-mobilya-set-living-room-furniture-sofa-bed/,"Divano Letto Futon Fotel Wypoczynkowy Sectional Kanepe Couche For Mueble De Sala Mobilya Set Living Room Furniture Sofa Bed",2020/04/Divano-Letto-Futon-Fotel-Wypoczynkowy-Sectional-Kanepe-Couche-For-Mueble-De-Sala-Mobilya-Set-Living-Room.jpg
362216,https://wallcorners.com/product/living-room-sofa-recliner-sofa-cow-genuine-leather-recliner-sofa-cinema-leather-recliner-sofa-for-home-cinema/,"living room sofa Recliner Sofa cow Genuine Leather Recliner Sofa, Cinema Leather Recliner Sofa for home cinema",2020/04/living-room-sofa-Recliner-Sofa-cow-Genuine-Leather-Recliner-Sofa-Cinema-Leather-Recliner-Sofa-for-home.jpg
362239,https://wallcorners.com/product/divano-mobili-futon-couche-for-living-room-para-couch-fotel-wypoczynkowy-meuble-maison-de-sala-mueble-furniture-mobilya-sofa/,"Divano Mobili Futon Couche For Living Room Para Couch Fotel Wypoczynkowy Meuble Maison De Sala Mueble Furniture Mobilya Sofa",2020/04/Divano-Mobili-Futon-Couche-For-Living-Room-Para-Couch-Fotel-Wypoczynkowy-Meuble-Maison-De-Sala-Mueble.jpg
362257,https://wallcorners.com/product/para-sala-meble-do-salonu-futon-fotel-wypoczynkowy-puff-asiento-mobilya-set-furniture-couches-for-living-room-inflatable-sofa/,"Para Sala Meble Do Salonu Futon Fotel Wypoczynkowy Puff Asiento Mobilya Set Furniture Couches For Living Room Inflatable Sofa",2020/04/Para-Sala-Meble-Do-Salonu-Futon-Fotel-Wypoczynkowy-Puff-Asiento-Mobilya-Set-Furniture-Couches-For-Living.jpg
362271,https://wallcorners.com/product/asiento-couche-for-meubel-copridivano-fotel-wypoczynkowy-meuble-maison-de-sala-mobilya-set-living-room-furniture-mueble-sofa/,"Asiento Couche For Meubel Copridivano Fotel Wypoczynkowy Meuble Maison De Sala Mobilya Set Living Room Furniture Mueble Sofa",2020/04/Asiento-Couche-For-Meubel-Copridivano-Fotel-Wypoczynkowy-Meuble-Maison-De-Sala-Mobilya-Set-Living-Room-Furniture.jpg
362280,https://wallcorners.com/product/luxury-portable-inflatable-bed-sofa-multi-fun-s-shape-sofa-pad-chair-living-room-inflatable-sofa-for-adult-couple-erotic-bed/,"Luxury Portable Inflatable Bed Sofa Multi-Fun S-shape Sofa Pad chair Living Room inflatable sofa  For Adult Couple Erotic Bed",2020/04/Luxury-Portable-Inflatable-Bed-Sofa-Multi-Fun-S-shape-Sofa-Pad-chair-Living-Room-inflatable-sofa.jpg
362287,https://wallcorners.com/product/couche-for-couch-oturma-grubu-sillon-futon-mobili-per-la-casa-leather-set-living-room-furniture-mobilya-de-sala-mueble-sofa/,"Couche For Couch Oturma Grubu Sillon Futon Mobili Per La Casa Leather Set Living Room Furniture Mobilya De Sala Mueble Sofa",2020/04/Couche-For-Couch-Oturma-Grubu-Sillon-Futon-Mobili-Per-La-Casa-Leather-Set-Living-Room-Furniture.jpg
362289,https://wallcorners.com/product/apartment-couch-love-seat-simple-living-room-furniture-2-seat-sofa-relaxing-sofa-chair-for-college-dorm-bedroom-studio/,"Apartment Couch Love Seat Simple Living Room Furniture 2 Seat Sofa Relaxing Sofa Chair For College Dorm Bedroom Studio",2020/04/Apartment-Couch-Love-Seat-Simple-Living-Room-Furniture-2-Seat-Sofa-Relaxing-Sofa-Chair-For-College.jpg
362334,https://wallcorners.com/product/meuble-maison-futon-koltuk-takimi-pouf-moderne-oturma-grubu-couche-for-living-room-set-furniture-mueble-de-sala-mobilya-sofa/,"Meuble Maison Futon Koltuk Takimi Pouf Moderne Oturma Grubu Couche For Living Room Set Furniture Mueble De Sala Mobilya Sofa",2020/04/Meuble-Maison-Futon-Koltuk-Takimi-Pouf-Moderne-Oturma-Grubu-Couche-For-Living-Room-Set-Furniture-Mueble.jpg
362364,https://wallcorners.com/product/couche-for-puff-moderno-para-couch-sillon-meuble-maison-kanepe-mueble-de-sala-mobilya-set-living-room-furniture-sofa/,"Couche For Puff Moderno Para Couch Sillon Meuble Maison Kanepe Mueble De Sala Mobilya Set Living Room Furniture Sofa",2020/04/Couche-For-Puff-Moderno-Para-Couch-Sillon-Meuble-Maison-Kanepe-Mueble-De-Sala-Mobilya-Set-Living.jpg
362395,https://wallcorners.com/product/sillon-puff-para-armut-koltuk-couche-for-recliner-divano-sectional-set-living-room-furniture-mueble-de-sala-mobilya-sofa-bed/,"Sillon Puff Para Armut Koltuk Couche For Recliner Divano Sectional Set Living Room Furniture Mueble De Sala Mobilya Sofa Bed",2020/04/Sillon-Puff-Para-Armut-Koltuk-Couche-For-Recliner-Divano-Sectional-Set-Living-Room-Furniture-Mueble-De.jpg
362401,https://wallcorners.com/product/folding-meble-do-salonu-couche-for-recliner-copridivano-cama-sectional-set-living-room-mueble-de-sala-mobilya-furniture-sofa-bed/,"Folding Meble Do Salonu Couche For Recliner Copridivano Cama Sectional Set Living Room Mueble De Sala Mobilya Furniture Sofa Bed",2020/04/Folding-Meble-Do-Salonu-Couche-For-Recliner-Copridivano-Cama-Sectional-Set-Living-Room-Mueble-De-Sala.jpg
362402,https://wallcorners.com/product/moderna-couche-for-mobili-meuble-maison-divano-letto-meble-copridivano-futon-de-sala-mueble-set-living-room-furniture-sofa-bed/,"Moderna Couche For Mobili Meuble Maison Divano Letto Meble Copridivano Futon De Sala Mueble Set Living Room Furniture Sofa Bed",2020/04/Moderna-Couche-For-Mobili-Meuble-Maison-Divano-Letto-Meble-Copridivano-Futon-De-Sala-Mueble-Set-Living.jpg
362427,https://wallcorners.com/product/couche-for-folding-recliner-puff-futon-oturma-grubu-mobilya-para-meble-leather-set-living-room-furniture-mueble-de-sala-sofa-bed/,"Couche For Folding Recliner Puff Futon Oturma Grubu Mobilya Para Meble Leather Set Living Room Furniture Mueble De Sala Sofa Bed",2020/04/Couche-For-Folding-Recliner-Puff-Futon-Oturma-Grubu-Mobilya-Para-Meble-Leather-Set-Living-Room-Furniture.jpg
362476,https://wallcorners.com/product/living-room-sofa-corner-sofa-real-genuine-leather-sofas-with-storage-usb-for-iphone-minimalist-muebles-de-sala-moveis-para-casa/,"Living Room Sofa  corner sofa real genuine leather sofas with storage USB for iphone minimalist muebles de sala moveis para casa",2020/04/Living-Room-Sofa-corner-sofa-real-genuine-leather-sofas-with-storage-USB-for-iphone-minimalist-muebles.jpg
362497,https://wallcorners.com/product/oturma-grubu-mueble-home-pouf-moderne-futon-mobili-per-la-casa-mobilya-couches-for-set-living-room-furniture-inflatable-sofa/,"Oturma Grubu Mueble Home Pouf Moderne Futon Mobili Per La Casa Mobilya Couches For Set Living Room Furniture Inflatable Sofa",2020/04/Oturma-Grubu-Mueble-Home-Pouf-Moderne-Futon-Mobili-Per-La-Casa-Mobilya-Couches-For-Set-Living.jpg
362523,https://wallcorners.com/product/light-luxury-single-sofa-nordic-minimalist-clothing-store-sofa-living-room-balcony-bedroom-small-apartment-net-red-sofa/,"Light luxury single sofa Nordic minimalist clothing store sofa living room balcony bedroom small apartment net red sofa",2020/04/Light-luxury-single-sofa-Nordic-minimalist-clothing-store-sofa-living-room-balcony-bedroom-small-apartment-net.jpg
362526,https://wallcorners.com/product/armut-koltuk-sillon-moderna-divano-letto-fotel-wypoczynkowy-mueble-de-sala-couches-for-set-living-room-furniture-inflatable-sofa/,"Armut Koltuk Sillon Moderna Divano Letto Fotel Wypoczynkowy Mueble De Sala Couches For Set Living Room Furniture Inflatable Sofa",2020/04/Armut-Koltuk-Sillon-Moderna-Divano-Letto-Fotel-Wypoczynkowy-Mueble-De-Sala-Couches-For-Set-Living-Room.jpg
362530,https://wallcorners.com/product/a0d261z-modern-simple-living-room-light-luxury-leisure-chair-clothing-store-electroplated-metal-foot-casual-backrest-chair/,"A0D261Z Modern Simple Living Room Light Luxury Leisure Chair Clothing Store Electroplated Metal Foot Casual Backrest Chair",2020/04/A0D261Z-Modern-Simple-Living-Room-Light-Luxury-Leisure-Chair-Clothing-Store-Electroplated-Metal-Foot-Casual-Backrest.jpg
362537,https://wallcorners.com/product/folding-sofa-bed-dual-use-collapsible-living-room-small-apartment-sofa-chair-multifunctional-simple-modern-single-sofa/,"Folding sofa bed dual-use collapsible living room small apartment sofa chair multifunctional simple modern single sofa",2020/04/Folding-sofa-bed-dual-use-collapsible-living-room-small-apartment-sofa-chair-multifunctional-simple-modern-single.jpg
362616,https://wallcorners.com/product/pink-golden-iron-metal-velvet-royal-crown-single-double-three-seat-sofa-dressing-chair-coffee-living-room-garden-princess-prince/,"Pink Golden Iron Metal Velvet Royal Crown Single Double Three-seat Sofa Dressing Chair Coffee Living Room Garden Princess Prince",2020/04/Pink-Golden-Iron-Metal-Velvet-Royal-Crown-Single-Double-Three-seat-Sofa-Dressing-Chair-Coffee-Living.jpg
378066,https://wallcorners.com/product/nordic-pouf-fabric-dressing-stool-ottoman-stylish-quality-pu-leather-or-flannel-change-shoes-small-sofa-fashion-living-room/,"Nordic Pouf Fabric Dressing Stool Ottoman Stylish Quality PU Leather or Flannel Change Shoes Small Sofa Fashion Living Room",2020/04/Nordic-Pouf-Fabric-Dressing-Stool-Ottoman-Stylish-Quality-PU-Leather-or-Flannel-Change-Shoes-Small-Sofa.jpg
378070,https://wallcorners.com/product/luxury-nordic-fabric-macaron-color-dressing-stool-change-shoes-small-sofa-fashion-living-room-4538cm/,"Luxury Nordic Fabric Macaron Color Dressing Stool  Change Shoes Small Sofa Fashion Living Room 45*38cm",2020/04/Luxury-Nordic-Fabric-Macaron-Color-Dressing-Stool-Change-Shoes-Small-Sofa-Fashion-Living-Room-45-38cm.jpg
378080,https://wallcorners.com/product/new-design-adult-home-outdoor-one-seat-inflatable-clear-sofa-with-glitter-transparent-round-ball-shape-air-chairs/,"New Design Adult Home Outdoor One Seat Inflatable Clear Sofa with Glitter Transparent Round Ball Shape Air Chairs",2020/04/New-Design-Adult-Home-Outdoor-One-Seat-Inflatable-Clear-Sofa-with-Glitter-Transparent-Round-Ball-Shape.jpg
378081,https://wallcorners.com/product/living-room-sofa-footrest-stool-makeup-dressing-stool-european-style-iron-art-shoes-bench-bedroom-coffee-table-and-chair/,"Living Room Sofa Footrest Stool Makeup Dressing Stool European Style Iron Art Shoes Bench Bedroom Coffee Table And Chair",2020/04/Living-Room-Sofa-Footrest-Stool-Makeup-Dressing-Stool-European-Style-Iron-Art-Shoes-Bench-Bedroom-Coffee.jpg
378083,https://wallcorners.com/product/white-foam-balls-beanbag-baby-filler-bed-sleeping-baby-bean-bags-chair-newborn-sofa-polystyrene-styrofoam-ball-5-7mm/,"White Foam Balls beanbag baby Filler bed sleeping Baby Bean Bags chair Newborn sofa Polystyrene Styrofoam ball 5-7mm",2020/04/White-Foam-Balls-beanbag-baby-Filler-bed-sleeping-Baby-Bean-Bags-chair-Newborn-sofa-Polystyrene-Styrofoam.jpg
378085,https://wallcorners.com/product/light-luxury-fabric-single-sofa-living-room-balcony-bedroom-small-apartment-simple-modern-lounge-chair/,"Light luxury fabric single sofa living room balcony bedroom small apartment simple modern lounge chair",2020/04/Light-luxury-fabric-single-sofa-living-room-balcony-bedroom-small-apartment-simple-modern-lounge-chair.jpg
378142,https://wallcorners.com/product/folding-sofa-bed-furniture-living-room-modern-lazy-sofa-couch-floor-gaming-sofa-chair-adjustab-sleeping-sofa-bed-11053/,"Folding Sofa Bed Furniture Living Room Modern Lazy Sofa Couch Floor Gaming Sofa Chair Adjustab Sleeping Sofa Bed 110*53",2020/04/Folding-Sofa-Bed-Furniture-Living-Room-Modern-Lazy-Sofa-Couch-Floor-Gaming-Sofa-Chair-Adjustab-Sleeping.jpg
378147,https://wallcorners.com/product/h-nordic-single-living-room-sofa-balcony-apartment-mini-chair-modern-minimalist-sofa-personality-leisure-bedroom-room-chair/,"H Nordic Single Living Room Sofa Balcony Apartment Mini Chair Modern Minimalist Sofa Personality Leisure Bedroom Room Chair",2020/04/H-Nordic-Single-Living-Room-Sofa-Balcony-Apartment-Mini-Chair-Modern-Minimalist-Sofa-Personality-Leisure-Bedroom.jpg
378153,https://wallcorners.com/product/solid-wood-chair-modern-living-room-sofa-chair-furniture-deco-home-adult-book-chair-minimalist-nordic-style-fashion-dining-chair/,"Solid Wood Chair Modern Living Room Sofa Chair Furniture Deco Home Adult Book Chair Minimalist Nordic Style Fashion Dining Chair",2020/04/Solid-Wood-Chair-Modern-Living-Room-Sofa-Chair-Furniture-Deco-Home-Adult-Book-Chair-Minimalist-Nordic.jpg
