200770,https://wallcorners.com/product/rocooart-animal-waterproof-temporary-tattoo-sticker-flamingo-cat-fox-tatoo-body-art-women-new-fake-taty-tatuaje-cute-small-tatto/,"Rocooart Animal Waterproof Temporary Tattoo Sticker Flamingo Cat Fox Tatoo Body Art Women New Fake Taty Tatuaje Cute Small Tatto",2020/02/Rocooart-Animal-Waterproof-Temporary-Tattoo-Sticker-Flamingo-Cat-Fox-Tatoo-Body-Art-Women-New-Fake-Taty.jpg
200786,https://wallcorners.com/product/2019-fashion-women-tattoo-diamond-makeup-eyeliner-eyeshadow-face-sticker-jewel-eyes-makeup-crystal-eyes-sticker/,"2019 Fashion Women Tattoo Diamond Makeup Eyeliner Eyeshadow Face Sticker Jewel Eyes Makeup Crystal Eyes Sticker",2020/02/2019-Fashion-Women-Tattoo-Diamond-Makeup-Eyeliner-Eyeshadow-Face-Sticker-Jewel-Eyes-Makeup-Crystal-Eyes-Sticker.jpg
200885,https://wallcorners.com/product/new-1-sheet-gold-face-flash-tattoo-stickersfashion-waterproof-blocked-freckles-make-up-body-art-eye-decals-bride-tribe-party/,"New 1 Sheet Gold Face Flash Tattoo StickersFashion Waterproof Blocked Freckles Make Up Body Art Eye Decals Bride Tribe Party",2020/02/New-1-Sheet-Gold-Face-Flash-Tattoo-StickersFashion-Waterproof-Blocked-Freckles-Make-Up-Body-Art-Eye.jpg
200891,https://wallcorners.com/product/astronaut-in-space-temporary-tattoo-sticker-tatoo-sticker-tatuagem-harajuku-henna-tattoo-sleeves-tatoo-temporaire-femme-water/,"Astronaut In Space temporary tattoo sticker  tatoo sticker tatuagem harajuku henna tattoo sleeves tatoo temporaire femme water",2020/02/Astronaut-In-Space-temporary-tattoo-sticker-tatoo-sticker-tatuagem-harajuku-henna-tattoo-sleeves-tatoo-temporaire-femme.jpg
200900,https://wallcorners.com/product/3d-crystal-sticker-music-festival-face-trendy-shiny-acrylic-drill-sticker-masquerade-face-decoration-temporary-tattoo-sticker/,"3D Crystal Sticker Music Festival Face Trendy Shiny Acrylic Drill Sticker Masquerade Face Decoration Temporary Tattoo Sticker",2020/02/3D-Crystal-Sticker-Music-Festival-Face-Trendy-Shiny-Acrylic-Drill-Sticker-Masquerade-Face-Decoration-Temporary-Tattoo.jpg
200902,https://wallcorners.com/product/nu-taty-chinese-i-loveyou-temporary-tattoo-body-art-arm-flash-tattoo-stickers-1710cm-waterproof-fake-henna-painless-tattoo/,"Nu-TATY Chinese  I LoveYou Temporary Tattoo Body Art Arm Flash Tattoo Stickers 17*10cm Waterproof Fake Henna Painless Tattoo",2020/02/Nu-TATY-Chinese-I-LoveYou-Temporary-Tattoo-Body-Art-Arm-Flash-Tattoo-Stickers-17-10cm-Waterproof.jpg
200912,https://wallcorners.com/product/cartoon-cute-puppy-team-child-temporary-body-art-flash-tattoo-sticker-1710cm-waterproof-painless-tattoo-free-shipping/,"Cartoon Cute Puppy Team Child Temporary Body Art Flash Tattoo Sticker 17*10cm Waterproof painless tattoo Free shipping",2020/02/Cartoon-Cute-Puppy-Team-Child-Temporary-Body-Art-Flash-Tattoo-Sticker-17-10cm-Waterproof-painless-tattoo.jpg
200949,https://wallcorners.com/product/1pc-summer-style-men-women-body-art-gold-metallic-tattoo-sticker-hys-101-chain-bracelet-fake-jewelry-waterproof-temporary-tattoo/,"1PC Summer Style Men Women Body Art Gold Metallic Tattoo Sticker HYS-101 Chain Bracelet Fake Jewelry Waterproof Temporary Tattoo",2020/02/1PC-Summer-Style-Men-Women-Body-Art-Gold-Metallic-Tattoo-Sticker-HYS-101-Chain-Bracelet-Fake.jpg
200980,https://wallcorners.com/product/large-arm-sleeve-tattoo-japanese-geisha-snake-waterproof-temporary-tatto-sticker-lotus-peacock-girl-tatoo-body-art-women/,"Large Arm Sleeve Tattoo Japanese Geisha Snake Waterproof Temporary Tatto Sticker Lotus Peacock Girl Tatoo Body Art Women",2020/02/Large-Arm-Sleeve-Tattoo-Japanese-Geisha-Snake-Waterproof-Temporary-Tatto-Sticker-Lotus-Peacock-Girl-Tatoo-Body.jpg
200993,https://wallcorners.com/product/wyuen-geometric-shapes-fake-tattoo-line-temporary-tattoo-stickers-for-adults-kids-body-art-gg-001-waterproof-tatoo-for-man-woman/,"Wyuen Geometric Shapes Fake Tattoo Line Temporary Tattoo Stickers for Adults Kids Body Art GG-001 Waterproof Tatoo for Man Woman",2020/02/Wyuen-Geometric-Shapes-Fake-Tattoo-Line-Temporary-Tattoo-Stickers-for-Adults-Kids-Body-Art-GG-001.jpg
201013,https://wallcorners.com/product/ommgo-wolf-king-galaxy-universe-temporary-tattoo-sticker-waterproof-fake-tattoos-for-men-women-custom-tatoos-body-art-armband/,"OMMGO Wolf King Galaxy Universe Temporary Tattoo Sticker Waterproof Fake Tattoos For Men Women Custom Tatoos Body Art Armband",2020/02/OMMGO-Wolf-King-Galaxy-Universe-Temporary-Tattoo-Sticker-Waterproof-Fake-Tattoos-For-Men-Women-Custom-Tatoos.jpg
201016,https://wallcorners.com/product/creative-lotus-snake-temporary-tattoos-sticker-for-women-3d-body-art-painting-legs-arm-tatoo-decal-fake-waterproof-black-tattoos/,"Creative Lotus Snake Temporary Tattoos Sticker For Women 3D Body Art Painting Legs Arm Tatoo Decal Fake Waterproof Black Tattoos",2020/02/Creative-Lotus-Snake-Temporary-Tattoos-Sticker-For-Women-3D-Body-Art-Painting-Legs-Arm-Tatoo-Decal.jpg
201018,https://wallcorners.com/product/glaryyears-24-designs-1-sheet-glitter-body-tattoo-fg-waterproof-sticker-cartoon-horse-cat-decal-temporary-children-tattoo-gift/,"glaryyears 24 Designs 1 Sheet Glitter Body Tattoo FG Waterproof Sticker Cartoon Horse Cat Decal Temporary Children Tattoo Gift",2020/02/glaryyears-24-Designs-1-Sheet-Glitter-Body-Tattoo-FG-Waterproof-Sticker-Cartoon-Horse-Cat-Decal-Temporary.jpg
201081,https://wallcorners.com/product/black-diamond-waterproof-temporary-tattoos-sticke-harajuku-tattoo-body-art-car-styling-tatoo-sticker-tatuajes-temporales-sabanas/,"Black Diamond Waterproof Temporary Tattoos Sticke Harajuku tattoo body art car-styling tatoo sticker tatuajes temporales sabanas",2020/02/Black-Diamond-Waterproof-Temporary-Tattoos-Sticke-Harajuku-tattoo-body-art-car-styling-tatoo-sticker-tatuajes-temporales.jpg
201142,https://wallcorners.com/product/hxman-flower-arrow-temporary-tattoo-sticker-tattoos-for-women-sexy-body-art-waterproof-men-hand-fake-tatoo-9-8x6cm-ab-005/,"HXMAN Flower Arrow Temporary Tattoo Sticker Tattoos for Women Sexy Body Art Waterproof Men Hand Fake Tatoo 9.8X6cm AB-005",2020/02/HXMAN-Flower-Arrow-Temporary-Tattoo-Sticker-Tattoos-for-Women-Sexy-Body-Art-Waterproof-Men-Hand-Fake.jpg
201237,https://wallcorners.com/product/ommgo-3d-rhombus-triangle-skull-nun-temporary-tattoo-sticker-for-men-women-arm-leg-tatoo-paper-waterproof-body-art-black-tattoos/,"OMMGO 3D Rhombus Triangle Skull Nun Temporary Tattoo Sticker For Men Women Arm Leg Tatoo Paper Waterproof Body Art Black Tattoos",2020/02/OMMGO-3D-Rhombus-Triangle-Skull-Nun-Temporary-Tattoo-Sticker-For-Men-Women-Arm-Leg-Tatoo-Paper.jpg
201271,https://wallcorners.com/product/4sheet-multi-style-cartoon-avengers-dark-clown-batman-wolverine-temporary-flash-tattoo-arm-taty-body-paint-colorful-tatuagem/,"4Sheet Multi-style Cartoon Avengers dark clown Batman Wolverine Temporary Flash Tattoo arm taty Body paint Colorful tatuagem",2020/02/4Sheet-Multi-style-Cartoon-Avengers-dark-clown-Batman-Wolverine-Temporary-Flash-Tattoo-arm-taty-Body-paint.jpg
201293,https://wallcorners.com/product/10pcs-lot-temporary-tattoos-tattoo-stickers-for-body-art-painting-waterproof-new-designs/,"10pcs/lot Temporary Tattoos Tattoo Stickers For Body Art Painting Waterproof  New Designs",2020/02/10pcs-lot-Temporary-Tattoos-Tattoo-Stickers-For-Body-Art-Painting-Waterproof-New-Designs.jpg
201375,https://wallcorners.com/product/flash-wolf-temporary-tattoo-stickers-geometric-body-arm-chest-water-transfer-tatoos-men-ankle-neck-ahesive-fake-tattoo-xmas-gift/,"Flash Wolf Temporary Tattoo Stickers Geometric Body Arm Chest Water Transfer Tatoos Men Ankle Neck Ahesive Fake Tattoo Xmas Gift",2020/02/Flash-Wolf-Temporary-Tattoo-Stickers-Geometric-Body-Arm-Chest-Water-Transfer-Tatoos-Men-Ankle-Neck-Ahesive.jpg
201386,https://wallcorners.com/product/the-cute-cat-of-blue-eyes-waterproof-temporary-tattoos-sticker-body-art-tattoo-beauty-animals-tattoo-sleeves-temporaryt-tatoo/,"The Cute Cat Of Blue eyes Waterproof Temporary Tattoos Sticker Body Art Tattoo Beauty Animals Tattoo Sleeves Temporaryt Tatoo",2020/02/The-Cute-Cat-Of-Blue-eyes-Waterproof-Temporary-Tattoos-Sticker-Body-Art-Tattoo-Beauty-Animals-Tattoo.jpg
201397,https://wallcorners.com/product/waterproof-temporary-tattoo-sticker-rose-other-flower-fake-tatto-flash-tatoo-hand-arm-foot-back-tato-body-art-for-girl-women-men/,"Waterproof Temporary Tattoo Sticker Rose other Flower Fake Tatto Flash Tatoo Hand Arm Foot Back Tato body art for Girl Women Men",2020/02/Waterproof-Temporary-Tattoo-Sticker-Rose-other-Flower-Fake-Tatto-Flash-Tatoo-Hand-Arm-Foot-Back-Tato.jpg
201401,https://wallcorners.com/product/tiger-skull-leopard-dragon-waterproof-temporary-tattoo-sticker-wolf-animals-tattoos-body-art-arm-hand-men-fake-tatoo-2/,"Tiger Skull Leopard dragon Waterproof Temporary Tattoo Sticker Wolf Animals Tattoos Body Art Arm Hand men Fake Tatoo",2020/02/Tiger-Skull-Leopard-dragon-Waterproof-Temporary-Tattoo-Sticker-Wolf-Animals-Tattoos-Body-Art-Arm-Hand-men-6.jpg
201406,https://wallcorners.com/product/sexy-blue-flower-rose-peony-temporary-tattoos-large-sticker-fake-waterproof-tattoo-for-women-girls-paper-tatoos-body-art-arm/,"Sexy Blue Flower Rose Peony Temporary Tattoos Large Sticker Fake Waterproof Tattoo For Women Girls Paper Tatoos Body Art Arm",2020/02/Sexy-Blue-Flower-Rose-Peony-Temporary-Tattoos-Large-Sticker-Fake-Waterproof-Tattoo-For-Women-Girls-Paper.jpg
201408,https://wallcorners.com/product/glaryyears-1-pc-hot-football-kids-temporary-tattoo-sticker-colorful-fake-tatoo-flash-tatto-waterproof-small-body-art-for-child/,"glaryyears 1 Pc Hot Football Kids Temporary Tattoo Sticker Colorful Fake Tatoo Flash Tatto Waterproof Small Body Art For Child",2020/02/glaryyears-1-Pc-Hot-Football-Kids-Temporary-Tattoo-Sticker-Colorful-Fake-Tatoo-Flash-Tatto-Waterproof-Small.jpg
201433,https://wallcorners.com/product/1-sheet-3d-gold-fish-waterproof-temporary-tattoo-goldfish-girl-tatto-stickers-flash-tatoo-fake-tattoos/,"1 Sheet 3D Gold Fish Waterproof Temporary Tattoo Goldfish Girl Tatto Stickers Flash Tatoo Fake Tattoos",2020/02/1-Sheet-3D-Gold-Fish-Waterproof-Temporary-Tattoo-Goldfish-Girl-Tatto-Stickers-Flash-Tatoo-Fake-Tattoos.jpg
201489,https://wallcorners.com/product/ommgo-geometric-hummingbird-temporary-circle-round-tattoo-sticker-leaf-pigeon-arrow-tattoo-body-art-black-fake-birds-tatoo-paper/,"OMMGO Geometric Hummingbird Temporary Circle Round Tattoo Sticker Leaf Pigeon Arrow Tattoo Body Art Black Fake Birds Tatoo Paper",2020/02/OMMGO-Geometric-Hummingbird-Temporary-Circle-Round-Tattoo-Sticker-Leaf-Pigeon-Arrow-Tattoo-Body-Art-Black-Fake.jpg
201492,https://wallcorners.com/product/baofuli-sexy-unicorn-cat-waterproof-butterfly-tattoos-men-watercolor-feather-temporary-tattoo-sticker-fake-horse-women-tattoos/,"Baofuli Sexy Unicorn Cat Waterproof Butterfly Tattoos Men Watercolor Feather Temporary Tattoo Sticker Fake Horse Women Tattoos",2020/02/Baofuli-Sexy-Unicorn-Cat-Waterproof-Butterfly-Tattoos-Men-Watercolor-Feather-Temporary-Tattoo-Sticker-Fake-Horse-Women.jpg
201850,https://wallcorners.com/product/nu-taty-amazing-butterfly-3d-temporary-tattoo-body-art-flash-tattoo-stickers-199cm-waterproof-tatoo-home-decor-wall-sticker/,"Nu-TATY Amazing Butterfly 3d Temporary Tattoo Body Art Flash Tattoo Stickers 19*9cm Waterproof Tatoo Home Decor Wall Sticker",2020/02/Nu-TATY-Amazing-Butterfly-3d-Temporary-Tattoo-Body-Art-Flash-Tattoo-Stickers-19-9cm-Waterproof-Tatoo.jpg
201863,https://wallcorners.com/product/waterproof-temporary-tattoo-sticker-cute-mickey-mouse-kt-cat-cartoon-tatto-flash-tatoo-fake-tattoos-for-kids-child-girls/,"Waterproof Temporary Tattoo Sticker cute mickey mouse KT cat cartoon tatto flash tatoo fake tattoos for kids child girls",2020/02/Waterproof-Temporary-Tattoo-Sticker-cute-mickey-mouse-KT-cat-cartoon-tatto-flash-tatoo-fake-tattoos-for.jpg
201864,https://wallcorners.com/product/1pc-gold-silver-tattoo-palm-treem-bracelet-tatoo-plum-flower-pineapple-starfish-slippers-wave-design-temporary-tattoo-beach-as45/,"1PC Gold Silver Tattoo Palm Treem Bracelet Tatoo Plum Flower Pineapple Starfish Slippers Wave Design Temporary Tattoo Beach AS45",2020/02/1PC-Gold-Silver-Tattoo-Palm-Treem-Bracelet-Tatoo-Plum-Flower-Pineapple-Starfish-Slippers-Wave-Design-Temporary.jpg
201868,https://wallcorners.com/product/sale-colorful-cartoon-new-tattoo-sticker-animal-sticker-disposable-black-bird-fish-flower-deer-body-art-fake-water-transfer/,"Sale Colorful Cartoon New tattoo sticker animal sticker disposable Black Bird fish Flower Deer Body Art Fake Water Transfer",2020/02/Sale-Colorful-Cartoon-New-tattoo-sticker-animal-sticker-disposable-Black-Bird-fish-Flower-Deer-Body-Art.jpg
201875,https://wallcorners.com/product/1pc-cute-flower-butterfly-cartoon-glitter-tattoo-stencil-woman-girl-kids-small-tattoo-stencildrawing-template/,"1Pc Cute Flower Butterfly Cartoon Glitter Tattoo Stencil  Woman Girl Kids Small Tattoo StencilDrawing Template",2020/02/1Pc-Cute-Flower-Butterfly-Cartoon-Glitter-Tattoo-Stencil-Woman-Girl-Kids-Small-Tattoo-StencilDrawing-Template.jpg
201879,https://wallcorners.com/product/30pcs-lot-temporary-chinese-tattoos-set-small-fake-tatoo-boys-black-arm-sleeve-tattoo-sticker-words-hand-tattoo-waterproof-mens/,"30pcs/lot temporary chinese tattoos set small fake tatoo boys black arm sleeve tattoo sticker words hand tattoo waterproof mens",2020/02/30pcs-lot-temporary-chinese-tattoos-set-small-fake-tatoo-boys-black-arm-sleeve-tattoo-sticker-words.jpg
202061,https://wallcorners.com/product/water-transfer-dark-splash-ink-realistic-roses-temporary-tattoo-sticker-arm-leg-back-pattern-body-art-waterproof-fake-tattoo/,"Water Transfer Dark splash ink realistic roses Temporary Tattoo Sticker Arm leg back Pattern body art Waterproof Fake tattoo",2020/02/Water-Transfer-Dark-splash-ink-realistic-roses-Temporary-Tattoo-Sticker-Arm-leg-back-Pattern-body-art.jpg
202096,https://wallcorners.com/product/1-sheet-wolf-tiger-dragon-body-art-temporary-women-men-tattoo-waterproof-large-tattoo-sticker-cool-skin-decor/,"1 Sheet Wolf Tiger Dragon Body Art Temporary Women Men Tattoo Waterproof Large Tattoo Sticker Cool Skin Decor",2020/02/1-Sheet-Wolf-Tiger-Dragon-Body-Art-Temporary-Women-Men-Tattoo-Waterproof-Large-Tattoo-Sticker-Cool.jpg
202102,https://wallcorners.com/product/new-bindi-india-sticker-face-jewels-forehead-temporary-tattoo-sticker-actress-make-up-tatuaje-festival-taty-party-tatouage/,"New Bindi India Sticker Face Jewels Forehead Temporary Tattoo Sticker Actress Make Up Tatuaje Festival Taty Party Tatouage",2020/02/New-Bindi-India-Sticker-Face-Jewels-Forehead-Temporary-Tattoo-Sticker-Actress-Make-Up-Tatuaje-Festival-Taty.jpg
202181,https://wallcorners.com/product/beautiful-sexy-waterproof-temporary-tattoos-for-women-and-men-3d-scorpion-design-large-arm-tattoo-sticker-qc2607/,"Beautiful sexy waterproof temporary tattoos for women and men 3D scorpion design large arm tattoo sticker QC2607",2020/02/Beautiful-sexy-waterproof-temporary-tattoos-for-women-and-men-3D-scorpion-design-large-arm-tattoo-sticker.jpg
202195,https://wallcorners.com/product/ommgo-outspace-women-planet-brain-temporary-tattoo-sticker-waterproof-black-geometric-mountain-tatoos-body-art-fake-tattoo-paper/,"OMMGO Outspace Women Planet Brain Temporary Tattoo Sticker Waterproof Black Geometric Mountain Tatoos Body Art Fake Tattoo Paper",2020/02/OMMGO-Outspace-Women-Planet-Brain-Temporary-Tattoo-Sticker-Waterproof-Black-Geometric-Mountain-Tatoos-Body-Art-Fake.jpg
202201,https://wallcorners.com/product/1pc-removable-temporary-gold-silver-leaf-flower-tattoos-metallic-sex-products-jewelry-henna-tatouage-body-art-tatto-stickers/,"1PC Removable Temporary Gold Silver Leaf Flower Tattoos Metallic Sex Products Jewelry Henna Tatouage Body Art Tatto Stickers",2020/02/1PC-Removable-Temporary-Gold-Silver-Leaf-Flower-Tattoos-Metallic-Sex-Products-Jewelry-Henna-Tatouage-Body-Art.jpg
202202,https://wallcorners.com/product/1pcs-waterproof-temporary-sticker-geometric-planet-jellyfish-tattoo-black-triangle-tattoos-body-arm-men-fake-tatoos/,"1PCS Waterproof Temporary Sticker Geometric Planet Jellyfish Tattoo Black Triangle Tattoos Body Arm Men Fake Tatoos",2020/02/1PCS-Waterproof-Temporary-Sticker-Geometric-Planet-Jellyfish-Tattoo-Black-Triangle-Tattoos-Body-Arm-Men-Fake-Tatoos.jpg
202205,https://wallcorners.com/product/waterproof-temporary-tattoo-sticker-snake-geometric-animal-fake-tatto-flash-tatoo-tatouage-temporaire-for-men-girl-women/,"Waterproof Temporary Tattoo Sticker snake Geometric animal fake tatto flash tatoo tatouage temporaire  for men girl women",2020/02/Waterproof-Temporary-Tattoo-Sticker-snake-Geometric-animal-fake-tatto-flash-tatoo-tatouage-temporaire-for-men-girl.jpg
202215,https://wallcorners.com/product/shnapign-cute-spiderman-children-cartoon-temporary-tattoos-sticker-fashion-summer-style-elsa-waterproof-girls-kids-boys-hot/,"SHNAPIGN Cute Spiderman Children Cartoon Temporary Tattoos Sticker Fashion Summer Style Elsa Waterproof Girls Kids Boys Hot",2020/02/SHNAPIGN-Cute-Spiderman-Children-Cartoon-Temporary-Tattoos-Sticker-Fashion-Summer-Style-Elsa-Waterproof-Girls-Kids-Boys.jpg
202329,https://wallcorners.com/product/geometry-cool-temporary-tattoo-sticker-women-minimalist-lines-pattern-body-art-new-design-fake-men-tattoos/,"Geometry cool Temporary Tattoo Sticker Women Minimalist lines pattern Body Art New Design Fake Men Tattoos",2020/02/Geometry-cool-Temporary-Tattoo-Sticker-Women-Minimalist-lines-pattern-Body-Art-New-Design-Fake-Men-Tattoos.jpg
202351,https://wallcorners.com/product/waterproof-temporary-tattoo-sticker-wolf-moon-girl-tattoo-sexy-black-tattoo-sleeves-arm-men-tatoo-wolf-forest-large-tatto-boys/,"waterproof temporary tattoo sticker wolf moon girl tattoo sexy black tattoo sleeves arm men tatoo wolf forest large tatto boys",2020/02/waterproof-temporary-tattoo-sticker-wolf-moon-girl-tattoo-sexy-black-tattoo-sleeves-arm-men-tatoo-wolf.jpg
202359,https://wallcorners.com/product/big-large-full-back-chest-tattoo-large-tattoo-stickers-fish-wolf-tiger-dragon-waterproof-temporary-flash-tattoos-cool-men-women/,"Big Large Full Back Chest Tattoo large tattoo stickers fish wolf Tiger Dragon waterproof temporary flash tattoos cool men women",2020/02/Big-Large-Full-Back-Chest-Tattoo-large-tattoo-stickers-fish-wolf-Tiger-Dragon-waterproof-temporary-flash.jpg
202373,https://wallcorners.com/product/halloween-stickers-face-temporary-tattoo-sticker-for-man-neck-boys-tattoo-body-art-sword-tattoo-black-face-tattoo-sticker-sexy/,"halloween stickers face temporary tattoo sticker for man neck boys tattoo &amp; body art sword tattoo black face tattoo sticker sexy",2020/02/halloween-stickers-face-temporary-tattoo-sticker-for-man-neck-boys-tattoo-body-art-sword-tattoo-black.jpg
202394,https://wallcorners.com/product/waterproof-temporary-tattoo-sticker-on-body-sexy-lace-pistol-gun-tatto-stickers-flash-tatoo-fake-art-tattoos-for-girl-women-men/,"Waterproof Temporary Tattoo Sticker on Body Sexy Lace Pistol Gun Tatto Stickers Flash Tatoo Fake Art Tattoos for Girl Women Men",2020/02/Waterproof-Temporary-Tattoo-Sticker-on-Body-Sexy-Lace-Pistol-Gun-Tatto-Stickers-Flash-Tatoo-Fake-Art.jpg
202563,https://wallcorners.com/product/waterproof-temporary-tattoo-sticker-sun-moon-fake-tatto-flash-tatoo-tatouage-wrist-foot-hand-arm-tatoos-for-girl-women-men-kids/,"Waterproof Temporary Tattoo Sticker sun Moon Fake Tatto Flash Tatoo Tatouage Wrist Foot Hand Arm tatoos For Girl Women Men Kids",2020/02/Waterproof-Temporary-Tattoo-Sticker-sun-Moon-Fake-Tatto-Flash-Tatoo-Tatouage-Wrist-Foot-Hand-Arm-tatoos.jpg
202577,https://wallcorners.com/product/24-designs-flower-waterproof-temporary-tattoo-sticker-lotus-leaf-girl-lavender-tatto-stickers-flash-tatoo-fake-tattoos-for-women/,"24 designs flower Waterproof temporary tattoo sticker lotus leaf girl lavender tatto stickers flash tatoo fake tattoos for women",2020/02/24-designs-flower-Waterproof-temporary-tattoo-sticker-lotus-leaf-girl-lavender-tatto-stickers-flash-tatoo-fake.jpg
202587,https://wallcorners.com/product/pisces-and-scorpio-waterproof-temporary-tattoo-sticker-henna-tatoo-body-sticker-fake-tattoo-the-flash-tatoo-tatuajes/,"Pisces And Scorpio  Waterproof Temporary Tattoo Sticker Henna Tatoo Body Sticker Fake Tattoo The Flash Tatoo Tatuajes",2020/02/Pisces-And-Scorpio-Waterproof-Temporary-Tattoo-Sticker-Henna-Tatoo-Body-Sticker-Fake-Tattoo-The-Flash-Tatoo.jpg
202596,https://wallcorners.com/product/black-raven-temporary-waterproof-tattoos-sticker-harajuku-henna-tattoo-women-animal-tattoo-crow-temporary-tatoo-men/,"Black Raven Temporary Waterproof Tattoos Sticker Harajuku henna Tattoo Women  Animal Tattoo Crow Temporary tatoo men",2020/02/Black-Raven-Temporary-Waterproof-Tattoos-Sticker-Harajuku-henna-Tattoo-Women-Animal-Tattoo-Crow-Temporary-tatoo-men.jpg
202606,https://wallcorners.com/product/hxman-flower-temporary-tattoos-sticker-waterproof-fashion-women-arm-face-fake-body-art-10-5x6cm-kids-adult-hand-tatoo-p-058/,"HXMAN Flower Temporary Tattoos Sticker Waterproof Fashion Women Arm Face Fake Body Art 10.5X6cm Kids Adult Hand Tatoo P-058",2020/02/HXMAN-Flower-Temporary-Tattoos-Sticker-Waterproof-Fashion-Women-Arm-Face-Fake-Body-Art-10-5X6cm-Kids.jpg
202633,https://wallcorners.com/product/hxman-scorpion-temporary-tattoo-sticker-tattoos-for-waterproof-women-fashion-body-art-kids-hand-fake-tatoo-10-5x6cm-a-068/,"HXMAN Scorpion Temporary Tattoo Sticker Tattoos for Waterproof Women Fashion Body Art Kids Hand Fake Tatoo 10.5X6cm A-068",2020/02/HXMAN-Scorpion-Temporary-Tattoo-Sticker-Tattoos-for-Waterproof-Women-Fashion-Body-Art-Kids-Hand-Fake-Tatoo.jpg
202658,https://wallcorners.com/product/hxman-dog-animal-temporary-tattoo-sticker-waterproof-women-fashion-fake-body-art-9-8x6cm-kids-hand-tattoos-hot-design-a-154/,"HXMAN Dog Animal Temporary Tattoo Sticker Waterproof Women Fashion Fake Body Art 9.8X6cm Kids Hand Tattoos Hot Design A-154",2020/02/HXMAN-Dog-Animal-Temporary-Tattoo-Sticker-Waterproof-Women-Fashion-Fake-Body-Art-9-8X6cm-Kids-Hand.jpg
202686,https://wallcorners.com/product/waterproof-temporary-tattoo-stickers-cartoon-lovely-dog-head-animal-fake-tatto-flash-tatoo-small-tattoos-for-girl-women-men-kid/,"Waterproof Temporary Tattoo Stickers cartoon lovely dog head animal Fake Tatto Flash Tatoo small tattoos for girl Women Men kid",2020/02/Waterproof-Temporary-Tattoo-Stickers-cartoon-lovely-dog-head-animal-Fake-Tatto-Flash-Tatoo-small-tattoos-for.jpg
202715,https://wallcorners.com/product/waterproof-temporary-tattoo-mens-fire-tatoo-eagle-lotus-mandala-eye-flame-totem-water-transfer-fake-tatto-for-man/,"Waterproof Temporary Tattoo Men's Fire Tatoo Eagle Lotus Mandala Eye Flame Totem  Water Transfer Fake Tatto For Man",2020/02/Waterproof-Temporary-Tattoo-Men-s-Fire-Tatoo-Eagle-Lotus-Mandala-Eye-Flame-Totem-Water-Transfer-Fake.jpg
202723,https://wallcorners.com/product/hxman-plane-to-earth-temporary-fake-tattoo-body-art-sticker-waterproof-hand-tattoo-sticker-for-men-9-8x6cm-e-023/,"HXMAN Plane To Earth Temporary Fake Tattoo Body Art Sticker Waterproof Hand Tattoo Sticker for Men 9.8X6cm E-023",2020/02/HXMAN-Plane-To-Earth-Temporary-Fake-Tattoo-Body-Art-Sticker-Waterproof-Hand-Tattoo-Sticker-for-Men.jpg
202733,https://wallcorners.com/product/nu-taty-nu-era-matrix-barcode-temporary-tattoo-body-art-flash-tattoo-sticker-1710cm-waterproof-henna-tatoo-selfie-wall-sticker/,"Nu-TATY Nu Era Matrix Barcode Temporary Tattoo Body Art Flash Tattoo Sticker 17*10cm Waterproof Henna Tatoo Selfie Wall Sticker",2020/02/Nu-TATY-Nu-Era-Matrix-Barcode-Temporary-Tattoo-Body-Art-Flash-Tattoo-Sticker-17-10cm-Waterproof.jpg
202735,https://wallcorners.com/product/2018-new-waterproof-temporary-tattoo-sticker-old-school-gril-rose-snake-tatto-flash-tatoo-fake-tattoos-for-woman-man/,"2018 New Waterproof Temporary Tattoo Sticker Old School Gril Rose&amp; Snake tatto flash tatoo fake tattoos for Woman Man",2020/02/2018-New-Waterproof-Temporary-Tattoo-Sticker-Old-School-Gril-Rose-Snake-tatto-flash-tatoo-fake-tattoos.jpg
202739,https://wallcorners.com/product/rocooart-hc1113-waterproof-temporary-tattoo-stickers-courage-fear-heart-mind-letters-design-water-transfer-harajuku-fake-tattoo/,"Rocooart HC1113 Waterproof Temporary Tattoo Stickers Courage Fear Heart Mind Letters Design Water Transfer Harajuku Fake Tattoo",2020/02/Rocooart-HC1113-Waterproof-Temporary-Tattoo-Stickers-Courage-Fear-Heart-Mind-Letters-Design-Water-Transfer-Harajuku-Fake.jpg
202798,https://wallcorners.com/product/1pc-halloween-zombie-neck-scar-tattoos-fake-scars-bloody-costume-horror-wound-blood-injury-sticker/,"1PC Halloween Zombie Neck Scar Tattoos Fake Scars Bloody Costume Horror Wound Blood Injury Sticker",2020/02/1PC-Halloween-Zombie-Neck-Scar-Tattoos-Fake-Scars-Bloody-Costume-Horror-Wound-Blood-Injury-Sticker.jpg
202821,https://wallcorners.com/product/wyuen-flower-cherry-blossoms-waterproof-temporary-tattoo-sticker-for-women-body-art-fake-tattoo-9-8x6cm-new-design-tatoo-p-015/,"Wyuen Flower Cherry Blossoms Waterproof Temporary Tattoo Sticker for Women Body Art Fake Tattoo 9.8X6cm New Design Tatoo P-015",2020/02/Wyuen-Flower-Cherry-Blossoms-Waterproof-Temporary-Tattoo-Sticker-for-Women-Body-Art-Fake-Tattoo-9-8X6cm.jpg
202861,https://wallcorners.com/product/2016-hot-black-temporary-tattoo-body-art-tattoos-3d-waterproof-temporary-tattoos-sticker-art-men-arm-leg-fake-tatoo-paper/,"2016 Hot Black Temporary Tattoo Body Art Tattoos 3D Waterproof Temporary Tattoos Sticker Art Men Arm Leg Fake Tatoo Paper",2020/02/2016-Hot-Black-Temporary-Tattoo-Body-Art-Tattoos-3D-Waterproof-Temporary-Tattoos-Sticker-Art-Men-Arm.jpg
202881,https://wallcorners.com/product/nu-taty-sexy-red-lip-cherry-temporary-tattoo-body-art-flash-tattoo-stickers-199cm-waterproof-tatoo-home-decor-wall-sticker/,"Nu-TATY Sexy Red Lip Cherry Temporary Tattoo Body Art Flash Tattoo Stickers 19*9cm Waterproof Tatoo Home Decor Wall Sticker",2020/02/Nu-TATY-Sexy-Red-Lip-Cherry-Temporary-Tattoo-Body-Art-Flash-Tattoo-Stickers-19-9cm-Waterproof.jpg
