191911,https://wallcorners.com/product/ecg-temporary-tattoo-men-and-women-love-tattoos-sexy-products-waterproof-disposable-tattoo-stickers-to-cover-the-scar/,"ECG temporary tattoo Men and women love tattoos  sexy products waterproof disposable tattoo stickers to cover the scar",2020/02/ECG-temporary-tattoo-Men-and-women-love-tattoos-sexy-products-waterproof-disposable-tattoo-stickers-to-cover.jpg
191913,https://wallcorners.com/product/the-black-pearl-pirate-ship-waterproof-temporary-tattoos-harajuku-men-fake-tattoo-hand-made-sticker-henna-tatoo-sleeve-tatuajes/,"The Black Pearl Pirate Ship Waterproof Temporary Tattoos harajuku men Fake Tattoo hand made sticker Henna Tatoo sleeve tatuajes",2020/02/The-Black-Pearl-Pirate-Ship-Waterproof-Temporary-Tattoos-harajuku-men-Fake-Tattoo-hand-made-sticker-Henna.jpg
191927,https://wallcorners.com/product/30sheet-flower-body-art-temporary-tattoos-butterfly-floral-reindeer-letter-fake-tattoos-back-tattoos-stickers-for-women-girls/,"30Sheet Flower Body Art Temporary Tattoos Butterfly Floral Reindeer Letter Fake Tattoos Back Tattoos Stickers for Women Girls",2020/02/30Sheet-Flower-Body-Art-Temporary-Tattoos-Butterfly-Floral-Reindeer-Letter-Fake-Tattoos-Back-Tattoos-Stickers-for.jpg
191930,https://wallcorners.com/product/water-transfer-tattoo-minimalist-small-sun-moon-saturn-tattoo-body-art-waterproof-temporary-fake-tattoo-for-adults-couples-kids/,"Water Transfer Tattoo Minimalist small sun moon Saturn tattoo Body Art Waterproof Temporary fake Tattoo for adults Couples kids",2020/02/Water-Transfer-Tattoo-Minimalist-small-sun-moon-Saturn-tattoo-Body-Art-Waterproof-Temporary-fake-Tattoo-for.jpg
191931,https://wallcorners.com/product/hot-flash-metallic-waterproof-temporary-tattoo-gold-silver-tatoo-women-henna-flower-taty-design-tattoo-sticker/,"Hot Flash Metallic Waterproof Temporary Tattoo Gold Silver Tatoo Women Henna Flower Taty Design Tattoo Sticker",2020/02/Hot-Flash-Metallic-Waterproof-Temporary-Tattoo-Gold-Silver-Tatoo-Women-Henna-Flower-Taty-Design-Tattoo-Sticker.jpg
191935,https://wallcorners.com/product/tribal-temporary-tattoo-maori-turtle-polynesian-black-mens-womens/,"TRIBAL TEMPORARY TATTOO, MAORI TURTLE, POLYNESIAN, BLACK, MENS, WOMENS",2020/02/TRIBAL-TEMPORARY-TATTOO-MAORI-TURTLE-POLYNESIAN-BLACK-MENS-WOMENS.jpg
191945,https://wallcorners.com/product/classic-dragon-ball-master-the-monkey-king-tattoo-tatuajes-hand-tatouage-body-waterproof-temporary-flash-faketattoo-sticker-taty/,"Classic Dragon Ball Master The Monkey King Tattoo Tatuajes Hand Tatouage Body Waterproof Temporary flash fakeTattoo Sticker Taty",2020/02/Classic-Dragon-Ball-Master-The-Monkey-King-Tattoo-Tatuajes-Hand-Tatouage-Body-Waterproof-Temporary-flash-fakeTattoo.jpg
191957,https://wallcorners.com/product/ophir-12x-shimmer-powder-temporary-glitter-tattoo-set-for-body-art-paint-with-body-glue-20-designs-stencil-2x-brushes_ta060/,"OPHIR 12x Shimmer Powder Temporary Glitter Tattoo Set for Body Art Paint with Body Glue 20 Designs Stencil &amp; 2x Brushes_TA060",2020/02/OPHIR-12x-Shimmer-Powder-Temporary-Glitter-Tattoo-Set-for-Body-Art-Paint-with-Body-Glue-20.jpg
192006,https://wallcorners.com/product/temporary-tattoo-black-flower-tattoo-sleeves-water-transfer-tatoo-sticker-peony-rose-tattoos-body-art-sexy-tatoo-girl-arm-tatto/,"temporary tattoo black flower tattoo sleeves water transfer tatoo sticker peony rose tattoos body art sexy tatoo girl arm tatto",2020/02/temporary-tattoo-black-flower-tattoo-sleeves-water-transfer-tatoo-sticker-peony-rose-tattoos-body-art-sexy.jpg
192039,https://wallcorners.com/product/fake-temporary-tattoo-sleeves-tattoos-full-long-slip-on-arm-tattoo-sleeve-kit-men-elastic-nylon-glove-tattoos-black-skull-design/,"Fake Temporary Tattoo Sleeves Tattoos Full Long Slip On Arm Tattoo Sleeve Kit Men Elastic Nylon Glove Tattoos black skull design",2020/02/Fake-Temporary-Tattoo-Sleeves-Tattoos-Full-Long-Slip-On-Arm-Tattoo-Sleeve-Kit-Men-Elastic-Nylon.jpg
192040,https://wallcorners.com/product/1sheet-multi-style-24models-hot-trendy-temporary-tattoos-arm-body-art-arabic-word-geometric-tattoo-sticker-black-tatuagem-hot/,"1sheet Multi-style 24models hot trendy Temporary Tattoos arm body art Arabic word  Geometric tattoo sticker black tatuagem HOT",2020/02/1sheet-Multi-style-24models-hot-trendy-Temporary-Tattoos-arm-body-art-Arabic-word-Geometric-tattoo-sticker.jpg
192062,https://wallcorners.com/product/new-hot-water-transfer-fake-tattoo-waterproof-temporary-tattoo-sticker-men-women-wolf-tattoo-flash-tattoo/,"New Hot Water Transfer fake tattoo Waterproof Temporary Tattoo sticker men women wolf tattoo flash tattoo",2020/02/New-Hot-Water-Transfer-fake-tattoo-Waterproof-Temporary-Tattoo-sticker-men-women-wolf-tattoo-flash-tattoo.jpg
192228,https://wallcorners.com/product/large-arm-sleeve-tattoo-sketch-lion-tiger-waterproof-temporary-tatoo-sticker-wild-fierce-animal-men-full-bird-totem-tatto/,"Large Arm Sleeve Tattoo Sketch Lion Tiger Waterproof Temporary Tatoo Sticker Wild Fierce Animal Men Full Bird Totem Tatto",2020/02/Large-Arm-Sleeve-Tattoo-Sketch-Lion-Tiger-Waterproof-Temporary-Tatoo-Sticker-Wild-Fierce-Animal-Men-Full.jpg
192230,https://wallcorners.com/product/arm-sleeve-tattoo-sketch-lion-tiger-waterproof-temporary-tattoo-sticker-wild-fierce-animal-men-full-bird-totem-tattoo-48cmx17cm/,"Arm Sleeve Tattoo Sketch Lion Tiger Waterproof Temporary Tattoo Sticker Wild Fierce Animal Men Full Bird Totem Tattoo 48cmx17cm",2020/02/Arm-Sleeve-Tattoo-Sketch-Lion-Tiger-Waterproof-Temporary-Tattoo-Sticker-Wild-Fierce-Animal-Men-Full-Bird.jpg
192301,https://wallcorners.com/product/team-bride-tribe-flash-temporary-tattoo-gold-silver-metallic-arrow-love-bachelorette-party-bridesmaid-shower-wedding-decoration/,"Team bride tribe Flash Temporary Tattoo Gold silver Metallic arrow Love bachelorette party Bridesmaid shower wedding decoration",2020/02/Team-bride-tribe-Flash-Temporary-Tattoo-Gold-silver-Metallic-arrow-Love-bachelorette-party-Bridesmaid-shower-wedding.jpg
192325,https://wallcorners.com/product/waterproof-temporary-tattoo-sticker-forest-moon-flying-bird-bear-flash-tattoos-leopard-wolf-tiger-body-art-arm-fake-tatoo-men/,"Waterproof Temporary Tattoo Sticker  Forest Moon Flying Bird Bear Flash Tattoos Leopard Wolf Tiger Body Art Arm Fake Tatoo Men",2020/02/Waterproof-Temporary-Tattoo-Sticker-Forest-Moon-Flying-Bird-Bear-Flash-Tattoos-Leopard-Wolf-Tiger-Body-Art.jpg
192336,https://wallcorners.com/product/new-fashion-sexy-waterproof-tattoo-maria-mother-with-cross-temporary-tattoo-size-2115-cm-hb-748/,"NEW Fashion Sexy Waterproof Tattoo Maria Mother With Cross Temporary Tattoo (Size 21*15 cm) #HB-748",2020/02/NEW-Fashion-Sexy-Waterproof-Tattoo-Maria-Mother-With-Cross-Temporary-Tattoo-Size-21-15-cm-HB.jpg
192353,https://wallcorners.com/product/waterproof-temporary-tattoo-sticker-english-word-letters-alphabet-mr-tatto-stickers-flash-tatoo-fake-tattoos-for-girl-men-4/,"Waterproof Temporary Tattoo Sticker English word letters alphabet Mr. tatto stickers flash tatoo fake tattoos for girl men 4",2020/02/Waterproof-Temporary-Tattoo-Sticker-English-word-letters-alphabet-Mr-tatto-stickers-flash-tatoo-fake-tattoos-for.jpg
192432,https://wallcorners.com/product/waterproof-temporary-tattoo-sticker-tribal-totem-band-fake-tatto-personality-flash-tatoo-waist-arm-foot-tato-for-girl-women-men/,"Waterproof Temporary Tattoo Sticker Tribal totem band Fake Tatto Personality Flash Tatoo Waist Arm Foot Tato for Girl Women Men",2020/02/Waterproof-Temporary-Tattoo-Sticker-Tribal-totem-band-Fake-Tatto-Personality-Flash-Tatoo-Waist-Arm-Foot-Tato.jpg
192514,https://wallcorners.com/product/1-pieces-compass-arrows-hot-black-white-large-flower-henna-temporary-tattoo-black-mehndi-style-waterproof-tattoo-sticker/,"1 Pieces Compass Arrows Hot Black White Large Flower Henna Temporary Tattoo Black Mehndi Style Waterproof Tattoo Sticker",2020/02/1-Pieces-Compass-Arrows-Hot-Black-White-Large-Flower-Henna-Temporary-Tattoo-Black-Mehndi-Style-Waterproof.jpg
192544,https://wallcorners.com/product/customized-personalized-waterproof-temporary-tattoo-sticker-diy-fake-tatoo-make-your-own-design-tattoo-for-logo-wedding/,"Customized Personalized Waterproof Temporary Tattoo Sticker DIY Fake Tatoo, Make Your Own design Tattoo For Logo/wedding",2020/02/Customized-Personalized-Waterproof-Temporary-Tattoo-Sticker-DIY-Fake-Tatoo-Make-Your-Own-design-Tattoo-For-Logo.jpg
192565,https://wallcorners.com/product/waterproof-temporary-english-word-sexy-romantic-tattoo-stickers-black-letters-feather-body-art-tattoos-dropshipping/,"Waterproof Temporary English Word sexy romantic Tattoo Stickers Black Letters Feather Body Art Tattoos Dropshipping",2020/02/Waterproof-Temporary-English-Word-sexy-romantic-Tattoo-Stickers-Black-Letters-Feather-Body-Art-Tattoos-Dropshipping.jpg
192576,https://wallcorners.com/product/2020-waterproof-temporary-tattoo-sticker-full-arm-large-skull-old-school-tatoo-stickers-fake-tattoos-for-men-women-new-arrival/,"2020 Waterproof Temporary Tattoo Sticker Full Arm Large Skull Old School Tatoo Stickers Fake Tattoos for Men Women New Arrival",2020/02/2020-Waterproof-Temporary-Tattoo-Sticker-Full-Arm-Large-Skull-Old-School-Tatoo-Stickers-Fake-Tattoos-for.jpg
192635,https://wallcorners.com/product/hxman-bear-on-tree-animal-temporary-tattoo-waterproof-women-fake-body-art-kids-hand-tattoos-hot-design-9-8x6cm-a-266/,"HXMAN Bear On Tree Animal Temporary Tattoo Waterproof Women Fake Body Art Kids Hand Tattoos Hot Design 9.8X6cm A-266",2020/02/HXMAN-Bear-On-Tree-Animal-Temporary-Tattoo-Waterproof-Women-Fake-Body-Art-Kids-Hand-Tattoos-Hot.jpg
192655,https://wallcorners.com/product/1-piece-waterproof-temporary-tattoo-sticker-black-roses-design-tatoo-flower-arm-body-art-big-large-fake-tatto-sticker-for-women/,"1 Piece Waterproof Temporary Tattoo Sticker Black Roses Design Tatoo Flower Arm Body Art Big Large Fake Tatto Sticker For women",2020/02/1-Piece-Waterproof-Temporary-Tattoo-Sticker-Black-Roses-Design-Tatoo-Flower-Arm-Body-Art-Big-Large.jpg
192663,https://wallcorners.com/product/waterproof-temporary-tattoo-sticker-crown-aircraft-elephant-fake-tatto-flash-tatoo-tatouage-wrist-foot-hand-for-girl-women-men/,"Waterproof Temporary Tattoo Sticker Crown aircraft Elephant Fake Tatto Flash Tatoo Tatouage Wrist Foot Hand For Girl Women Men",2020/02/Waterproof-Temporary-Tattoo-Sticker-Crown-aircraft-Elephant-Fake-Tatto-Flash-Tatoo-Tatouage-Wrist-Foot-Hand-For.jpg
192680,https://wallcorners.com/product/waterproof-temporary-tattoo-sticker-of-body-love-wave-tattoo-small-size-tatto-stickers-flash-tatoo-fake-tattoos-for-girl-women/,"Waterproof Temporary Tattoo Sticker of body Love wave tattoo small size tatto stickers flash tatoo fake tattoos for girl women",2020/02/Waterproof-Temporary-Tattoo-Sticker-of-body-Love-wave-tattoo-small-size-tatto-stickers-flash-tatoo-fake.jpg
192690,https://wallcorners.com/product/waterproof-temporary-tattoo-sticker-feather-fly-bird-flash-tatoo-fake-tatto-arm-leg-wrist-foot-hand-shoulder-for-girl-men-women/,"Waterproof Temporary Tattoo Sticker Feather fly bird Flash Tatoo Fake Tatto arm leg Wrist Foot hand shoulder For Girl Men Women",2020/02/Waterproof-Temporary-Tattoo-Sticker-Feather-fly-bird-Flash-Tatoo-Fake-Tatto-arm-leg-Wrist-Foot-hand.jpg
192704,https://wallcorners.com/product/cute-heart-temporary-tattoo-sticker-beauty-fake-tattoo-temporary-tatoo-men-tatuajes-faux-tatouage-face-jewels-festival-tattoo/,"Cute Heart Temporary Tattoo Sticker Beauty Fake Tattoo Temporary Tatoo Men Tatuajes Faux Tatouage Face Jewels Festival Tattoo",2020/02/Cute-Heart-Temporary-Tattoo-Sticker-Beauty-Fake-Tattoo-Temporary-Tatoo-Men-Tatuajes-Faux-Tatouage-Face-Jewels.jpg
192712,https://wallcorners.com/product/tiger-skull-leopard-dragon-waterproof-temporary-tattoo-sticker-wolf-animals-tattoos-body-art-arm-hand-men-fake-tatoo/,"Tiger Skull Leopard dragon Waterproof Temporary Tattoo Sticker Wolf Animals Tattoos Body Art Arm Hand men Fake Tatoo",2020/02/Tiger-Skull-Leopard-dragon-Waterproof-Temporary-Tattoo-Sticker-Wolf-Animals-Tattoos-Body-Art-Arm-Hand-men.jpg
192878,https://wallcorners.com/product/6pcs-nylon-elastic-tattoo-sleeve-designs-temporary-body-arm-stockings-tattoo-for-cool-men-women-free-shipping-d01040/,"6PCS Nylon Elastic Tattoo Sleeve Designs Temporary Body Arm Stockings Tattoo for Cool Men Women Free shipping D01040",2020/02/6PCS-Nylon-Elastic-Tattoo-Sleeve-Designs-Temporary-Body-Arm-Stockings-Tattoo-for-Cool-Men-Women-Free.jpg
192898,https://wallcorners.com/product/1-sheet-temporary-english-word-tattoo-stickers-black-letters-feather-body-art-tattoos-sticker-waterproof-for-temporary-tattoos/,"1 Sheet Temporary English Word Tattoo Stickers Black Letters Feather Body Art Tattoos Sticker Waterproof For Temporary Tattoos",2020/02/1-Sheet-Temporary-English-Word-Tattoo-Stickers-Black-Letters-Feather-Body-Art-Tattoos-Sticker-Waterproof-For.jpg
192919,https://wallcorners.com/product/10-styles-big-temporary-fake-tattoos-stickers-black-death-skull-tattoos-large-arm-should-temporary-tattoo-for-men-women/,"10 Styles Big Temporary Fake Tattoos Stickers Black Death Skull Tattoos Large Arm Should Temporary Tattoo For Men women",2020/02/10-Styles-Big-Temporary-Fake-Tattoos-Stickers-Black-Death-Skull-Tattoos-Large-Arm-Should-Temporary-Tattoo.jpg
192924,https://wallcorners.com/product/40pcs-set-waterproof-temporary-tattoo-body-art-cute-carton-pattern-print-beauty-for-kids-women-fake-tattoo/,"40pcs/set Waterproof Temporary Tattoo Body Art Cute Carton Pattern Print Beauty for Kids Women Fake Tattoo",2020/02/40pcs-set-Waterproof-Temporary-Tattoo-Body-Art-Cute-Carton-Pattern-Print-Beauty-for-Kids-Women-Fake.jpg
192946,https://wallcorners.com/product/waterproof-temporary-tattoo-sticker-black-machine-gun-tatto-flash-tatoo-fake-tattoos-for-men-women/,"Waterproof Temporary Tattoo Sticker black machine gun tatto flash tatoo fake tattoos for men women",2020/02/Waterproof-Temporary-Tattoo-Sticker-black-machine-gun-tatto-flash-tatoo-fake-tattoos-for-men-women.jpg
192961,https://wallcorners.com/product/waterproof-temporary-tattoo-sticker-rose-flower-hand-art-flash-tatoo-fake-tattoos-for-women-men/,"Waterproof Temporary Tattoo Sticker Rose Flower Hand Art  flash tatoo fake tattoos for women men",2020/02/Waterproof-Temporary-Tattoo-Sticker-Rose-Flower-Hand-Art-flash-tatoo-fake-tattoos-for-women-men.jpg
192984,https://wallcorners.com/product/large-arm-sleeve-tattoo-sketch-lion-tiger-waterproof-temporary-tattoo-sticker-wild-fierce-animal-men-full-totem-transfer-tattoo/,"Large Arm Sleeve Tattoo Sketch Lion Tiger Waterproof Temporary Tattoo Sticker Wild Fierce Animal Men Full Totem Transfer Tattoo",2020/02/Large-Arm-Sleeve-Tattoo-Sketch-Lion-Tiger-Waterproof-Temporary-Tattoo-Sticker-Wild-Fierce-Animal-Men-Full.jpg
193023,https://wallcorners.com/product/ommgo-hot-3d-black-henna-flower-rose-temporary-tattoos-for-girls-women-tattoo-sticker-leaf-custom-wholesale-tatoos-body-art-kit/,"OMMGO HOT 3D Black Henna Flower Rose Temporary Tattoos For Girls Women Tattoo Sticker Leaf Custom Wholesale Tatoos Body Art Kit",2020/02/OMMGO-HOT-3D-Black-Henna-Flower-Rose-Temporary-Tattoos-For-Girls-Women-Tattoo-Sticker-Leaf-Custom.jpg
193108,https://wallcorners.com/product/waterproof-temporary-tattoo-sticker-geometric-tattoo-water-transfer-fake-tattoo-flash-tattoo-for-unisex/,"Waterproof Temporary Tattoo Sticker Geometric Tattoo Water Transfer Fake Tattoo Flash Tattoo For Unisex",2020/02/Waterproof-Temporary-Tattoo-Sticker-Geometric-Tattoo-Water-Transfer-Fake-Tattoo-Flash-Tattoo-For-Unisex.jpg
193116,https://wallcorners.com/product/christmas-halloween-gold-silver-face-tattoo-waterproof-bronzing-freckles-make-up-flash-tattoo-sticker-eye-decals-tribe-party/,"Christmas Halloween Gold Silver Face Tattoo Waterproof Bronzing Freckles Make Up  Flash Tattoo Sticker Eye Decals Tribe Party",2020/02/Christmas-Halloween-Gold-Silver-Face-Tattoo-Waterproof-Bronzing-Freckles-Make-Up-Flash-Tattoo-Sticker-Eye-Decals.jpg
193166,https://wallcorners.com/product/kids-3d-cute-dog-agent-child-temporary-body-art-flash-tattoo-sticker-1710cm-waterproof-painless-tattoo-free-shipping/,"Kids 3d Cute Dog Agent Child Temporary Body Art Flash Tattoo Sticker 17*10cm Waterproof painless tattoo Free shipping",2020/02/Kids-3d-Cute-Dog-Agent-Child-Temporary-Body-Art-Flash-Tattoo-Sticker-17-10cm-Waterproof-painless.jpg
193258,https://wallcorners.com/product/large-arm-sleeve-tattoo-lion-crown-king-rose-waterproof-temporary-tatoo-sticker-wild-wolf-tiger-men-full-skull-totem-tatto/,"Large Arm Sleeve Tattoo Lion Crown King Rose Waterproof Temporary Tatoo Sticker Wild Wolf Tiger Men Full Skull Totem Tatto",2020/02/Large-Arm-Sleeve-Tattoo-Lion-Crown-King-Rose-Waterproof-Temporary-Tatoo-Sticker-Wild-Wolf-Tiger-Men.jpg
193271,https://wallcorners.com/product/halloween-removable-3d-scary-zombie-tattoo-costume-makeup-blood-injury-wound-new-arrival/,"Halloween Removable 3D Scary Zombie Tattoo Costume MakeUp Blood Injury Wound New Arrival",2020/02/Halloween-Removable-3D-Scary-Zombie-Tattoo-Costume-MakeUp-Blood-Injury-Wound-New-Arrival.jpg
193310,https://wallcorners.com/product/ommgo-black-henna-arm-tattoo-mandala-flower-temporary-tattoos-for-women-female-girls-sticker-fake-tattoo-mehndi-custom-tatoos/,"OMMGO Black Henna Arm Tattoo Mandala Flower Temporary Tattoos For Women Female Girls Sticker Fake Tattoo Mehndi Custom Tatoos",2020/02/OMMGO-Black-Henna-Arm-Tattoo-Mandala-Flower-Temporary-Tattoos-For-Women-Female-Girls-Sticker-Fake-Tattoo.jpg
193341,https://wallcorners.com/product/whale-planet-sea-animals-temporary-tattoos-waterproof-women-fake-body-art-arm-tattoo-sticker-hand-tatoo/,"Whale Planet Sea Animals Temporary Tattoos Waterproof Women Fake Body Art Arm Tattoo Sticker Hand Tatoo",2020/02/Whale-Planet-Sea-Animals-Temporary-Tattoos-Waterproof-Women-Fake-Body-Art-Arm-Tattoo-Sticker-Hand-Tatoo.jpg
193354,https://wallcorners.com/product/1pcs-waterproof-temporary-tattoo-sticker-black-clover-maple-leaf-tattoo-flash-tatoo-fake-water-transfer-tatto-for-woman-man/,"1PCs Waterproof Temporary Tattoo Sticker Black Clover Maple Leaf Tattoo Flash Tatoo Fake Water Transfer Tatto for Woman Man",2020/02/1PCs-Waterproof-Temporary-Tattoo-Sticker-Black-Clover-Maple-Leaf-Tattoo-Flash-Tatoo-Fake-Water-Transfer-Tatto.jpg
193355,https://wallcorners.com/product/rocooart-moon-mountain-temporary-tattoo-stickers-ecology-fake-tattoo-planet-tatuajes-ocean-taty-coconut-tree-waterproof-tatouage/,"Rocooart Moon Mountain Temporary Tattoo Stickers Ecology Fake Tattoo Planet Tatuajes Ocean Taty Coconut Tree Waterproof Tatouage",2020/02/Rocooart-Moon-Mountain-Temporary-Tattoo-Stickers-Ecology-Fake-Tattoo-Planet-Tatuajes-Ocean-Taty-Coconut-Tree-Waterproof.jpg
193378,https://wallcorners.com/product/waterproof-temporary-tattoo-sticker-flower-rose-fake-tatto-flash-tatoo-hand-arm-foot-back-tato-body-art-for-girl-women-men/,"Waterproof Temporary Tattoo Sticker Flower Rose Fake Tatto Flash Tatoo Hand Arm Foot Back Tato body art for Girl Women Men",2020/02/Waterproof-Temporary-Tattoo-Sticker-Flower-Rose-Fake-Tatto-Flash-Tatoo-Hand-Arm-Foot-Back-Tato-body.jpg
193497,https://wallcorners.com/product/1pc-waterproof-tattoo-sticker-body-art-tattoo-water-transfer-feather-music-note-cross-barcode-temporary-tattoo-sticker/,"1pc Waterproof Tattoo Sticker Body Art Tattoo Water Transfer Feather Music Note Cross Barcode Temporary Tattoo Sticker",2020/02/1pc-Waterproof-Tattoo-Sticker-Body-Art-Tattoo-Water-Transfer-Feather-Music-Note-Cross-Barcode-Temporary-Tattoo.jpg
193516,https://wallcorners.com/product/elegant-feathers-waterproof-temporary-tattoo-sticker-maquiagem-fake-tattoothe-flash-kids-tatoo-stickers-tatuaje-cheap-stuff/,"Elegant Feathers Waterproof Temporary Tattoo Sticker maquiagem Fake TattooThe flash Kids Tatoo Stickers Tatuaje Cheap Stuff",2020/02/Elegant-Feathers-Waterproof-Temporary-Tattoo-Sticker-maquiagem-Fake-TattooThe-flash-Kids-Tatoo-Stickers-Tatuaje-Cheap-Stuff.jpg
193542,https://wallcorners.com/product/30pcs-woman-waterproof-temporary-tattoo-fake-tattoo-sticker-on-the-body-cartoon-colorful-temporal-tattoos/,"30pcs Woman Waterproof Temporary Tattoo Fake Tattoo Sticker on the Body Cartoon Colorful Temporal Tattoos",2020/02/30pcs-Woman-Waterproof-Temporary-Tattoo-Fake-Tattoo-Sticker-on-the-Body-Cartoon-Colorful-Temporal-Tattoos.jpg
193550,https://wallcorners.com/product/hot-wolf-temporary-tattoo-sticker-men-women-black-animal-waterproof-tattoo-multi-styles-water-transfer-fake-tattoo/,"HOT Wolf Temporary Tattoo Sticker Men Women Black Animal Waterproof Tattoo Multi Styles Water Transfer Fake Tattoo",2020/02/HOT-Wolf-Temporary-Tattoo-Sticker-Men-Women-Black-Animal-Waterproof-Tattoo-Multi-Styles-Water-Transfer-Fake.jpg
193559,https://wallcorners.com/product/body-art-beauty-makeup-pink-sexy-ear-on-and-off-waterproof-temporary-tattoo-stickers-sexy/,"Body Art Beauty Makeup Pink Sexy Ear On and off Waterproof Temporary Tattoo Stickers Sexy",2020/02/Body-Art-Beauty-Makeup-Pink-Sexy-Ear-On-and-off-Waterproof-Temporary-Tattoo-Stickers-Sexy.jpg
193578,https://wallcorners.com/product/sexy-wife-temporary-tattoo-sticker-fake-tattoo-body-art-henna-tatoo-stickers-tattoo-waterproof-tattoo-men/,"Sexy Wife Temporary Tattoo Sticker Fake Tattoo &amp; Body Art Henna Tatoo Stickers Tattoo waterproof  tattoo Men",2020/02/Sexy-Wife-Temporary-Tattoo-Sticker-Fake-Tattoo-Body-Art-Henna-Tatoo-Stickers-Tattoo-waterproof-tattoo-Men.jpg
193600,https://wallcorners.com/product/rocooart-1-sheet-hot-football-kids-temporary-tattoo-sticker-colorful-fake-tatoo-flash-tatto-waterproof-small-body-art-for-child/,"Rocooart 1 sheet Hot Football Kids Temporary Tattoo Sticker Colorful Fake Tatoo Flash Tatto Waterproof Small Body Art For Child",2020/02/Rocooart-1-sheet-Hot-Football-Kids-Temporary-Tattoo-Sticker-Colorful-Fake-Tatoo-Flash-Tatto-Waterproof-Small.jpg
193651,https://wallcorners.com/product/1pcs-big-size-rose-flowers-temporary-tattoos-stickers-sexy-women-arm-shoulder-body-waterproof-flash-tattoo-stickers/,"1Pcs Big Size Rose Flowers Temporary Tattoos Stickers Sexy Women Arm Shoulder Body Waterproof Flash Tattoo Stickers",2020/02/1Pcs-Big-Size-Rose-Flowers-Temporary-Tattoos-Stickers-Sexy-Women-Arm-Shoulder-Body-Waterproof-Flash-Tattoo.jpg
193658,https://wallcorners.com/product/waterproof-world-map-temporary-tattoo-sticker-women-coconut-tree-planet-pattern-body-art-new-design-fake-men-tattoos/,"Waterproof World Map Temporary Tattoo Sticker Women Coconut tree planet pattern Body Art New Design Fake Men Tattoos",2020/02/Waterproof-World-Map-Temporary-Tattoo-Sticker-Women-Coconut-tree-planet-pattern-Body-Art-New-Design-Fake.jpg
193664,https://wallcorners.com/product/waterproof-black-infinity-tattoo-feather-bird-women-body-hand-art-drawing-temporary-tattoo-stickers-men-finger-tatto-small-paste/,"Waterproof Black Infinity Tattoo Feather Bird Women Body Hand Art Drawing Temporary Tattoo Stickers Men Finger Tatto Small Paste",2020/02/Waterproof-Black-Infinity-Tattoo-Feather-Bird-Women-Body-Hand-Art-Drawing-Temporary-Tattoo-Stickers-Men-Finger.jpg
193687,https://wallcorners.com/product/waterproof-temporary-tattoo-sticker-ancient-egypt-scarab-fake-tatto-flash-tatoo-tatouage-hand-foot-for-men-women/,"Waterproof Temporary Tattoo Sticker Ancient Egypt Scarab Fake Tatto Flash Tatoo Tatouage hand foot For Men Women",2020/02/Waterproof-Temporary-Tattoo-Sticker-Ancient-Egypt-Scarab-Fake-Tatto-Flash-Tatoo-Tatouage-hand-foot-For-Men.jpg
193696,https://wallcorners.com/product/rocooart-cartoon-unicorn-tattoo-for-kid-cute-fake-taty-children-tatouage-temporaire-body-art-waterproof-temporary-tattoo-sticker/,"Rocooart Cartoon Unicorn Tattoo For Kid Cute Fake Taty Children Tatouage Temporaire Body Art Waterproof Temporary Tattoo Sticker",2020/02/Rocooart-Cartoon-Unicorn-Tattoo-For-Kid-Cute-Fake-Taty-Children-Tatouage-Temporaire-Body-Art-Waterproof-Temporary.jpg
193914,https://wallcorners.com/product/water-transfer-tattoo-minimalist-small-sun-moon-tattoo-body-art-waterproof-temporary-fake-tattoo-for-man-woman-kid-10-56cm/,"Water Transfer Tattoo Minimalist small sun moon tattoo Body Art Waterproof Temporary fake Tattoo for man woman kid 10.5*6cm",2020/02/Water-Transfer-Tattoo-Minimalist-small-sun-moon-tattoo-Body-Art-Waterproof-Temporary-fake-Tattoo-for-man.jpg
193918,https://wallcorners.com/product/ophir-12-color-airbrush-tattoo-inks-with-color-wheel-30ml-bottle-body-art-paint-colors-for-temporary-tattoo-pigment_ta053ac128/,"OPHIR 12 Color Airbrush Tattoo Inks with Color Wheel 30ML/Bottle Body Art Paint Colors for Temporary Tattoo Pigment_TA053+AC128",2020/02/OPHIR-12-Color-Airbrush-Tattoo-Inks-with-Color-Wheel-30ML-Bottle-Body-Art-Paint-Colors-for.jpg
193921,https://wallcorners.com/product/30-sheet-waterproof-temporary-tattoos-flower-animal-body-art-fake-tattoo-women-kids-feather-heart-quote-false-tattoos-sleeve/,"30 Sheet Waterproof Temporary Tattoos Flower Animal Body Art Fake Tattoo Women Kids Feather Heart Quote False Tattoos Sleeve",2020/02/30-Sheet-Waterproof-Temporary-Tattoos-Flower-Animal-Body-Art-Fake-Tattoo-Women-Kids-Feather-Heart-Quote.jpg
193925,https://wallcorners.com/product/tian-ci-100pcs-per-bag-tattoo-supplies-fougera-vitamin-ointment-anti-scar-tattoo-aftercare-cream-for-tattoo-body-art/,"TIAN CI 100Pcs per bag Tattoo Supplies Fougera Vitamin Ointment Anti Scar Tattoo Aftercare Cream For Tattoo Body Art",2020/02/TIAN-CI-100Pcs-per-bag-Tattoo-Supplies-Fougera-Vitamin-Ointment-Anti-Scar-Tattoo-Aftercare-Cream-For.jpg
193926,https://wallcorners.com/product/tattoo-bandage-roll-tian-ci-6-x-10-9-yard-tattoo-film-aftercare-protective-waterprooftattoo-aftercare-for-initial-healing/,"Tattoo Bandage Roll - TIAN CI 6"" x 10.9 Yard Tattoo Film AfterCare Protective Waterproof,Tattoo Aftercare for Initial Healing",2020/02/Tattoo-Bandage-Roll-TIAN-CI-6-x-10-9-Yard-Tattoo-Film-AfterCare-Protective-Waterproof-Tattoo.jpg
