198265,https://wallcorners.com/product/watercolor-lavender-reed-glory-flower-tattoos-temporary-design-full-flower-arm-body-art-big-large-fake-tattoo-sticker-tattoo/,"Watercolor Lavender Reed Glory Flower Tattoos Temporary  Design Full Flower Arm Body Art Big Large Fake Tattoo Sticker Tattoo",2020/02/Watercolor-Lavender-Reed-Glory-Flower-Tattoos-Temporary-Design-Full-Flower-Arm-Body-Art-Big-Large-Fake.jpg
198274,https://wallcorners.com/product/waterproof-temporary-tattoo-sticker-totem-geometric-full-arm-large-size-sleeve-tatoo-fake-tatto-flash-tattoos-for-men-women/,"Waterproof Temporary Tattoo Sticker totem geometric full arm large size sleeve tatoo fake tatto flash tattoos for men women",2020/02/Waterproof-Temporary-Tattoo-Sticker-totem-geometric-full-arm-large-size-sleeve-tatoo-fake-tatto-flash-tattoos.jpg
198309,https://wallcorners.com/product/3d-temporary-tattoo-animal-blue-tiger-snake-moth-for-boy-girl-children-tattoo-sticker-kids-watercolor-tatto-arm-art/,"3D Temporary Tattoo Animal Blue Tiger Snake Moth For Boy Girl Children Tattoo Sticker Kids Watercolor Tatto Arm Art",2020/02/3D-Temporary-Tattoo-Animal-Blue-Tiger-Snake-Moth-For-Boy-Girl-Children-Tattoo-Sticker-Kids-Watercolor.jpg
198325,https://wallcorners.com/product/waterproof-temporary-tattoo-stickers-tribal-totem-fake-tatto-flash-tatoo-body-art-back-leg-arm-belly-big-size-for-women-men-girl/,"Waterproof Temporary Tattoo Stickers Tribal Totem Fake Tatto Flash Tatoo Body art Back Leg Arm belly big size for Women Men girl",2020/02/Waterproof-Temporary-Tattoo-Stickers-Tribal-Totem-Fake-Tatto-Flash-Tatoo-Body-art-Back-Leg-Arm-belly.jpg
198409,https://wallcorners.com/product/24-styles-sexy-women-flowers-tempoary-tattoo-sticker-waterproof-rose-peony-lotus-peach-tattoo-body-art-fake-tatoos/,"24 Styles Sexy Women Flowers Tempoary Tattoo Sticker Waterproof  Rose Peony lotus peach Tattoo Body Art fake Tatoos",2020/02/24-Styles-Sexy-Women-Flowers-Tempoary-Tattoo-Sticker-Waterproof-Rose-Peony-lotus-peach-Tattoo-Body-Art.jpg
198418,https://wallcorners.com/product/rocooart-classic-black-tattoo-cat-bird-fake-tattoo-tatuajes-hand-tatouage-body-waterproof-temporary-tattoo-sticker-small-taty/,"Rocooart Classic Black Tattoo Cat Bird Fake Tattoo Tatuajes Hand Tatouage Body Waterproof Temporary Tattoo Sticker Small Taty",2020/02/Rocooart-Classic-Black-Tattoo-Cat-Bird-Fake-Tattoo-Tatuajes-Hand-Tatouage-Body-Waterproof-Temporary-Tattoo-Sticker.jpg
198487,https://wallcorners.com/product/1pc-10cm-tattoo-sticker-disposable-tattoo-bird-design-waterproof-tattoo-sticker/,"1pc 10cm Tattoo Sticker Disposable Tattoo Bird Design Waterproof Tattoo Sticker",2020/02/1pc-10cm-Tattoo-Sticker-Disposable-Tattoo-Bird-Design-Waterproof-Tattoo-Sticker.jpg
198532,https://wallcorners.com/product/glaryyears-1-sheet-dinosaur-makeup-temporary-tattoo-sticker-cute-fake-tatoo-flash-tatto-waterproof-small-body-art-for-children/,"glaryyears 1 Sheet Dinosaur Makeup Temporary Tattoo Sticker Cute Fake Tatoo Flash Tatto Waterproof Small Body Art For Children",2020/02/glaryyears-1-Sheet-Dinosaur-Makeup-Temporary-Tattoo-Sticker-Cute-Fake-Tatoo-Flash-Tatto-Waterproof-Small-Body.jpg
198552,https://wallcorners.com/product/hot-2019-black-butterfly-flower-tattoo-design-temporary-tribal-body-tattoo-sticker-arm-leg-belly-tattoo-for-women-waterproof/,"Hot 2019 Black Butterfly flower tattoo design temporary tribal body tattoo sticker arm leg belly tattoo for women waterproof",2020/02/Hot-2019-Black-Butterfly-flower-tattoo-design-temporary-tribal-body-tattoo-sticker-arm-leg-belly-tattoo.jpg
198624,https://wallcorners.com/product/mini-body-art-waterproof-temporary-tattoos-for-women-flower-design-flash-tattoo-sticker-cc6034/,"Mini Body Art waterproof temporary tattoos for women flower design flash tattoo sticker CC6034",2020/02/Mini-Body-Art-waterproof-temporary-tattoos-for-women-flower-design-flash-tattoo-sticker-CC6034.jpg
198650,https://wallcorners.com/product/fake-raccoon-black-waterproof-arm-koala-tattoos-stickers-sketch-body-art-cartoon-tatto-temporary-wrist-makeup-tips-tattoo-decals/,"Fake Raccoon Black Waterproof Arm Koala Tattoos Stickers Sketch Body Art Cartoon Tatto Temporary Wrist Makeup Tips Tattoo Decals",2020/02/Fake-Raccoon-Black-Waterproof-Arm-Koala-Tattoos-Stickers-Sketch-Body-Art-Cartoon-Tatto-Temporary-Wrist-Makeup.jpg
198680,https://wallcorners.com/product/new-1pc-feather-image-temporary-tattoos-stickers-sexy-harajuku-waterproof-temporary-tattoo-for-man-woman-fake-tattoo-stickers/,"NEW 1PC feather Image Temporary Tattoos Stickers Sexy Harajuku Waterproof Temporary Tattoo For Man Woman Fake Tattoo Stickers",2020/02/NEW-1PC-feather-Image-Temporary-Tattoos-Stickers-Sexy-Harajuku-Waterproof-Temporary-Tattoo-For-Man-Woman-Fake.jpg
198683,https://wallcorners.com/product/waterproof-temporary-tattoo-sticker-lovely-bamboo-panda-animals-tatto-flash-tatoo-fake-tattoos-for-kids-men-women/,"Waterproof Temporary Tattoo Sticker lovely bamboo panda animals tatto flash tatoo fake tattoos for kids men women",2020/02/Waterproof-Temporary-Tattoo-Sticker-lovely-bamboo-panda-animals-tatto-flash-tatoo-fake-tattoos-for-kids-men.jpg
198719,https://wallcorners.com/product/waterproof-temporary-tatoo-sticker-black-lace-crown-for-king-queen-tattoo-water-transfer-fake-tatoo-flash-tatto-10-56cm/,"Waterproof Temporary tatoo sticker  black Lace Crown for king queen tattoo Water Transfer fake tatoo flash tatto 10.5*6cm",2020/02/Waterproof-Temporary-tatoo-sticker-black-Lace-Crown-for-king-queen-tattoo-Water-Transfer-fake-tatoo-flash.jpg
198729,https://wallcorners.com/product/body-art-waterproof-temporary-tattoos-for-men-women-beautiful-3d-black-star-design-flash-tattoo-sticker-hc-021/,"Body Art waterproof temporary tattoos for men women beautiful 3d black star design flash tattoo sticker HC-021",2020/02/Body-Art-waterproof-temporary-tattoos-for-men-women-beautiful-3d-black-star-design-flash-tattoo-sticker.jpg
198782,https://wallcorners.com/product/30pcs-set-sexy-temporary-tattoo-sticker-body-art-alphabet-crown-flower-small-pattern-design-waterproof-fake-tatoo-for-men-women/,"30pcs/set Sexy Temporary Tattoo Sticker Body Art Alphabet Crown Flower Small Pattern Design Waterproof Fake Tatoo for Men Women",2020/02/30pcs-set-Sexy-Temporary-Tattoo-Sticker-Body-Art-Alphabet-Crown-Flower-Small-Pattern-Design-Waterproof-Fake.jpg
198820,https://wallcorners.com/product/cartoon-mermaid-unicorn-dolphin-temporary-tattoo-sticker-for-kids-children-fake-hand-joker-tattoo-kids-tattoo-sticker-face-tatoo/,"Cartoon Mermaid Unicorn Dolphin Temporary Tattoo Sticker For Kids Children Fake Hand Joker Tattoo kids Tattoo Sticker Face Tatoo",2020/02/Cartoon-Mermaid-Unicorn-Dolphin-Temporary-Tattoo-Sticker-For-Kids-Children-Fake-Hand-Joker-Tattoo-kids-Tattoo.jpg
198878,https://wallcorners.com/product/hxman-dreamcatcher-temporary-tattoos-waterproof-women-fashion-fake-body-art-arm-tattoo-sticker-9-8x6cm-kids-hand-tatoo-t-016/,"HXMAN Dreamcatcher Temporary Tattoos Waterproof Women Fashion Fake Body Art Arm Tattoo Sticker 9.8X6cm Kids Hand Tatoo T-016",2020/02/HXMAN-Dreamcatcher-Temporary-Tattoos-Waterproof-Women-Fashion-Fake-Body-Art-Arm-Tattoo-Sticker-9-8X6cm-Kids.jpg
198891,https://wallcorners.com/product/hxman-colorful-sparrow-birds-women-temporary-tattoo-sticker-tattoos-for-waterproof-kids-body-art-tatoo-9-8x6cm-a-185/,"HXMAN Colorful Sparrow Birds Women Temporary Tattoo Sticker Tattoos for Waterproof Kids Body Art Tatoo 9.8X6cm A-185",2020/02/HXMAN-Colorful-Sparrow-Birds-Women-Temporary-Tattoo-Sticker-Tattoos-for-Waterproof-Kids-Body-Art-Tatoo-9.jpg
198910,https://wallcorners.com/product/wounded-lonely-wolf-waterproof-temporary-tattoos-men-sad-animal-temporary-tattoo-tatouage-rose-fake-tattoo-sleeve-tatoo-sticker/,"Wounded lonely wolf Waterproof Temporary Tattoos Men Sad Animal Temporary Tattoo tatouage  Rose fake tattoo sleeve tatoo sticker",2020/02/Wounded-lonely-wolf-Waterproof-Temporary-Tattoos-Men-Sad-Animal-Temporary-Tattoo-tatouage-Rose-fake-tattoo-sleeve.jpg
199038,https://wallcorners.com/product/batman-the-joker-temporary-tattoos-sticker-suicide-squad-harley-quinn-cosplay-costume-prop/,"Batman The Joker Temporary Tattoos Sticker Suicide Squad Harley Quinn Cosplay Costume Prop",2020/02/Batman-The-Joker-Temporary-Tattoos-Sticker-Suicide-Squad-Harley-Quinn-Cosplay-Costume-Prop.jpg
199050,https://wallcorners.com/product/large-arm-sleeve-tattoo-maori-power-totem-waterproof-temporary-tattoo-sticker-warrior-samurai-angel-skull-men-full-black-tatoo/,"Large Arm Sleeve Tattoo Maori Power Totem Waterproof Temporary Tattoo Sticker Warrior Samurai Angel Skull Men Full Black Tatoo",2020/02/Large-Arm-Sleeve-Tattoo-Maori-Power-Totem-Waterproof-Temporary-Tattoo-Sticker-Warrior-Samurai-Angel-Skull-Men.jpg
199051,https://wallcorners.com/product/yuran-men-fashion-black-tattoo-stickers-little-peak-wolf-temporary-tattoo-women-body-art-painting-forearm-waterproof-tatoos-moon/,"YURAN Men Fashion Black Tattoo Stickers Little Peak Wolf Temporary Tattoo Women Body Art Painting Forearm Waterproof Tatoos Moon",2020/02/YURAN-Men-Fashion-Black-Tattoo-Stickers-Little-Peak-Wolf-Temporary-Tattoo-Women-Body-Art-Painting-Forearm.jpg
199059,https://wallcorners.com/product/water-transfer-3d-star-black-planet-tree-temporary-tattoo-sticker-for-kids-women-men-wolf-lion-tree-tattoos-foream-body-arm-tato/,"Water Transfer 3D Star Black Planet Tree Temporary Tattoo Sticker For Kids Women Men Wolf Lion Tree Tattoos Foream Body Arm Tato",2020/02/Water-Transfer-3D-Star-Black-Planet-Tree-Temporary-Tattoo-Sticker-For-Kids-Women-Men-Wolf-Lion.jpg
199062,https://wallcorners.com/product/vankirs-black-henna-totem-fake-tattoo-stickers-geometric-pentagram-women-temporary-tattoo-men-arm-ankle-badge-diy-tatoo-supplies/,"VANKIRS Black Henna Totem Fake Tattoo Stickers Geometric Pentagram Women Temporary Tattoo Men Arm Ankle Badge DIY Tatoo Supplies",2020/02/VANKIRS-Black-Henna-Totem-Fake-Tattoo-Stickers-Geometric-Pentagram-Women-Temporary-Tattoo-Men-Arm-Ankle-Badge.jpg
199068,https://wallcorners.com/product/geometric-planet-temporary-tattoo-for-children-girl-moon-forest-waterproof-fake-black-tattoo-stickers-kids-women-ear-tatoos/,"Geometric Planet Temporary Tattoo For Children Girl Moon Forest Waterproof Fake Black Tattoo Stickers Kids Women Ear Tatoos",2020/02/Geometric-Planet-Temporary-Tattoo-For-Children-Girl-Moon-Forest-Waterproof-Fake-Black-Tattoo-Stickers-Kids-Women.jpg
199208,https://wallcorners.com/product/hxman-dragon-women-temporary-tattoo-sticker-tattoos-for-waterproof-men-fashion-body-art-kids-hand-fake-tatoo-10-5x6cm-a-216/,"HXMAN Dragon Women Temporary Tattoo Sticker Tattoos for Waterproof Men Fashion Body Art Kids Hand Fake Tatoo 10.5X6cm A-216",2020/02/HXMAN-Dragon-Women-Temporary-Tattoo-Sticker-Tattoos-for-Waterproof-Men-Fashion-Body-Art-Kids-Hand-Fake.jpg
199300,https://wallcorners.com/product/1-sheet-3d-rose-gold-fish-goldfish-flower-girl-tatto-stickers-flash-tatoo-fake-tattoos-waterproof-temporary-tattoo/,"1 Sheet 3D Rose Gold Fish Goldfish Flower Girl Tatto Stickers Flash Tatoo Fake Tattoos Waterproof Temporary Tattoo",2020/02/1-Sheet-3D-Rose-Gold-Fish-Goldfish-Flower-Girl-Tatto-Stickers-Flash-Tatoo-Fake-Tattoos-Waterproof.jpg
199334,https://wallcorners.com/product/family-rose-time-gun-clock-skull-temporary-tattoo-sticker-scorpion-tower-waterproof-tattoos-body-art-arm-fake-tatoo-men-wo/,"Family Rose Time Gun clock Skull Temporary Tattoo Sticker Scorpion Tower Waterproof Tattoos Body Art Arm Fake Tatoo Men Wo",2020/02/Family-Rose-Time-Gun-clock-Skull-Temporary-Tattoo-Sticker-Scorpion-Tower-Waterproof-Tattoos-Body-Art-Arm.jpg
199337,https://wallcorners.com/product/1-sheet-women-sternum-jewelry-tattoo-temporary-body-chest-waist-art-tattoo-sticker-cool-sexy-choker-pendant-under-breast-designs/,"1 sheet Women Sternum Jewelry Tattoo Temporary Body Chest Waist Art Tattoo Sticker Cool Sexy Choker Pendant Under breast designs",2020/02/1-sheet-Women-Sternum-Jewelry-Tattoo-Temporary-Body-Chest-Waist-Art-Tattoo-Sticker-Cool-Sexy-Choker.jpg
199354,https://wallcorners.com/product/temporary-tattoos-for-women-leg-shoulder-tattoo-rose-and-snake-tattoo-fake-water-transfer-tattoo-watercolor-body-art-thigh-tatto/,"temporary tattoos for women leg shoulder tattoo rose and snake tattoo fake water transfer tattoo watercolor body art thigh tatto",2020/02/temporary-tattoos-for-women-leg-shoulder-tattoo-rose-and-snake-tattoo-fake-water-transfer-tattoo-watercolor.jpg
199357,https://wallcorners.com/product/temporary-tattoos-3d-black-robot-mechanical-arm-fake-transfer-tattoo-stickers-hot-sexy-cool-men-spray-waterproof-designs-c058/,"Temporary tattoos 3D black Robot mechanical arm fake transfer tattoo stickers hot sexy cool men spray waterproof designs C058",2020/02/Temporary-tattoos-3D-black-Robot-mechanical-arm-fake-transfer-tattoo-stickers-hot-sexy-cool-men-spray.jpg
199363,https://wallcorners.com/product/waterproof-temporary-tattoo-sticker-rose-flower-small-fake-tatto-stickers-flash-tatoo-hand-foot-tattoos-for-girl-men-women-kids/,"Waterproof Temporary Tattoo sticker rose flower small fake tatto stickers flash tatoo hand foot tattoos for girl men women kids",2020/02/Waterproof-Temporary-Tattoo-sticker-rose-flower-small-fake-tatto-stickers-flash-tatoo-hand-foot-tattoos-for.jpg
199465,https://wallcorners.com/product/waterproof-temporary-tattoo-sticker-butterfly-fake-tatto-flash-tatoo-leg-arm-hand-foot-tatouage-for-girl-women-lady/,"Waterproof Temporary Tattoo Sticker  Butterfly Fake Tatto Flash Tatoo leg Arm hand foot tatouage for Girl Women lady",2020/02/Waterproof-Temporary-Tattoo-Sticker-Butterfly-Fake-Tatto-Flash-Tatoo-leg-Arm-hand-foot-tatouage-for-Girl.jpg
199627,https://wallcorners.com/product/waterproof-temporary-tattoo-moon-tatto-stickers-flash-tatoo-fake-tatoos-hand-foot-neck-arm-body-art-tatouage-for-men-girl-women/,"Waterproof Temporary Tattoo Moon tatto stickers flash tatoo fake tatoos hand foot neck arm body art tatouage for men girl women",2020/02/Waterproof-Temporary-Tattoo-Moon-tatto-stickers-flash-tatoo-fake-tatoos-hand-foot-neck-arm-body-art.jpg
199640,https://wallcorners.com/product/27-designs-waterproof-temporary-tattoo-sticker-tiger-dragon-hawk-snake-for-men-tatto-stickers-flash-tatoo-fake-tattoos-body-art/,"27 designs Waterproof Temporary Tattoo Sticker tiger dragon hawk snake for men tatto stickers flash tatoo fake tattoos Body Art",2020/02/27-designs-Waterproof-Temporary-Tattoo-Sticker-tiger-dragon-hawk-snake-for-men-tatto-stickers-flash-tatoo.jpg
199649,https://wallcorners.com/product/ommgo-black-love-minimalist-adults-temporary-tattoos-sticker-small-fake-tattoo-gun-custom-tatoos-for-women-sexy-body-art-arm/,"OMMGO Black Love Minimalist Adults Temporary Tattoos Sticker Small Fake Tattoo Gun Custom Tatoos For Women Sexy Body Art Arm",2020/02/OMMGO-Black-Love-Minimalist-Adults-Temporary-Tattoos-Sticker-Small-Fake-Tattoo-Gun-Custom-Tatoos-For-Women.jpg
199656,https://wallcorners.com/product/ommgo-geometric-mountain-small-temporary-tattoos-sticker-wave-colorful-forest-custom-tattoo-body-art-arm-fake-tatoos-women-men/,"OMMGO Geometric Mountain Small Temporary Tattoos Sticker Wave Colorful Forest Custom Tattoo Body Art Arm Fake Tatoos Women Men",2020/02/OMMGO-Geometric-Mountain-Small-Temporary-Tattoos-Sticker-Wave-Colorful-Forest-Custom-Tattoo-Body-Art-Arm-Fake.jpg
199781,https://wallcorners.com/product/batman-temporary-tattoo-stickers-for-kids-boys-superheros-union-fake-flash-waterproof-tattoo/,"Batman Temporary Tattoo Stickers For Kids Boys Superheros Union Fake Flash Waterproof Tattoo",2020/02/Batman-Temporary-Tattoo-Stickers-For-Kids-Boys-Superheros-Union-Fake-Flash-Waterproof-Tattoo.jpg
199858,https://wallcorners.com/product/waterproof-temporary-tattoo-sticker-snake-flower-rose-flash-tattoos-lace-fox-lion-tree-body-art-arm-fake-sleeve-tattoo-women/,"Waterproof Temporary Tattoo Sticker Snake Flower Rose Flash Tattoos Lace Fox Lion Tree Body Art Arm Fake Sleeve Tattoo Women",2020/02/Waterproof-Temporary-Tattoo-Sticker-Snake-Flower-Rose-Flash-Tattoos-Lace-Fox-Lion-Tree-Body-Art-Arm.jpg
199899,https://wallcorners.com/product/rocooart-cc6-6x6cm-little-vintage-old-school-style-gun-girls-women-black-white-face-temporary-tattoo-sticker-body-art-fake-taty/,"Rocooart CC6 6X6cm Little Vintage Old School Style Gun Girls Women Black White Face Temporary Tattoo Sticker Body Art Fake Taty",2020/02/Rocooart-CC6-6X6cm-Little-Vintage-Old-School-Style-Gun-Girls-Women-Black-White-Face-Temporary-Tattoo.jpg
199963,https://wallcorners.com/product/diy-3d-mini-body-art-waterproof-temporary-tattoos-for-men-women-butterfly-design-flash-tattoo-sticker-cc6101/,"DIY 3D Mini Body Art waterproof temporary tattoos for men women butterfly design flash tattoo sticker CC6101",2020/02/DIY-3D-Mini-Body-Art-waterproof-temporary-tattoos-for-men-women-butterfly-design-flash-tattoo-sticker.jpg
199984,https://wallcorners.com/product/1pc-owl-design-large-arm-tattoo-sleeve-flash-hedwig-temporary-tattoo-sticker-waterproof-henna-tatoo-women-body-art/,"1PC Owl Design Large Arm Tattoo Sleeve Flash Hedwig Temporary Tattoo Sticker Waterproof Henna Tatoo Women Body Art",2020/02/1PC-Owl-Design-Large-Arm-Tattoo-Sleeve-Flash-Hedwig-Temporary-Tattoo-Sticker-Waterproof-Henna-Tatoo-Women.jpg
199985,https://wallcorners.com/product/yuran-black-tulip-totem-tattoos-stickers-women-body-waist-arm-art-bracelet-tattoos-temporary-girls-butterfly-tatoos-rose-chains/,"YURAN Black Tulip Totem Tattoos Stickers Women Body Waist Arm Art Bracelet Tattoos Temporary Girls Butterfly Tatoos Rose Chains",2020/02/YURAN-Black-Tulip-Totem-Tattoos-Stickers-Women-Body-Waist-Arm-Art-Bracelet-Tattoos-Temporary-Girls-Butterfly.jpg
199986,https://wallcorners.com/product/5-pcs-new-mixed-92nylon-elastic-fake-temporary-tattoo-sleeves-design-body-arm-sleeves-tattoo-for-cool-men-women-tattoo-sleeves/,"5 PCS new mixed 92%Nylon elastic Fake temporary tattoo sleeves design body Arm sleeves tattoo for cool men women tattoo sleeves",2020/02/5-PCS-new-mixed-92-Nylon-elastic-Fake-temporary-tattoo-sleeves-design-body-Arm-sleeves-tattoo.jpg
199989,https://wallcorners.com/product/poker-spades-waterproof-temporary-tattoos-women-fake-tattoo-body-stickers-tatoo-men-festival-tattoo-tatuajes-faux-tatouage/,"Poker Spades Waterproof Temporary Tattoos Women Fake Tattoo Body Stickers Tatoo Men  Festival Tattoo Tatuajes Faux Tatouage",2020/02/Poker-Spades-Waterproof-Temporary-Tattoos-Women-Fake-Tattoo-Body-Stickers-Tatoo-Men-Festival-Tattoo-Tatuajes-Faux.jpg
199992,https://wallcorners.com/product/ommgo-dinosaur-monster-fierce-temporary-tattoos-sticker-roar-tyrannosaurus-rex-custom-tattoo-body-art-arm-wrist-fake-tatoos-men/,"OMMGO Dinosaur Monster Fierce Temporary Tattoos Sticker Roar Tyrannosaurus Rex Custom Tattoo Body Art Arm Wrist Fake Tatoos Men",2020/02/OMMGO-Dinosaur-Monster-Fierce-Temporary-Tattoos-Sticker-Roar-Tyrannosaurus-Rex-Custom-Tattoo-Body-Art-Arm-Wrist.jpg
199999,https://wallcorners.com/product/childrens-space-series-temporary-tattoo-boys-and-girls-arm-cartoon-astronauts-art-tattoo-stickers-planet-water-transfer-taty/,"Children's Space Series Temporary Tattoo Boys and Girls Arm Cartoon Astronauts Art Tattoo Stickers Planet Water Transfer Taty",2020/02/Children-s-Space-Series-Temporary-Tattoo-Boys-and-Girls-Arm-Cartoon-Astronauts-Art-Tattoo-Stickers-Planet.jpg
200039,https://wallcorners.com/product/yuran-black-rifle-gun-temporary-tattoo-stickers-women-sniper-waterproof-tatoo-ak-akm-m4-soldier-men-wrist-fake-tattoo-wolf-totem/,"YURAN Black Rifle Gun Temporary Tattoo Stickers Women Sniper Waterproof Tatoo AK AKM M4 Soldier Men Wrist Fake Tattoo Wolf Totem",2020/02/YURAN-Black-Rifle-Gun-Temporary-Tattoo-Stickers-Women-Sniper-Waterproof-Tatoo-AK-AKM-M4-Soldier-Men.jpg
200069,https://wallcorners.com/product/new-designs-chest-flash-tattoo-large-rose-flower-dragonfly-shoulder-arm-sternum-tattoos-henna-body-back-paint-under-breast-skull/,"New designs Chest Flash Tattoo large rose flower dragonfly shoulder arm Sternum tattoos henna body/back paint Under breast skull",2020/02/New-designs-Chest-Flash-Tattoo-large-rose-flower-dragonfly-shoulder-arm-Sternum-tattoos-henna-body-back.jpg
200180,https://wallcorners.com/product/mandala-lotus-flower-tattoo-mehndi-henna-stickers-for-hands-sexy-arab-tattoo-black-sketches-tattoo-designs-waterproof-body-art/,"mandala lotus flower tattoo mehndi henna stickers for hands sexy arab tattoo black sketches tattoo designs waterproof body art",2020/02/mandala-lotus-flower-tattoo-mehndi-henna-stickers-for-hands-sexy-arab-tattoo-black-sketches-tattoo-designs.jpg
200219,https://wallcorners.com/product/hxman-dragon-women-temporary-tattoo-sticker-tattoos-for-waterproof-men-fashion-body-art-kids-hand-fake-tatoo-10-5x6cm-a-230/,"HXMAN Dragon Women Temporary Tattoo Sticker Tattoos for Waterproof Men Fashion Body Art Kids Hand Fake Tatoo 10.5X6cm A-230",2020/02/HXMAN-Dragon-Women-Temporary-Tattoo-Sticker-Tattoos-for-Waterproof-Men-Fashion-Body-Art-Kids-Hand-Fake-1.jpg
200248,https://wallcorners.com/product/waterproof-temporary-tattoo-sticker-black-musical-note-music-tatto-flash-tatoo-fake-arm-hand-body-tatouage-for-men-women-kids/,"Waterproof Temporary Tattoo Sticker Black Musical Note Music Tatto Flash Tatoo Fake Arm Hand Body Tatouage  for Men Women Kids",2020/02/Waterproof-Temporary-Tattoo-Sticker-Black-Musical-Note-Music-Tatto-Flash-Tatoo-Fake-Arm-Hand-Body-Tatouage.jpg
200299,https://wallcorners.com/product/waterproof-temporary-tattoo-sticker-fly-birds-mermaid-owl-deer-mandala-tatto-stickers-flash-tatoo-fake-tattoos-for-women-girl-4/,"Waterproof Temporary Tattoo Sticker fly birds mermaid owl deer mandala tatto stickers flash tatoo fake tattoos for women girl 4",2020/02/Waterproof-Temporary-Tattoo-Sticker-fly-birds-mermaid-owl-deer-mandala-tatto-stickers-flash-tatoo-fake-tattoos.jpg
200303,https://wallcorners.com/product/waterproof-temporary-tattoo-camellia-rose-flowers-freedom-tatto-stickers-flash-tatoo-fake-tattoos-for-girl-women-lady/,"Waterproof Temporary Tattoo camellia rose flowers freedom tatto stickers flash tatoo fake tattoos for girl women lady",2020/02/Waterproof-Temporary-Tattoo-camellia-rose-flowers-freedom-tatto-stickers-flash-tatoo-fake-tattoos-for-girl-women.jpg
200309,https://wallcorners.com/product/16-sheets-different-black-small-tattoo-design-women-unique-temporary-tattoo-sticker-body-art-fake-hands-tatoo/,"16 Sheets Different Black Small Tattoo Design Women Unique Temporary Tattoo Sticker Body Art Fake Hands Tatoo.",2020/02/16-Sheets-Different-Black-Small-Tattoo-Design-Women-Unique-Temporary-Tattoo-Sticker-Body-Art-Fake-Hands.jpg
200328,https://wallcorners.com/product/waterproof-temporary-tattoo-sticker-rose-flower-fake-tatto-personality-flash-tatoo-hand-arm-foot-back-tato-for-girl-women-men/,"Waterproof Temporary Tattoo Sticker Rose Flower Fake Tatto Personality Flash Tatoo Hand Arm Foot Back Tato for Girl Women Men",2020/02/Waterproof-Temporary-Tattoo-Sticker-Rose-Flower-Fake-Tatto-Personality-Flash-Tatoo-Hand-Arm-Foot-Back-Tato.jpg
200382,https://wallcorners.com/product/waterproof-temporary-tattoo-stickers-cobra-snake-animal-fake-tatto-flash-tatoo-body-art-tattoos-for-girl-women-men-kid/,"Waterproof Temporary Tattoo Stickers cobra snake animal Fake Tatto Flash Tatoo Body Art tattoos for Girl Women Men kid",2020/02/Waterproof-Temporary-Tattoo-Stickers-cobra-snake-animal-Fake-Tatto-Flash-Tatoo-Body-Art-tattoos-for-Girl.jpg
200536,https://wallcorners.com/product/hxman-flower-temporary-tattoos-for-women-hand-tattoo-sticker-fashion-body-art-waterproof-arm-fake-tatoo-paper-9-8x6cm-p-013/,"HXMAN Flower Temporary Tattoos for Women Hand Tattoo Sticker Fashion Body Art Waterproof Arm Fake Tatoo Paper 9.8X6cm P-013",2020/02/HXMAN-Flower-Temporary-Tattoos-for-Women-Hand-Tattoo-Sticker-Fashion-Body-Art-Waterproof-Arm-Fake-Tatoo.jpg
200562,https://wallcorners.com/product/tattoo-body-art-mandala-tattoo-women-mehndi-henna-tattoo-stickers-temporary-tattoo-sticker-sexy-arab-indian-lotus-flower-art/,"tattoo &amp; body art mandala tattoo women mehndi henna tattoo stickers temporary tattoo sticker sexy arab indian lotus flower art",2020/02/tattoo-body-art-mandala-tattoo-women-mehndi-henna-tattoo-stickers-temporary-tattoo-sticker-sexy-arab-indian.jpg
200584,https://wallcorners.com/product/glaryyears-1-sheet-temporary-tattoo-sticker-colorful-fake-tatoo-unicorn-flash-tatto-waterproof-small-body-art-child-24-designs/,"Glaryyears 1 Sheet Temporary Tattoo Sticker Colorful Fake Tatoo Unicorn Flash Tatto Waterproof Small Body Art Child 24 Designs",2020/02/Glaryyears-1-Sheet-Temporary-Tattoo-Sticker-Colorful-Fake-Tatoo-Unicorn-Flash-Tatto-Waterproof-Small-Body-Art.jpg
200595,https://wallcorners.com/product/temporary-tattoo-black-flower-tattoo-sleeves-water-transfer-tatoo-sticker-peony-rose-tattoos-body-art-sexy-tatoo-girl-arm-tatto-2/,"temporary tattoo black flower tattoo sleeves water transfer tatoo sticker peony rose tattoos body art sexy tatoo girl arm tatto",2020/02/temporary-tattoo-black-flower-tattoo-sleeves-water-transfer-tatoo-sticker-peony-rose-tattoos-body-art-sexy-6.jpg
200614,https://wallcorners.com/product/hxman-watercolor-butterfly-temporary-tattoo-sticker-waterproof-women-fake-tattoos-men-children-body-art-hot-design-9-8x6cm-a-001/,"HXMAN Watercolor Butterfly Temporary Tattoo Sticker Waterproof Women Fake Tattoos Men Children Body Art Hot Design 9.8X6cm A-001",2020/02/HXMAN-Watercolor-Butterfly-Temporary-Tattoo-Sticker-Waterproof-Women-Fake-Tattoos-Men-Children-Body-Art-Hot-Design.jpg
200746,https://wallcorners.com/product/tcool-dandelion-waterproof-temporary-tattoo-sticker-fashion-women-men-arm-fake-body-art-10-5x6cm-kids-adult-hand-tattoos-p-132/,"TCOOL Dandelion Waterproof Temporary Tattoo Sticker Fashion Women Men Arm Fake Body Art 10.5X6cm Kids Adult Hand Tattoos P-132",2020/02/TCOOL-Dandelion-Waterproof-Temporary-Tattoo-Sticker-Fashion-Women-Men-Arm-Fake-Body-Art-10-5X6cm-Kids.jpg
