196212,https://wallcorners.com/product/waterproof-temporary-tattoo-sticker-roman-numerals-number-tatoos-stickers-tatto-flash-tatoo-fake-arm-leg-tatouage-for-women-men/,"Waterproof Temporary Tattoo Sticker Roman numerals Number Tatoos Stickers Tatto Flash Tatoo Fake Arm Leg Tatouage for Women Men",2020/02/Waterproof-Temporary-Tattoo-Sticker-Roman-numerals-Number-Tatoos-Stickers-Tatto-Flash-Tatoo-Fake-Arm-Leg-Tatouage.jpg
196215,https://wallcorners.com/product/1pc-new-temporary-tattoo-sticker-waterproof-decals-fake-tatoo-art-taty-crown-english-words-pattern-tattoo-sticker/,"1Pc NEW Temporary Tattoo Sticker Waterproof Decals Fake tatoo Art Taty Crown English words pattern Tattoo Sticker",2020/02/1Pc-NEW-Temporary-Tattoo-Sticker-Waterproof-Decals-Fake-tatoo-Art-Taty-Crown-English-words-pattern-Tattoo.jpg
196269,https://wallcorners.com/product/waterproof-temporary-tattoo-sticker-english-letter-arabic-numerals-fake-tatto-flash-tatoo-hand-arm-finger-tato-for-women-men-boy/,"Waterproof Temporary Tattoo Sticker English letter Arabic numerals Fake Tatto Flash Tatoo Hand Arm Finger Tato for Women Men Boy",2020/02/Waterproof-Temporary-Tattoo-Sticker-English-letter-Arabic-numerals-Fake-Tatto-Flash-Tatoo-Hand-Arm-Finger-Tato.jpg
196273,https://wallcorners.com/product/sexy-black-feather-mandala-flower-henna-temporary-tattoos-stickers-women-girls-body-large-boho-tattoo-arm-fake-tatoo-wedding/,"Sexy Black Feather Mandala Flower Henna Temporary Tattoos Stickers Women Girls Body Large Boho Tattoo Arm Fake Tatoo Wedding",2020/02/Sexy-Black-Feather-Mandala-Flower-Henna-Temporary-Tattoos-Stickers-Women-Girls-Body-Large-Boho-Tattoo-Arm.jpg
196362,https://wallcorners.com/product/10pcs-set-tatouage-temporaire-cartoon-unicorn-mermaid-dinosaur-tattoo-for-children-cute-fake-tattoo-waterproof-kids-tattoo/,"10pcs/set Tatouage Temporaire Cartoon Unicorn Mermaid Dinosaur Tattoo for Children Cute Fake Tattoo Waterproof Kids Tattoo",2020/02/10pcs-set-Tatouage-Temporaire-Cartoon-Unicorn-Mermaid-Dinosaur-Tattoo-for-Children-Cute-Fake-Tattoo-Waterproof-Kids.jpg
196386,https://wallcorners.com/product/waterproof-temporary-tattoo-sticker-large-size-dreamcatcher-wolves-wolf-tatto-stickers-flash-tatoo-fake-tattoos-for-men-women-7/,"Waterproof Temporary Tattoo Sticker large size dreamcatcher wolves wolf tatto stickers flash tatoo fake tattoos for men women 7",2020/02/Waterproof-Temporary-Tattoo-Sticker-large-size-dreamcatcher-wolves-wolf-tatto-stickers-flash-tatoo-fake-tattoos-for.jpg
196437,https://wallcorners.com/product/immortal-knight-waterproof-temporary-tattoos-men-warrior-tatouage-temporaire-femme-tatoo-temporary-stickers/,"Immortal Knight Waterproof Temporary Tattoos Men Warrior Tatouage Temporaire Femme Tatoo Temporary Stickers",2020/02/Immortal-Knight-Waterproof-Temporary-Tattoos-Men-Warrior-Tatouage-Temporaire-Femme-Tatoo-Temporary-Stickers.jpg
196438,https://wallcorners.com/product/waterproof-temporary-tattoo-fox-wolf-wolves-whale-owl-geometric-animal-tatto-flash-tatoo-fake-tattoos-for-girl-women-man-kid-7/,"Waterproof Temporary Tattoo fox wolf wolves whale owl geometric animal tatto flash tatoo fake tattoos for girl women man kid 7",2020/02/Waterproof-Temporary-Tattoo-fox-wolf-wolves-whale-owl-geometric-animal-tatto-flash-tatoo-fake-tattoos-for.jpg
196465,https://wallcorners.com/product/sexy-body-art-beauty-makeup-crow-feather-waterproof-temporary-tattoo-stickers/,"Sexy Body Art Beauty Makeup Crow Feather Waterproof Temporary Tattoo Stickers",2020/02/Sexy-Body-Art-Beauty-Makeup-Crow-Feather-Waterproof-Temporary-Tattoo-Stickers.jpg
196477,https://wallcorners.com/product/lotus-peony-rose-flowers-waterproof-temporary-tattoo-sticker-minimalist-flash-tattoos-body-art-fake-arm-tatoo-women/,"Lotus Peony Rose Flowers Waterproof Temporary Tattoo Sticker  Minimalist Flash Tattoos Body Art Fake Arm tatoo Women",2020/02/Lotus-Peony-Rose-Flowers-Waterproof-Temporary-Tattoo-Sticker-Minimalist-Flash-Tattoos-Body-Art-Fake-Arm-tatoo.jpg
196480,https://wallcorners.com/product/personality-fashion-colorful-flowers-tattoo-women-new-waterproof-temporary-black-tattoo-sticker-body-art/,"personality Fashion Colorful Flowers Tattoo Women New Waterproof Temporary Black Tattoo Sticker Body Art",2020/02/personality-Fashion-Colorful-Flowers-Tattoo-Women-New-Waterproof-Temporary-Black-Tattoo-Sticker-Body-Art.jpg
196555,https://wallcorners.com/product/1pc-flash-metallic-waterproof-tattoo-gold-silver-women-fashion-henna-peacock-feather-design-face-freckle-temporary-tattoo/,"1PC Flash Metallic Waterproof Tattoo Gold Silver Women Fashion Henna Peacock Feather Design Face Freckle Temporary Tattoo",2020/02/1PC-Flash-Metallic-Waterproof-Tattoo-Gold-Silver-Women-Fashion-Henna-Peacock-Feather-Design-Face-Freckle-Temporary.jpg
196622,https://wallcorners.com/product/waterproof-temporary-tattoo-sticker-black-devil-doesnt-sleep-english-letters-flash-tatoo-fake-tatto-neck-wrist-for-woman-men/,"Waterproof Temporary Tattoo Sticker Black Devil Doesn't Sleep English Letters Flash Tatoo Fake Tatto Neck Wrist For Woman Men",2020/02/Waterproof-Temporary-Tattoo-Sticker-Black-Devil-Doesn-t-Sleep-English-Letters-Flash-Tatoo-Fake-Tatto-Neck.jpg
196678,https://wallcorners.com/product/flash-metallic-waterproof-tattoo-gold-silver-women-fashion-henna-peacock-feather-design-temporary-tattoo-stick-paster/,"Flash Metallic Waterproof Tattoo Gold Silver Women Fashion Henna /Peacock Feather Design Temporary Tattoo Stick Paster",2020/02/Flash-Metallic-Waterproof-Tattoo-Gold-Silver-Women-Fashion-Henna-Peacock-Feather-Design-Temporary-Tattoo-Stick-Paster.jpg
196731,https://wallcorners.com/product/water-transfer-small-fresh-animal-waterproof-tattoo-sticker-pattern-black-rose-sticker-cartoonbody-tattoo-tattoo-wolf-animal/,"Water transfer small fresh animal waterproof tattoo sticker pattern black rose sticker cartoonbody tattoo tattoo   wolf animal",2020/02/Water-transfer-small-fresh-animal-waterproof-tattoo-sticker-pattern-black-rose-sticker-cartoonbody-tattoo-tattoo-wolf.jpg
196736,https://wallcorners.com/product/ommgo-seahorse-dolphin-ocean-temporary-tattoos-sticker-watercolor-fake-tattoo-flash-custom-tatoo-for-children-women-body-art-arm/,"OMMGO Seahorse Dolphin Ocean Temporary Tattoos Sticker Watercolor Fake Tattoo Flash Custom Tatoo For Children Women Body Art Arm",2020/02/OMMGO-Seahorse-Dolphin-Ocean-Temporary-Tattoos-Sticker-Watercolor-Fake-Tattoo-Flash-Custom-Tatoo-For-Children-Women.jpg
196739,https://wallcorners.com/product/cartoon-mermaid-unicorn-dinosaur-temporary-tattoo-sticker-for-kids-children-fake-joker-face-flower-tattoo-sticker-tatoo-stick/,"Cartoon Mermaid Unicorn Dinosaur Temporary Tattoo Sticker For Kids Children Fake Joker  Face Flower Tattoo Sticker Tatoo Stick",2020/02/Cartoon-Mermaid-Unicorn-Dinosaur-Temporary-Tattoo-Sticker-For-Kids-Children-Fake-Joker-Face-Flower-Tattoo-Sticker.jpg
196771,https://wallcorners.com/product/rocooart-cartoon-super-hero-fake-tattoo-taty-iron-spider-bat-man-tatouage-body-art-temporary-tattoo-stickers-for-child-tatuagem/,"Rocooart Cartoon Super Hero Fake Tattoo Taty Iron Spider Bat Man Tatouage Body Art Temporary Tattoo Stickers For Child Tatuagem",2020/02/Rocooart-Cartoon-Super-Hero-Fake-Tattoo-Taty-Iron-Spider-Bat-Man-Tatouage-Body-Art-Temporary-Tattoo.jpg
196816,https://wallcorners.com/product/sexy-lace-lotus-pendants-tattoos-for-women-blach-henna-temporary-tattoo-sticker-water-transfer-fake-jewelry-bracelet-tatoo-paste/,"Sexy Lace Lotus Pendants Tattoos For Women Blach Henna Temporary Tattoo Sticker Water Transfer Fake Jewelry Bracelet Tatoo Paste",2020/02/Sexy-Lace-Lotus-Pendants-Tattoos-For-Women-Blach-Henna-Temporary-Tattoo-Sticker-Water-Transfer-Fake-Jewelry.jpg
196997,https://wallcorners.com/product/waterproof-temporary-tattoo-cartoon-animal-fake-tattoos-body-art-hand-foot-stickers-kids-children-makeup-10pcs/,"Waterproof Temporary Tattoo Cartoon Animal Fake Tattoos Body Art Hand Foot Stickers Kids Children Makeup 10pcs",2020/02/Waterproof-Temporary-Tattoo-Cartoon-Animal-Fake-Tattoos-Body-Art-Hand-Foot-Stickers-Kids-Children-Makeup-10pcs.jpg
196998,https://wallcorners.com/product/1pcs-flash-metallic-waterproof-tattoo-gold-silver-women-fashion-henna-flower-taty-design-tattoo-sticker-wholesale-and-dropship/,"1pcs Flash Metallic Waterproof Tattoo Gold Silver Women Fashion Henna Flower Taty Design Tattoo Sticker Wholesale and Dropship",2020/02/1pcs-Flash-Metallic-Waterproof-Tattoo-Gold-Silver-Women-Fashion-Henna-Flower-Taty-Design-Tattoo-Sticker-Wholesale.jpg
197013,https://wallcorners.com/product/waterproof-temporary-tattoos-ocean-feather-wave-mountain-flash-glitte-tattoo-stickers-body-art-for-men-translated-tattoo-sleeve/,"Waterproof Temporary Tattoos ocean feather Wave Mountain flash glitte Tattoo stickers body art for men translated tattoo sleeve",2020/02/Waterproof-Temporary-Tattoos-ocean-feather-Wave-Mountain-flash-glitte-Tattoo-stickers-body-art-for-men-translated.jpg
197043,https://wallcorners.com/product/3d-mars-god-hero-of-sparta-full-arm-temporary-tattoo-sticker-for-men-women-48x17cm-large-fake-tattoo-big-body-art-tatoo-ares/,"3D Mars God Hero of Sparta Full Arm Temporary Tattoo Sticker For Men Women 48x17CM Large Fake Tattoo Big Body Art Tatoo Ares",2020/02/3D-Mars-God-Hero-of-Sparta-Full-Arm-Temporary-Tattoo-Sticker-For-Men-Women-48x17CM-Large.jpg
197054,https://wallcorners.com/product/disposable-waterproof-body-tattoo-tattoo-stickers-paper-plane-sticker-hc1079/,"Disposable waterproof body tattoo tattoo stickers paper plane sticker HC1079",2020/02/Disposable-waterproof-body-tattoo-tattoo-stickers-paper-plane-sticker-HC1079.jpg
197065,https://wallcorners.com/product/ommgo-tribal-fox-series-temporary-tattoo-stickers-watercolor-fake-tattoos-for-women-men-custom-flash-waterproof-tatoos-body-art/,"OMMGO Tribal Fox Series Temporary Tattoo Stickers Watercolor Fake Tattoos For Women Men Custom Flash Waterproof Tatoos Body Art",2020/02/OMMGO-Tribal-Fox-Series-Temporary-Tattoo-Stickers-Watercolor-Fake-Tattoos-For-Women-Men-Custom-Flash-Waterproof.jpg
197104,https://wallcorners.com/product/1pcs-water-transfer-sexy-lace-stocking-fake-flash-tattoo-for-girl-women-waterproof-temporary-tattoo-sticker-on-body-leg/,"1PCS Water Transfer Sexy Lace Stocking Fake Flash Tattoo for Girl Women Waterproof Temporary Tattoo Sticker on Body Leg",2020/02/1PCS-Water-Transfer-Sexy-Lace-Stocking-Fake-Flash-Tattoo-for-Girl-Women-Waterproof-Temporary-Tattoo-Sticker.jpg
197115,https://wallcorners.com/product/5pcs-disposable-tattoo-sticker-unicorn-mermaid-party-decoration-baby-kids-unicorn-birthday-party-favors-temporary-party-supplies/,"5Pcs Disposable Tattoo Sticker Unicorn Mermaid Party Decoration Baby Kids Unicorn Birthday Party Favors Temporary Party Supplies",2020/02/5Pcs-Disposable-Tattoo-Sticker-Unicorn-Mermaid-Party-Decoration-Baby-Kids-Unicorn-Birthday-Party-Favors-Temporary-Party.jpg
197131,https://wallcorners.com/product/waterproof-temporary-tattoo-stickers-angel-wing-fake-tatto-flash-tatoo-tatouage-body-art-hand-back-foot-for-girl-women-men-lady/,"Waterproof Temporary Tattoo Stickers Angel Wing fake Tatto Flash Tatoo Tatouage Body Art Hand Back Foot for Girl Women Men lady",2020/02/Waterproof-Temporary-Tattoo-Stickers-Angel-Wing-fake-Tatto-Flash-Tatoo-Tatouage-Body-Art-Hand-Back-Foot.jpg
197193,https://wallcorners.com/product/fanrui-black-triangle-tattoos-temporary-women-geometric-arm-astronaut-art-tattoo-stickers-planet-water-transfer-tatto-space-man/,"FANRUI Black Triangle Tattoos Temporary Women Geometric Arm Astronaut Art Tattoo Stickers Planet Water Transfer Tatto Space Man",2020/02/FANRUI-Black-Triangle-Tattoos-Temporary-Women-Geometric-Arm-Astronaut-Art-Tattoo-Stickers-Planet-Water-Transfer-Tatto.jpg
197196,https://wallcorners.com/product/2019-fashion-geometry-cool-temporary-tattoo-sticker-women-minimalist-lines-pattern-body-art-new-design-fake-men-tattoos/,"2019 Fashion Geometry cool Temporary Tattoo Sticker Women Minimalist lines pattern Body Art New Design Fake Men Tattoos",2020/02/2019-Fashion-Geometry-cool-Temporary-Tattoo-Sticker-Women-Minimalist-lines-pattern-Body-Art-New-Design-Fake.jpg
197230,https://wallcorners.com/product/black-letter-water-transfer-fake-tattoos-disposable-waterproof-temporary-words-stickers-beauty-women-men-sexy-cool-body-art/,"Black Letter Water Transfer Fake tattoos Disposable Waterproof Temporary Words Stickers beauty Women Men Sexy Cool Body Art",2020/02/Black-Letter-Water-Transfer-Fake-tattoos-Disposable-Waterproof-Temporary-Words-Stickers-beauty-Women-Men-Sexy-Cool.jpg
197314,https://wallcorners.com/product/body-art-waterproof-temporary-tattoos-for-men-and-women-sex-lovely-3d-cartoon-design-small-tattoo-sticker-wholesale-hc1175/,"Body Art waterproof temporary tattoos for men and women Sex lovely 3D cartoon design small tattoo sticker Wholesale HC1175",2020/02/Body-Art-waterproof-temporary-tattoos-for-men-and-women-Sex-lovely-3D-cartoon-design-small-tattoo.jpg
197325,https://wallcorners.com/product/waterproof-temporary-tattoo-sticker-kurama-naruto-orochimaru-snake-flash-tattoos-old-school-body-art-arm-fake-tatoo-women-men/,"Waterproof Temporary Tattoo Sticker Kurama Naruto Orochimaru Snake Flash Tattoos  Old School Body Art Arm Fake Tatoo Women Men",2020/02/Waterproof-Temporary-Tattoo-Sticker-Kurama-Naruto-Orochimaru-Snake-Flash-Tattoos-Old-School-Body-Art-Arm-Fake.jpg
197330,https://wallcorners.com/product/nu-taty-sexy-hearts-stars-temporary-tattoo-body-art-flash-tattoo-stickers-1710cm-waterproof-fake-tatoo-styling-wall-sticker/,"Nu-TATY Sexy hearts stars Temporary Tattoo Body Art Flash Tattoo Stickers 17*10cm Waterproof Fake Tatoo Styling Wall Sticker",2020/02/Nu-TATY-Sexy-hearts-stars-Temporary-Tattoo-Body-Art-Flash-Tattoo-Stickers-17-10cm-Waterproof-Fake.jpg
197354,https://wallcorners.com/product/waterproof-temporary-tattoo-sticker-stars-tattoo-water-transfer-fake-tattoo-flash-tattoo-for-men-girl/,"Waterproof Temporary Tattoo Sticker Stars Tattoo Water Transfer Fake Tattoo Flash Tattoo For Men Girl",2020/02/Waterproof-Temporary-Tattoo-Sticker-Stars-Tattoo-Water-Transfer-Fake-Tattoo-Flash-Tattoo-For-Men-Girl.jpg
197410,https://wallcorners.com/product/waterproof-temporary-tattoo-sticker-rose-flower-paw-fake-tatto-flash-tatoo-tatouage-wrist-foot-hand-arm-for-girl-women-men/,"Waterproof Temporary Tattoo Sticker Rose Flower paw Fake Tatto Flash Tatoo Tatouage Wrist Foot Hand Arm For Girl Women Men",2020/02/Waterproof-Temporary-Tattoo-Sticker-Rose-Flower-paw-Fake-Tatto-Flash-Tatoo-Tatouage-Wrist-Foot-Hand-Arm.jpg
197565,https://wallcorners.com/product/hxman-tiger-women-temporary-tattoo-sticker-waterproof-fashion-fake-body-art-animal-tattoos-9-8x6cm-kids-hand-tatoo-a-054/,"HXMAN Tiger Women Temporary Tattoo Sticker Waterproof Fashion Fake Body Art Animal Tattoos 9.8X6cm Kids Hand Tatoo A-054",2020/02/HXMAN-Tiger-Women-Temporary-Tattoo-Sticker-Waterproof-Fashion-Fake-Body-Art-Animal-Tattoos-9-8X6cm-Kids.jpg
197581,https://wallcorners.com/product/1-sheet-luminous-temporary-tattoos-stickers-glow-dark-fluorescent-waterproof-butterfly-tattoo-for-face-body-art-halloween-party/,"1 Sheet Luminous Temporary Tattoos Stickers Glow Dark Fluorescent Waterproof Butterfly Tattoo for Face Body Art Halloween Party",2020/02/1-Sheet-Luminous-Temporary-Tattoos-Stickers-Glow-Dark-Fluorescent-Waterproof-Butterfly-Tattoo-for-Face-Body-Art.jpg
197583,https://wallcorners.com/product/krasivyy-face-temporary-tattoo-stickers-jewelry-arab-indias-large-tattoos-eyes-masquerade-flash-tattoo-paste-makeup-girl-tattoo/,"Krasivyy Face temporary tattoo stickers jewelry Arab India's large tattoos eyes Masquerade flash tattoo paste makeup girl tattoo",2020/02/Krasivyy-Face-temporary-tattoo-stickers-jewelry-Arab-India-s-large-tattoos-eyes-Masquerade-flash-tattoo-paste.jpg
197588,https://wallcorners.com/product/rocooart-butterfly-luminous-fake-tattoo-wings-flash-taty-anchor-tatouage-glowing-in-dark-waterproof-temporary-tatoo-sticker-body/,"Rocooart Butterfly Luminous Fake Tattoo Wings Flash Taty Anchor Tatouage Glowing in Dark Waterproof Temporary Tatoo Sticker Body",2020/02/Rocooart-Butterfly-Luminous-Fake-Tattoo-Wings-Flash-Taty-Anchor-Tatouage-Glowing-in-Dark-Waterproof-Temporary-Tatoo.jpg
197592,https://wallcorners.com/product/waterproof-temporary-tattoo-sticker-tribal-totem-fake-tatto-flash-tatoo-tatouage-stickers-foot-hand-arm-leg-for-girl-women-men/,"Waterproof Temporary Tattoo Sticker Tribal totem fake tatto flash tatoo tatouage Stickers foot hand arm leg for girl women men",2020/02/Waterproof-Temporary-Tattoo-Sticker-Tribal-totem-fake-tatto-flash-tatoo-tatouage-Stickers-foot-hand-arm-leg.jpg
197600,https://wallcorners.com/product/temporary-tatoo-fake-tattoo-sticker-mandala-lotus-flower-henna-crystaltattoos-tatouage-waterproof-flash-tatto-art-for-women-girl/,"Temporary Tatoo Fake Tattoo Sticker Mandala Lotus Flower Henna CrystalTattoos Tatouage Waterproof Flash Tatto Art For Women Girl",2020/02/Temporary-Tatoo-Fake-Tattoo-Sticker-Mandala-Lotus-Flower-Henna-CrystalTattoos-Tatouage-Waterproof-Flash-Tatto-Art-For.jpg
197602,https://wallcorners.com/product/3pcs-double-ends-temporary-ink-skin-marker-pen-fine-point-large-capacity-tattoo-supplies-body-art-tools-office-school-supplies/,"3Pcs Double Ends Temporary Ink Skin Marker Pen Fine Point Large Capacity Tattoo Supplies Body Art Tools Office School Supplies",2020/02/3Pcs-Double-Ends-Temporary-Ink-Skin-Marker-Pen-Fine-Point-Large-Capacity-Tattoo-Supplies-Body-Art.jpg
197642,https://wallcorners.com/product/long-lasting-temporary-tattoos-animals-lion-head-tattoo-stickers-body-art-waterproof-tattoo-fake-forest-black-thigh-tatoo-leg/,"long lasting temporary tattoos animals lion head tattoo stickers body art waterproof tattoo fake forest black thigh tatoo leg",2020/02/long-lasting-temporary-tattoos-animals-lion-head-tattoo-stickers-body-art-waterproof-tattoo-fake-forest-black.jpg
197652,https://wallcorners.com/product/temporary-tattoo-sticker-waterproof-instant-stitched-wound-scary-scars-convenient-tattoo-sticker-for-halloween-decor-new/,"Temporary Tattoo Sticker Waterproof Instant Stitched Wound Scary Scars Convenient Tattoo Sticker For Halloween Decor New",2020/02/Temporary-Tattoo-Sticker-Waterproof-Instant-Stitched-Wound-Scary-Scars-Convenient-Tattoo-Sticker-For-Halloween-Decor-New.jpg
197667,https://wallcorners.com/product/1pcs-watercolor-cool-henna-rose-flowers-temporary-body-tattoo-beautiful-shoulder-thigh-back-body-decor-lace-owl-women-body-paint/,"1pcs Watercolor cool henna rose flowers Temporary Body Tattoo Beautiful Shoulder thigh Back Body decor lace owl women body paint",2020/02/1pcs-Watercolor-cool-henna-rose-flowers-Temporary-Body-Tattoo-Beautiful-Shoulder-thigh-Back-Body-decor-lace.jpg
197726,https://wallcorners.com/product/temporary-tattoos-for-men-shoulder-tattoos-large-chest-body-sexy-tattoo-sticker-waterproof-tatoo-fake-boys-make-up-arm-pattern/,"temporary tattoos for men shoulder tattoos large chest body sexy tattoo sticker waterproof tatoo fake boys make up arm pattern",2020/02/temporary-tattoos-for-men-shoulder-tattoos-large-chest-body-sexy-tattoo-sticker-waterproof-tatoo-fake-boys.jpg
197761,https://wallcorners.com/product/waterproof-temporary-tattoo-sticker-small-cross-sun-and-moon-on-finger-ear-tatto-flash-tatoo-fake-tattoos-for-girl-women-men/,"Waterproof Temporary Tattoo Sticker small cross sun and moon on finger ear tatto flash tatoo fake tattoos for girl women men",2020/02/Waterproof-Temporary-Tattoo-Sticker-small-cross-sun-and-moon-on-finger-ear-tatto-flash-tatoo-fake.jpg
197788,https://wallcorners.com/product/waterproof-temporary-tattoo-sticker-chinese-style-fengkaobiguo-flash-tatoo-fake-tatto-arm-leg-wrist-foot-hand-for-girl-men-women/,"Waterproof Temporary Tattoo Sticker Chinese style fengkaobiguo Flash Tatoo Fake Tatto arm leg Wrist Foot hand For Girl Men Women",2020/02/Waterproof-Temporary-Tattoo-Sticker-Chinese-style-fengkaobiguo-Flash-Tatoo-Fake-Tatto-arm-leg-Wrist-Foot-hand.jpg
197901,https://wallcorners.com/product/waterproof-temporary-tattoo-siberia-forest-bear-tree-bird-fox-owl-wolf-whale-tatto-flash-tatoo-fake-for-girl-women-men-7/,"Waterproof Temporary Tattoo Siberia forest bear tree bird fox owl wolf whale tatto flash tatoo fake for girl women men 7",2020/02/Waterproof-Temporary-Tattoo-Siberia-forest-bear-tree-bird-fox-owl-wolf-whale-tatto-flash-tatoo-fake.jpg
197915,https://wallcorners.com/product/waterproof-temporary-tattoo-sticker-on-ear-finger-music-note-bird-stars-line-streak-henna-tatto-flash-tatoo-fake-for-women-24/,"Waterproof Temporary Tattoo sticker on ear finger music note bird stars line streak henna tatto flash tatoo fake for women 24",2020/02/Waterproof-Temporary-Tattoo-sticker-on-ear-finger-music-note-bird-stars-line-streak-henna-tatto-flash.jpg
197983,https://wallcorners.com/product/coconut-tree-waterproof-temporary-tattoo-sticker-fake-tattoo-the-flash-stickers-tatuagem-tatoo-sleeve/,"Coconut Tree Waterproof Temporary Tattoo Sticker Fake Tattoo The Flash Stickers Tatuagem Tatoo Sleeve",2020/02/Coconut-Tree-Waterproof-Temporary-Tattoo-Sticker-Fake-Tattoo-The-Flash-Stickers-Tatuagem-Tatoo-Sleeve.jpg
198009,https://wallcorners.com/product/hot-black-english-words-tattoo-sticker-women-men-couple-body-art-temporary-fake-tattoo-sticker-waterproof/,"Hot Black English Words Tattoo Sticker Women Men Couple Body Art Temporary Fake Tattoo Sticker Waterproof",2020/02/Hot-Black-English-Words-Tattoo-Sticker-Women-Men-Couple-Body-Art-Temporary-Fake-Tattoo-Sticker-Waterproof.jpeg
198062,https://wallcorners.com/product/wing-holy-angel-waterproof-temporary-tattoo-sticker-brave-knight-warrior-flash-tattoos-body-art-arm-fake-tatoo/,"Wing Holy Angel Waterproof Temporary Tattoo Sticker Brave knight Warrior Flash Tattoos Body Art Arm Fake Tatoo",2020/02/Wing-Holy-Angel-Waterproof-Temporary-Tattoo-Sticker-Brave-knight-Warrior-Flash-Tattoos-Body-Art-Arm-Fake.jpg
198095,https://wallcorners.com/product/hands-of-men-and-women-couple-waterproof-temporary-tattoo-sticker-harajuku-tatoo-temporary-stickers-tatuagem-bindi-kids-tattoo/,"Hands Of Men And Women Couple Waterproof Temporary Tattoo Sticker Harajuku Tatoo Temporary Stickers Tatuagem Bindi Kids Tattoo",2020/02/Hands-Of-Men-And-Women-Couple-Waterproof-Temporary-Tattoo-Sticker-Harajuku-Tatoo-Temporary-Stickers-Tatuagem-Bindi.jpg
198117,https://wallcorners.com/product/1pack-frecks-flash-tattoo-fashion-waterproof-blad-fish-scales-pattern-gold-face-tattoo-beauty-make-up-body-art-eye-shadow-decal/,"1Pack Frecks Flash Tattoo Fashion Waterproof Blad Fish Scales Pattern Gold Face Tattoo Beauty Make Up Body Art Eye Shadow Decal",2020/02/1Pack-Frecks-Flash-Tattoo-Fashion-Waterproof-Blad-Fish-Scales-Pattern-Gold-Face-Tattoo-Beauty-Make-Up.jpg
198127,https://wallcorners.com/product/lc-882-new-2019-childrens-temporary-body-art-tattoos-fake-cartoon-tattoo-sticker-for-kids-marvels-queen-batman-superman-tattoo/,"LC-882/New 2019 Children's Temporary Body Art Tattoos Fake Cartoon Tattoo Sticker For Kids Marvels Queen Batman Superman Tattoo",2020/02/LC-882-New-2019-Children-s-Temporary-Body-Art-Tattoos-Fake-Cartoon-Tattoo-Sticker-For-Kids.jpg
198160,https://wallcorners.com/product/new-waterproof-temporary-tattoo-stickers-courage-fear-heart-mind-letters-design-water-transfer-tattoo-harajuku-fake-tattoo/,"New Waterproof Temporary Tattoo Stickers Courage Fear Heart Mind Letters Design Water Transfer Tattoo Harajuku Fake Tattoo",2020/02/New-Waterproof-Temporary-Tattoo-Stickers-Courage-Fear-Heart-Mind-Letters-Design-Water-Transfer-Tattoo-Harajuku-Fake.jpg
198209,https://wallcorners.com/product/diamond-glitter-tattoo-set-semi-permanent-simple-tattoo-template-send-100-template-set-body-painting-art-for-kids-teenagers-adul/,"Diamond Glitter Tattoo Set Semi-permanent Simple Tattoo Template Send 100 Template Set Body Painting Art For Kids Teenagers Adul",2020/02/Diamond-Glitter-Tattoo-Set-Semi-permanent-Simple-Tattoo-Template-Send-100-Template-Set-Body-Painting-Art.jpg
198220,https://wallcorners.com/product/temporary-tattoos-large-black-owl-arm-fake-transfer-tattoo-stickers-hot-sexy-men-women-spray-waterproof-designs/,"Temporary tattoos large black owl arm fake transfer tattoo stickers hot sexy men women spray waterproof designs",2020/02/Temporary-tattoos-large-black-owl-arm-fake-transfer-tattoo-stickers-hot-sexy-men-women-spray-waterproof.jpg
198223,https://wallcorners.com/product/10-56cm-1-sheet-of-temporary-tattoo-sticker-fake-flash-tattoo-sticker-fingers-toes-body-art-sexy-waterproof-temporary-tattoo/,"10.5*6cm 1 Sheet of Temporary Tattoo Sticker Fake Flash Tattoo Sticker Fingers Toes Body Art Sexy Waterproof Temporary Tattoo",2020/02/10-5-6cm-1-Sheet-of-Temporary-Tattoo-Sticker-Fake-Flash-Tattoo-Sticker-Fingers-Toes-Body.jpg
198225,https://wallcorners.com/product/waterproof-always-love-wrist-temporary-henna-tatoo-selfie-fake-tattoos-sticker-for-lover-body-art-flash-tattoo-sticker-10-56cm/,"Waterproof Always Love Wrist Temporary Henna Tatoo Selfie Fake Tattoos Sticker for Lover Body Art Flash Tattoo Sticker 10.5*6cm",2020/02/Waterproof-Always-Love-Wrist-Temporary-Henna-Tatoo-Selfie-Fake-Tattoos-Sticker-for-Lover-Body-Art-Flash.jpg
198230,https://wallcorners.com/product/waterproof-temporary-tattoo-sticker-royal-crowns-wrist-finger-fake-tattoos-2pcs-king-and-queen-tatto-stickers-sexy-lady-body-art/,"Waterproof Temporary Tattoo Sticker Royal Crowns Wrist Finger Fake Tattoos 2pcs King And Queen Tatto Stickers Sexy Lady Body Art",2020/02/Waterproof-Temporary-Tattoo-Sticker-Royal-Crowns-Wrist-Finger-Fake-Tattoos-2pcs-King-And-Queen-Tatto-Stickers.jpg
198254,https://wallcorners.com/product/baofuli-waterproof-temporary-sticker-geometric-planet-jellyfish-tattoo-black-triangle-tattoos-body-arm-men-fake-tatoos-chains/,"Baofuli Waterproof Temporary Sticker Geometric Planet Jellyfish Tattoo Black Triangle Tattoos Body Arm Men Fake Tatoos Chains",2020/02/Baofuli-Waterproof-Temporary-Sticker-Geometric-Planet-Jellyfish-Tattoo-Black-Triangle-Tattoos-Body-Arm-Men-Fake-Tatoos.jpg
